"DESCRIPTION","DURATION IN MS","NAME","PARENT SUITE","START TIME","STATUS","STOP TIME","SUB SUITE","SUITE","TEST CLASS","TEST METHOD"
"","219","should display confirm dialog when clicking on duplicate button when user did not see the modal","ollectiveOfferRow","Tue Feb 11 14:27:41 UTC 2025","passed","Tue Feb 11 14:27:41 UTC 2025","","","",""
"","18","should not display a expiration row if the offer has no booking limit","ollectiveOfferRow","Tue Feb 11 14:27:42 UTC 2025","passed","Tue Feb 11 14:27:42 UTC 2025","","","",""
"","26","should display the institution budget","AdageHeader","Tue Feb 11 14:29:08 UTC 2025","passed","Tue Feb 11 14:29:08 UTC 2025","","","",""
"","417","should allow user to reset prefilters when some where applied","components | BookingsRecap | Pro user","Tue Feb 11 14:27:17 UTC 2025","passed","Tue Feb 11 14:27:17 UTC 2025","","","",""
"","0","should return false for 'not allowed action CAN_CREATE_BOOKABL…'","isActionAllowedOnCollectiveOffer","Tue Feb 11 14:31:24 UTC 2025","passed","Tue Feb 11 14:31:24 UTC 2025","","","",""
"","109","should show the offer location for an offer at a specific address","AdageOfferInfoSection","Tue Feb 11 14:29:41 UTC 2025","passed","Tue Feb 11 14:29:41 UTC 2025","","","",""
"","35","should display delete and pause buttons","VenueProviderCard","Tue Feb 11 14:29:22 UTC 2025","passed","Tue Feb 11 14:29:22 UTC 2025","","integration provider with on going sync","",""
"","1","should invalidate the following email address : test.com","isValidEmail","Tue Feb 11 14:32:36 UTC 2025","passed","Tue Feb 11 14:32:36 UTC 2025","","","",""
"","4","should not show suggestions header if no offer could be suggested","OffersSuggestions","Tue Feb 11 14:28:41 UTC 2025","passed","Tue Feb 11 14:28:41 UTC 2025","","","",""
"","33","should display pricing point section when venue has no siret","ReimbursementFields","Tue Feb 11 14:30:50 UTC 2025","passed","Tue Feb 11 14:30:50 UTC 2025","","","",""
"","7","Should display the right wording without the FF enabled","OffererBanners","Tue Feb 11 14:29:56 UTC 2025","passed","Tue Feb 11 14:29:56 UTC 2025","user offerer not validated","WIP_ENABLE_OFFER_ADDRESS","",""
"","5","should not show cancel button when ENABLE_COLLECTIVE_NEW_STATUSES and offer has not CAN_CANCEL allowed action","CollectiveActionsCells","Tue Feb 11 14:27:34 UTC 2025","passed","Tue Feb 11 14:27:34 UTC 2025","","","",""
"","25","calls onOptionSelect when Enter key is pressed on an option","<MultiSelectPanel />","Tue Feb 11 14:28:55 UTC 2025","passed","Tue Feb 11 14:28:55 UTC 2025","","","",""
"","51","should render school tag when offer will happens in school","OfferCard component","Tue Feb 11 14:29:22 UTC 2025","passed","Tue Feb 11 14:29:22 UTC 2025","","","",""
"","58","should display saved information in the action bar","","Tue Feb 11 14:28:21 UTC 2025","passed","Tue Feb 11 14:28:21 UTC 2025","","","",""
"","90","selects all options when ""Select All"" is clicked","<MultiSelect />","Tue Feb 11 14:29:49 UTC 2025","passed","Tue Feb 11 14:29:49 UTC 2025","","","",""
"","3","should validate the latitude, longitude format","checkCoords","Tue Feb 11 14:30:39 UTC 2025","passed","Tue Feb 11 14:30:39 UTC 2025","","","",""
"","7","should display the offer duration","AdageOfferDetailsSection","Tue Feb 11 14:29:38 UTC 2025","passed","Tue Feb 11 14:29:38 UTC 2025","","","",""
"","59","should display suggestions if there are no search results","offersSearch component","Tue Feb 11 14:28:09 UTC 2025","passed","Tue Feb 11 14:28:09 UTC 2025","","","",""
"","0","should not block when going from visibilite to stocks","components | RouteLeavingGuardCollectiveOfferCreation","Tue Feb 11 14:29:26 UTC 2025","passed","Tue Feb 11 14:29:26 UTC 2025","","","",""
"","47","should not render when the offer is not set","IndividualOfferDetails","Tue Feb 11 14:27:10 UTC 2025","passed","Tue Feb 11 14:27:10 UTC 2025","","onboarding","",""
"","55","should display not reimbursed banner when subcategory is not reimbursed","screens:IndividualOffer::UsefulInformation","Tue Feb 11 14:27:50 UTC 2025","passed","Tue Feb 11 14:27:50 UTC 2025","","","",""
"","1","should not be able to archive from summary when the offer is already archived and the offer is reimbursed","canArchiveCollectiveOffer","Tue Feb 11 14:29:37 UTC 2025","passed","Tue Feb 11 14:29:37 UTC 2025","","","",""
"","250","should cancel booking of an offer","ollectiveOfferRow","Tue Feb 11 14:27:41 UTC 2025","passed","Tue Feb 11 14:27:42 UTC 2025","","","",""
"","71","should display notification on api error","Summary","Tue Feb 11 14:27:10 UTC 2025","passed","Tue Feb 11 14:27:10 UTC 2025","","On Creation","",""
"","58","should see the data from the previous forms for validation","ValidationScreen","Tue Feb 11 14:28:04 UTC 2025","passed","Tue Feb 11 14:28:04 UTC 2025","","","",""
"","140","should download all bookings as Excel","DownloadBookingModal","Tue Feb 11 14:29:01 UTC 2025","passed","Tue Feb 11 14:29:02 UTC 2025","","","",""
"","121","should render favorites title","OffersFavorites","Tue Feb 11 14:29:39 UTC 2025","passed","Tue Feb 11 14:29:39 UTC 2025","","","",""
"","6","should render LinkVenueCallout with singular wording","LinkVenueCallout","Tue Feb 11 14:29:14 UTC 2025","passed","Tue Feb 11 14:29:14 UTC 2025","","With FF enabled","",""
"","1","should format a date with the right format for a HTML input","formatShortDateForInput","Tue Feb 11 14:29:37 UTC 2025","passed","Tue Feb 11 14:29:37 UTC 2025","","","",""
"","2","should serialize patchBody","IndividualOffer:commons:serializers","Tue Feb 11 14:28:24 UTC 2025","passed","Tue Feb 11 14:28:24 UTC 2025","","serializePatchOffer","",""
"","79","should display comment field when toggle is clicked","components | SiretOrCommentFields","Tue Feb 11 14:28:06 UTC 2025","passed","Tue Feb 11 14:28:06 UTC 2025","","","",""
"","0","should return null if the query param is not a valid offer subtype","getOfferSubtypeFromParam","Tue Feb 11 14:29:07 UTC 2025","passed","Tue Feb 11 14:29:07 UTC 2025","","","",""
"","1","should serialize patchBody with empty address label and manual edition false","IndividualOffer:commons:serializers","Tue Feb 11 14:28:24 UTC 2025","passed","Tue Feb 11 14:28:24 UTC 2025","","serializePatchOffer","",""
"","8","should warn user offerer is being validated when user attachment to offerer is not yet validated","OffererBanners","Tue Feb 11 14:29:56 UTC 2025","passed","Tue Feb 11 14:29:56 UTC 2025","","","",""
"","48","should call tracker when last playlist is visible","AdageDiscovery","Tue Feb 11 14:29:25 UTC 2025","passed","Tue Feb 11 14:29:25 UTC 2025","","","",""
"","73","log event on click","venue image edit","Tue Feb 11 14:31:16 UTC 2025","passed","Tue Feb 11 14:31:16 UTC 2025","","","",""
"","78","should show the offer instistution panel for a collective bookable offer","AdageOffer","Tue Feb 11 14:31:19 UTC 2025","passed","Tue Feb 11 14:31:19 UTC 2025","","","",""
"","338","should redirect to onboarding page if offerer list is empty","SignIn","Tue Feb 11 14:27:51 UTC 2025","passed","Tue Feb 11 14:27:51 UTC 2025","","sign in with new onboarding feature","",""
"","81","should display an error message","DetailsEanSearch","Tue Feb 11 14:28:17 UTC 2025","passed","Tue Feb 11 14:28:17 UTC 2025","when no EAN search has been performed > when the input has format issues","when the draft offer has not been created yet (dirty)","",""
"","278","should be able to quit without submitting from RouteLeavingGuard","screens:StocksEventEdition","Tue Feb 11 14:27:29 UTC 2025","passed","Tue Feb 11 14:27:29 UTC 2025","","","",""
"","3","should validate the following email address : test@test.test.com","isValidEmail","Tue Feb 11 14:32:36 UTC 2025","passed","Tue Feb 11 14:32:36 UTC 2025","","","",""
"","132","should not disable description, price and places when offer is 'CONFIRMED' since less than 2 days","OfferEducationalStock","Tue Feb 11 14:28:20 UTC 2025","passed","Tue Feb 11 14:28:20 UTC 2025","","","",""
"","33","should set logEvent and userId if cookie is set","useFirebase","Tue Feb 11 14:29:44 UTC 2025","passed","Tue Feb 11 14:29:44 UTC 2025","","","",""
"","347","should not redirect user to onboarding page if use has an offerer","SignIn","Tue Feb 11 14:27:51 UTC 2025","passed","Tue Feb 11 14:27:51 UTC 2025","","sign in with new onboarding feature","",""
"","30","should allow tabbing from one input of type url to the next","TextInput","Tue Feb 11 14:30:34 UTC 2025","passed","Tue Feb 11 14:30:34 UTC 2025","","","",""
"","87","should display the right wording without the OA FF","OA feature flag","Tue Feb 11 14:31:15 UTC 2025","passed","Tue Feb 11 14:31:15 UTC 2025","","","",""
"","24","should only display mail","RequestFormDialog","Tue Feb 11 14:28:27 UTC 2025","passed","Tue Feb 11 14:28:27 UTC 2025","","","",""
"","1","should map api response errors to form one with changes","serializeApiErrors","Tue Feb 11 14:29:50 UTC 2025","passed","Tue Feb 11 14:29:50 UTC 2025","","","",""
"","32","should display stepper with number and label","Stepper","Tue Feb 11 14:30:19 UTC 2025","passed","Tue Feb 11 14:30:19 UTC 2025","","","",""
"","1","should singularize word if 0 offer","pluralize","Tue Feb 11 14:31:50 UTC 2025","passed","Tue Feb 11 14:31:50 UTC 2025","","standard words","",""
"","641","should display text area + intervention area multiselect when user selects ""other""","screens | OfferEducational : event address step","Tue Feb 11 14:28:50 UTC 2025","passed","Tue Feb 11 14:28:50 UTC 2025","","when there is only one venue managed by the offerer","",""
"","29","should disable submit button if the user did not select an institution","CollectiveOfferVisibility","Tue Feb 11 14:27:44 UTC 2025","passed","Tue Feb 11 14:27:44 UTC 2025","","","",""
"","41","should display public name(if valued) of the venue when addressType is OFFERER_VENUE","OfferVenue","Tue Feb 11 14:31:37 UTC 2025","passed","Tue Feb 11 14:31:37 UTC 2025","","","",""
"","4","should submit uploaded image in case of template offer","useCollectiveOfferImageUpload","Tue Feb 11 14:30:11 UTC 2025","passed","Tue Feb 11 14:30:11 UTC 2025","","","",""
"","6","should show the partner distance to school","AdageOfferPartnerPanel","Tue Feb 11 14:29:46 UTC 2025","passed","Tue Feb 11 14:29:46 UTC 2025","","","",""
"","19","should display categories and subcategories as disabled","IndividualOfferDetails","Tue Feb 11 14:27:10 UTC 2025","passed","Tue Feb 11 14:27:10 UTC 2025","","on edition","",""
"","1","should return 0 if lastname and firstname are the same even with different case","sortByBeneficiaryName","Tue Feb 11 14:29:16 UTC 2025","passed","Tue Feb 11 14:29:16 UTC 2025","","when both beneficiaries lastname are the same","",""
"","41","user should not be able to enter non number characters","components | SiretOrCommentFields","Tue Feb 11 14:28:07 UTC 2025","passed","Tue Feb 11 14:28:07 UTC 2025","","should validate SIRET on submit","",""
"","100","should render edit button","test ButtonImageEdit","Tue Feb 11 14:31:07 UTC 2025","passed","Tue Feb 11 14:31:07 UTC 2025","","","",""
"","553","render stock event row","screens:StocksEventEdition","Tue Feb 11 14:27:23 UTC 2025","passed","Tue Feb 11 14:27:24 UTC 2025","","","",""
"","10","should display ""Stock & Prix"" step as active/enabled when offer is no longer a non-published draft","IndividualOfferNavigation","Tue Feb 11 14:28:31 UTC 2025","passed","Tue Feb 11 14:28:31 UTC 2025","","when offer is not an event","",""
"","0","should not block when going from visibilite to creation","components | RouteLeavingGuardCollectiveOfferCreation","Tue Feb 11 14:29:26 UTC 2025","passed","Tue Feb 11 14:29:26 UTC 2025","","","",""
"","53","should display a new column ""Date de l’évènement""","CollectiveOffersScreen","Tue Feb 11 14:27:31 UTC 2025","passed","Tue Feb 11 14:27:31 UTC 2025","","","",""
"","0","should return true when collective template offer is archivable","isCollectiveOfferArchivable","Tue Feb 11 14:31:34 UTC 2025","passed","Tue Feb 11 14:31:34 UTC 2025","","","",""
"","1","should parse a dict body","getHumanReadableApiError","Tue Feb 11 14:29:50 UTC 2025","passed","Tue Feb 11 14:29:50 UTC 2025","","","",""
"","100","should display an auto-focused venue selector with all venues selected by default","Income","Tue Feb 11 14:27:36 UTC 2025","passed","Tue Feb 11 14:27:36 UTC 2025","","when the page first renders","",""
"","18","should display the bank account section even without context","BankInformations","Tue Feb 11 14:29:46 UTC 2025","passed","Tue Feb 11 14:29:46 UTC 2025","","","",""
"","11","should render steps for confirmed booking and modification links and info when event is passed and can edit discount","collective timeline","Tue Feb 11 14:27:57 UTC 2025","passed","Tue Feb 11 14:27:57 UTC 2025","","can edit discount","",""
"","185","should have offerer address value when user filters by address","route Offers","Tue Feb 11 14:27:12 UTC 2025","passed","Tue Feb 11 14:27:12 UTC 2025","","With WIP_ENABLE_OFFER_ADDRESS FF","",""
"","0","should return false otherwise","hasMusicType","Tue Feb 11 14:28:02 UTC 2025","passed","Tue Feb 11 14:28:02 UTC 2025","","","",""
"","31","should render the expected table with max given number of hits per page","components | BookingsRecapTable","Tue Feb 11 14:27:45 UTC 2025","passed","Tue Feb 11 14:27:45 UTC 2025","","","",""
"","38","should redirect to onboarding after submit if isDidacticOnboardingEnabled is true","ValidationScreen","Tue Feb 11 14:28:04 UTC 2025","passed","Tue Feb 11 14:28:04 UTC 2025","","user actions","",""
"","17","should verify user link is not valid and redirect to connexion","src | components | pages | Signup | validation","Tue Feb 11 14:30:10 UTC 2025","passed","Tue Feb 11 14:30:10 UTC 2025","","","",""
"","1","should build proper query given template collective offers filters","computeCollectiveOffersUrl","Tue Feb 11 14:31:17 UTC 2025","passed","Tue Feb 11 14:31:17 UTC 2025","","","",""
"","37","should display the playlist title based on the maximum venue distance","VenuePlaylist","Tue Feb 11 14:30:28 UTC 2025","passed","Tue Feb 11 14:30:28 UTC 2025","","","",""
"","51","renders the search input if hasSearch is true","<MultiSelectPanel />","Tue Feb 11 14:28:55 UTC 2025","passed","Tue Feb 11 14:28:55 UTC 2025","","","",""
"","1","should parse dom-tom phone number with region code","dom-tom phone number with region code","Tue Feb 11 14:30:09 UTC 2025","passed","Tue Feb 11 14:30:09 UTC 2025","","","",""
"","84","should display the offer title and history title and amount when it is not free","IndividualBookingsStatusCell","Tue Feb 11 14:28:43 UTC 2025","passed","Tue Feb 11 14:28:43 UTC 2025","","","",""
"","33","should not display survey satisfaction if only 1 offer","offers","Tue Feb 11 14:27:14 UTC 2025","passed","Tue Feb 11 14:27:14 UTC 2025","","","",""
"","7","should display an Error callout","Callout","Tue Feb 11 14:31:06 UTC 2025","passed","Tue Feb 11 14:31:06 UTC 2025","","","",""
"","1","should generate stocks on a monthly basis by first day at end of month","onSubmit","Tue Feb 11 14:27:58 UTC 2025","passed","Tue Feb 11 14:27:58 UTC 2025","","","",""
"","43","should filter bookings collective on render","components | BookingsRecapTable","Tue Feb 11 14:27:45 UTC 2025","passed","Tue Feb 11 14:27:45 UTC 2025","","","",""
"","50","should display an import button disabled by default on creation","AllocineProviderForm","Tue Feb 11 14:28:11 UTC 2025","passed","Tue Feb 11 14:28:11 UTC 2025","","","",""
"","102","closes the dropdown when clicked outside or when Escape key is pressed","<MultiSelect />","Tue Feb 11 14:29:49 UTC 2025","passed","Tue Feb 11 14:29:49 UTC 2025","","","",""
"","32","should display a warning with number of stocks sold out when at least one stock is sold out","IndividualOfferRow","Tue Feb 11 14:27:05 UTC 2025","passed","Tue Feb 11 14:27:05 UTC 2025","","when offer is an event product","",""
"","2","return right title with mode { mode: 'creation', expected: 'Créer une offre' }","getTitle","Tue Feb 11 14:32:34 UTC 2025","passed","Tue Feb 11 14:32:34 UTC 2025","","","",""
"","18","should show links if confirmation is the active step","CollectiveCreationOfferNavigation","Tue Feb 11 14:28:18 UTC 2025","passed","Tue Feb 11 14:28:18 UTC 2025","","","",""
"","77","should set active styles on the active button","ToggleButtonGroup","Tue Feb 11 14:32:21 UTC 2025","passed","Tue Feb 11 14:32:21 UTC 2025","","","",""
"","24","display a new text in the ""à savoir"" section when marseille ff is active","FormParticipants","Tue Feb 11 14:28:36 UTC 2025","passed","Tue Feb 11 14:28:36 UTC 2025","","","",""
"","3","should return simple query for offers page when no search filters","computeIndividualOffersUrl","Tue Feb 11 14:32:13 UTC 2025","passed","Tue Feb 11 14:32:13 UTC 2025","","","",""
"","21","should show duplicate button if offer is bookable and ff is active","CollectiveEditionOfferNavigation","Tue Feb 11 14:27:57 UTC 2025","passed","Tue Feb 11 14:27:57 UTC 2025","","","",""
"","8","should display a banner when it expires today","ExpirationCell","Tue Feb 11 14:30:57 UTC 2025","passed","Tue Feb 11 14:30:57 UTC 2025","","","",""
"","3","should works with only plain objects","isPlainObject","Tue Feb 11 14:32:32 UTC 2025","passed","Tue Feb 11 14:32:32 UTC 2025","","","",""
"","211","should not disable form fields if the FF ENABLE_COLLECTIVE_NEW_STATUSES is active","OfferEducationalForm","Tue Feb 11 14:29:30 UTC 2025","passed","Tue Feb 11 14:29:30 UTC 2025","","","",""
"","70","should track cancel all offers on click on ""Annuler"" button","ActionsBar","Tue Feb 11 14:27:54 UTC 2025","passed","Tue Feb 11 14:27:54 UTC 2025","","","",""
"","7","should display disabled Adage step","CollectiveDmsTimeline","Tue Feb 11 14:28:41 UTC 2025","passed","Tue Feb 11 14:28:41 UTC 2025","","should replace ""lieu"" by ""structure"" if WIP_ENABLE_OFFER_ADDRESS is enabled","",""
"","20","should not disable institution input when allowedAction CAN_EDIT_INSTITUTION exist and FF ENABLE_COLLECTIVE_NEW_STATUSES enable","CollectiveOfferVisibility","Tue Feb 11 14:27:46 UTC 2025","passed","Tue Feb 11 14:27:46 UTC 2025","","","",""
"","99","should render summary with filled data","UsefulInformationsSummaryScreen","Tue Feb 11 14:30:48 UTC 2025","passed","Tue Feb 11 14:30:48 UTC 2025","","","",""
"","14","should render message when has a pending bank account and no valid one","BankInformations page","Tue Feb 11 14:28:23 UTC 2025","passed","Tue Feb 11 14:28:23 UTC 2025","","","",""
"","216","should request bookings of event date requested by user when user clicks on ""Afficher""","components | BookingsRecap | Pro user","Tue Feb 11 14:27:18 UTC 2025","passed","Tue Feb 11 14:27:18 UTC 2025","","","",""
"","4","should render { displayedStatus: 'EXPIRED', expectedLabel: 'expirée' } status","CollectiveStatusLabel","Tue Feb 11 14:30:04 UTC 2025","passed","Tue Feb 11 14:30:04 UTC 2025","","","",""
"","34","should render the description as text","Description","Tue Feb 11 14:32:07 UTC 2025","passed","Tue Feb 11 14:32:07 UTC 2025","","","",""
"","63","should initialize context with api","IndividualOfferContextProvider","Tue Feb 11 14:30:45 UTC 2025","passed","Tue Feb 11 14:30:45 UTC 2025","","","",""
"","2","should reject too short phone number","french phone number without region code","Tue Feb 11 14:30:09 UTC 2025","passed","Tue Feb 11 14:30:09 UTC 2025","","","",""
"","127","should display errors on api failure","Offerer","Tue Feb 11 14:27:53 UTC 2025","passed","Tue Feb 11 14:27:54 UTC 2025","","","",""
"","1","should validate the form for case: in edition, quantity below bookings number","validationSchema","Tue Feb 11 14:31:04 UTC 2025","passed","Tue Feb 11 14:31:04 UTC 2025","","","",""
"","3","should validate the form for case: should allow a start datetime set on 01/09/N and an end datetime set on 31/08/N+1","validationSchema","Tue Feb 11 14:30:07 UTC 2025","passed","Tue Feb 11 14:30:07 UTC 2025","","","",""
"","135","should display venue iframe when selecting a venue","OffererStatsScreen","Tue Feb 11 14:29:33 UTC 2025","passed","Tue Feb 11 14:29:33 UTC 2025","","","",""
"","131","should close autocomplete panel when focus outside form","Autocomplete","Tue Feb 11 14:28:32 UTC 2025","passed","Tue Feb 11 14:28:32 UTC 2025","","","",""
"","0","should return false when collective offer is not archivable","isCollectiveOfferArchivable","Tue Feb 11 14:31:34 UTC 2025","passed","Tue Feb 11 14:31:34 UTC 2025","","","",""
"","50","Should display the page if the user can access onboarding","<OnboardingOfferIndividual />","Tue Feb 11 14:31:55 UTC 2025","passed","Tue Feb 11 14:31:55 UTC 2025","","","",""
"","65","should disabled all fields if another offer with the same EAN is already published","screens:IndividualOffer::UsefulInformation","Tue Feb 11 14:27:50 UTC 2025","passed","Tue Feb 11 14:27:50 UTC 2025","","","",""
"","73","should call onSubmit when file is valid","ImageUploadBrowserForm","Tue Feb 11 14:29:43 UTC 2025","passed","Tue Feb 11 14:29:43 UTC 2025","","","",""
"","0","should be invalid if no special char","When validating a password","Tue Feb 11 14:32:24 UTC 2025","passed","Tue Feb 11 14:32:24 UTC 2025","","","",""
"","30","should display toggle disabled","components | SiretOrCommentFields","Tue Feb 11 14:28:06 UTC 2025","passed","Tue Feb 11 14:28:06 UTC 2025","","","",""
"","176","should disable email input and submit button on contact form","CollectiveOfferConfirmation","Tue Feb 11 14:28:59 UTC 2025","passed","Tue Feb 11 14:28:59 UTC 2025","","","",""
"","5","should retrieve a bookable offer from the url","useCollectiveOfferFromParams","Tue Feb 11 14:30:46 UTC 2025","passed","Tue Feb 11 14:30:46 UTC 2025","","","",""
"","0","should return true when collective offer status is INACTIVE","canArchiveCollectiveOffer","Tue Feb 11 14:29:37 UTC 2025","passed","Tue Feb 11 14:29:37 UTC 2025","","","",""
"","4","should display ""Toute l’année scolaire"" if dates are not defined","OfferNameCell","Tue Feb 11 14:30:16 UTC 2025","passed","Tue Feb 11 14:30:16 UTC 2025","","","",""
"","31","should log event on click dms link","CollectiveDmsTimeline","Tue Feb 11 14:28:41 UTC 2025","passed","Tue Feb 11 14:28:41 UTC 2025","","","",""
"","147","should display actionsBar when at least one offer is selected","TemplateCollectiveOffersScreen","Tue Feb 11 14:27:55 UTC 2025","passed","Tue Feb 11 14:27:56 UTC 2025","","","",""
"","67","should replace single option","SelectAutocomplete","Tue Feb 11 14:27:20 UTC 2025","passed","Tue Feb 11 14:27:21 UTC 2025","Simple","Options","",""
"","8","should display the value","Slider","Tue Feb 11 14:32:13 UTC 2025","passed","Tue Feb 11 14:32:13 UTC 2025","","","",""
"","74","should let going to recap when form has been filled in edition","PriceCategories","Tue Feb 11 14:29:27 UTC 2025","passed","Tue Feb 11 14:29:27 UTC 2025","","","",""
"","605","should display venue selects as disabled (not editable) fields","screens | OfferEducational : edition offerer step","Tue Feb 11 14:30:13 UTC 2025","passed","Tue Feb 11 14:30:13 UTC 2025","","","",""
"","9","should diplay only some fields when the venue is virtual","VenueFormScreen","Tue Feb 11 14:28:13 UTC 2025","passed","Tue Feb 11 14:28:13 UTC 2025","","","",""
"","308","should render reimbursement page","Reimbursement page","Tue Feb 11 14:29:58 UTC 2025","passed","Tue Feb 11 14:29:59 UTC 2025","","","",""
"","45","should move focus to the input when the checkbox is unchecked and init the input with the minimum","QuantityInput","Tue Feb 11 14:30:14 UTC 2025","passed","Tue Feb 11 14:30:14 UTC 2025","","","",""
"","5","renders component successfully with required message","components:BoxFormLayout","Tue Feb 11 14:32:25 UTC 2025","passed","Tue Feb 11 14:32:25 UTC 2025","","","",""
"","4","should render 1 place","StockEventSection","Tue Feb 11 14:30:58 UTC 2025","passed","Tue Feb 11 14:30:58 UTC 2025","","","",""
"","39","should display a DatePicker","components | FilterByEventDate","Tue Feb 11 14:32:16 UTC 2025","passed","Tue Feb 11 14:32:16 UTC 2025","","","",""
"","26","should display a filter toggle button","OffersTableSearch","Tue Feb 11 14:29:35 UTC 2025","passed","Tue Feb 11 14:29:35 UTC 2025","","when filters toggling and storing is enabled","",""
"","241","should display confirmation message and empty field when contremarque is validated"," Desk","Tue Feb 11 14:28:43 UTC 2025","passed","Tue Feb 11 14:28:43 UTC 2025","","should validate contremarque when the user submits the form","",""
"","33","should disable start datetime, end datetime and event time inputs when form access is read only","FormStock","Tue Feb 11 14:28:34 UTC 2025","passed","Tue Feb 11 14:28:34 UTC 2025","","","",""
"","0","should be able to parse Greenwich Meridian coordinates correctly","parseDms","Tue Feb 11 14:30:39 UTC 2025","passed","Tue Feb 11 14:30:39 UTC 2025","","","",""
"","24","should show create bookable offer if offer is template in edition","CollectiveEditionOfferNavigation","Tue Feb 11 14:27:57 UTC 2025","passed","Tue Feb 11 14:27:57 UTC 2025","","","",""
"","666","should display errors","OpeningHoursForm","Tue Feb 11 14:29:02 UTC 2025","passed","Tue Feb 11 14:29:03 UTC 2025","","","",""
"","552","should not let add more than 20 price categories","PriceCategories","Tue Feb 11 14:28:22 UTC 2025","passed","Tue Feb 11 14:28:22 UTC 2025","","","",""
"","152","should trigger onSubmit callback when submitting","components:UserIdentityForm","Tue Feb 11 14:31:04 UTC 2025","passed","Tue Feb 11 14:31:04 UTC 2025","","","",""
"","11","should display both date and time when dates are not the same","OfferNameCell","Tue Feb 11 14:30:16 UTC 2025","passed","Tue Feb 11 14:30:16 UTC 2025","","","",""
"","1","should create a template offer payload with phone infos when the phone option is checked in the form","createOfferPayload","Tue Feb 11 14:30:24 UTC 2025","passed","Tue Feb 11 14:30:24 UTC 2025","","","",""
