"DESCRIPTION","DURATION IN MS","NAME","PARENT SUITE","START TIME","STATUS","STOP TIME","SUB SUITE","SUITE","TEST CLASS","TEST METHOD"
"","261","should trigger onSubmit callback when submitting","components:UserEmailForm","Fri Jan 10 13:55:12 UTC 2025","passed","Fri Jan 10 13:55:12 UTC 2025","","","",""
"","102","should display an input and a submit button within a dedicated form","DetailsEanSearch","Fri Jan 10 13:51:50 UTC 2025","passed","Fri Jan 10 13:51:50 UTC 2025","","","",""
"","131","should deactivate an offer and confirm","StatusToggleButton","Fri Jan 10 13:52:53 UTC 2025","passed","Fri Jan 10 13:52:53 UTC 2025","","","",""
"","8","should display department label in tag","FiltersTag","Fri Jan 10 13:52:25 UTC 2025","passed","Fri Jan 10 13:52:25 UTC 2025","","","",""
"","26","should apply offerName filter when typing keywords for offer name","components | FilterByOmniSearch","Fri Jan 10 13:52:36 UTC 2025","passed","Fri Jan 10 13:52:36 UTC 2025","","","",""
"","81","should render when no offer is given","IndivualOfferLayout","Fri Jan 10 13:52:48 UTC 2025","passed","Fri Jan 10 13:52:48 UTC 2025","","","",""
"","1","should singularize word if 0 offer","pluralize","Fri Jan 10 13:55:10 UTC 2025","passed","Fri Jan 10 13:55:10 UTC 2025","","standard words","",""
"","6","should not display dms link if condition to display it is false","VenueOfferSteps","Fri Jan 10 13:52:26 UTC 2025","passed","Fri Jan 10 13:52:26 UTC 2025","","","",""
"","4","should display ""Toute l’année scolaire"" if dates are not defined","OfferNameCell","Fri Jan 10 13:53:41 UTC 2025","passed","Fri Jan 10 13:53:41 UTC 2025","","","",""
"","58","should track continue to ds","AddBankInformations","Fri Jan 10 13:54:56 UTC 2025","passed","Fri Jan 10 13:54:56 UTC 2025","","","",""
"","75","should close dialog when the user focuses outside of the field","AdageButtonFilter","Fri Jan 10 13:53:45 UTC 2025","passed","Fri Jan 10 13:53:45 UTC 2025","","","",""
"","0","when it is in another location","formatOfferEventAddress","Fri Jan 10 13:54:49 UTC 2025","passed","Fri Jan 10 13:54:49 UTC 2025","","","",""
"","143","should disable email input and submit button on contact form","CollectiveOfferConfirmation","Fri Jan 10 13:52:34 UTC 2025","passed","Fri Jan 10 13:52:34 UTC 2025","","","",""
"","0","should remove dates from an offer that has no valid dates to create a template offer","createOfferPayload","Fri Jan 10 13:53:50 UTC 2025","passed","Fri Jan 10 13:53:50 UTC 2025","","","",""
"","57","should track add bank account button","BankInformations page","Fri Jan 10 13:51:57 UTC 2025","passed","Fri Jan 10 13:51:57 UTC 2025","","","",""
"","17","should load features","src | App","Fri Jan 10 13:55:11 UTC 2025","passed","Fri Jan 10 13:55:11 UTC 2025","","","",""
"","16","should display ""Réservation"" active/enabled step","IndividualOfferNavigation","Fri Jan 10 13:52:05 UTC 2025","passed","Fri Jan 10 13:52:05 UTC 2025","","on edition mode","",""
"","658","should reset modal state when closing departments filter modal","OfferFilters","Fri Jan 10 13:51:57 UTC 2025","passed","Fri Jan 10 13:51:58 UTC 2025","","","",""
"","11","should display the image if its present","PartnerPages","Fri Jan 10 13:53:52 UTC 2025","passed","Fri Jan 10 13:53:52 UTC 2025","","","",""
"","3","should return default values when collectiveStock is not defined","extractInitialVisibilityValues","Fri Jan 10 13:52:51 UTC 2025","passed","Fri Jan 10 13:52:51 UTC 2025","","","",""
"","77","should render with all fields","Signup","Fri Jan 10 13:51:42 UTC 2025","passed","Fri Jan 10 13:51:42 UTC 2025","","render","",""
"","23","should display when prebooking is activated","offer item","Fri Jan 10 13:53:06 UTC 2025","passed","Fri Jan 10 13:53:06 UTC 2025","","","",""
"","21","should log next action if disabled","screens:SignupJourney::ActionBar","Fri Jan 10 13:53:52 UTC 2025","passed","Fri Jan 10 13:53:52 UTC 2025","","","",""
"","1","should serialize patchBody","IndividualOffer:commons:serializers","Fri Jan 10 13:51:57 UTC 2025","passed","Fri Jan 10 13:51:57 UTC 2025","","serializePatchOffer","",""
"","391","should allow user to delete a stock","screens:StocksEventEdition","Fri Jan 10 13:50:59 UTC 2025","passed","Fri Jan 10 13:50:59 UTC 2025","","","",""
"","339","should filter stocks","StocksEventList","Fri Jan 10 13:51:23 UTC 2025","passed","Fri Jan 10 13:51:23 UTC 2025","","","",""
"","2","should return empty state when no notification is stored","notificationSelector","Fri Jan 10 13:55:44 UTC 2025","passed","Fri Jan 10 13:55:44 UTC 2025","","","",""
"","3","should return the union of national programs for multiple domains","getNationalProgramsForDomains","Fri Jan 10 13:55:46 UTC 2025","passed","Fri Jan 10 13:55:46 UTC 2025","","","",""
"","7","should display ""non conforme"" if offer is rejected when FF is active","StatusLabel","Fri Jan 10 13:54:35 UTC 2025","passed","Fri Jan 10 13:54:35 UTC 2025","","","",""
"","33","should display the acceslibre section in readonly if the feature is enabled and data is present","VenueFormScreen","Fri Jan 10 13:51:55 UTC 2025","passed","Fri Jan 10 13:51:55 UTC 2025","","","",""
"","147","should display modal on click","offer item","Fri Jan 10 13:53:06 UTC 2025","passed","Fri Jan 10 13:53:06 UTC 2025","","","",""
"","165","should not display MaybeAppUserDialog component if siret is incorrect","Offerer","Fri Jan 10 13:51:27 UTC 2025","passed","Fri Jan 10 13:51:27 UTC 2025","","","",""
"","0","should return filter subcategories that are not events","filterCategories","Fri Jan 10 13:52:37 UTC 2025","passed","Fri Jan 10 13:52:37 UTC 2025","","","",""
"","33","should redirect to the unavailable error page when the API sirene feature is disabled","SignIn","Fri Jan 10 13:51:27 UTC 2025","passed","Fri Jan 10 13:51:27 UTC 2025","","when user clicks on 'Créer un compte'","",""
"","2","should validate the form for case: missing a day value for weekly recurrence","validationSchema","Fri Jan 10 13:53:23 UTC 2025","passed","Fri Jan 10 13:53:23 UTC 2025","","","",""
"","144","should offer the national program oprtions filtered for the selected domains","FormOfferType","Fri Jan 10 13:55:15 UTC 2025","passed","Fri Jan 10 13:55:15 UTC 2025","","","",""
"","58","should display toggle button and should be enabled","Toggle button","Fri Jan 10 13:54:25 UTC 2025","passed","Fri Jan 10 13:54:25 UTC 2025","","","",""
"","55","should not display status filters modal","IndividualOffersScreen","Fri Jan 10 13:50:52 UTC 2025","passed","Fri Jan 10 13:50:52 UTC 2025","","","",""
"","38","should display the text value of the button when is not loading and the button should be enabled","submit button","Fri Jan 10 13:55:47 UTC 2025","passed","Fri Jan 10 13:55:47 UTC 2025","","","",""
"","169","should always display the confirmation modal before redirection","components | RouteLeavingGuardCollectiveOfferCreation | RouteLeavingGuard","Fri Jan 10 13:53:27 UTC 2025","passed","Fri Jan 10 13:53:27 UTC 2025","","","",""
"","327","should display error message when api reject call","RequestFormDialog","Fri Jan 10 13:52:01 UTC 2025","passed","Fri Jan 10 13:52:01 UTC 2025","","","",""
"","35","shoud render error block","reimbursementsWithFilters","Fri Jan 10 13:51:18 UTC 2025","passed","Fri Jan 10 13:51:18 UTC 2025","","","",""
"","23","should say how many offers are selected when more than 1 offer are selected","ActionsBar","Fri Jan 10 13:50:54 UTC 2025","passed","Fri Jan 10 13:50:54 UTC 2025","","","",""
"","6","should format the booking date even when the department code of the venue is not defined","BookingDetails","Fri Jan 10 13:55:07 UTC 2025","passed","Fri Jan 10 13:55:07 UTC 2025","","","",""
"","113","should render empty state when offerer has no offers","StatisticsDashboard","Fri Jan 10 13:53:23 UTC 2025","passed","Fri Jan 10 13:53:23 UTC 2025","","","",""
"","4","should display in school message when addressType is IN_SCHOOL","OfferVenue","Fri Jan 10 13:54:57 UTC 2025","passed","Fri Jan 10 13:54:57 UTC 2025","","","",""
"","47","should display the title of the list if it exists","Carousel","Fri Jan 10 13:54:02 UTC 2025","passed","Fri Jan 10 13:54:02 UTC 2025","","","",""
"","397","should submit onclick modal search button domain artistic","OfferFilters","Fri Jan 10 13:51:55 UTC 2025","passed","Fri Jan 10 13:51:56 UTC 2025","","","",""
"","0","should return list containing only BookingRecap matching beneficiary firstname keywords","filterBookingsRecap","Fri Jan 10 13:51:53 UTC 2025","passed","Fri Jan 10 13:51:53 UTC 2025","","","",""
"","28","should display the breadcrumb with a link back to the favorite page if the url contains 'mes-favoris'","OfferInfos","Fri Jan 10 13:52:40 UTC 2025","passed","Fri Jan 10 13:52:40 UTC 2025","","","",""
"","54","user should be able to enter number characters","components | SiretOrCommentFields","Fri Jan 10 13:51:44 UTC 2025","passed","Fri Jan 10 13:51:44 UTC 2025","","should validate SIRET on submit","",""
"","174","should display delete banner when stock is linked and delete right line","PriceCategories","Fri Jan 10 13:52:06 UTC 2025","passed","Fri Jan 10 13:52:06 UTC 2025","","","",""
"","377","should request bookings of venue requested by user when user clicks on ""Afficher""","components | BookingsRecap | Pro user","Fri Jan 10 13:50:52 UTC 2025","passed","Fri Jan 10 13:50:52 UTC 2025","","","",""
"","1","should validate the form for case: not valid form without phone","validationSchema","Fri Jan 10 13:54:05 UTC 2025","passed","Fri Jan 10 13:54:05 UTC 2025","","","",""
"","43","should show an offer card","OffersFavorites","Fri Jan 10 13:53:08 UTC 2025","passed","Fri Jan 10 13:53:08 UTC 2025","","","",""
"","41","should filter options with the default filter function when the user types in the field","SelectAutocomplete","Fri Jan 10 13:50:58 UTC 2025","passed","Fri Jan 10 13:50:58 UTC 2025","","filter","",""
"","179","should display error message and empty field when contremarque could not be validated"," Desk","Fri Jan 10 13:52:22 UTC 2025","passed","Fri Jan 10 13:52:22 UTC 2025","","should validate contremarque when the user submits the form","",""
"","3","should log an event containing query string and url parameters","useLogNavigation","Fri Jan 10 13:53:53 UTC 2025","passed","Fri Jan 10 13:53:53 UTC 2025","","","",""
"","32","should be able to go to the stocks step if the details are already filled","CollectiveCreationOfferNavigation","Fri Jan 10 13:51:52 UTC 2025","passed","Fri Jan 10 13:51:52 UTC 2025","","","",""
"","146","should prefill form with venue collective data","CollectiveDataEdition","Fri Jan 10 13:51:13 UTC 2025","passed","Fri Jan 10 13:51:13 UTC 2025","","prefill","",""
"","7","should not show create bookable offer button if template offer has pending status","CollectiveCreationOfferNavigation","Fri Jan 10 13:51:52 UTC 2025","passed","Fri Jan 10 13:51:52 UTC 2025","","","",""
"","0","should return full array when offer is from provider","setFormReadOnlyFields","Fri Jan 10 13:53:58 UTC 2025","passed","Fri Jan 10 13:53:58 UTC 2025","","","",""
"","61","should log add venue bank to account","LinkVenueCallout","Fri Jan 10 13:54:04 UTC 2025","passed","Fri Jan 10 13:54:04 UTC 2025","","With FF enabled","",""
"","0","should format browser date as UTC to required format","formatBrowserTimezonedDateAsUTC","Fri Jan 10 13:53:04 UTC 2025","passed","Fri Jan 10 13:53:04 UTC 2025","","","",""
"","20","should remove geolocation tag on click","FiltersTag","Fri Jan 10 13:52:25 UTC 2025","passed","Fri Jan 10 13:52:25 UTC 2025","","","",""
"","1","should return false when booking quantity is 0","hasChangesOnStockWithBookings","Fri Jan 10 13:54:44 UTC 2025","passed","Fri Jan 10 13:54:44 UTC 2025","","","",""
"","24","should display a select input with the collective options","components | FilterByOmniSearch","Fri Jan 10 13:52:36 UTC 2025","passed","Fri Jan 10 13:52:36 UTC 2025","","","",""
"","127","should handle connected users","Accessibility layout","Fri Jan 10 13:55:08 UTC 2025","passed","Fri Jan 10 13:55:08 UTC 2025","","","",""
"","9","should show the whole date","OfferNameCell","Fri Jan 10 13:52:36 UTC 2025","passed","Fri Jan 10 13:52:36 UTC 2025","","","",""
"","4","should not call API when SIREN is empty","getSirenData","Fri Jan 10 13:54:30 UTC 2025","passed","Fri Jan 10 13:54:30 UTC 2025","","","",""
"","84","should not let choose an other partner page when on adress page","route VenueEdition","Fri Jan 10 13:51:46 UTC 2025","passed","Fri Jan 10 13:51:46 UTC 2025","","","",""
"","4","should not display the formats section if the offer has no formats","AdageOfferDetailsSection","Fri Jan 10 13:53:06 UTC 2025","passed","Fri Jan 10 13:53:06 UTC 2025","","","",""
"","59","should not display column titles when no offers are returned","route TemplateCollectiveOffers","Fri Jan 10 13:51:17 UTC 2025","passed","Fri Jan 10 13:51:17 UTC 2025","status filters","filters","",""
"","53","on creation, should not display the EAN field since it would duplicate top EAN search/input field","DetailsSubForm","Fri Jan 10 13:52:50 UTC 2025","passed","Fri Jan 10 13:52:50 UTC 2025","when the offer is product based","when EAN search is displayed","",""
"","11","should display the mobility zone for an event","CollectiveOfferLocationSection","Fri Jan 10 13:52:49 UTC 2025","passed","Fri Jan 10 13:52:49 UTC 2025","","","",""
"","268","should let peform actions on invoices","reimbursementsWithFilters","Fri Jan 10 13:51:18 UTC 2025","passed","Fri Jan 10 13:51:19 UTC 2025","","","",""
"","129","should display error message if siret does not match siren if venue is non virtual","components | SiretOrCommentFields","Fri Jan 10 13:51:44 UTC 2025","passed","Fri Jan 10 13:51:44 UTC 2025","","should validate SIRET on submit","",""
"","0","should return true for 'allowed action CAN_CREATE_BOOKABLE_OF…'","isActionAllowedOnCollectiveOffer","Fri Jan 10 13:54:45 UTC 2025","passed","Fri Jan 10 13:54:45 UTC 2025","","","",""
"","1","should not return uai facet filter","adageFiltersToFacetFilters","Fri Jan 10 13:53:08 UTC 2025","passed","Fri Jan 10 13:53:08 UTC 2025","","","",""
"","34","should disable institution input when allowedAction CAN_EDIT_INSTITUTION  doesnt exist and FF ENABLE_COLLECTIVE_NEW_STATUSES enable","CollectiveOfferVisibility","Fri Jan 10 13:51:21 UTC 2025","passed","Fri Jan 10 13:51:21 UTC 2025","","","",""
"","24","should not display non permanent venues","screens:SignupJourney::Offerers","Fri Jan 10 13:51:46 UTC 2025","passed","Fri Jan 10 13:51:46 UTC 2025","","","",""
"","11","should render confirmation page when offer is active and template","CollectiveOfferConfirmation","Fri Jan 10 13:54:11 UTC 2025","passed","Fri Jan 10 13:54:11 UTC 2025","","","",""
"","2","should validate the form for case: price above 300","validationSchema","Fri Jan 10 13:54:27 UTC 2025","passed","Fri Jan 10 13:54:27 UTC 2025","","","",""
"","7","should render LinkVenueCallout with singular plural","LinkVenueCallout","Fri Jan 10 13:52:44 UTC 2025","passed","Fri Jan 10 13:52:44 UTC 2025","","With FF enabled","",""
"","11","should display link for eac informations if has adage id and already created offer","VenueOfferSteps","Fri Jan 10 13:52:26 UTC 2025","passed","Fri Jan 10 13:52:26 UTC 2025","","","",""
"","148","should fetch API for CSV when clicking on the download button and disable button while its loading","components | BookingsRecap | Pro user","Fri Jan 10 13:50:54 UTC 2025","passed","Fri Jan 10 13:50:54 UTC 2025","","","",""
"","119","should render tabs","src | components | Tabs","Fri Jan 10 13:54:26 UTC 2025","passed","Fri Jan 10 13:54:26 UTC 2025","","","",""
"","1","should validate the form for case: not valid form with invalid and too long phone","validationSchema","Fri Jan 10 13:54:05 UTC 2025","passed","Fri Jan 10 13:54:05 UTC 2025","","","",""
"","129","should indicate that the format is invalid and which characters are valid"," Desk","Fri Jan 10 13:52:21 UTC 2025","passed","Fri Jan 10 13:52:21 UTC 2025","","should validate while user is typing","",""
"","48","should update the selected omniSearch criteria when selecting an omniSearchCriteria","components | FilterByOmniSearch","Fri Jan 10 13:52:36 UTC 2025","passed","Fri Jan 10 13:52:36 UTC 2025","","","",""
"","253","should open a download modal","IndividualOfferBookingsSummaryScreen","Fri Jan 10 13:53:00 UTC 2025","passed","Fri Jan 10 13:53:01 UTC 2025","","","",""
"","287","should display venue select disabled","screens | OfferEducational : edition offerer step","Fri Jan 10 13:53:39 UTC 2025","passed","Fri Jan 10 13:53:40 UTC 2025","","","",""
"","123","should close diffuse help","DiffuseHelp","Fri Jan 10 13:55:35 UTC 2025","passed","Fri Jan 10 13:55:35 UTC 2025","","","",""
"","0","should create a template offer payload with url infos when the form option is checked in the form","createOfferPayload","Fri Jan 10 13:53:50 UTC 2025","passed","Fri Jan 10 13:53:50 UTC 2025","","","",""
"","33","should log info when opening sastisfaction survey","SurveySatisfaction","Fri Jan 10 13:54:32 UTC 2025","passed","Fri Jan 10 13:54:32 UTC 2025","","","",""
"","1","should return institution details","extractInitialVisibilityValues","Fri Jan 10 13:54:12 UTC 2025","passed","Fri Jan 10 13:54:12 UTC 2025","","","",""
"","1","should serialize data for stock event edition","serializeStockEventEdition","Fri Jan 10 13:54:02 UTC 2025","passed","Fri Jan 10 13:54:02 UTC 2025","","","",""
"","34","should track ReimbursementPoint","VenueOfferSteps","Fri Jan 10 13:53:48 UTC 2025","passed","Fri Jan 10 13:53:48 UTC 2025","","","",""
"","49","should show existing parameters on edition","AllocineProviderForm","Fri Jan 10 13:51:50 UTC 2025","passed","Fri Jan 10 13:51:50 UTC 2025","","","",""
"","102","should have requete parameter in the link for previous step when requete is present in the URL","CollectiveOfferSummaryCreation","Fri Jan 10 13:53:44 UTC 2025","passed","Fri Jan 10 13:53:44 UTC 2025","","","",""
"","25","should set an initial search value on init","Autocomplete","Fri Jan 10 13:52:04 UTC 2025","passed","Fri Jan 10 13:52:04 UTC 2025","","","",""
"","57","should render digital book","screens:StocksThing","Fri Jan 10 13:51:02 UTC 2025","passed","Fri Jan 10 13:51:02 UTC 2025","","","",""
"","91","should redirect with the offer type when venue and type selected","screens:IndividualOffer::OfferType","Fri Jan 10 13:53:32 UTC 2025","passed","Fri Jan 10 13:53:32 UTC 2025","","","",""
"","30","should remove department tag on click","FiltersTag","Fri Jan 10 13:52:25 UTC 2025","passed","Fri Jan 10 13:52:25 UTC 2025","","","",""
"","2","should validate the form for case: number of participants should not exceed 3000","validationSchema","Fri Jan 10 13:53:32 UTC 2025","passed","Fri Jan 10 13:53:32 UTC 2025","","","",""
"","10","should format the booking date when the booking has a starting date","BookingDetails","Fri Jan 10 13:55:07 UTC 2025","passed","Fri Jan 10 13:55:07 UTC 2025","","","",""
"","147","should display errors on api failure","Offerer","Fri Jan 10 13:51:27 UTC 2025","passed","Fri Jan 10 13:51:27 UTC 2025","","","",""
"","25","should show an error message notification when offer could not be fetched","AdageDiscovery","Fri Jan 10 13:53:50 UTC 2025","passed","Fri Jan 10 13:53:50 UTC 2025","","","",""
"","3","should not display the national program section if the offer has no national program","AdageOfferDetailsSection","Fri Jan 10 13:53:06 UTC 2025","passed","Fri Jan 10 13:53:06 UTC 2025","","","",""
"","14","should display ""Tous les établissements"" when offer is not assigned to a specific institution","ollectiveOfferRow","Fri Jan 10 13:51:16 UTC 2025","passed","Fri Jan 10 13:51:16 UTC 2025","","offer remaining quantity or institution","",""
"","70","should have a cancel button instead of the previous step button when editing the offer","OfferEducationalStock","Fri Jan 10 13:51:55 UTC 2025","passed","Fri Jan 10 13:51:55 UTC 2025","","","",""
"","279","should load offers with selected period beginning date","route TemplateCollectiveOffers","Fri Jan 10 13:51:18 UTC 2025","passed","Fri Jan 10 13:51:18 UTC 2025","on click on search button","filters","",""
"","9","should not show an error if input has not been touched","PhoneNumberInput","Fri Jan 10 13:53:57 UTC 2025","passed","Fri Jan 10 13:53:57 UTC 2025","","","",""
"","4","when it is in offerer venue","formatOfferEventAddress","Fri Jan 10 13:54:49 UTC 2025","passed","Fri Jan 10 13:54:49 UTC 2025","","","",""
"","2","should display a ""-"" when the date is not available","bookings status history cell","Fri Jan 10 13:54:00 UTC 2025","passed","Fri Jan 10 13:54:00 UTC 2025","","","",""
"","162","should render authentication step","test SignupJourneyStepper","Fri Jan 10 13:52:55 UTC 2025","passed","Fri Jan 10 13:52:55 UTC 2025","","","",""
"","9","should not display the clear button anymore","DetailsEanSearch","Fri Jan 10 13:51:51 UTC 2025","passed","Fri Jan 10 13:51:51 UTC 2025","","when the draft offer has been created and the offer is product-based","",""
"","13","should display an internal link with icon","LinkNodes","Fri Jan 10 13:54:58 UTC 2025","passed","Fri Jan 10 13:54:58 UTC 2025","","","",""
"","60","should return an error on offer archiving when the offer id is not valid","CollectiveEditionOfferNavigation","Fri Jan 10 13:51:33 UTC 2025","passed","Fri Jan 10 13:51:33 UTC 2025","","","",""
"","74","should return width and height","useGetImageBitmap","Fri Jan 10 13:55:29 UTC 2025","passed","Fri Jan 10 13:55:29 UTC 2025","","","",""
"","286","should render collective offer stock form","CollectiveOfferStockCreation","Fri Jan 10 13:54:17 UTC 2025","passed","Fri Jan 10 13:54:17 UTC 2025","","","",""
"","32","should not display a expiration row if the offer has no booking limit","ollectiveOfferRow","Fri Jan 10 13:51:17 UTC 2025","passed","Fri Jan 10 13:51:17 UTC 2025","","","",""
"","1","should return start datetime in user timezone when booking limit datetime is not valid","buildBookingLimitDatetimeForStockPayload","Fri Jan 10 13:54:40 UTC 2025","passed","Fri Jan 10 13:54:40 UTC 2025","","","",""
"","26","should display disabled checkbox when offer is not editable","ollectiveOfferRow","Fri Jan 10 13:51:16 UTC 2025","passed","Fri Jan 10 13:51:16 UTC 2025","","","",""
"","55","should display select siret button if venue does not have pricing point","LinkVenueDialog","Fri Jan 10 13:51:51 UTC 2025","passed","Fri Jan 10 13:51:51 UTC 2025","","","",""
"","99","should toggle collective section on collective section button click","SideNavLinks","Fri Jan 10 13:52:47 UTC 2025","passed","Fri Jan 10 13:52:47 UTC 2025","","","",""
"","106","should render validation step and navigate through steps","test SignupJourneyStepper","Fri Jan 10 13:52:56 UTC 2025","passed","Fri Jan 10 13:52:56 UTC 2025","","","",""
"","0","parse empty error","getHumanReadableApiError","Fri Jan 10 13:53:17 UTC 2025","passed","Fri Jan 10 13:53:17 UTC 2025","","","",""
"","34","should append script tag on first render","initReCaptchaScript","Fri Jan 10 13:55:51 UTC 2025","passed","Fri Jan 10 13:55:51 UTC 2025","","","",""
"","73","should not render component on getOfferer error","Reimbursement page","Fri Jan 10 13:53:26 UTC 2025","passed","Fri Jan 10 13:53:26 UTC 2025","","","",""
"","9","should display a Success callout","Callout","Fri Jan 10 13:54:29 UTC 2025","passed","Fri Jan 10 13:54:29 UTC 2025","","","",""
"","54","should render all institution if no institution provided","CollectiveOfferVisibilitySection","Fri Jan 10 13:55:21 UTC 2025","passed","Fri Jan 10 13:55:21 UTC 2025","","","",""
"","3","should render nothing when all steps are not shown","VenueOfferSteps","Fri Jan 10 13:52:26 UTC 2025","passed","Fri Jan 10 13:52:26 UTC 2025","","","",""
"","83","should not fill input quantity with negative value","AllocineProviderForm","Fri Jan 10 13:51:50 UTC 2025","passed","Fri Jan 10 13:51:50 UTC 2025","","","",""
"","1","should correctly serialize extra data","serializeExtraData","Fri Jan 10 13:51:39 UTC 2025","passed","Fri Jan 10 13:51:39 UTC 2025","","","",""
"","1","should return list containing only BookingRecap matching keywords","filterBookingsRecap","Fri Jan 10 13:51:53 UTC 2025","passed","Fri Jan 10 13:51:53 UTC 2025","","by offer name","",""
"","173","should show the dates section if the offer is a template","OfferEducationalForm","Fri Jan 10 13:53:00 UTC 2025","passed","Fri Jan 10 13:53:00 UTC 2025","","","",""
"","1","getActiveStep","getActiveStep","Fri Jan 10 13:55:53 UTC 2025","passed","Fri Jan 10 13:55:53 UTC 2025","","","",""
"","17","should not display an edit button","DetailsSummaryScreen","Fri Jan 10 13:53:26 UTC 2025","passed","Fri Jan 10 13:53:26 UTC 2025","","when the offer is product based","",""
"","20","should display dates for status","CollectiveDmsTimeline","Fri Jan 10 13:52:22 UTC 2025","passed","Fri Jan 10 13:52:22 UTC 2025","","","",""
"","15","should display a banner with the days left before expiration when it expires in less than 7 days","ExpirationCell","Fri Jan 10 13:54:20 UTC 2025","passed","Fri Jan 10 13:54:20 UTC 2025","","","",""
"","26","should enforce absolute links","ButtonLink","Fri Jan 10 13:54:18 UTC 2025","passed","Fri Jan 10 13:54:18 UTC 2025","","","",""
"","7","should render LinkVenueCallout with singular plural","LinkVenueCallout","Fri Jan 10 13:52:44 UTC 2025","passed","Fri Jan 10 13:52:44 UTC 2025","WIP_ENABLE_OFFER_ADDRESS","With FF enabled","",""
"","58","should notify of an error if the offer booking limit date is in the past on press ""Publier l’offre""","CollectiveOfferConfirmation","Fri Jan 10 13:52:33 UTC 2025","passed","Fri Jan 10 13:52:34 UTC 2025","","","",""
"","285","should check accessibilities on click","Accessibility","Fri Jan 10 13:52:39 UTC 2025","passed","Fri Jan 10 13:52:39 UTC 2025","","","",""
"","70","should allow edition for a template offer when the ENABLE_COLLECTIVE_NEW_STATUSES FF is enabled and the edition of details is allowed","CollectiveActionsCells","Fri Jan 10 13:51:13 UTC 2025","passed","Fri Jan 10 13:51:13 UTC 2025","","","",""
