"DESCRIPTION","DURATION IN MS","NAME","PARENT SUITE","START TIME","STATUS","STOP TIME","SUB SUITE","SUITE","TEST CLASS","TEST METHOD"
"","233","should open a download modal","IndividualOfferBookingsSummaryScreen","Tue Jan 14 15:56:28 UTC 2025","passed","Tue Jan 14 15:56:28 UTC 2025","","","",""
"","35","should not allow edition for a bookable offer when the ENABLE_COLLECTIVE_NEW_STATUSES FF is enabled and no edition action is allowed","CollectiveActionsCells","Tue Jan 14 15:54:38 UTC 2025","passed","Tue Jan 14 15:54:38 UTC 2025","","","",""
"","6","should not display the dialog when the button modal was not opened or was closed","AdageButtonFilter","Tue Jan 14 15:57:13 UTC 2025","passed","Tue Jan 14 15:57:13 UTC 2025","","","",""
"","92","should display title, content and links","Callout","Tue Jan 14 15:57:57 UTC 2025","passed","Tue Jan 14 15:57:57 UTC 2025","","","",""
"","1","should generate stocks on a monthly basis every beginning of month","onSubmit","Tue Jan 14 15:55:00 UTC 2025","passed","Tue Jan 14 15:55:00 UTC 2025","","","",""
"","0","should return other uai facet filter","adageFiltersToFacetFilters","Tue Jan 14 15:56:36 UTC 2025","passed","Tue Jan 14 15:56:36 UTC 2025","","","",""
"","79","should display total number of offers in plural if multiple offers","TemplateCollectiveOffersScreen","Tue Jan 14 15:54:55 UTC 2025","passed","Tue Jan 14 15:54:55 UTC 2025","","","",""
"","2","should return an empty array when start date is after end date","getDatesInInterval","Tue Jan 14 15:57:48 UTC 2025","passed","Tue Jan 14 15:57:48 UTC 2025","","","",""
"","27","should display adage publish button if action is allowed","OfferEducationalActions","Tue Jan 14 15:55:15 UTC 2025","passed","Tue Jan 14 15:55:15 UTC 2025","","","",""
"","2","should return true when collective offer status is ACTIVE","canArchiveCollectiveOffer","Tue Jan 14 15:56:32 UTC 2025","passed","Tue Jan 14 15:56:32 UTC 2025","","","",""
"","6","should render in venue tag if event adress type school is selected","FiltersTag","Tue Jan 14 15:55:50 UTC 2025","passed","Tue Jan 14 15:55:50 UTC 2025","","","",""
"","71","should instanciate the observer and observe the watched element","useIsElementVisible","Tue Jan 14 15:58:56 UTC 2025","passed","Tue Jan 14 15:58:56 UTC 2025","","","",""
"","45","should display the number of offers for the user institution","AdageHeader","Tue Jan 14 15:56:05 UTC 2025","passed","Tue Jan 14 15:56:05 UTC 2025","","","",""
"","905","should display new stocks banner for several stocks","StocksEventCreation","Tue Jan 14 15:56:09 UTC 2025","passed","Tue Jan 14 15:56:10 UTC 2025","","","",""
"","24","should display error message when trying to publish offer bookable when the FF ENABLE_COLLECTIVE_NEW_STATUSES is enabled","ActionsBar","Tue Jan 14 15:54:20 UTC 2025","passed","Tue Jan 14 15:54:20 UTC 2025","","","",""
"","0","should not prefill the form values with the venue email and phone if they already exist on in the form","applyVenueDefaultsToFormValues","Tue Jan 14 15:57:10 UTC 2025","passed","Tue Jan 14 15:57:10 UTC 2025","","","",""
"","46","should set an initial search value on init","Autocomplete","Tue Jan 14 15:55:30 UTC 2025","passed","Tue Jan 14 15:55:31 UTC 2025","","","",""
"","59","should render component","screens:SignupJourney::Welcome","Tue Jan 14 15:59:00 UTC 2025","passed","Tue Jan 14 15:59:00 UTC 2025","","","",""
"","27","should render text for multiple offers","DeactivationConfirmDialog","Tue Jan 14 15:57:48 UTC 2025","passed","Tue Jan 14 15:57:48 UTC 2025","","","",""
"","12","should validate the form for case: valid form for unique date","validationSchema","Tue Jan 14 15:56:51 UTC 2025","passed","Tue Jan 14 15:56:51 UTC 2025","","","",""
"","54","should redirect to home page if the user is logged in","src | components | pages | Signup | validation","Tue Jan 14 15:57:04 UTC 2025","passed","Tue Jan 14 15:57:04 UTC 2025","","","",""
"","0","should return -1 when first row bookingDate comes before second row bookingDate","sortByBookingDate","Tue Jan 14 15:56:13 UTC 2025","passed","Tue Jan 14 15:56:13 UTC 2025","","","",""
"","43","should render app preview offer","AppPreviewOffer","Tue Jan 14 15:59:16 UTC 2025","passed","Tue Jan 14 15:59:16 UTC 2025","","","",""
"","18","should display the right wording with the OA FF","CollectiveOfferSummary","Tue Jan 14 15:55:03 UTC 2025","passed","Tue Jan 14 15:55:03 UTC 2025","","OA feature flag","",""
"","351","should prefill event address venue when selecting venue for reimbursement","screens | OfferEducational : event address step","Tue Jan 14 15:57:27 UTC 2025","passed","Tue Jan 14 15:57:28 UTC 2025","","","",""
"","5","should render { displayedStatus: 'BOOKED', expectedLabel: 'réservée' } status","CollectiveStatusLabel","Tue Jan 14 15:56:56 UTC 2025","passed","Tue Jan 14 15:56:56 UTC 2025","","","",""
"","0","should return already validated message when booking is already validated","getBookingFailure","Tue Jan 14 15:57:46 UTC 2025","passed","Tue Jan 14 15:57:46 UTC 2025","","","",""
"","0","should return all fields as read only when offer is pending","setFormReadOnlyFields","Tue Jan 14 15:55:43 UTC 2025","passed","Tue Jan 14 15:55:43 UTC 2025","","","",""
"","15","It should register the correct event listener and unregister on unmount","useBeforeUnload","Tue Jan 14 15:58:32 UTC 2025","passed","Tue Jan 14 15:58:32 UTC 2025","","When the hook is initialised","",""
"","55","should notify when there is not yet stocks","StocksEventCreation","Tue Jan 14 15:56:10 UTC 2025","passed","Tue Jan 14 15:56:10 UTC 2025","","","",""
"","16","renders the first card with correct title, description, and button","OnboardingOffersChoice Component","Tue Jan 14 15:58:42 UTC 2025","passed","Tue Jan 14 15:58:42 UTC 2025","","","",""
"","65","should not display survey satisfaction","offers","Tue Jan 14 15:54:11 UTC 2025","passed","Tue Jan 14 15:54:11 UTC 2025","","","",""
"","1","should send isVenueAddress flag set to false when user select another location (WIP_ENABLE_OFFER_ADDRESS)","IndividualOffer:commons:serializers","Tue Jan 14 15:55:24 UTC 2025","passed","Tue Jan 14 15:55:24 UTC 2025","","serializePatchOffer","",""
"","10","should not display a warning when all stocks are sold out","IndividualOfferRow","Tue Jan 14 15:55:08 UTC 2025","passed","Tue Jan 14 15:55:08 UTC 2025","","when offer is an event product","",""
"","0","should return false for today, current hour and past minutes","isTimeInTheFuture","Tue Jan 14 15:57:48 UTC 2025","passed","Tue Jan 14 15:57:48 UTC 2025","","","",""
"","3","should return stock details","extractInitialVisibilityValues","Tue Jan 14 15:56:19 UTC 2025","passed","Tue Jan 14 15:56:19 UTC 2025","","","",""
"","39","should display the searched query when something was searched","NoResultPage","Tue Jan 14 15:59:04 UTC 2025","passed","Tue Jan 14 15:59:04 UTC 2025","","","",""
"","3","should return the start date of the offer when the end date is equal","adageOfferDates","Tue Jan 14 15:57:38 UTC 2025","passed","Tue Jan 14 15:57:38 UTC 2025","","getFormattedDatesForBookableOffer","",""
"","4","should display the right formatted user name","BeneficiaryCell","Tue Jan 14 15:58:25 UTC 2025","passed","Tue Jan 14 15:58:25 UTC 2025","","","",""
"","65","should not render reimbursement fields when FF bank details is enabled and venue has no siret","route VenueEdition","Tue Jan 14 15:55:12 UTC 2025","passed","Tue Jan 14 15:55:12 UTC 2025","","","",""
"","25","should filter bookings collective on render","components | BookingsRecapTable","Tue Jan 14 15:54:49 UTC 2025","passed","Tue Jan 14 15:54:49 UTC 2025","","","",""
"","553","should redirect to stock on submit","screens | OfferEducational : event address step","Tue Jan 14 15:57:34 UTC 2025","passed","Tue Jan 14 15:57:35 UTC 2025","","","",""
"","79","should redirect user on offerer page on continue button click","screens:SignupJourney::ConfirmedAttachment","Tue Jan 14 15:58:46 UTC 2025","passed","Tue Jan 14 15:58:46 UTC 2025","","","",""
"","126","should display error message if siret does not match siren if venue is non virtual","components | SiretOrCommentFields","Tue Jan 14 15:55:10 UTC 2025","passed","Tue Jan 14 15:55:10 UTC 2025","","should validate SIRET on submit","",""
"","1","should reject non dom-tom phone number with region code","dom-tom phone number with region code","Tue Jan 14 15:57:03 UTC 2025","passed","Tue Jan 14 15:57:03 UTC 2025","","","",""
"","42","should render a main heading when provided","Layout","Tue Jan 14 15:57:03 UTC 2025","passed","Tue Jan 14 15:57:03 UTC 2025","","about main heading & back to nav link","",""
"","24","should display allociné spécific info","VenueProviderCard","Tue Jan 14 15:56:20 UTC 2025","passed","Tue Jan 14 15:56:20 UTC 2025","","Allociné provider","",""
"","107","should display error message if uai does not match","offer item","Tue Jan 14 15:56:34 UTC 2025","passed","Tue Jan 14 15:56:34 UTC 2025","","","",""
"","195","should render selection duplication page","CollectiveOfferConfirmation","Tue Jan 14 15:55:54 UTC 2025","passed","Tue Jan 14 15:55:54 UTC 2025","","","",""
"","0","when offer is not template","computeURLCollectiveOfferId","Tue Jan 14 15:59:32 UTC 2025","passed","Tue Jan 14 15:59:32 UTC 2025","","","",""
"","123","should  render footer","Footer","Tue Jan 14 15:58:55 UTC 2025","passed","Tue Jan 14 15:58:55 UTC 2025","","","",""
"","17","should display the venue name when venue public name is not given","ollectiveOfferRow","Tue Jan 14 15:54:41 UTC 2025","passed","Tue Jan 14 15:54:41 UTC 2025","","","",""
"","107","should call tracker for classroom playlist element","AdageDiscover classRoomPlaylist","Tue Jan 14 15:57:35 UTC 2025","passed","Tue Jan 14 15:57:35 UTC 2025","","","",""
"","80","should not display redirect modal if offer is free","Summary","Tue Jan 14 15:54:07 UTC 2025","passed","Tue Jan 14 15:54:07 UTC 2025","","On Creation","",""
"","50","should clear the form when the clear button is clicked","DetailsEanSearch","Tue Jan 14 15:55:17 UTC 2025","passed","Tue Jan 14 15:55:17 UTC 2025","when an EAN search is performed succesfully","when the draft offer has not been created yet (dirty)","",""
"","170","should render authentication step","test SignupJourneyStepper","Tue Jan 14 15:56:23 UTC 2025","passed","Tue Jan 14 15:56:23 UTC 2025","","","",""
"","1","should prefill the form values with the venue email and phone if the venue has them","applyVenueDefaultsToFormValues","Tue Jan 14 15:57:10 UTC 2025","passed","Tue Jan 14 15:57:10 UTC 2025","","","",""
"","1","should return serialized filters","serializeFiltersForData","Tue Jan 14 15:56:36 UTC 2025","passed","Tue Jan 14 15:56:36 UTC 2025","","","",""
"","70","should only uncheck none option when unchecking it","useAccessibilityOptions","Tue Jan 14 15:58:01 UTC 2025","passed","Tue Jan 14 15:58:01 UTC 2025","","","",""
"","0","getHumanizeRelativeDistance(undefined) 	= '900+ km'","getDistance","Tue Jan 14 15:59:05 UTC 2025","passed","Tue Jan 14 15:59:05 UTC 2025","","","",""
"","4","should serialize data with event stock","routes::Summary::serializers","Tue Jan 14 15:57:03 UTC 2025","passed","Tue Jan 14 15:57:03 UTC 2025","","","",""
"","74","should display comment field when toggle is clicked","components | SiretOrCommentFields","Tue Jan 14 15:55:09 UTC 2025","passed","Tue Jan 14 15:55:09 UTC 2025","","","",""
"","440","should be able to reset the password when token is ok","ResetPassword","Tue Jan 14 15:58:33 UTC 2025","passed","Tue Jan 14 15:58:33 UTC 2025","","","",""
"","0","should return false when collective offer status is ""SOLD_OUT""","canArchiveCollectiveOffer","Tue Jan 14 15:56:32 UTC 2025","passed","Tue Jan 14 15:56:32 UTC 2025","","","",""
"","265","should trim values when searching in a SelectAutocomplete","CollectiveOfferVisibility","Tue Jan 14 15:54:46 UTC 2025","passed","Tue Jan 14 15:54:46 UTC 2025","","","",""
"","0","should return false if last provider is null","isAllocineOffer","Tue Jan 14 15:59:04 UTC 2025","passed","Tue Jan 14 15:59:04 UTC 2025","","","",""
"","23","should have an edit link to detail page when offer is draft","IndividualOfferRow","Tue Jan 14 15:55:08 UTC 2025","passed","Tue Jan 14 15:55:08 UTC 2025","","","",""
"","146","should display an error when the institution could not be saved","CollectiveOfferVisibility","Tue Jan 14 15:54:45 UTC 2025","passed","Tue Jan 14 15:54:45 UTC 2025","","","",""
"","152","should display an error when input value is not valid for Formik","SelectAutocomplete","Tue Jan 14 15:54:23 UTC 2025","passed","Tue Jan 14 15:54:23 UTC 2025","","","",""
"","71","should display each necessary days","OpeningHoursReadOnly","Tue Jan 14 15:57:41 UTC 2025","passed","Tue Jan 14 15:57:41 UTC 2025","","","",""
"","20","should display publication date when it is in the future","IndivualOfferLayout","Tue Jan 14 15:56:16 UTC 2025","passed","Tue Jan 14 15:56:16 UTC 2025","","","",""
"","1","should return false if the value is not a number","isNumber","Tue Jan 14 15:58:37 UTC 2025","passed","Tue Jan 14 15:58:37 UTC 2025","","","",""
"","66","should render the component","AddressManual","Tue Jan 14 15:58:59 UTC 2025","passed","Tue Jan 14 15:58:59 UTC 2025","","","",""
"","14","should check the checkbox initially when the input value is 0","PriceInput","Tue Jan 14 15:57:15 UTC 2025","passed","Tue Jan 14 15:57:15 UTC 2025","","when ""Gratuit"" checkbox display is enabled","",""
"","0","should handle accessibility not set","setDefaultInitialValuesFromOffer","Tue Jan 14 15:55:43 UTC 2025","passed","Tue Jan 14 15:55:43 UTC 2025","","","",""
"","30","should call reinit filters on click reinit button","FiltersTag","Tue Jan 14 15:55:50 UTC 2025","passed","Tue Jan 14 15:55:50 UTC 2025","","","",""
"","10","should call API with given path and formData and credentials by default and correct method","pcapiClient","Tue Jan 14 15:58:06 UTC 2025","passed","Tue Jan 14 15:58:06 UTC 2025","","postWithFormData","",""
"","4","should render italic text with <em> tag","Markdown","Tue Jan 14 15:58:05 UTC 2025","passed","Tue Jan 14 15:58:05 UTC 2025","","","",""
"","59","should uncheck none option if any other is clicked","useAccessibilityOptions","Tue Jan 14 15:58:01 UTC 2025","passed","Tue Jan 14 15:58:01 UTC 2025","","","",""
"","2","should return undefined when durationHour is empty","IndividualOffer:commons:serializers","Tue Jan 14 15:55:24 UTC 2025","passed","Tue Jan 14 15:55:24 UTC 2025","","serializeDurationMinutes","",""
"","216","should show the cancelled status option if the ENABLE_COLLECTIVE_NEW_STATUSES FF is active","CollectiveOffersScreen","Tue Jan 14 15:54:34 UTC 2025","passed","Tue Jan 14 15:54:35 UTC 2025","","","",""
"","129","should apply offerDate filter when choosing an offer date","components | FilterByEventDate","Tue Jan 14 15:59:08 UTC 2025","passed","Tue Jan 14 15:59:08 UTC 2025","","","",""
"","10","should not render on venue types api error","ValidationScreen","Tue Jan 14 15:55:15 UTC 2025","passed","Tue Jan 14 15:55:15 UTC 2025","","errors","",""
"","4323","should require a title with less than 110 chars (and truncate longer strings)","screens | OfferEducational : creation offer type step","Tue Jan 14 15:55:37 UTC 2025","passed","Tue Jan 14 15:55:41 UTC 2025","","title, description and duration inputs","",""
"","15","should generate stocks for one unique date","onSubmit","Tue Jan 14 15:55:00 UTC 2025","passed","Tue Jan 14 15:55:00 UTC 2025","","","",""
"","19","should show the price section when the offer is bookable","AdageOfferInfoSection","Tue Jan 14 15:56:37 UTC 2025","passed","Tue Jan 14 15:56:37 UTC 2025","","","",""
"","35","should display the playlist title based on the maximum venue distance","VenuePlaylist","Tue Jan 14 15:57:24 UTC 2025","passed","Tue Jan 14 15:57:24 UTC 2025","","","",""
"","15","should not render a Header component when there is no filtered booking","components | BookingsRecapTable","Tue Jan 14 15:54:49 UTC 2025","passed","Tue Jan 14 15:54:49 UTC 2025","","","",""
"","16","should display a custom external link with icon","LinkNodes","Tue Jan 14 15:58:28 UTC 2025","passed","Tue Jan 14 15:58:28 UTC 2025","","","",""
"","3","should verify that two offers are the same","isSameOffer","Tue Jan 14 15:58:27 UTC 2025","passed","Tue Jan 14 15:58:27 UTC 2025","","","",""
"","432","should display error toast when adapter call failed","CollectiveDataEdition","Tue Jan 14 15:54:37 UTC 2025","passed","Tue Jan 14 15:54:38 UTC 2025","","submit","",""
"","27","should not deactivate offers on click on ""Masquer"" when at least one offer expired but with booking finished","ActionsBar","Tue Jan 14 15:54:19 UTC 2025","passed","Tue Jan 14 15:54:20 UTC 2025","","","",""
"","100","should toggle collective section on collective section button click","SideNavLinks","Tue Jan 14 15:56:14 UTC 2025","passed","Tue Jan 14 15:56:14 UTC 2025","","","",""
"","9","should show the offer title even if it's a preview of the offer","AdageOfferHeader","Tue Jan 14 15:55:58 UTC 2025","passed","Tue Jan 14 15:55:58 UTC 2025","","","",""
"","164","should display an error message on CSV download when API returns a status other than 200","components | BookingsRecap | Pro user","Tue Jan 14 15:54:19 UTC 2025","passed","Tue Jan 14 15:54:19 UTC 2025","","","",""
"","256","should let peform actions on invoices","reimbursementsWithFilters","Tue Jan 14 15:54:43 UTC 2025","passed","Tue Jan 14 15:54:43 UTC 2025","","","",""
"","0","using image from thumbUrl","getIndividualOfferImage","Tue Jan 14 15:58:36 UTC 2025","passed","Tue Jan 14 15:58:36 UTC 2025","","","",""
"","1","should create a template from an offer with offer email","computeInitialValuesFromOffer","Tue Jan 14 15:57:05 UTC 2025","passed","Tue Jan 14 15:57:05 UTC 2025","","","",""
"","11","should render steps for confirmed booking when event is passed","collective timeline","Tue Jan 14 15:54:59 UTC 2025","passed","Tue Jan 14 15:54:59 UTC 2025","","confirmed booking","",""
"","105","should not show help section if there are stocks already and show table","StocksEventCreation","Tue Jan 14 15:56:09 UTC 2025","passed","Tue Jan 14 15:56:09 UTC 2025","","","",""
"","1","should serialize data for stock event with ""bookingLimitDatetime"" even if not provided","serializeStockEventEdition","Tue Jan 14 15:57:30 UTC 2025","passed","Tue Jan 14 15:57:30 UTC 2025","","","",""
"","8","should not display pricing point section venue has siret","ReimbursementFields","Tue Jan 14 15:57:43 UTC 2025","passed","Tue Jan 14 15:57:43 UTC 2025","","","",""
"","5","should retrieve a bookable offer from the url","useCollectiveOfferFromParams","Tue Jan 14 15:57:39 UTC 2025","passed","Tue Jan 14 15:57:39 UTC 2025","","","",""
"","78","should render the component","IndividualOfferDetails","Tue Jan 14 15:54:06 UTC 2025","passed","Tue Jan 14 15:54:06 UTC 2025","","","",""
"","85","should display the right wording without the OA FF","PricingPoint","Tue Jan 14 15:56:18 UTC 2025","passed","Tue Jan 14 15:56:18 UTC 2025","","OA feature flag","",""
"","1","should return already reimbursed message when booking is already reimbursed","getBookingFailure","Tue Jan 14 15:57:46 UTC 2025","passed","Tue Jan 14 15:57:46 UTC 2025","","","",""
"","20","should display booking link for booked offer","OfferEducationalActions","Tue Jan 14 15:55:15 UTC 2025","passed","Tue Jan 14 15:55:15 UTC 2025","","","",""
"","6","should not show the favorite button if the user is not admin","AdageOfferHeader","Tue Jan 14 15:55:58 UTC 2025","passed","Tue Jan 14 15:55:58 UTC 2025","","","",""
"","32","should not display the edition button when there is no edition link","CollectiveOfferSummary","Tue Jan 14 15:55:03 UTC 2025","passed","Tue Jan 14 15:55:03 UTC 2025","","","",""
"","11","should render message to empty the filters when no bookings","CollectiveTableRow","Tue Jan 14 15:58:29 UTC 2025","passed","Tue Jan 14 15:58:29 UTC 2025","","","",""
"","10","should render confirmation page when offer is active and associated to an institution","CollectiveOfferConfirmation","Tue Jan 14 15:57:40 UTC 2025","passed","Tue Jan 14 15:57:40 UTC 2025","","","",""
"","35","should display the offer that is passed through the router when the user navigates within the app","OfferInfos","Tue Jan 14 15:56:07 UTC 2025","passed","Tue Jan 14 15:56:07 UTC 2025","","","",""
"","151","should download validated bookings as CSV","DownloadBookingModal","Tue Jan 14 15:55:59 UTC 2025","passed","Tue Jan 14 15:55:59 UTC 2025","","","",""
"","83","should be able to filter by offererAddress","filter bookings by bookings period","Tue Jan 14 15:56:27 UTC 2025","passed","Tue Jan 14 15:56:27 UTC 2025","","","",""
"","12","should render confirmation page when offer is active and associated to all institutions","CollectiveOfferConfirmation","Tue Jan 14 15:57:40 UTC 2025","passed","Tue Jan 14 15:57:40 UTC 2025","","","",""
"","145","should bulk delete lines with ids when clicking on each stock","StocksEventList","Tue Jan 14 15:54:49 UTC 2025","passed","Tue Jan 14 15:54:49 UTC 2025","","","",""
"","3","should validate url correctly when isVenueVirtual is true","getValidationSchema","Tue Jan 14 15:56:38 UTC 2025","passed","Tue Jan 14 15:56:38 UTC 2025","","","",""
"","59","should not display when prebooking is not activated","offer item","Tue Jan 14 15:56:33 UTC 2025","passed","Tue Jan 14 15:56:33 UTC 2025","","","",""
"","134","should render image uploader for existing file","ImageUploader","Tue Jan 14 15:58:00 UTC 2025","passed","Tue Jan 14 15:58:00 UTC 2025","","","",""
"","17","should display event period filter with no default option","IndividualOffersScreen","Tue Jan 14 15:54:16 UTC 2025","passed","Tue Jan 14 15:54:16 UTC 2025","","","",""
"","55","should render summary page layout in edition","CollectiveOfferLayout","Tue Jan 14 15:58:02 UTC 2025","passed","Tue Jan 14 15:58:02 UTC 2025","","","",""
"","24","should show the nearby (< 5km) offers when no results in initial search with no filters","OffersSuggestions","Tue Jan 14 15:55:45 UTC 2025","passed","Tue Jan 14 15:55:45 UTC 2025","","","",""
"","9","should display the distance when it is available","OfferCard component","Tue Jan 14 15:56:21 UTC 2025","passed","Tue Jan 14 15:56:21 UTC 2025","","","",""
"","2","should return location values when the SIREN exists","getSirenData","Tue Jan 14 15:57:59 UTC 2025","passed","Tue Jan 14 15:57:59 UTC 2025","","","",""
"","86","should display non eligible banner if offerer can not create collective offer","OfferType","Tue Jan 14 15:55:03 UTC 2025","passed","Tue Jan 14 15:55:03 UTC 2025","","","",""
"","2","should compute max width for original ""landscape"" target ""landscape""","getCropMaxDimension","Tue Jan 14 15:58:40 UTC 2025","passed","Tue Jan 14 15:58:40 UTC 2025","","","",""
"","113","should return an error when the offer id is not valid","collectiveActionButton api call","Tue Jan 14 15:55:48 UTC 2025","passed","Tue Jan 14 15:55:48 UTC 2025","","","",""
"","6","should show draft not saved indicator","IndividualOffer::ActionBar","Tue Jan 14 15:56:55 UTC 2025","passed","Tue Jan 14 15:56:55 UTC 2025","","on creation","",""
"","66","should disable description, price and places when allowedAction CAN_EDIT_DISCOUNT doesnt exist and FF ENABLE_COLLECTIVE_NEW_STATUSES enable","","Tue Jan 14 15:55:22 UTC 2025","passed","Tue Jan 14 15:55:22 UTC 2025","","","",""
"","22","should change sorting mode on callback call","useColumnSorting","Tue Jan 14 15:58:12 UTC 2025","passed","Tue Jan 14 15:58:12 UTC 2025","","","",""
"","9","renders component successfully when not success","screens:EmailChangeValidation","Tue Jan 14 15:59:18 UTC 2025","passed","Tue Jan 14 15:59:18 UTC 2025","","","",""
"","0","should singularize word if 1 offer","pluralize","Tue Jan 14 15:58:39 UTC 2025","passed","Tue Jan 14 15:58:39 UTC 2025","","words with ""x"" plural","",""
"","21","should render when an image is given","test ImageUploaderOffer","Tue Jan 14 15:58:22 UTC 2025","passed","Tue Jan 14 15:58:22 UTC 2025","","","",""
"","33","should display error when file's width is too small","ImageUploadBrowserForm","Tue Jan 14 15:56:39 UTC 2025","passed","Tue Jan 14 15:56:39 UTC 2025","","","",""
"","1","should not return a date when transforming an invalid date into French text","getDateToFrenchText","Tue Jan 14 15:56:32 UTC 2025","passed","Tue Jan 14 15:56:32 UTC 2025","","","",""
"","55","should not render a back to nav link when not connected","Layout","Tue Jan 14 15:57:03 UTC 2025","passed","Tue Jan 14 15:57:03 UTC 2025","","about main heading & back to nav link","",""
"","20","should redirect user if there is no siret","screens:SignupJourney::Offerers","Tue Jan 14 15:55:14 UTC 2025","passed","Tue Jan 14 15:55:14 UTC 2025","","","",""
"","111","should disable save button, description, price and places when offer is reimbursed or is used since more than 2 days","OfferEducationalStock","Tue Jan 14 15:55:21 UTC 2025","passed","Tue Jan 14 15:55:21 UTC 2025","","","",""
"","33","should set the input value to 0 when the checkbox is checked","PriceInput","Tue Jan 14 15:57:15 UTC 2025","passed","Tue Jan 14 15:57:15 UTC 2025","","when ""Gratuit"" checkbox display is enabled","",""
"","75","should render summary with filled data","UsefulInformationsSummaryScreen","Tue Jan 14 15:57:41 UTC 2025","passed","Tue Jan 14 15:57:41 UTC 2025","","","",""
"","182","should be able to submit when price field is filled on creation","AllocineProviderForm","Tue Jan 14 15:55:16 UTC 2025","passed","Tue Jan 14 15:55:16 UTC 2025","","","",""
"","0","should not translate user inputs for collective offers","translate","Tue Jan 14 15:57:02 UTC 2025","passed","Tue Jan 14 15:57:02 UTC 2025","","","",""
"","0","should return list containing only BookingRecap matching beneficiary firstname lastname in that order","filterBookingsRecap","Tue Jan 14 15:55:19 UTC 2025","passed","Tue Jan 14 15:55:19 UTC 2025","","","",""
