"DESCRIPTION","DURATION IN MS","NAME","PARENT SUITE","START TIME","STATUS","STOP TIME","SUB SUITE","SUITE","TEST CLASS","TEST METHOD"
"","29","should display the venue location infos if the offer happens at the offerer place","AdagePreviewLayout","Wed Jan 08 08:05:29 UTC 2025","passed","Wed Jan 08 08:05:29 UTC 2025","","","",""
"","61","should trigger a log event when clicking the offer when the offers are in list mode","offers","Wed Jan 08 08:01:53 UTC 2025","passed","Wed Jan 08 08:01:53 UTC 2025","","","",""
"","5","should render steps for cancelled booking expired","collective timeline","Wed Jan 08 08:02:40 UTC 2025","passed","Wed Jan 08 08:02:40 UTC 2025","","","",""
"","36","should only display buttonlink of custom form","RequestFormDialog","Wed Jan 08 08:03:06 UTC 2025","passed","Wed Jan 08 08:03:06 UTC 2025","","","",""
"","165","should display tags when the user selects options","SelectAutocomplete","Wed Jan 08 08:02:04 UTC 2025","passed","Wed Jan 08 08:02:04 UTC 2025","","tags","",""
"","149","should render dialog","AddBankInformations","Wed Jan 08 08:06:01 UTC 2025","passed","Wed Jan 08 08:06:02 UTC 2025","","","",""
"","1","should handle circular references","trimStringsInObject","Wed Jan 08 08:05:54 UTC 2025","passed","Wed Jan 08 08:05:54 UTC 2025","","","",""
"","26","should have an edit link to detail page when offer is draft","IndividualOfferRow","Wed Jan 08 08:02:48 UTC 2025","passed","Wed Jan 08 08:02:48 UTC 2025","","","",""
"","1","should give venue name when venue is not virtual and has no public name","computeVenueDisplayName","Wed Jan 08 08:04:30 UTC 2025","passed","Wed Jan 08 08:04:30 UTC 2025","","","",""
"","26","should not log breadcrumbs navigation to activity","test renderSignupJourneyStepper","Wed Jan 08 08:03:42 UTC 2025","passed","Wed Jan 08 08:03:42 UTC 2025","","","",""
"","14","should not display adage link when user is readonly","AdageHeader","Wed Jan 08 08:03:44 UTC 2025","passed","Wed Jan 08 08:03:44 UTC 2025","","","",""
"","2","should be valid if all requirements are met","When validating a password","Wed Jan 08 08:06:51 UTC 2025","passed","Wed Jan 08 08:06:51 UTC 2025","","","",""
"","106","should remove price categories on trash button click and rename last one","PriceCategories","Wed Jan 08 08:03:12 UTC 2025","passed","Wed Jan 08 08:03:12 UTC 2025","","","",""
"","29","should show the count of characters typed","FieldLayoutCharacterCount","Wed Jan 08 08:06:22 UTC 2025","passed","Wed Jan 08 08:06:22 UTC 2025","","","",""
"","0","should return list containing only BookingRecap matching partial beneficiary email keywords","filterBookingsRecap","Wed Jan 08 08:02:59 UTC 2025","passed","Wed Jan 08 08:02:59 UTC 2025","","","",""
"","80","should clear the input on focus","SelectAutocomplete","Wed Jan 08 08:02:05 UTC 2025","passed","Wed Jan 08 08:02:05 UTC 2025","","","",""
"","125","should return an error when the offer id is not valid","collectiveActionButton api call","Wed Jan 08 08:03:29 UTC 2025","passed","Wed Jan 08 08:03:29 UTC 2025","","","",""
"","143","should disable the submit button","DetailsEanSearch","Wed Jan 08 08:02:57 UTC 2025","passed","Wed Jan 08 08:02:57 UTC 2025","when an EAN search is performed and ends with a product API error","when the draft offer has not been created yet (dirty)","",""
"","33","should limit ending date to beggining date when value","FormDates","Wed Jan 08 08:03:55 UTC 2025","passed","Wed Jan 08 08:03:55 UTC 2025","","","",""
"","2","should return the union of national programs for multiple domains","getNationalProgramsForDomains","Wed Jan 08 08:06:52 UTC 2025","passed","Wed Jan 08 08:06:52 UTC 2025","","","",""
"","3","should not display the national program section if the offer has no national program","AdageOfferDetailsSection","Wed Jan 08 08:04:13 UTC 2025","passed","Wed Jan 08 08:04:13 UTC 2025","","","",""
"","1","should return last index when it satisfies the condition","findLastIndex","Wed Jan 08 08:06:37 UTC 2025","passed","Wed Jan 08 08:06:37 UTC 2025","","","",""
"","53","should display 0 in case the user institution offer count is not available","AdageHeader","Wed Jan 08 08:03:44 UTC 2025","passed","Wed Jan 08 08:03:44 UTC 2025","","","",""
"","14","should show a generic count when more than 500 offers are selected","ActionsBar","Wed Jan 08 08:02:00 UTC 2025","passed","Wed Jan 08 08:02:00 UTC 2025","","","",""
"","6","should render the component for summary page","IndividualOffer::ActionBar","Wed Jan 08 08:04:33 UTC 2025","passed","Wed Jan 08 08:04:33 UTC 2025","","on edition","",""
"","7","should display the EAC section when adage application in progress","PartnerPages","Wed Jan 08 08:04:31 UTC 2025","passed","Wed Jan 08 08:04:31 UTC 2025","","","",""
"","48","should not have ""Tout Sélectionner"" checked when there is no offer to be checked","CollectiveOffersScreen","Wed Jan 08 08:02:14 UTC 2025","passed","Wed Jan 08 08:02:14 UTC 2025","","","",""
"","172","should reset modal state when closing geoloc filter modal","OfferFilters","Wed Jan 08 08:03:04 UTC 2025","passed","Wed Jan 08 08:03:04 UTC 2025","","","",""
"","245","should render collective offer preview","CollectiveOfferPreviewCreation","Wed Jan 08 08:04:39 UTC 2025","passed","Wed Jan 08 08:04:39 UTC 2025","","","",""
"","1","should returns 31st of August of next year if current date is after September","getMaxEndDate","Wed Jan 08 08:07:03 UTC 2025","passed","Wed Jan 08 08:07:03 UTC 2025","","","",""
"","51","should display offerer screen on submit","screens:SignupJourney::OffererAuthentication","Wed Jan 08 08:03:52 UTC 2025","passed","Wed Jan 08 08:03:52 UTC 2025","","","",""
"","0","should return category online for virtual cases","getCategoryStatusFromOfferSubtype","Wed Jan 08 08:03:43 UTC 2025","passed","Wed Jan 08 08:03:43 UTC 2025","","","",""
"","0","getHumanizeRelativeDistance(undefined) 	= '15 m'","getDistance","Wed Jan 08 08:06:41 UTC 2025","passed","Wed Jan 08 08:06:41 UTC 2025","","","",""
"","15","should display the venue name when venue public name is not given","IndividualOfferRow","Wed Jan 08 08:02:47 UTC 2025","passed","Wed Jan 08 08:02:48 UTC 2025","","","",""
"","8","should show links if confirmation is the active step and the offer is template","CollectiveCreationOfferNavigation","Wed Jan 08 08:02:58 UTC 2025","passed","Wed Jan 08 08:02:58 UTC 2025","","","",""
"","62","should display address header with the FF","route Offers","Wed Jan 08 08:01:58 UTC 2025","passed","Wed Jan 08 08:01:58 UTC 2025","","With WIP_ENABLE_OFFER_ADDRESS FF","",""
"","64","calls the callback on supprimer button click","venue image edit","Wed Jan 08 08:06:14 UTC 2025","passed","Wed Jan 08 08:06:14 UTC 2025","","","",""
"","196","should display column titles when offers are returned","IndividualOffersScreen","Wed Jan 08 08:01:56 UTC 2025","passed","Wed Jan 08 08:01:56 UTC 2025","","","",""
"","24","should refresh the offers list when the offer status is modified and the FF WIP_ENABLE_NEW_COLLECTIVE_OFFERS_AND_BOOKINGS_STRUCTURE is disabled","ActionsBar","Wed Jan 08 08:02:01 UTC 2025","passed","Wed Jan 08 08:02:01 UTC 2025","","","",""
"","7","should display ""non conforme"" if offer is rejected when FF is active","StatusLabel","Wed Jan 08 08:05:42 UTC 2025","passed","Wed Jan 08 08:05:42 UTC 2025","","","",""
"","45","should not display required message if siret is empty for virtual venue","components | SiretOrCommentFields","Wed Jan 08 08:02:50 UTC 2025","passed","Wed Jan 08 08:02:50 UTC 2025","","should validate SIRET on submit","",""
"","37","should render all section titles in the sitemap","Sitemap","Wed Jan 08 08:04:09 UTC 2025","passed","Wed Jan 08 08:04:09 UTC 2025","","","",""
"","1","should unselect all departments","handleAllFranceDepartmentOptions","Wed Jan 08 08:05:16 UTC 2025","passed","Wed Jan 08 08:05:16 UTC 2025","","","",""
"","1","should return list containing only BookingRecap matching keywords with different case","filterBookingsRecap","Wed Jan 08 08:02:59 UTC 2025","passed","Wed Jan 08 08:02:59 UTC 2025","","by offer name","",""
"","45","should render the component for details page","IndividualOffer::ActionBar","Wed Jan 08 08:04:33 UTC 2025","passed","Wed Jan 08 08:04:33 UTC 2025","","on edition","",""
"","7","should not display bank any wording or button under bank account card if offerer has no venue","ReimbursementBankAccount","Wed Jan 08 08:02:41 UTC 2025","passed","Wed Jan 08 08:02:41 UTC 2025","","","",""
"","63","should modify the list horizontal scroll when the arrows are clicked","Carousel","Wed Jan 08 08:05:09 UTC 2025","passed","Wed Jan 08 08:05:09 UTC 2025","","","",""
"","41","should display error when file is too big","ImageUploadBrowserForm","Wed Jan 08 08:04:50 UTC 2025","passed","Wed Jan 08 08:04:50 UTC 2025","","","",""
"","253","should require a venue selection from the user","screens | OfferEducational : creation offerer step","Wed Jan 08 08:03:42 UTC 2025","passed","Wed Jan 08 08:03:42 UTC 2025","","when there is multiple venues managed by an offerer","",""
"","168","should check all validated offers checkboxes","IndividualOffersScreen","Wed Jan 08 08:01:58 UTC 2025","passed","Wed Jan 08 08:01:58 UTC 2025","","on click on select all offers checkbox","",""
"","5","should not display pre publishing banner in edition mode","Summary","Wed Jan 08 08:01:49 UTC 2025","passed","Wed Jan 08 08:01:49 UTC 2025","","banners","",""
"","1","should return false if the value is not a number","isNumber","Wed Jan 08 08:06:14 UTC 2025","passed","Wed Jan 08 08:06:14 UTC 2025","","","",""
"","3","should display other address when addressType is OTHER","OfferVenue","Wed Jan 08 08:06:03 UTC 2025","passed","Wed Jan 08 08:06:03 UTC 2025","","","",""
"","9","should focus on the next tag when a tag is removed","SelectedValuesTags","Wed Jan 08 08:05:17 UTC 2025","passed","Wed Jan 08 08:05:17 UTC 2025","","","",""
"","101","should display an unchecked by default checkbox to select all offers when user is not admin","CollectiveOffersScreen","Wed Jan 08 08:02:13 UTC 2025","passed","Wed Jan 08 08:02:13 UTC 2025","","","",""
"","223","should set all participants to true when user selects ""all""","FormParticipants","Wed Jan 08 08:03:14 UTC 2025","passed","Wed Jan 08 08:03:14 UTC 2025","","useParticipantUpdates","",""
"","55","should disable visibility form if offer is not editable","CollectiveOfferVisibility","Wed Jan 08 08:02:25 UTC 2025","passed","Wed Jan 08 08:02:25 UTC 2025","","","",""
"","11","should render 'Offre vitrine' tag if offer is template","CollectiveOfferLayout","Wed Jan 08 08:05:40 UTC 2025","passed","Wed Jan 08 08:05:40 UTC 2025","","","",""
"","60","should render correctly","StockThingSection","Wed Jan 08 08:06:33 UTC 2025","passed","Wed Jan 08 08:06:33 UTC 2025","","","",""
"","4","should display venueOfferSteps if condition to display it","VenueOfferSteps","Wed Jan 08 08:03:31 UTC 2025","passed","Wed Jan 08 08:03:31 UTC 2025","","","",""
"","209","should render all options with default value","FormParticipants","Wed Jan 08 08:03:14 UTC 2025","passed","Wed Jan 08 08:03:14 UTC 2025","","","",""
"","1","should build subcategory options","buildSubcategoryOptions","Wed Jan 08 08:02:45 UTC 2025","passed","Wed Jan 08 08:02:45 UTC 2025","","","",""
"","1","should not return uai facet filter","adageFiltersToFacetFilters","Wed Jan 08 08:04:15 UTC 2025","passed","Wed Jan 08 08:04:15 UTC 2025","","","",""
"","63","should display venue creation link if user has no venue","VenueOfferSteps","Wed Jan 08 08:03:31 UTC 2025","passed","Wed Jan 08 08:03:31 UTC 2025","","","",""
"","15","should display the image if its present","PartnerPages","Wed Jan 08 08:05:01 UTC 2025","passed","Wed Jan 08 08:05:01 UTC 2025","","","",""
"","52","should show different links if offer is template","CollectiveCreationOfferNavigation","Wed Jan 08 08:02:57 UTC 2025","passed","Wed Jan 08 08:02:58 UTC 2025","","","",""
"","73","should allow user to select imported creation mode filter","IndividualOffersScreen","Wed Jan 08 08:01:57 UTC 2025","passed","Wed Jan 08 08:01:58 UTC 2025","","","",""
"","119","should return domains options when the api call was successful","OfferFilters","Wed Jan 08 08:03:03 UTC 2025","passed","Wed Jan 08 08:03:03 UTC 2025","","","",""
"","385","should filter offers given multiple status filter when clicking on ""Appliquer""","route TemplateCollectiveOffers","Wed Jan 08 08:02:22 UTC 2025","passed","Wed Jan 08 08:02:23 UTC 2025","status filters","filters","",""
"","1599","should display the address change modal when updating venue address","VenueSettingsScreen","Wed Jan 08 08:03:06 UTC 2025","passed","Wed Jan 08 08:03:08 UTC 2025","","","",""
"","6","should display ""lieux"" plurals","ReimbursementBankAccount","Wed Jan 08 08:02:41 UTC 2025","passed","Wed Jan 08 08:02:41 UTC 2025","","plurals","",""
"","12","should replace conditional fields with a subcategory related error callout","DetailsSubForm","Wed Jan 08 08:03:56 UTC 2025","passed","Wed Jan 08 08:03:56 UTC 2025","when the offer is non-product based > when the offer is a CD","when EAN search is displayed","",""
"","3","should transform queryParams to object / keys-values","handling of URL","Wed Jan 08 08:06:56 UTC 2025","passed","Wed Jan 08 08:06:56 UTC 2025","","","",""
"","20","should add the currency sign to a price","formatPrice","Wed Jan 08 08:06:58 UTC 2025","passed","Wed Jan 08 08:06:58 UTC 2025","","","",""
"","6","should not display the dialog when the button modal was not opened or was closed","AdageButtonFilter","Wed Jan 08 08:04:52 UTC 2025","passed","Wed Jan 08 08:04:52 UTC 2025","","","",""
"","173","should have venue value be removed when user asks for all venues","route TemplateCollectiveOffers","Wed Jan 08 08:03:17 UTC 2025","passed","Wed Jan 08 08:03:17 UTC 2025","","url query params","",""
"","76","should display not reimbursed banner when subcategory is not reimbursed","screens:IndividualOffer::UsefulInformation","Wed Jan 08 08:02:37 UTC 2025","passed","Wed Jan 08 08:02:37 UTC 2025","","","",""
"","3","should submit uploaded image in case of template offer","useCollectiveOfferImageUpload","Wed Jan 08 08:04:43 UTC 2025","passed","Wed Jan 08 08:04:43 UTC 2025","","","",""
"","74","should allow to publish template offer when the ENABLE_COLLECTIVE_NEW_STATUSES FF is enabled","CollectiveActionsCells","Wed Jan 08 08:02:19 UTC 2025","passed","Wed Jan 08 08:02:19 UTC 2025","","","",""
"","0","should return list containing only BookingRecap matching beneficiary email keywords","filterBookingsRecap","Wed Jan 08 08:02:59 UTC 2025","passed","Wed Jan 08 08:02:59 UTC 2025","","","",""
"","16","should have the left or right arrow enabled when respectively the first or last element is not fully visible","Carousel","Wed Jan 08 08:05:09 UTC 2025","passed","Wed Jan 08 08:05:09 UTC 2025","","","",""
"","39","should not display creation links when user has no venue created","VenueCrationLinks","Wed Jan 08 08:06:08 UTC 2025","passed","Wed Jan 08 08:06:08 UTC 2025","","","",""
"","62","should destroy firebase when consent is taken back","useFirebase","Wed Jan 08 08:04:17 UTC 2025","passed","Wed Jan 08 08:04:17 UTC 2025","","","",""
"","11","should only show the partner postal code if there is no city","AdageOfferPartnerPanel","Wed Jan 08 08:04:20 UTC 2025","passed","Wed Jan 08 08:04:20 UTC 2025","","","",""
"","26","should display booking link for sold out offer with pending booking","ollectiveOfferRow","Wed Jan 08 08:02:22 UTC 2025","passed","Wed Jan 08 08:02:22 UTC 2025","","","",""
"","20","should not archive offers on click on ""Archiver"" when at least one offer cannot be archived and ff is active","ActionsBar","Wed Jan 08 08:02:01 UTC 2025","passed","Wed Jan 08 08:02:01 UTC 2025","","","",""
"","0","should return false if the object is not a collective offer template","isCollectiveOfferTemplate","Wed Jan 08 08:06:29 UTC 2025","passed","Wed Jan 08 08:06:29 UTC 2025","","","",""
"","5","should display the right wording with the OA FF","VenueFormScreen","Wed Jan 08 08:03:01 UTC 2025","passed","Wed Jan 08 08:03:01 UTC 2025","","OA feature flag","",""
"","1","should reformat french phone number with region code and invalid prefix","french phone number with region code","Wed Jan 08 08:04:41 UTC 2025","passed","Wed Jan 08 08:04:41 UTC 2025","","","",""
"","3","should not block when following creation flow (from creation to stocks)","components | RouteLeavingGuardCollectiveOfferCreation","Wed Jan 08 08:04:02 UTC 2025","passed","Wed Jan 08 08:04:02 UTC 2025","","","",""
"","7","should not display the time for a template offer starting at midnight UTC","OfferNameCell","Wed Jan 08 08:04:51 UTC 2025","passed","Wed Jan 08 08:04:51 UTC 2025","","","",""
"","13","should display ""Sauvegarder le brouillon"" and ""Publier l’offre"" buttons on summary page","IndividualOffer::ActionBar","Wed Jan 08 08:04:33 UTC 2025","passed","Wed Jan 08 08:04:33 UTC 2025","","on creation","",""
"","23","should not display the edition buttons when the FF ENABLE_COLLECTIVE_NEW_STATUSES is enabled the template offer cannot be edited","CollectiveOfferSummary","Wed Jan 08 08:02:43 UTC 2025","passed","Wed Jan 08 08:02:43 UTC 2025","","","",""
"","22","should log event on click dms link","CollectiveDmsTimeline","Wed Jan 08 08:03:27 UTC 2025","passed","Wed Jan 08 08:03:27 UTC 2025","","","",""
"","0","using image from thumbUrl","getIndividualOfferImage","Wed Jan 08 08:06:12 UTC 2025","passed","Wed Jan 08 08:06:12 UTC 2025","","","",""
"","12","should not display status in creation","IndivualOfferLayout","Wed Jan 08 08:03:54 UTC 2025","passed","Wed Jan 08 08:03:54 UTC 2025","","","",""
"","1","should not display the time when the starting date is at midnight","getRangeToFrenchText","Wed Jan 08 08:04:10 UTC 2025","passed","Wed Jan 08 08:04:10 UTC 2025","","","",""
"","9","should display ""Stock & Prix"" step as active/enabled when offer is no longer a non-published draft","IndividualOfferNavigation","Wed Jan 08 08:03:11 UTC 2025","passed","Wed Jan 08 08:03:11 UTC 2025","","when offer is not an event","",""
"","213","should always display the confirmation modal before redirection","components | RouteLeavingGuardCollectiveOfferCreation | RouteLeavingGuard","Wed Jan 08 08:04:33 UTC 2025","passed","Wed Jan 08 08:04:34 UTC 2025","","","",""
"","55","should render summary page layout in edition","CollectiveOfferLayout","Wed Jan 08 08:05:40 UTC 2025","passed","Wed Jan 08 08:05:40 UTC 2025","","","",""
"","31","should display error","SignIn","Wed Jan 08 08:02:35 UTC 2025","passed","Wed Jan 08 08:02:35 UTC 2025","","should display messages after account validation","",""
"","281","should block download several invoices at same time for more than 24 invoices","reimbursementsWithFilters","Wed Jan 08 08:02:25 UTC 2025","passed","Wed Jan 08 08:02:25 UTC 2025","","","",""
"","90","should collapse one menu at a time","SideNavLinks","Wed Jan 08 08:03:52 UTC 2025","passed","Wed Jan 08 08:03:52 UTC 2025","","small height devices","",""
"","50","should display offerer stats when selecting all venues","OffererStatsScreen","Wed Jan 08 08:04:08 UTC 2025","passed","Wed Jan 08 08:04:08 UTC 2025","","","",""
"","29","should show the offer cultural partner infos for a collective offer","AdageOffer","Wed Jan 08 08:05:47 UTC 2025","passed","Wed Jan 08 08:05:47 UTC 2025","","","",""
"","204","should display passCulture default form","RequestFormDialog","Wed Jan 08 08:03:06 UTC 2025","passed","Wed Jan 08 08:03:06 UTC 2025","","","",""
"","58","should filter options when the user types in the field","SelectAutocomplete","Wed Jan 08 08:02:04 UTC 2025","passed","Wed Jan 08 08:02:04 UTC 2025","","filter","",""
"","2","should validate the form for case: not valid form without any contact option","validationSchema OfferEducational","Wed Jan 08 08:04:14 UTC 2025","passed","Wed Jan 08 08:04:14 UTC 2025","","template offer","",""
"","74","should be able to check all offers because, a venue being filtered, there are no performance issues","IndividualOffersScreen","Wed Jan 08 08:01:58 UTC 2025","passed","Wed Jan 08 08:01:58 UTC 2025","","when user is admin","",""
"","56","should add value to filters when unchecking on a checkbox","components | FilterByBookingStatus","Wed Jan 08 08:03:48 UTC 2025","passed","Wed Jan 08 08:03:48 UTC 2025","","on focus on the filter icon","",""
"","1","should reject  dom-tom phone number with region code and invalid prefix","dom-tom phone number with region code","Wed Jan 08 08:04:41 UTC 2025","passed","Wed Jan 08 08:04:41 UTC 2025","","","",""
"","1","should format a date with the right format for a HTML input","formatShortDateForInput","Wed Jan 08 08:04:10 UTC 2025","passed","Wed Jan 08 08:04:10 UTC 2025","","","",""
"","2","should validate the form for case: should allow a start datetime set on 01/09/N and an end datetime set on 31/08/N+1","validationSchema","Wed Jan 08 08:04:38 UTC 2025","passed","Wed Jan 08 08:04:38 UTC 2025","","","",""
"","93","the user should see the home even when not validated","Homepage","Wed Jan 08 08:03:35 UTC 2025","passed","Wed Jan 08 08:03:35 UTC 2025","","","",""
"","2","should validate the form for case: price should be at least 0","validationSchema","Wed Jan 08 08:04:38 UTC 2025","passed","Wed Jan 08 08:04:38 UTC 2025","","","",""
"","19","display a new text in the ""à savoir"" section when marseille ff is active","FormParticipants","Wed Jan 08 08:03:15 UTC 2025","passed","Wed Jan 08 08:03:15 UTC 2025","","","",""
"","109","should handle update failure","LinkVenueDialog","Wed Jan 08 08:04:01 UTC 2025","passed","Wed Jan 08 08:04:01 UTC 2025","","","",""
"","51","should log add venue bank to account","LinkVenueCallout","Wed Jan 08 08:03:50 UTC 2025","passed","Wed Jan 08 08:03:50 UTC 2025","","With FF enabled","",""
"","417","should display an error message when there is an api error","CollectiveOfferConfirmation","Wed Jan 08 08:03:36 UTC 2025","passed","Wed Jan 08 08:03:36 UTC 2025","","","",""
"","29","should activate an offer and confirm","StatusToggleButton","Wed Jan 08 08:03:58 UTC 2025","passed","Wed Jan 08 08:03:58 UTC 2025","","","",""
"","271","should not read through local storage offerers if it is not available","SignIn","Wed Jan 08 08:02:36 UTC 2025","passed","Wed Jan 08 08:02:36 UTC 2025","","","",""
"","1","should return true when detecting change on beginningDate","hasChangesOnStockWithBookings","Wed Jan 08 08:05:50 UTC 2025","passed","Wed Jan 08 08:05:50 UTC 2025","","","",""
"","0","should not block when following creation flow (from visibilite to recapitulatif)","components | RouteLeavingGuardCollectiveOfferCreation","Wed Jan 08 08:04:02 UTC 2025","passed","Wed Jan 08 08:04:02 UTC 2025","","","",""
"","1","should return the students level map with all keys enabled","buildStudentLevelsMapWithDefaultValue","Wed Jan 08 08:05:58 UTC 2025","passed","Wed Jan 08 08:05:58 UTC 2025","","","",""
"","0","should be invalid if no upper case","When validating a password","Wed Jan 08 08:06:51 UTC 2025","passed","Wed Jan 08 08:06:51 UTC 2025","","","",""
"","9","should display the correct placeholder for current option selected","components | FilterByOmniSearch","Wed Jan 08 08:03:41 UTC 2025","passed","Wed Jan 08 08:03:41 UTC 2025","","","",""
"","42","should show existing parameters on edition","AllocineProviderForm","Wed Jan 08 08:02:55 UTC 2025","passed","Wed Jan 08 08:02:55 UTC 2025","","","",""
"","0","should invalidate the following email address : test@test.c","isValidEmail","Wed Jan 08 08:07:03 UTC 2025","passed","Wed Jan 08 08:07:03 UTC 2025","","","",""
"","0","should return true when collective offer status is REJECTED","canArchiveCollectiveOffer","Wed Jan 08 08:04:10 UTC 2025","passed","Wed Jan 08 08:04:10 UTC 2025","","","",""
"","116","should ask user to select a pre-filter before clicking on ""Afficher""","components | BookingsRecap | Pro user","Wed Jan 08 08:01:58 UTC 2025","passed","Wed Jan 08 08:01:58 UTC 2025","","","",""
"","30","should indicate current page","src | components | Tabs","Wed Jan 08 08:05:33 UTC 2025","passed","Wed Jan 08 08:05:33 UTC 2025","","Accessibility","",""
"","48","should not log current tab click and disabled ones","test renderSignupJourneyStepper","Wed Jan 08 08:03:42 UTC 2025","passed","Wed Jan 08 08:03:42 UTC 2025","","","",""
"","9","should not display the price details section if the offer has no price details","AdageOfferInfoSection","Wed Jan 08 08:04:15 UTC 2025","passed","Wed Jan 08 08:04:15 UTC 2025","","","",""
"","855","should display new stocks banner for several stocks","StocksEventCreation","Wed Jan 08 08:03:48 UTC 2025","passed","Wed Jan 08 08:03:49 UTC 2025","","","",""
"","18","should display ""Tarifs"" step as active/enabled when offer is no longer a non-published draft","IndividualOfferNavigation","Wed Jan 08 08:03:11 UTC 2025","passed","Wed Jan 08 08:03:11 UTC 2025","","when offer is an event","",""
"","130","should render the instution panel","AdageOfferPartnerPanel","Wed Jan 08 08:06:04 UTC 2025","passed","Wed Jan 08 08:06:04 UTC 2025","","","",""
"","19","should not display a expiration row if the offer has no booking limit","ollectiveOfferRow","Wed Jan 08 08:02:22 UTC 2025","passed","Wed Jan 08 08:02:22 UTC 2025","","","",""
"","0","should validate the following email address : test@test.test.com","isValidEmail","Wed Jan 08 08:07:03 UTC 2025","passed","Wed Jan 08 08:07:03 UTC 2025","","","",""
"","0","should return vitual venues when categoryStatus is ONLINE only","getFilteredVenueList","Wed Jan 08 08:04:47 UTC 2025","passed","Wed Jan 08 08:04:47 UTC 2025","","getFilteredVenueListBySubcategory","",""
"","136","should display BannerInvisibleSiren on error 400 with specific message","Offerer","Wed Jan 08 08:02:33 UTC 2025","passed","Wed Jan 08 08:02:33 UTC 2025","","","",""
"","39","should display a new column ""Date de l’évènement""","CollectiveOffersScreen","Wed Jan 08 08:02:14 UTC 2025","passed","Wed Jan 08 08:02:15 UTC 2025","","","",""
