"DESCRIPTION","DURATION IN MS","NAME","PARENT SUITE","START TIME","STATUS","STOP TIME","SUB SUITE","SUITE","TEST CLASS","TEST METHOD"
"","2","should return undefined when the offerId in the params is an invalid number","useCollectiveOfferFromParams","Tue Feb 11 14:30:46 UTC 2025","passed","Tue Feb 11 14:30:46 UTC 2025","","","",""
"","14","should render quantity as ""Illimité"" when quantity is null or undefined","Summary stock section","Tue Feb 11 14:28:09 UTC 2025","passed","Tue Feb 11 14:28:10 UTC 2025","","for stock thing","",""
"","190","should display the venue provider cards & add provider button","VenueSettingsScreen","Tue Feb 11 14:28:27 UTC 2025","passed","Tue Feb 11 14:28:27 UTC 2025","","","",""
"","1","should validate the form for case: not valid form without password","validationSchema","Tue Feb 11 14:30:38 UTC 2025","passed","Tue Feb 11 14:30:38 UTC 2025","","","",""
"","21","should render when an image is given","test ImageUploaderOffer","Tue Feb 11 14:31:33 UTC 2025","passed","Tue Feb 11 14:31:33 UTC 2025","","","",""
"","20","should display the breadcrumb with a link back to the favorite page if the url contains 'mes-favoris'","OfferInfos","Tue Feb 11 14:29:10 UTC 2025","passed","Tue Feb 11 14:29:10 UTC 2025","","","",""
"","33","should not display ds application link when the FF is enabled","VenueOfferSteps","Tue Feb 11 14:28:46 UTC 2025","passed","Tue Feb 11 14:28:46 UTC 2025","","","",""
"","62","should allow edition for a bookable offer when the ENABLE_COLLECTIVE_NEW_STATUSES FF is enabled and the edition of 'details' is allowed","CollectiveActionsCells","Tue Feb 11 14:27:33 UTC 2025","passed","Tue Feb 11 14:27:33 UTC 2025","","","",""
"","2","should validate the form for case: valid form with form option checked and default form selected","validationSchema OfferEducational","Tue Feb 11 14:29:40 UTC 2025","passed","Tue Feb 11 14:29:40 UTC 2025","","template offer","",""
"","67","should remove notification mail input when trash icon is clicked","FormNotifications","Tue Feb 11 14:30:38 UTC 2025","passed","Tue Feb 11 14:30:38 UTC 2025","","","",""
"","100","The email suggestion should not be displayed when the email is already valid","EmailSpellCheckInput","Tue Feb 11 14:30:31 UTC 2025","passed","Tue Feb 11 14:30:31 UTC 2025","","","",""
"","46","should show existing parameters on edition","AllocineProviderForm","Tue Feb 11 14:28:11 UTC 2025","passed","Tue Feb 11 14:28:11 UTC 2025","","","",""
"","3","should return default values when institution is not defined","extractInitialVisibilityValues","Tue Feb 11 14:30:47 UTC 2025","passed","Tue Feb 11 14:30:47 UTC 2025","","","",""
"","17","should handle not connected with back button","Accessibility layout","Tue Feb 11 14:31:48 UTC 2025","passed","Tue Feb 11 14:31:48 UTC 2025","","","",""
"","44","should display required message if siret is empty for non virtual venue","components | SiretOrCommentFields","Tue Feb 11 14:28:06 UTC 2025","passed","Tue Feb 11 14:28:06 UTC 2025","","should validate SIRET on submit","",""
"","42","should uncheck the checkbox when the input value changes to a non-zero value","PriceInput","Tue Feb 11 14:30:21 UTC 2025","passed","Tue Feb 11 14:30:21 UTC 2025","","when ""Gratuit"" checkbox display is enabled","",""
"","17","should render in horizontal mode by default","<CardLink />","Tue Feb 11 14:31:32 UTC 2025","passed","Tue Feb 11 14:31:32 UTC 2025","","","",""
"","8","should redirect with ""découverte"" in url on click in offer card","OfferCard component","Tue Feb 11 14:29:22 UTC 2025","passed","Tue Feb 11 14:29:22 UTC 2025","","","",""
"","69","should display unsaved information in the action bar when the value is not the default value","OfferEducationalForm","Tue Feb 11 14:29:30 UTC 2025","passed","Tue Feb 11 14:29:30 UTC 2025","","","",""
"","92","should display no result page","OffersInstitutionList","Tue Feb 11 14:31:09 UTC 2025","passed","Tue Feb 11 14:31:09 UTC 2025","","","",""
"","2","should validate the form for case: number of participants should be at least 1","validationSchema","Tue Feb 11 14:30:07 UTC 2025","passed","Tue Feb 11 14:30:07 UTC 2025","","","",""
"","141","should trigger search when clicking Rechercher while using geoloc","OfferFilters","Tue Feb 11 14:28:26 UTC 2025","passed","Tue Feb 11 14:28:26 UTC 2025","","","",""
"","31","should update aria pane name announcer region when user navigates to another page","usePageTitle","Tue Feb 11 14:31:04 UTC 2025","passed","Tue Feb 11 14:31:04 UTC 2025","","","",""
"","0","should return true when collective offer status is ""EXPIRED"" and booking status ""CANCELLED""","canArchiveCollectiveOffer","Tue Feb 11 14:29:37 UTC 2025","passed","Tue Feb 11 14:29:37 UTC 2025","","","",""
"","106","should render error message when siret doesn't exist","Offerer","Tue Feb 11 14:27:54 UTC 2025","passed","Tue Feb 11 14:27:54 UTC 2025","","","",""
"","122","should render collective offer stock form from template","CollectiveOfferStockCreation","Tue Feb 11 14:30:53 UTC 2025","passed","Tue Feb 11 14:30:53 UTC 2025","","","",""
"","29","should display national program","CollectiveOfferSummary","Tue Feb 11 14:27:59 UTC 2025","passed","Tue Feb 11 14:27:59 UTC 2025","","","",""
"","0","returns 31st August of current year if current date is before September","getMaxEndDate","Tue Feb 11 14:32:35 UTC 2025","passed","Tue Feb 11 14:32:35 UTC 2025","","","",""
"","30","should display the venue location infos if the offer happens at the offerer place","AdagePreviewLayout","Tue Feb 11 14:30:58 UTC 2025","passed","Tue Feb 11 14:30:58 UTC 2025","","","",""
"","190","should display the price field with minimum value set to 0","AllocineProviderForm","Tue Feb 11 14:28:10 UTC 2025","passed","Tue Feb 11 14:28:10 UTC 2025","","","",""
"","73","should display offerer stats when selecting all venues","OffererStatsScreen","Tue Feb 11 14:29:33 UTC 2025","passed","Tue Feb 11 14:29:33 UTC 2025","","","",""
"","314","should render collective offer stock form","CollectiveOfferStockCreation","Tue Feb 11 14:30:53 UTC 2025","passed","Tue Feb 11 14:30:53 UTC 2025","","","",""
"","136","should call ""handleChangeOfferer"" on value change","App","Tue Feb 11 14:29:53 UTC 2025","passed","Tue Feb 11 14:29:53 UTC 2025","","Switch Offerer","",""
"","159","should not display MaybeAppUserDialog component on submit with valid apeCode","Offerer","Tue Feb 11 14:27:54 UTC 2025","passed","Tue Feb 11 14:27:54 UTC 2025","","","",""
"","3","should ignore heading and trailing spaces","searchPatternInOptions","Tue Feb 11 14:31:07 UTC 2025","passed","Tue Feb 11 14:31:08 UTC 2025","","","",""
"","108","should keep previously selected subcategory as radio button even if it is not in the suggested subcategories","SuggestedSubcategories","Tue Feb 11 14:28:53 UTC 2025","passed","Tue Feb 11 14:28:53 UTC 2025","","","",""
"","168","should render a table with header and data","StocksEventList","Tue Feb 11 14:27:48 UTC 2025","passed","Tue Feb 11 14:27:48 UTC 2025","","","",""
"","111","should log event when cliking collective row","components | BookingsRecapTable","Tue Feb 11 14:27:46 UTC 2025","passed","Tue Feb 11 14:27:46 UTC 2025","","","",""
"","12","should display eac dms link when condition to display it is true","VenueOfferSteps","Tue Feb 11 14:28:46 UTC 2025","passed","Tue Feb 11 14:28:46 UTC 2025","","","",""
"","17","should apply bookingId filter when typing keywords for booking id","components | FilterByOmniSearch","Tue Feb 11 14:29:06 UTC 2025","passed","Tue Feb 11 14:29:06 UTC 2025","","","",""
"","10","should render confirmation page when offer is active and associated to all institutions","CollectiveOfferConfirmation","Tue Feb 11 14:30:47 UTC 2025","passed","Tue Feb 11 14:30:47 UTC 2025","","","",""
"","4800","should display localisation filter with departments options if user has selected departement filter","offersSearch component","Tue Feb 11 14:28:02 UTC 2025","passed","Tue Feb 11 14:28:07 UTC 2025","","","",""
"","182","should filters with artistic domains id if provided in url","offersSearch component","Tue Feb 11 14:28:08 UTC 2025","passed","Tue Feb 11 14:28:08 UTC 2025","","","",""
"","12","should render link when needed","Stepper","Tue Feb 11 14:30:19 UTC 2025","passed","Tue Feb 11 14:30:19 UTC 2025","","","",""
"","141","The email suggestion should not be displayed when the field is empty","EmailSpellCheckInput","Tue Feb 11 14:30:31 UTC 2025","passed","Tue Feb 11 14:30:31 UTC 2025","","","",""
"","170","should redirect on submit button and offer selected","CollectiveOfferConfirmation","Tue Feb 11 14:28:51 UTC 2025","passed","Tue Feb 11 14:28:52 UTC 2025","","","",""
"","26","should return empty string if location is wrong","useActiveStep","Tue Feb 11 14:31:53 UTC 2025","passed","Tue Feb 11 14:31:53 UTC 2025","","","",""
"","1","should return false for today, current hour and past minutes","isTimeInTheFuture","Tue Feb 11 14:30:55 UTC 2025","passed","Tue Feb 11 14:30:55 UTC 2025","","","",""
"","418","should remove QRcode prefix"," Desk","Tue Feb 11 14:28:42 UTC 2025","passed","Tue Feb 11 14:28:42 UTC 2025","","should validate while user is typing","",""
"","11","should display a banner saying that the offer needs to be booked if it is already pre-booked","ExpirationCell","Tue Feb 11 14:30:57 UTC 2025","passed","Tue Feb 11 14:30:57 UTC 2025","","","",""
"","184","should reset modal state when closing academies filter modal","OfferFilters","Tue Feb 11 14:28:26 UTC 2025","passed","Tue Feb 11 14:28:26 UTC 2025","","","",""
"","8","should show that the offer happens at a specific address","AdageOfferHeader","Tue Feb 11 14:28:59 UTC 2025","passed","Tue Feb 11 14:28:59 UTC 2025","","","",""
"","75","should display error message when trying to activate collective offers with booking limit date passed","TemplateCollectiveOffersScreen","Tue Feb 11 14:27:56 UTC 2025","passed","Tue Feb 11 14:27:56 UTC 2025","","on click on select all offers checkbox","",""
"","3","should display label for variant: dark-grey","Tag","Tue Feb 11 14:32:33 UTC 2025","passed","Tue Feb 11 14:32:33 UTC 2025","","render","",""
"","13","should have the correct options checked when values are string[]","AdageMultiselect","Tue Feb 11 14:30:36 UTC 2025","passed","Tue Feb 11 14:30:36 UTC 2025","","","",""
"","252","should load offers with selected offer type if the WIP_ENABLE_NEW_COLLECTIVE_OFFERS_AND_BOOKINGS_STRUCTURE FF is not active","route CollectiveOffers","Tue Feb 11 14:27:29 UTC 2025","passed","Tue Feb 11 14:27:29 UTC 2025","on click on search button","filters","",""
"","226","should update venue selection when selecting pricing point","LinkVenueDialog","Tue Feb 11 14:28:17 UTC 2025","passed","Tue Feb 11 14:28:17 UTC 2025","","","",""
"","19","should remove domain tag on click","FiltersTag","Tue Feb 11 14:28:46 UTC 2025","passed","Tue Feb 11 14:28:46 UTC 2025","","","",""
"","50","should not display the text value of the button when is loading, and the button should be disabled","submit button","Tue Feb 11 14:32:26 UTC 2025","passed","Tue Feb 11 14:32:26 UTC 2025","","","",""
"","1","should return filter subcategories that are not events","filterCategories","Tue Feb 11 14:29:07 UTC 2025","passed","Tue Feb 11 14:29:07 UTC 2025","","","",""
"","6","should render in my school tag if event adress type school is selected","FiltersTag","Tue Feb 11 14:28:46 UTC 2025","passed","Tue Feb 11 14:28:46 UTC 2025","","","",""
"","112","should send event when offer is added to favorites","OfferFavoriteButton","Tue Feb 11 14:31:14 UTC 2025","passed","Tue Feb 11 14:31:14 UTC 2025","","","",""
"","145","should check all validated offers checkboxes","IndividualOffersScreen","Tue Feb 11 14:27:18 UTC 2025","passed","Tue Feb 11 14:27:18 UTC 2025","","on click on select all offers checkbox","",""
"","103","should display an input and a checkbox","QuantityInput","Tue Feb 11 14:30:13 UTC 2025","passed","Tue Feb 11 14:30:13 UTC 2025","","","",""
"","21","should not render on venue types api error","ValidationScreen","Tue Feb 11 14:28:04 UTC 2025","passed","Tue Feb 11 14:28:04 UTC 2025","","errors","",""
"","7","offer name with a link to the offer when stock is a thing","bookings offer cell","Tue Feb 11 14:29:43 UTC 2025","passed","Tue Feb 11 14:29:43 UTC 2025","","","",""
"","4","should not remove dates from an offer to create a template offer","createOfferPayload","Tue Feb 11 14:30:24 UTC 2025","passed","Tue Feb 11 14:30:24 UTC 2025","","","",""
"","4","should not display bank account link on first venue if user has bank account","VenueOfferSteps","Tue Feb 11 14:28:46 UTC 2025","passed","Tue Feb 11 14:28:46 UTC 2025","","","",""
"","14","should not display bank any wording or button under bank account card if offerer has no venue","ReimbursementBankAccount","Tue Feb 11 14:27:58 UTC 2025","passed","Tue Feb 11 14:27:58 UTC 2025","","","",""
"","22","should display ""Réservation"" active/enabled step","IndividualOfferNavigation","Tue Feb 11 14:28:31 UTC 2025","passed","Tue Feb 11 14:28:31 UTC 2025","","on edition mode","",""
"","60","should track choosing collective offers","OnboardingOffersChoice Component","Tue Feb 11 14:30:50 UTC 2025","passed","Tue Feb 11 14:30:50 UTC 2025","","trackers","",""
"","11","should display ""Stock & Prix"" step as active/enabled when offer has stocks","IndividualOfferNavigation","Tue Feb 11 14:28:31 UTC 2025","passed","Tue Feb 11 14:28:31 UTC 2025","","when offer is not an event","",""
"","6","should display 1 date and time when dates are the same for a template offer","OfferNameCell","Tue Feb 11 14:30:16 UTC 2025","passed","Tue Feb 11 14:30:16 UTC 2025","","","",""
"","88","should close Dialog on confirm button click","ButtonInvalidateToken","Tue Feb 11 14:32:02 UTC 2025","passed","Tue Feb 11 14:32:02 UTC 2025","","","",""
"","12","should display a Warning callout","Callout","Tue Feb 11 14:31:06 UTC 2025","passed","Tue Feb 11 14:31:06 UTC 2025","","","",""
"","12","should not display a expiration row if the offer was cancelled","ollectiveOfferRow","Tue Feb 11 14:27:42 UTC 2025","passed","Tue Feb 11 14:27:42 UTC 2025","","","",""
"","0","should return null if there are no venues","getLastCollectiveDmsApplication","Tue Feb 11 14:29:47 UTC 2025","passed","Tue Feb 11 14:29:47 UTC 2025","","getLastDmsApplicationForOfferer","",""
"","0","should invalidate the following email address : test@test.c","isValidEmail","Tue Feb 11 14:32:36 UTC 2025","passed","Tue Feb 11 14:32:36 UTC 2025","","","",""
"","48","should not render a back to nav link when not connected","Layout","Tue Feb 11 14:29:54 UTC 2025","passed","Tue Feb 11 14:29:54 UTC 2025","","about main heading & back to nav link","",""
"","2","should sort prices","computeInitialValues","Tue Feb 11 14:32:27 UTC 2025","passed","Tue Feb 11 14:32:27 UTC 2025","","","",""
"","0","should return list containing only BookingRecap matching partial beneficiary email keywords","filterBookingsRecap","Tue Feb 11 14:28:19 UTC 2025","passed","Tue Feb 11 14:28:19 UTC 2025","","","",""
"","359","should track logout","SignupJourneyRoutes::trackers","Tue Feb 11 14:31:26 UTC 2025","passed","Tue Feb 11 14:31:26 UTC 2025","","","",""
"","218","should select collective offer","OfferType","Tue Feb 11 14:28:01 UTC 2025","passed","Tue Feb 11 14:28:01 UTC 2025","","","",""
"","2","should display label for variant: light-purple","Tag","Tue Feb 11 14:32:33 UTC 2025","passed","Tue Feb 11 14:32:33 UTC 2025","","render","",""
"","138","should add geo location filter when user has latitude and longitude","app","Tue Feb 11 14:29:14 UTC 2025","passed","Tue Feb 11 14:29:14 UTC 2025","","when is authenticated","",""
"","0","should return the students levels with marseille levels","buildStudentLevelsMapWithDefaultValue","Tue Feb 11 14:31:31 UTC 2025","passed","Tue Feb 11 14:31:31 UTC 2025","","","",""
"","489","should redirect to stock on submit","screens | OfferEducational : event address step","Tue Feb 11 14:30:40 UTC 2025","passed","Tue Feb 11 14:30:40 UTC 2025","","","",""
"","1","should parse a list body","getHumanReadableApiError","Tue Feb 11 14:29:50 UTC 2025","passed","Tue Feb 11 14:29:50 UTC 2025","","","",""
"","223","should display radius input filter if user has selected around me filter","offersSearch component","Tue Feb 11 14:28:07 UTC 2025","passed","Tue Feb 11 14:28:07 UTC 2025","","","",""
"","125","should display pricing point pop-in with term ""structures""","LinkVenueDialog","Tue Feb 11 14:28:17 UTC 2025","passed","Tue Feb 11 14:28:18 UTC 2025","","WIP_ENABLE_OFFER_ADDRESS","",""
"","108","should display total number of offers in singular if one or no offer","CollectiveOffersScreen","Tue Feb 11 14:27:30 UTC 2025","passed","Tue Feb 11 14:27:30 UTC 2025","","","",""
"","54","should focus on top of the page as a fallback","useFocus","Tue Feb 11 14:31:02 UTC 2025","passed","Tue Feb 11 14:31:02 UTC 2025","","","",""
"","135","should toggle individual section on individual section button click","SideNavLinks","Tue Feb 11 14:29:17 UTC 2025","passed","Tue Feb 11 14:29:17 UTC 2025","","","",""
"","74","should redirect to authentification if no offerer is selected","ValidationScreen","Tue Feb 11 14:28:04 UTC 2025","passed","Tue Feb 11 14:28:04 UTC 2025","","","",""
"","3","should format intervention area when there are a few departments","getInterventionAreaLabels","Tue Feb 11 14:32:31 UTC 2025","passed","Tue Feb 11 14:32:31 UTC 2025","","","",""
"","1","should return 0 when first row offer name is the same as second row offer name","sortByOfferName","Tue Feb 11 14:29:16 UTC 2025","passed","Tue Feb 11 14:29:16 UTC 2025","","","",""
"","64","should not display column titles when no offers are returned","route Offers","Tue Feb 11 14:27:06 UTC 2025","passed","Tue Feb 11 14:27:06 UTC 2025","status filters","filters","",""
"","167","should display an error if no venues are selected and avoid fetching income data","Income","Tue Feb 11 14:27:37 UTC 2025","passed","Tue Feb 11 14:27:37 UTC 2025","","when the user changes venue selection","",""
"","377","should request bookings of venue requested by user when user clicks on ""Afficher""","components | BookingsRecap | Pro user","Tue Feb 11 14:27:16 UTC 2025","passed","Tue Feb 11 14:27:16 UTC 2025","","","",""
"","50","should notify of an error if the offer booking limit date is in the past on press ""Publier l’offre""","CollectiveOfferConfirmation","Tue Feb 11 14:28:58 UTC 2025","passed","Tue Feb 11 14:28:58 UTC 2025","","","",""
"","113","should call tracker when clicking on template button","FormOfferType","Tue Feb 11 14:30:45 UTC 2025","passed","Tue Feb 11 14:30:45 UTC 2025","","","",""
"","202","should have venue value be removed when user asks for all venues","route TemplateCollectiveOffers","Tue Feb 11 14:28:34 UTC 2025","passed","Tue Feb 11 14:28:35 UTC 2025","","url query params","",""
"","42","should log a tracking event when clicking the share button","OfferShareLink","Tue Feb 11 14:31:22 UTC 2025","passed","Tue Feb 11 14:31:22 UTC 2025","","","",""
"","17","should display acronym + city when educationalinstitution has no name","ollectiveOfferRow","Tue Feb 11 14:27:41 UTC 2025","passed","Tue Feb 11 14:27:41 UTC 2025","","offer remaining quantity or institution","",""
"","1","should be case insensitive","searchPatternInOptions","Tue Feb 11 14:31:08 UTC 2025","passed","Tue Feb 11 14:31:08 UTC 2025","","","",""
"","247","should update displayed link venue after closing link venue dialog","BankInformations page","Tue Feb 11 14:28:23 UTC 2025","passed","Tue Feb 11 14:28:24 UTC 2025","","","",""
"","1","should not return uai facet filter","adageFiltersToFacetFilters","Tue Feb 11 14:29:41 UTC 2025","passed","Tue Feb 11 14:29:41 UTC 2025","","","",""
"","104","should render error message when siret is not visible","Offerer","Tue Feb 11 14:27:54 UTC 2025","passed","Tue Feb 11 14:27:54 UTC 2025","","","",""
"","660","should display blocker when form is dirty","screens:StocksEventEdition","Tue Feb 11 14:27:29 UTC 2025","passed","Tue Feb 11 14:27:30 UTC 2025","","","",""
"","233","should display functional edit button","AllocineProviderEdit","Tue Feb 11 14:31:01 UTC 2025","passed","Tue Feb 11 14:31:01 UTC 2025","","","",""
"","5","should not display radio input children when the input is unchecked","BaseRadio","Tue Feb 11 14:32:08 UTC 2025","passed","Tue Feb 11 14:32:08 UTC 2025","","","",""
"","2","should validate accessibility correctly","getValidationSchema","Tue Feb 11 14:29:42 UTC 2025","passed","Tue Feb 11 14:29:42 UTC 2025","","","",""
"","37","should fetch the offer with the id in the url when there is no offer in the router location","OfferInfos","Tue Feb 11 14:29:10 UTC 2025","passed","Tue Feb 11 14:29:10 UTC 2025","","","",""
"","6","Should display the right wording without the FF enabled","OffererBanners","Tue Feb 11 14:29:56 UTC 2025","passed","Tue Feb 11 14:29:56 UTC 2025","","WIP_ENABLE_OFFER_ADDRESS","",""
"","140","the user should not see the home offer steps if they have some venues","Homepage","Tue Feb 11 14:28:50 UTC 2025","passed","Tue Feb 11 14:28:50 UTC 2025","","","",""
"","72","should display Opening hours details message","route VenueEdition","Tue Feb 11 14:28:12 UTC 2025","passed","Tue Feb 11 14:28:12 UTC 2025","","","",""
"","3","should pass additional button attributes","ButtonFilter","Tue Feb 11 14:30:59 UTC 2025","passed","Tue Feb 11 14:30:59 UTC 2025","","","",""
"","95","should display a black filter icon","components | FilterByBookingStatus","Tue Feb 11 14:29:12 UTC 2025","passed","Tue Feb 11 14:29:12 UTC 2025","","","",""
"","3","should show that the offer is not accessible if the offer has no accessibility criteria enabled","AdageOfferPublicSection","Tue Feb 11 14:30:55 UTC 2025","passed","Tue Feb 11 14:30:55 UTC 2025","","","",""
"","111","should render as much offers as returned by the api","IndividualOffersScreen","Tue Feb 11 14:27:15 UTC 2025","passed","Tue Feb 11 14:27:15 UTC 2025","","","",""
"","102","should log breadcrumbs navigation to authentication","test renderSignupJourneyStepper","Tue Feb 11 14:29:06 UTC 2025","passed","Tue Feb 11 14:29:06 UTC 2025","","","",""
"","70","should have a cancel button instead of the previous step button when editing the offer","OfferEducationalStock","Tue Feb 11 14:28:20 UTC 2025","passed","Tue Feb 11 14:28:21 UTC 2025","","","",""
"","262","should clear filters","StocksEventList","Tue Feb 11 14:27:49 UTC 2025","passed","Tue Feb 11 14:27:50 UTC 2025","","","",""
"","0","should not block when going from stocks to creation page with id in url","components | RouteLeavingGuardCollectiveOfferCreation","Tue Feb 11 14:29:26 UTC 2025","passed","Tue Feb 11 14:29:26 UTC 2025","","","",""
"","322","should render a list of events","StocksSummaryScreen","Tue Feb 11 14:31:17 UTC 2025","passed","Tue Feb 11 14:31:18 UTC 2025","","","",""
"","8","should display link for eac informations if has adage id and already created offer","VenueOfferSteps","Tue Feb 11 14:28:46 UTC 2025","passed","Tue Feb 11 14:28:46 UTC 2025","","","",""
"","1","should return a valid initial form object with offer address fields","setInitialFormValues","Tue Feb 11 14:30:42 UTC 2025","passed","Tue Feb 11 14:30:42 UTC 2025","","","",""
"","10","should render steps for confirmed booking when event is passed","collective timeline","Tue Feb 11 14:27:57 UTC 2025","passed","Tue Feb 11 14:27:57 UTC 2025","","confirmed booking","",""
"","10","should have right attributes for open in new tab","ButtonLink","Tue Feb 11 14:30:54 UTC 2025","passed","Tue Feb 11 14:30:54 UTC 2025","","","",""
"","6","should display given information text with icon","Notification","Tue Feb 11 14:31:14 UTC 2025","passed","Tue Feb 11 14:31:14 UTC 2025","","","",""
"","9","should display an empty screen if no venues were found","Income","Tue Feb 11 14:27:36 UTC 2025","passed","Tue Feb 11 14:27:36 UTC 2025","","when the page first renders","",""
"","52","should display error message on api error","ValidationScreen","Tue Feb 11 14:28:04 UTC 2025","passed","Tue Feb 11 14:28:04 UTC 2025","","errors","",""
"","3","should delete image in case of template offer","useCollectiveOfferImageUpload","Tue Feb 11 14:30:11 UTC 2025","passed","Tue Feb 11 14:30:11 UTC 2025","","","",""
"","11","not renders the search input if hasSearch is false","<MultiSelectPanel />","Tue Feb 11 14:28:55 UTC 2025","passed","Tue Feb 11 14:28:55 UTC 2025","","","",""
"","63","should show the suggestions header when there are results","OffersSuggestions","Tue Feb 11 14:28:41 UTC 2025","passed","Tue Feb 11 14:28:41 UTC 2025","","","",""
"","2","should return a date range if the start date is different from the end date","adageOfferDates","Tue Feb 11 14:30:44 UTC 2025","passed","Tue Feb 11 14:30:44 UTC 2025","","getFormattedDatesForBookableOffer","",""
"","4","should validate the form for case: valid form with form option checked and url form selected and custom url valid","validationSchema OfferEducational","Tue Feb 11 14:29:40 UTC 2025","passed","Tue Feb 11 14:29:40 UTC 2025","","template offer","",""
"","41","should show cancel button when ENABLE_COLLECTIVE_NEW_STATUSES is on and offer has CAN_CANCEL allowed action","CollectiveBookingDetails","Tue Feb 11 14:30:43 UTC 2025","passed","Tue Feb 11 14:30:43 UTC 2025","","","",""
"","111","should have max number page of 10","route TemplateCollectiveOffers","Tue Feb 11 14:27:39 UTC 2025","passed","Tue Feb 11 14:27:39 UTC 2025","when 101 offers are fetched","page navigation","",""
"","6","should return defautl cancellation message when reason is unknown","collective timeline","Tue Feb 11 14:27:56 UTC 2025","passed","Tue Feb 11 14:27:56 UTC 2025","","","",""
"","14","should not initialize firebase on the adage iframe","App","Tue Feb 11 14:28:57 UTC 2025","passed","Tue Feb 11 14:28:57 UTC 2025","","","",""
"","30","should display creation title","CollectiveOfferLayout","Tue Feb 11 14:31:11 UTC 2025","passed","Tue Feb 11 14:31:11 UTC 2025","","","",""
