"DESCRIPTION","DURATION IN MS","NAME","PARENT SUITE","START TIME","STATUS","STOP TIME","SUB SUITE","SUITE","TEST CLASS","TEST METHOD"
"","27","should display the edition button when the FF ENABLE_COLLECTIVE_NEW_STATUSES is disabled and the offer is template","CollectiveOfferSummary","Tue Jan 14 15:55:03 UTC 2025","passed","Tue Jan 14 15:55:03 UTC 2025","","","",""
"","50","should not show a count restriction message if there is no maximum count","SelectAutocomplete","Tue Jan 14 15:54:24 UTC 2025","passed","Tue Jan 14 15:54:24 UTC 2025","","","",""
"","1","should return an error for wrong siret lengths","getsiretData","Tue Jan 14 15:58:13 UTC 2025","passed","Tue Jan 14 15:58:13 UTC 2025","","","",""
"","16","should display pre publishing banner in creation","Summary","Tue Jan 14 15:54:07 UTC 2025","passed","Tue Jan 14 15:54:07 UTC 2025","","banners","",""
"","305","should trigger onSubmit callback when submitting","components:UserEmailForm","Tue Jan 14 15:58:42 UTC 2025","passed","Tue Jan 14 15:58:42 UTC 2025","","","",""
"","1","accepts image when it's lighter that maximum","image constraints","Tue Jan 14 15:56:45 UTC 2025","passed","Tue Jan 14 15:56:45 UTC 2025","","size","",""
"","1","should singularize word if 0 offer","pluralize","Tue Jan 14 15:58:39 UTC 2025","passed","Tue Jan 14 15:58:39 UTC 2025","","standard words","",""
"","3","should display label for variant: red","Tag","Tue Jan 14 15:59:26 UTC 2025","passed","Tue Jan 14 15:59:26 UTC 2025","","render","",""
"","1","should validate the form for case: ending date is before starting date","validationSchema","Tue Jan 14 15:56:51 UTC 2025","passed","Tue Jan 14 15:56:51 UTC 2025","","","",""
"","48","should not refine on click previous page button","AdagePagination","Tue Jan 14 15:58:02 UTC 2025","passed","Tue Jan 14 15:58:02 UTC 2025","","","",""
"","298","should reset filter onclick modal clear students","OfferFilters","Tue Jan 14 15:55:23 UTC 2025","passed","Tue Jan 14 15:55:23 UTC 2025","","","",""
"","38","should see the data from the previous forms for validation","ValidationScreen","Tue Jan 14 15:55:14 UTC 2025","passed","Tue Jan 14 15:55:14 UTC 2025","","","",""
"","380","should prefill intervention and accessibility fields with venue intervention field when selecting venue","screens | OfferEducational : event address step","Tue Jan 14 15:57:27 UTC 2025","passed","Tue Jan 14 15:57:27 UTC 2025","","","",""
"","3","should be able to correctly parse DMS into decimal degrees","parseDms","Tue Jan 14 15:57:33 UTC 2025","passed","Tue Jan 14 15:57:33 UTC 2025","","","",""
"","310","should display the dialog if user updated withdrawal informations","screens:IndividualOffer::UsefulInformation","Tue Jan 14 15:54:57 UTC 2025","passed","Tue Jan 14 15:54:57 UTC 2025","","ConfirmDialog","",""
"","119","should let going to stock when form has been filled in creation","PriceCategories","Tue Jan 14 15:56:25 UTC 2025","passed","Tue Jan 14 15:56:25 UTC 2025","","","",""
"","0","should trim input","filterBookingsRecap","Tue Jan 14 15:55:19 UTC 2025","passed","Tue Jan 14 15:55:19 UTC 2025","","","",""
"","1","should return false if the object is not a collective offer","isCollectiveOffer","Tue Jan 14 15:58:53 UTC 2025","passed","Tue Jan 14 15:58:53 UTC 2025","","","",""
"","101","should renders the Autocomplete component with placeholder and search button","Autocomplete","Tue Jan 14 15:55:30 UTC 2025","passed","Tue Jan 14 15:55:30 UTC 2025","","","",""
"","1","should format a time with the right format for a HTML input","formatTimeForInput","Tue Jan 14 15:56:32 UTC 2025","passed","Tue Jan 14 15:56:32 UTC 2025","","","",""
"","140","should render a table with bookings","CollectiveTableRow","Tue Jan 14 15:58:28 UTC 2025","passed","Tue Jan 14 15:58:29 UTC 2025","","","",""
"","20","should display creation title","CollectiveOfferLayout","Tue Jan 14 15:58:02 UTC 2025","passed","Tue Jan 14 15:58:02 UTC 2025","","","",""
"","312","should handle unique line label cases","PriceCategories","Tue Jan 14 15:55:32 UTC 2025","passed","Tue Jan 14 15:55:33 UTC 2025","","","",""
"","14","should announce the last link as the current page for assistive technologies","Breadcrumb","Tue Jan 14 15:59:00 UTC 2025","passed","Tue Jan 14 15:59:00 UTC 2025","","","",""
"","18","should render message when has a pending bank account and no valid one","BankInformations page","Tue Jan 14 15:55:22 UTC 2025","passed","Tue Jan 14 15:55:22 UTC 2025","","","",""
"","1","should handle null withdrawalDelay correctly","setDefaultInitialValuesFromOffer","Tue Jan 14 15:55:43 UTC 2025","passed","Tue Jan 14 15:55:43 UTC 2025","","","",""
"","155","should open/close ModalAppPreview on click","ButtonAppPreview","Tue Jan 14 15:58:35 UTC 2025","passed","Tue Jan 14 15:58:35 UTC 2025","","","",""
"","46","should render component","screens:SignupJourney::ConfirmedAttachment","Tue Jan 14 15:58:46 UTC 2025","passed","Tue Jan 14 15:58:46 UTC 2025","","","",""
"","14","should say how many offers are selected when more than 1 offer are selected","ActionsBar","Tue Jan 14 15:54:52 UTC 2025","passed","Tue Jan 14 15:54:52 UTC 2025","","","",""
"","40","should fetch a bookable offer if the id in url is prefixed with ""B-""","OfferInfos","Tue Jan 14 15:56:07 UTC 2025","passed","Tue Jan 14 15:56:07 UTC 2025","","","",""
"","44","should close the Callout","Callout","Tue Jan 14 15:57:57 UTC 2025","passed","Tue Jan 14 15:57:57 UTC 2025","","","",""
"","22","should display the venue name when venue public name is not given","IndividualOfferRow","Tue Jan 14 15:55:07 UTC 2025","passed","Tue Jan 14 15:55:08 UTC 2025","","","",""
"","4","should display the EAC section when adage application accepted but has not yet adageId","PartnerPages","Tue Jan 14 15:56:53 UTC 2025","passed","Tue Jan 14 15:56:53 UTC 2025","","","",""
"","2","should validate the form for case: event time should be after current time when start date is today","validationSchema","Tue Jan 14 15:57:00 UTC 2025","passed","Tue Jan 14 15:57:00 UTC 2025","","","",""
"","18","should not display a expiration row if the offer was cancelled","ollectiveOfferRow","Tue Jan 14 15:54:42 UTC 2025","passed","Tue Jan 14 15:54:42 UTC 2025","","","",""
"","85","should select and redirect fine case : %s","OfferType","Tue Jan 14 15:55:03 UTC 2025","passed","Tue Jan 14 15:55:04 UTC 2025","","","",""
"","194","should display price modification modal with booking","PriceCategories","Tue Jan 14 15:55:41 UTC 2025","passed","Tue Jan 14 15:55:41 UTC 2025","","","",""
"","20","should not display provider banner when no provider is provided","IndivualOfferLayout","Tue Jan 14 15:56:16 UTC 2025","passed","Tue Jan 14 15:56:16 UTC 2025","","","",""
"","28","should display two edition buttons when the FF ENABLE_COLLECTIVE_NEW_STATUSES is enabled and the offer description and price are editable","CollectiveOfferSummary","Tue Jan 14 15:55:03 UTC 2025","passed","Tue Jan 14 15:55:03 UTC 2025","","","",""
"","92","should display error message when trying to activate collective offers with booking limit date passed","TemplateCollectiveOffersScreen","Tue Jan 14 15:54:56 UTC 2025","passed","Tue Jan 14 15:54:56 UTC 2025","","on click on select all offers checkbox","",""
"","174","should show AddBankInformationsDialog on click add bank account button","BankInformations page","Tue Jan 14 15:55:22 UTC 2025","passed","Tue Jan 14 15:55:22 UTC 2025","","","",""
"","0","should block when leaving summary creation","components | RouteLeavingGuardCollectiveOfferCreation","Tue Jan 14 15:56:25 UTC 2025","passed","Tue Jan 14 15:56:25 UTC 2025","","","",""
"","19","should redirect to maintenance page api v1 responds with status 503","Maintenance","Tue Jan 14 15:58:56 UTC 2025","passed","Tue Jan 14 15:58:56 UTC 2025","","","",""
"","20","should display actions button and status tag by default","OfferEducationalActions","Tue Jan 14 15:55:15 UTC 2025","passed","Tue Jan 14 15:55:15 UTC 2025","","","",""
"","31","should pluralize number of stocks sold out when at least two stocks are sold out","IndividualOfferRow","Tue Jan 14 15:55:08 UTC 2025","passed","Tue Jan 14 15:55:08 UTC 2025","","when offer is an event product","",""
"","33","should not deactivate offers on click on ""Masquer"" when at least one offer is not published or expired","ActionsBar","Tue Jan 14 15:54:19 UTC 2025","passed","Tue Jan 14 15:54:19 UTC 2025","","","",""
"","27","should allow tabbing from one input of type search to the next","TextInput","Tue Jan 14 15:57:49 UTC 2025","passed","Tue Jan 14 15:57:49 UTC 2025","","","",""
"","92","should render banner with venue information when offerer venue is selected","FormPracticalInformation","Tue Jan 14 15:56:56 UTC 2025","passed","Tue Jan 14 15:56:56 UTC 2025","","eventAddress conditionnal render","",""
"","337","should load offers with selected venue filter","route CollectiveOffers","Tue Jan 14 15:54:27 UTC 2025","passed","Tue Jan 14 15:54:27 UTC 2025","on click on search button","filters","",""
"","45","should update the selected omniSearch criteria when selecting an omniSearchCriteria","components | FilterByOmniSearch","Tue Jan 14 15:56:03 UTC 2025","passed","Tue Jan 14 15:56:03 UTC 2025","","","",""
"","1","should be invalid if no special char","When validating a password","Tue Jan 14 15:59:16 UTC 2025","passed","Tue Jan 14 15:59:16 UTC 2025","","","",""
"","26","should not display footer is ""showFooter"" is false","Layout","Tue Jan 14 15:57:03 UTC 2025","passed","Tue Jan 14 15:57:03 UTC 2025","","showFooter","",""
"","3","should return the correct parent","getNthParentFormValues","Tue Jan 14 15:58:59 UTC 2025","passed","Tue Jan 14 15:58:59 UTC 2025","","","",""
"","18","should display the right wording without the OA FF","CollectiveOfferSummary","Tue Jan 14 15:55:03 UTC 2025","passed","Tue Jan 14 15:55:03 UTC 2025","","OA feature flag","",""
"","55","should display the appropriate message when there is one booking","bookings recap table's header","Tue Jan 14 15:58:29 UTC 2025","passed","Tue Jan 14 15:58:29 UTC 2025","","","",""
"","53","should make two calls if the ids come from template offer and bookable offer","ActionsBar","Tue Jan 14 15:54:20 UTC 2025","passed","Tue Jan 14 15:54:20 UTC 2025","","","",""
"","15","should display the right wording with the OA FF","CollectiveDataEdition","Tue Jan 14 15:54:38 UTC 2025","passed","Tue Jan 14 15:54:38 UTC 2025","","OA feature flag","",""
"","0","should not block when following template creation flow (from creation to recapitulatif)","components | RouteLeavingGuardCollectiveOfferCreation","Tue Jan 14 15:56:25 UTC 2025","passed","Tue Jan 14 15:56:25 UTC 2025","","","",""
"","1","should not display the time minutes when the starting date minutes are 00","getRangeToFrenchText","Tue Jan 14 15:56:32 UTC 2025","passed","Tue Jan 14 15:56:32 UTC 2025","","","",""
"","5","should display the value","Slider","Tue Jan 14 15:59:02 UTC 2025","passed","Tue Jan 14 15:59:02 UTC 2025","","","",""
"","1","should format the months and years for both dates when the starting date and ending date are on different years","getRangeToFrenchText","Tue Jan 14 15:56:32 UTC 2025","passed","Tue Jan 14 15:56:32 UTC 2025","","","",""
"","13","should not render sitemap if user is not connected","Footer","Tue Jan 14 15:58:55 UTC 2025","passed","Tue Jan 14 15:58:55 UTC 2025","","","",""
"","397","should filter offers given multiple status filter when clicking on ""Appliquer""","route TemplateCollectiveOffers","Tue Jan 14 15:54:42 UTC 2025","passed","Tue Jan 14 15:54:42 UTC 2025","status filters","filters","",""
"","2","should be valid if all requirements are met","When validating a password","Tue Jan 14 15:59:16 UTC 2025","passed","Tue Jan 14 15:59:16 UTC 2025","","","",""
"","256","should render collective offer stock form","CollectiveOfferStockCreation","Tue Jan 14 15:57:46 UTC 2025","passed","Tue Jan 14 15:57:46 UTC 2025","","","",""
"","60","should display institution type, name and city in select options","CollectiveOfferVisibility","Tue Jan 14 15:54:45 UTC 2025","passed","Tue Jan 14 15:54:46 UTC 2025","","","",""
"","54","should not display statistics dashboard when selected offerer is validated but not active","Homepage","Tue Jan 14 15:55:54 UTC 2025","passed","Tue Jan 14 15:55:54 UTC 2025","","render statistics dashboard","",""
"","104","should render ButtonImageDelete","ButtonImageDelete","Tue Jan 14 15:58:42 UTC 2025","passed","Tue Jan 14 15:58:42 UTC 2025","","","",""
"","183","should display the offer information sections","AdageOffer","Tue Jan 14 15:58:10 UTC 2025","passed","Tue Jan 14 15:58:10 UTC 2025","","","",""
"","203","should render as much offers as returned by the api","TemplateCollectiveOffersScreen","Tue Jan 14 15:54:55 UTC 2025","passed","Tue Jan 14 15:54:55 UTC 2025","","","",""
"","42","should log event when clicked on booking link","OfferEducationalActions","Tue Jan 14 15:55:15 UTC 2025","passed","Tue Jan 14 15:55:15 UTC 2025","","","",""
"","21","should be ""illimité"" when at least one stock of the individual offer is unlimited","IndividualOfferRow","Tue Jan 14 15:55:08 UTC 2025","passed","Tue Jan 14 15:55:08 UTC 2025","","offer remaining quantity or institution","",""
"","75","should show the e-mail address","AdageOfferPartnerSection","Tue Jan 14 15:58:38 UTC 2025","passed","Tue Jan 14 15:58:38 UTC 2025","","","",""
"","33","should disable submit button when no options selected","UserReviewDialog","Tue Jan 14 15:56:47 UTC 2025","passed","Tue Jan 14 15:56:47 UTC 2025","","","",""
"","53","should notify of an error if the offer beginning date is in the past on press ""Publier l’offre""","CollectiveOfferConfirmation","Tue Jan 14 15:55:59 UTC 2025","passed","Tue Jan 14 15:55:59 UTC 2025","","","",""
"","3650","should not display the 501st offer","route Offers","Tue Jan 14 15:54:12 UTC 2025","passed","Tue Jan 14 15:54:16 UTC 2025","when 501 offers are fetched","page navigation","",""
"","1","refuses image with invalid type","image constraints","Tue Jan 14 15:56:45 UTC 2025","passed","Tue Jan 14 15:56:45 UTC 2025","checks file type","formats","",""
"","1","should return offererVenue event type facet filter","adageFiltersToFacetFilters","Tue Jan 14 15:56:36 UTC 2025","passed","Tue Jan 14 15:56:36 UTC 2025","","","",""
"","21","should not display the offer greyed when offer is ARCHIVED","ollectiveOfferRow","Tue Jan 14 15:54:41 UTC 2025","passed","Tue Jan 14 15:54:41 UTC 2025","","","",""
"","66","calls the callback on supprimer button click","venue image edit","Tue Jan 14 15:58:07 UTC 2025","passed","Tue Jan 14 15:58:07 UTC 2025","","","",""
"","53","should display radius range input in localisation filter modal","OfferFilters","Tue Jan 14 15:55:23 UTC 2025","passed","Tue Jan 14 15:55:23 UTC 2025","","","",""
"","1","should omit the page number in search filters","getCollectiveOffersSwrKeys","Tue Jan 14 15:58:34 UTC 2025","passed","Tue Jan 14 15:58:34 UTC 2025","","","",""
"","43","should fetch the offer with the id in the url when there is no offer in the router location","OfferInfos","Tue Jan 14 15:56:07 UTC 2025","passed","Tue Jan 14 15:56:07 UTC 2025","","","",""
"","492","should filter offers given status filter when clicking on ""Appliquer""","route TemplateCollectiveOffers","Tue Jan 14 15:54:41 UTC 2025","passed","Tue Jan 14 15:54:42 UTC 2025","status filters","filters","",""
"","48","should return an error on offer archiving when there is an api error","CollectiveEditionOfferNavigation","Tue Jan 14 15:54:58 UTC 2025","passed","Tue Jan 14 15:54:58 UTC 2025","","","",""
"","22","should show the partner page link if the offer venue has an adageId","AdageOfferPartnerPanel","Tue Jan 14 15:56:43 UTC 2025","passed","Tue Jan 14 15:56:43 UTC 2025","","","",""
"","91","should render when no offer is given","IndivualOfferLayout","Tue Jan 14 15:56:15 UTC 2025","passed","Tue Jan 14 15:56:15 UTC 2025","","","",""
"","38","should display the acceslibre section under the form if the feature is enabled and data is present","VenueFormScreen","Tue Jan 14 15:55:13 UTC 2025","passed","Tue Jan 14 15:55:13 UTC 2025","","","",""
"","322","should not redirect user to onboarding page if use has an offerer","SignIn","Tue Jan 14 15:54:54 UTC 2025","passed","Tue Jan 14 15:54:54 UTC 2025","","sign in with new onboarding feature","",""
"","10","should not display dms timeline link if venue has no dms application","venues","Tue Jan 14 15:58:24 UTC 2025","passed","Tue Jan 14 15:58:24 UTC 2025","","","",""
"","5","should validate the form for case: valid form with form option checked and url form selected and custom url valid","validationSchema OfferEducational","Tue Jan 14 15:56:35 UTC 2025","passed","Tue Jan 14 15:56:35 UTC 2025","","template offer","",""
"","0","should validate the following email address : a.test@test.com","isValidEmail","Tue Jan 14 15:59:28 UTC 2025","passed","Tue Jan 14 15:59:28 UTC 2025","","","",""
"","8","should show the offer location for an offer at the school","AdageOfferInfoSection","Tue Jan 14 15:56:36 UTC 2025","passed","Tue Jan 14 15:56:37 UTC 2025","","","",""
"","244","should display modal when user cancel venue creation","route VenueCreation","Tue Jan 14 15:57:22 UTC 2025","passed","Tue Jan 14 15:57:22 UTC 2025","","","",""
"","43","should render the revenue page nested link in ""Gestion financière"" list","Sitemap","Tue Jan 14 15:56:32 UTC 2025","passed","Tue Jan 14 15:56:32 UTC 2025","","when the offerer stats v2 feature is active","",""
"","145","should render stock thing","screens:Stocks","Tue Jan 14 15:56:39 UTC 2025","passed","Tue Jan 14 15:56:39 UTC 2025","","","",""
"","12","should not display the offer greyed when offer is ACTIVE","ollectiveOfferRow","Tue Jan 14 15:54:41 UTC 2025","passed","Tue Jan 14 15:54:41 UTC 2025","","","",""
"","8","should not render error and warning messages when all venues are linked","ReimbursementBankAccount","Tue Jan 14 15:55:00 UTC 2025","passed","Tue Jan 14 15:55:00 UTC 2025","","","",""
"","19","should load saved venue in localStorage if no get parameter","PartnerPages","Tue Jan 14 15:56:42 UTC 2025","passed","Tue Jan 14 15:56:42 UTC 2025","","","",""
"","1","should return the end of the booking limit datetime when it is different from the start datetime","buildBookingLimitDatetimeForStockPayload","Tue Jan 14 15:58:09 UTC 2025","passed","Tue Jan 14 15:58:09 UTC 2025","","","",""
"","3","should add ""Toute la France"" in selected values","handleAllFranceDepartmentOptions","Tue Jan 14 15:57:38 UTC 2025","passed","Tue Jan 14 15:57:38 UTC 2025","","","",""
"","34","should render a link to RGS information","src | components | BannerRGS","Tue Jan 14 15:59:28 UTC 2025","passed","Tue Jan 14 15:59:28 UTC 2025","","","",""
"","232","should called onCancel button onclick","DeactivationConfirmDialog","Tue Jan 14 15:57:52 UTC 2025","passed","Tue Jan 14 15:57:52 UTC 2025","","","",""
"","39","should not redirect to next step on submit and show notification error when publication fails","CollectiveOfferConfirmation","Tue Jan 14 15:55:58 UTC 2025","passed","Tue Jan 14 15:55:58 UTC 2025","","","",""
"","19","should display creation from template title","CollectiveOfferLayout","Tue Jan 14 15:58:02 UTC 2025","passed","Tue Jan 14 15:58:02 UTC 2025","","","",""
"","27","should contain a link with the offer name and details link","IndividualOfferRow","Tue Jan 14 15:55:07 UTC 2025","passed","Tue Jan 14 15:55:07 UTC 2025","","offer title","",""
"","65","should render component with new sections","Summary","Tue Jan 14 15:54:05 UTC 2025","passed","Tue Jan 14 15:54:05 UTC 2025","","On Creation","",""
"","905","should show a notification on api call error","Signup","Tue Jan 14 15:55:08 UTC 2025","passed","Tue Jan 14 15:55:09 UTC 2025","formValidation","render","",""
"","110","should display statistics dashboard when selected offerer is active and validated","Homepage","Tue Jan 14 15:55:53 UTC 2025","passed","Tue Jan 14 15:55:54 UTC 2025","","render statistics dashboard","",""
"","166","should display with the lateral bar","OfferType","Tue Jan 14 15:59:02 UTC 2025","passed","Tue Jan 14 15:59:02 UTC 2025","","","",""
"","37","should allow edition for a bookable offer when the ENABLE_COLLECTIVE_NEW_STATUSES FF is enabled and the edition of 'discount' is allowed","CollectiveActionsCells","Tue Jan 14 15:54:38 UTC 2025","passed","Tue Jan 14 15:54:38 UTC 2025","","","",""
"","26","should render bold text with <strong> tag","Markdown","Tue Jan 14 15:58:05 UTC 2025","passed","Tue Jan 14 15:58:05 UTC 2025","","","",""
"","5","should display a banner saying that the offer needs to be booked if it is already pre-booked","ExpirationCell","Tue Jan 14 15:57:49 UTC 2025","passed","Tue Jan 14 15:57:49 UTC 2025","","","",""
"","151","should render component","Offerer","Tue Jan 14 15:54:51 UTC 2025","passed","Tue Jan 14 15:54:52 UTC 2025","","","",""
"","38","should not display ds application link when the FF is enabled","VenueOfferSteps","Tue Jan 14 15:55:50 UTC 2025","passed","Tue Jan 14 15:55:50 UTC 2025","","","",""
"","5","should not show cancel button when ENABLE_COLLECTIVE_NEW_STATUSES and offer has not CAN_CANCEL allowed action","CollectiveActionsCells","Tue Jan 14 15:54:38 UTC 2025","passed","Tue Jan 14 15:54:38 UTC 2025","","","",""
"","4255","should not display the 501st offer","route TemplateCollectiveOffers","Tue Jan 14 15:54:45 UTC 2025","passed","Tue Jan 14 15:54:49 UTC 2025","when 501 offers are fetched","page navigation","",""
"","247","should track displaying the confirmation dialog","Offerers trackers","Tue Jan 14 15:57:14 UTC 2025","passed","Tue Jan 14 15:57:15 UTC 2025","","","",""
"","1","should not set null when quantity value is 0","serializeStockThingList","Tue Jan 14 15:57:29 UTC 2025","passed","Tue Jan 14 15:57:29 UTC 2025","","","",""
"","707","should display errors","OpeningHoursForm","Tue Jan 14 15:56:01 UTC 2025","passed","Tue Jan 14 15:56:02 UTC 2025","","","",""
"","201","should show a preview of the offer template","AdagePreviewLayout","Tue Jan 14 15:57:51 UTC 2025","passed","Tue Jan 14 15:57:51 UTC 2025","","","",""
"","177","should sort students options with selected first but keep initial order otherwise","OfferFilters","Tue Jan 14 15:55:25 UTC 2025","passed","Tue Jan 14 15:55:25 UTC 2025","","","",""
"","83","should log event when duplicating a bookable offer","CollectiveActionsCells","Tue Jan 14 15:54:38 UTC 2025","passed","Tue Jan 14 15:54:38 UTC 2025","","CollectiveActionsCells:Duplicate","",""
"","223","should indicate that no offers match selected filters","route Offers","Tue Jan 14 15:54:08 UTC 2025","passed","Tue Jan 14 15:54:09 UTC 2025","status filters","filters","",""
"","60","should display the EAC section when no adage","PartnerPages","Tue Jan 14 15:56:53 UTC 2025","passed","Tue Jan 14 15:56:53 UTC 2025","","","",""
"","53","should open and display all options when the user focuses on the field","SelectAutocomplete","Tue Jan 14 15:54:22 UTC 2025","passed","Tue Jan 14 15:54:22 UTC 2025","","Options","",""
"","253","should check content for accessibility","Stepper","Tue Jan 14 15:57:13 UTC 2025","passed","Tue Jan 14 15:57:13 UTC 2025","","","",""
"","1","accepts bitmap image","image constraints","Tue Jan 14 15:56:45 UTC 2025","passed","Tue Jan 14 15:56:45 UTC 2025","checks file binary","formats","",""
"","35","should redirect to the unavailable error page when the API sirene feature is disabled","SignIn","Tue Jan 14 15:54:52 UTC 2025","passed","Tue Jan 14 15:54:52 UTC 2025","","when user clicks on 'Créer un compte'","",""
"","6","should parse french metropolitan phone number","french phone number without region code","Tue Jan 14 15:57:03 UTC 2025","passed","Tue Jan 14 15:57:03 UTC 2025","","","",""
"","20","should show a generic count when more than 500 offers are selected","ActionsBar","Tue Jan 14 15:54:52 UTC 2025","passed","Tue Jan 14 15:54:52 UTC 2025","","","",""
"","20","should display a favorites tab in the header","AdageHeader","Tue Jan 14 15:56:05 UTC 2025","passed","Tue Jan 14 15:56:05 UTC 2025","","","",""
"","8","should show that the offer happens in school","AdageOfferHeader","Tue Jan 14 15:55:58 UTC 2025","passed","Tue Jan 14 15:55:58 UTC 2025","","","",""
"","54","should display ""expirée"" if offer is expired","StatusLabel","Tue Jan 14 15:58:04 UTC 2025","passed","Tue Jan 14 15:58:04 UTC 2025","","","",""
"","45","should redirect to onboarding if has no user_offerer on private page","App","Tue Jan 14 15:56:39 UTC 2025","passed","Tue Jan 14 15:56:39 UTC 2025","","","",""
"","7","should return defautl cancellation message when reason is unknown","collective timeline","Tue Jan 14 15:54:59 UTC 2025","passed","Tue Jan 14 15:54:59 UTC 2025","","","",""
"","385","should store search value","route CollectiveOffers","Tue Jan 14 15:54:27 UTC 2025","passed","Tue Jan 14 15:54:27 UTC 2025","on click on search button","filters","",""
"","0","should build initial values for given data","test ImageUploader:utils:buildInitialValues","Tue Jan 14 15:58:55 UTC 2025","passed","Tue Jan 14 15:58:55 UTC 2025","","","",""
"","78","should display creation links when user has a venue created","VenueCrationLinks","Tue Jan 14 15:58:32 UTC 2025","passed","Tue Jan 14 15:58:32 UTC 2025","","","",""
"","560","should display venue selects as disabled (not editable) fields","screens | OfferEducational : edition offerer step","Tue Jan 14 15:57:07 UTC 2025","passed","Tue Jan 14 15:57:08 UTC 2025","","","",""
"","0","getHumanizeRelativeDistance(undefined) 	= '15 m'","getDistance","Tue Jan 14 15:59:05 UTC 2025","passed","Tue Jan 14 15:59:05 UTC 2025","","","",""
"","120","should attempt to fetch venues data and display a loading spinner meanwhile","Income","Tue Jan 14 15:54:37 UTC 2025","passed","Tue Jan 14 15:54:37 UTC 2025","","when the page first renders","",""
"","60","should render review dialog when clicking on the review button","Newsletter","Tue Jan 14 15:59:15 UTC 2025","passed","Tue Jan 14 15:59:15 UTC 2025","","","",""
