"DESCRIPTION","DURATION IN MS","NAME","PARENT SUITE","START TIME","STATUS","STOP TIME","SUB SUITE","SUITE","TEST CLASS","TEST METHOD"
"","73","should show an error message notification when domains could not be fetched","offersSearch component","Tue Dec 31 14:10:21 UTC 2024","passed","Tue Dec 31 14:10:21 UTC 2024","","","",""
"","171","should track event on cancel","screen Offers","Tue Dec 31 14:13:51 UTC 2024","passed","Tue Dec 31 14:13:51 UTC 2024","","","",""
"","0","should return a date range if the start date is different from the end date","adageOfferDates","Tue Dec 31 14:12:48 UTC 2024","passed","Tue Dec 31 14:12:48 UTC 2024","","getFormattedDatesForBookableOffer","",""
"","41","should display the corresponding status and date when the offer is booked","bookings status history cell","Tue Dec 31 14:12:40 UTC 2024","passed","Tue Dec 31 14:12:40 UTC 2024","","","",""
"","13086","I can create an offer with draft status","Create collective offers","Tue Dec 31 14:13:29 UTC 2024","passed","Tue Dec 31 14:13:42 UTC 2024","","","",""
"","27","should not see edit button if offer from publicApi","CollectiveOfferSummary","Tue Dec 31 14:10:16 UTC 2024","passed","Tue Dec 31 14:10:16 UTC 2024","","","",""
"","13","should not display options at first display","SelectAutocomplete","Tue Dec 31 14:09:36 UTC 2024","passed","Tue Dec 31 14:09:36 UTC 2024","","Options","",""
"","75","should display dms application banner if offerer can not create collective offer but has a dms application","OfferType","Tue Dec 31 14:10:17 UTC 2024","passed","Tue Dec 31 14:10:17 UTC 2024","","","",""
"","35","should not display expired offer","offers","Tue Dec 31 14:09:31 UTC 2024","passed","Tue Dec 31 14:09:31 UTC 2024","","","",""
"","22","should disabled field for rejected offer","PriceCategories","Tue Dec 31 14:13:33 UTC 2024","passed","Tue Dec 31 14:13:33 UTC 2024","","","",""
"","160","should show student levels without Marseille options when WIP_ENABLE_MARSEILLE is off","CollectiveDataForm","Tue Dec 31 14:13:09 UTC 2024","passed","Tue Dec 31 14:13:09 UTC 2024","","","",""
"","5","should parse french metropolitan phone number","french phone number without region code","Tue Dec 31 14:12:14 UTC 2024","passed","Tue Dec 31 14:12:14 UTC 2024","","","",""
"","173","should check all validated offers checkboxes","IndividualOffersScreen","Tue Dec 31 14:09:35 UTC 2024","passed","Tue Dec 31 14:09:36 UTC 2024","","on click on select all offers checkbox","",""
"","65","should use ""Structure"" instead of ""Lieu"" if the WIP_ENABLE_OFFER_ADDRESS FF is active","filter bookings by bookings period","Tue Dec 31 14:11:38 UTC 2024","passed","Tue Dec 31 14:11:38 UTC 2024","","","",""
"","109","should render validation step and navigate through steps","test SignupJourneyStepper","Tue Dec 31 14:11:36 UTC 2024","passed","Tue Dec 31 14:11:36 UTC 2024","","","",""
"","77","should display title and banner","OffersInstitutionList","Tue Dec 31 14:12:55 UTC 2024","passed","Tue Dec 31 14:12:55 UTC 2024","","","",""
"","84","should render collective offer stock form from requested offer","CollectiveOfferStockCreation","Tue Dec 31 14:12:58 UTC 2024","passed","Tue Dec 31 14:12:58 UTC 2024","","","",""
"","85","should change placeholder when user change country code","PhoneNumberInput","Tue Dec 31 14:12:35 UTC 2024","passed","Tue Dec 31 14:12:35 UTC 2024","","","",""
"","6","should render in venue tag if event adress type school is selected","FiltersTag","Tue Dec 31 14:11:04 UTC 2024","passed","Tue Dec 31 14:11:04 UTC 2024","","","",""
"","36","should call functions for notifications with parameter","useNotification","Tue Dec 31 14:13:34 UTC 2024","passed","Tue Dec 31 14:13:34 UTC 2024","","","",""
"","24","should display the text value of the button when is not loading and the button should be enabled","submit button","Tue Dec 31 14:14:25 UTC 2024","passed","Tue Dec 31 14:14:25 UTC 2024","","","",""
"","158","should render a table with header and data","StocksEventList","Tue Dec 31 14:10:01 UTC 2024","passed","Tue Dec 31 14:10:01 UTC 2024","","","",""
"","14","should call API with given path and formData and credentials by default and correct method","pcapiClient","Tue Dec 31 14:13:17 UTC 2024","passed","Tue Dec 31 14:13:17 UTC 2024","","postWithFormData","",""
"","4","should unobserve  on unmount","useIsElementVisible","Tue Dec 31 14:14:06 UTC 2024","passed","Tue Dec 31 14:14:06 UTC 2024","","","",""
"","75","should replace single option","SelectAutocomplete","Tue Dec 31 14:09:37 UTC 2024","passed","Tue Dec 31 14:09:37 UTC 2024","Simple","Options","",""
"","0","should throw error if parent is invalid","getNthParentFormValues","Tue Dec 31 14:14:08 UTC 2024","passed","Tue Dec 31 14:14:08 UTC 2024","","","",""
"","88","should render bookable offer summary creation with three edit links (details, stock, institution)","CollectiveOfferSummaryCreation","Tue Dec 31 14:12:23 UTC 2024","passed","Tue Dec 31 14:12:23 UTC 2024","","","",""
"","0","should singularize word if 1 offer","pluralize","Tue Dec 31 14:13:49 UTC 2024","passed","Tue Dec 31 14:13:49 UTC 2024","","words with ""x"" plural","",""
"","0","should sort collective offers in a ascending order","sortCollectiveOffers","Tue Dec 31 14:12:46 UTC 2024","passed","Tue Dec 31 14:12:46 UTC 2024","","","",""
"","42","should not display the text value of the button when is loading, and the button should be disabled","submit button","Tue Dec 31 14:14:25 UTC 2024","passed","Tue Dec 31 14:14:25 UTC 2024","","","",""
"","12","should show the offer's venue name","AdageOfferHeader","Tue Dec 31 14:11:13 UTC 2024","passed","Tue Dec 31 14:11:13 UTC 2024","","","",""
"","2","should validate the form for case: valid form without notification email","validationSchema OfferEducational","Tue Dec 31 14:11:46 UTC 2024","passed","Tue Dec 31 14:11:46 UTC 2024","","template offer","",""
"","0","should not return uai facet filter","adageFiltersToFacetFilters","Tue Dec 31 14:11:47 UTC 2024","passed","Tue Dec 31 14:11:47 UTC 2024","","","",""
"","2","should remove the notification when closing it","notificationsReducer","Tue Dec 31 14:14:18 UTC 2024","passed","Tue Dec 31 14:14:18 UTC 2024","","","",""
"","3","should redirect to maintenance page api v2 responds with status 503","Maintenance","Tue Dec 31 14:14:05 UTC 2024","passed","Tue Dec 31 14:14:05 UTC 2024","","","",""
"","0","should validate the form for case: price should be at least 0","validationSchema","Tue Dec 31 14:12:11 UTC 2024","passed","Tue Dec 31 14:12:11 UTC 2024","","","",""
"","21","should show the nearby (< 5km) offers when no results in initial search with no filters","OffersSuggestions","Tue Dec 31 14:10:57 UTC 2024","passed","Tue Dec 31 14:10:57 UTC 2024","","","",""
"","97","should notify an error when submit fail because offer was virtual without url","PriceCategories","Tue Dec 31 14:10:57 UTC 2024","passed","Tue Dec 31 14:10:57 UTC 2024","","","",""
"","15","shoud prefill form with initial values","CollectiveOfferVisibility","Tue Dec 31 14:10:00 UTC 2024","passed","Tue Dec 31 14:10:00 UTC 2024","","edition","",""
"","87","should render banner with venue information when offerer venue is selected","FormPracticalInformation","Tue Dec 31 14:12:06 UTC 2024","passed","Tue Dec 31 14:12:06 UTC 2024","","eventAddress conditionnal render","",""
"","0","should return list containing only BookingRecap matching keywords","filterBookingsRecap","Tue Dec 31 14:10:31 UTC 2024","passed","Tue Dec 31 14:10:31 UTC 2024","","by offer name","",""
"","61","should close Dialog on cancel button click","ButtonInvalidateToken","Tue Dec 31 14:14:02 UTC 2024","passed","Tue Dec 31 14:14:02 UTC 2024","","","",""
"","0","should be able to parse Greenwich Meridian coordinates correctly","parseDms","Tue Dec 31 14:12:44 UTC 2024","passed","Tue Dec 31 14:12:44 UTC 2024","","","",""
"","31","should show different links if offer is template","CollectiveCreationOfferNavigation","Tue Dec 31 14:10:31 UTC 2024","passed","Tue Dec 31 14:10:31 UTC 2024","","","",""
"","125","when clicking on ""Réinitialiser les filtres""","route Offers","Tue Dec 31 14:09:30 UTC 2024","passed","Tue Dec 31 14:09:31 UTC 2024","","should reset filters","",""
"","40","should update the selected omniSearch criteria when selecting an omniSearchCriteria","components | FilterByOmniSearch","Tue Dec 31 14:11:14 UTC 2024","passed","Tue Dec 31 14:11:14 UTC 2024","","","",""
"","0","should return 0 when first row bookingDate is the same as second row bookingDate","sortByBookingDate","Tue Dec 31 14:11:25 UTC 2024","passed","Tue Dec 31 14:11:25 UTC 2024","","","",""
"","130","should render when no image is given","test ImageUploaderOffer","Tue Dec 31 14:13:31 UTC 2024","passed","Tue Dec 31 14:13:31 UTC 2024","","","",""
"","34","should track click on dms timeline link","VenueOfferSteps","Tue Dec 31 14:12:26 UTC 2024","passed","Tue Dec 31 14:12:26 UTC 2024","","","",""
"","1","should return true if last provider name is Allociné","isAllocineOffer","Tue Dec 31 14:14:12 UTC 2024","passed","Tue Dec 31 14:14:12 UTC 2024","","","",""
"","40","should track on import","CinemaProviderForm","Tue Dec 31 14:12:17 UTC 2024","passed","Tue Dec 31 14:12:17 UTC 2024","","import form cinema provider for the first time","",""
"","180","should clear teacher suggestion when clearing institution","CollectiveOfferVisibility","Tue Dec 31 14:10:00 UTC 2024","passed","Tue Dec 31 14:10:00 UTC 2024","","","",""
"","0","should match diacritics characters with regular characters","searchPatternInOptions","Tue Dec 31 14:13:11 UTC 2024","passed","Tue Dec 31 14:13:11 UTC 2024","","","",""
"","110","should display publication confirmation modal when publication date is in the future","StatusToggleButton","Tue Dec 31 14:11:31 UTC 2024","passed","Tue Dec 31 14:11:31 UTC 2024","","","",""
"","1515","I should be able to find collective bookings by booking number","Search for collective bookings","Tue Dec 31 14:12:42 UTC 2024","passed","Tue Dec 31 14:12:43 UTC 2024","","","",""
"","17","should display when prebooking is activated","offer item","Tue Dec 31 14:11:44 UTC 2024","passed","Tue Dec 31 14:11:44 UTC 2024","","","",""
"","0","should return start datetime in user timezone when booking limit datetime is not valid","buildBookingLimitDatetimeForStockPayload","Tue Dec 31 14:13:20 UTC 2024","passed","Tue Dec 31 14:13:20 UTC 2024","","","",""
"","178","should have venue value be removed when user asks for all venues","route Offers","Tue Dec 31 14:09:25 UTC 2024","passed","Tue Dec 31 14:09:25 UTC 2024","","url query params","",""
"","44","should be able to unlink a venue already attached to the same bank account","LinkVenueDialog","Tue Dec 31 14:10:31 UTC 2024","passed","Tue Dec 31 14:10:31 UTC 2024","","","",""
"","303","should display modal when user try to quite venue creation","route VenueCreation","Tue Dec 31 14:12:32 UTC 2024","passed","Tue Dec 31 14:12:32 UTC 2024","","","",""
"","17","should display domain label in tag","FiltersTag","Tue Dec 31 14:11:04 UTC 2024","passed","Tue Dec 31 14:11:04 UTC 2024","","","",""
"","10872","It should put an offer in favorite","ADAGE discovery","Tue Dec 31 14:11:10 UTC 2024","passed","Tue Dec 31 14:11:21 UTC 2024","","","",""
"","2","should return undefined when durationHour is empty","IndividualOffer:commons:serializers","Tue Dec 31 14:10:36 UTC 2024","passed","Tue Dec 31 14:10:36 UTC 2024","","serializeDurationMinutes","",""
"","0","should return list containing only BookingRecap matching beneficiary email keywords","filterBookingsRecap","Tue Dec 31 14:10:31 UTC 2024","passed","Tue Dec 31 14:10:31 UTC 2024","","","",""
"","70","should display total number of offers in singular if one or no offer","IndividualOffersScreen","Tue Dec 31 14:09:34 UTC 2024","passed","Tue Dec 31 14:09:34 UTC 2024","","","",""
"","31","should not log breadcrumbs navigation to activity","test renderSignupJourneyStepper","Tue Dec 31 14:11:15 UTC 2024","passed","Tue Dec 31 14:11:15 UTC 2024","","","",""
"","8","should not display adage link when user is readonly","AdageHeader","Tue Dec 31 14:11:17 UTC 2024","passed","Tue Dec 31 14:11:17 UTC 2024","","","",""
"","3476","As a pro user, I should be able to update a venue","Create and update venue","Tue Dec 31 14:19:21 UTC 2024","passed","Tue Dec 31 14:19:24 UTC 2024","","","",""
"","27","should not be able to check all offers for performance reasons","IndividualOffersScreen","Tue Dec 31 14:09:35 UTC 2024","passed","Tue Dec 31 14:09:35 UTC 2024","","when user is admin","",""
"","61","should show the offer cards","offers","Tue Dec 31 14:09:31 UTC 2024","passed","Tue Dec 31 14:09:31 UTC 2024","","","",""
"","8","should display modification banner if venue has a bank account","BankAccountInfos","Tue Dec 31 14:12:54 UTC 2024","passed","Tue Dec 31 14:12:54 UTC 2024","","With OA feature flag enabled","",""
"","0","getHumanizeRelativeDistance(undefined) 	= '15 m'","getDistance","Tue Dec 31 14:14:14 UTC 2024","passed","Tue Dec 31 14:14:14 UTC 2024","","","",""
"","88","The email suggestion should be displayed when the email is invalid","EmailSpellCheckInput","Tue Dec 31 14:12:36 UTC 2024","passed","Tue Dec 31 14:12:36 UTC 2024","","","",""
"","0","should handle address fields","setDefaultInitialValuesFromOffer","Tue Dec 31 14:10:59 UTC 2024","passed","Tue Dec 31 14:10:59 UTC 2024","","","",""
"","199","should display details on selected institution","CollectiveOfferVisibility","Tue Dec 31 14:09:58 UTC 2024","passed","Tue Dec 31 14:09:59 UTC 2024","","","",""
"","13","should not initialize firebase on the adage iframe","App","Tue Dec 31 14:11:51 UTC 2024","passed","Tue Dec 31 14:11:51 UTC 2024","","","",""
"","171","should scroll into view and give focus","ScrollToFirstErrorAfterSubmit","Tue Dec 31 14:13:43 UTC 2024","passed","Tue Dec 31 14:13:43 UTC 2024","","","",""
"","137","should delete selected draft offers upon deletion","ActionsBar","Tue Dec 31 14:10:06 UTC 2024","passed","Tue Dec 31 14:10:06 UTC 2024","","","",""
"","0","should return all fields as read only when offer is pending","setFormReadOnlyFields","Tue Dec 31 14:10:59 UTC 2024","passed","Tue Dec 31 14:10:59 UTC 2024","","","",""
"","41","should call onConfirm when pressing Masquer button","DeactivationConfirmDialog","Tue Dec 31 14:12:58 UTC 2024","passed","Tue Dec 31 14:12:58 UTC 2024","","","",""
"","79","should render school tag when offer will happens in school","OfferCard component","Tue Dec 31 14:11:32 UTC 2024","passed","Tue Dec 31 14:11:32 UTC 2024","","","",""
"","142","should render the button menu","Layout","Tue Dec 31 14:12:13 UTC 2024","passed","Tue Dec 31 14:12:13 UTC 2024","on smaller screen sizes","side navigation","",""
"","170","should display a notification in case of draft deletion error","IndividualOfferRow","Tue Dec 31 14:10:22 UTC 2024","passed","Tue Dec 31 14:10:22 UTC 2024","draft delete button","action buttons","",""
"","324","should display an error message when login rate limit exceeded","SignIn","Tue Dec 31 14:10:07 UTC 2024","passed","Tue Dec 31 14:10:07 UTC 2024","","","",""
"","39","should disable start datetime, end datetime and event time inputs when form access is read only","FormStock","Tue Dec 31 14:10:47 UTC 2024","passed","Tue Dec 31 14:10:47 UTC 2024","","","",""
"","0","should build venues options","buildVenueOptions","Tue Dec 31 14:10:19 UTC 2024","passed","Tue Dec 31 14:10:19 UTC 2024","","","",""
"","20","should display error message when trying to publish offer bookable when the FF ENABLE_COLLECTIVE_NEW_STATUSES is enabled","ActionsBar","Tue Dec 31 14:09:34 UTC 2024","passed","Tue Dec 31 14:09:34 UTC 2024","","","",""
"","0","should return true when detecting change on beginningTime","hasChangesOnStockWithBookings","Tue Dec 31 14:13:24 UTC 2024","passed","Tue Dec 31 14:13:24 UTC 2024","","","",""
"","4","should render 1 place","StockEventSection","Tue Dec 31 14:13:00 UTC 2024","passed","Tue Dec 31 14:13:00 UTC 2024","","","",""
"","1","should check that localstorage is not available","localStorageAvailable","Tue Dec 31 14:14:26 UTC 2024","passed","Tue Dec 31 14:14:26 UTC 2024","","","",""
"","31","should render connect as banner if user has isImpersonated value is true","Layout","Tue Dec 31 14:12:14 UTC 2024","passed","Tue Dec 31 14:12:14 UTC 2024","","","",""
"","172","should warn that there are no results","SelectAutocomplete","Tue Dec 31 14:09:37 UTC 2024","passed","Tue Dec 31 14:09:37 UTC 2024","","filter","",""
"","262","should allow user to reset its pre-filters in the no bookings warning","components | BookingsRecap | Pro user","Tue Dec 31 14:09:27 UTC 2024","passed","Tue Dec 31 14:09:28 UTC 2024","","","",""
"","23","should redirect to page 404 when api has not found","App","Tue Dec 31 14:11:51 UTC 2024","passed","Tue Dec 31 14:11:51 UTC 2024","","","",""
"","70","should check the checkbox when the input value changes to 0","PriceInput","Tue Dec 31 14:12:26 UTC 2024","passed","Tue Dec 31 14:12:26 UTC 2024","","when ""Gratuit"" checkbox display is enabled","",""
"","34","should remove geolocation tag on click","FiltersTag","Tue Dec 31 14:11:04 UTC 2024","passed","Tue Dec 31 14:11:04 UTC 2024","","","",""
"","0","should be invalid if no special char","When validating a password","Tue Dec 31 14:14:25 UTC 2024","passed","Tue Dec 31 14:14:25 UTC 2024","","","",""
"","56","offer name and ean with a link to the offer when stock is a book","bookings offer cell","Tue Dec 31 14:11:46 UTC 2024","passed","Tue Dec 31 14:11:46 UTC 2024","","","",""
"","185","should not allow price to be greater than initial value","FormStock","Tue Dec 31 14:10:46 UTC 2024","passed","Tue Dec 31 14:10:47 UTC 2024","","","",""
"","58","should render summary page layout in edition","CollectiveOfferLayout","Tue Dec 31 14:13:12 UTC 2024","passed","Tue Dec 31 14:13:12 UTC 2024","","","",""
"","1","should create a template offer payload with email infos when the email option is checked in the form","createOfferPayload","Tue Dec 31 14:12:30 UTC 2024","passed","Tue Dec 31 14:12:30 UTC 2024","","","",""
"","0","should return array when offer is allociné","setFormReadOnlyFields","Tue Dec 31 14:12:38 UTC 2024","passed","Tue Dec 31 14:12:38 UTC 2024","","","",""
"","10","should display the EAC section when it has an adageId in homepage","PartnerPages","Tue Dec 31 14:12:04 UTC 2024","passed","Tue Dec 31 14:12:04 UTC 2024","","","",""
"","0","should handle default values for missing properties in the offer","setDefaultInitialValuesFromOffer","Tue Dec 31 14:10:59 UTC 2024","passed","Tue Dec 31 14:10:59 UTC 2024","","","",""
"","16","should display ""Récapitulatif"" step","IndividualOfferNavigation","Tue Dec 31 14:10:44 UTC 2024","passed","Tue Dec 31 14:10:44 UTC 2024","","on creation mode","",""
"","90","should display the date and time of the offer","CollectiveOfferSummary","Tue Dec 31 14:10:16 UTC 2024","passed","Tue Dec 31 14:10:16 UTC 2024","","","",""
"","384","should allow user to select national systems","screens | OfferEducational : creation offer type step","Tue Dec 31 14:10:52 UTC 2024","passed","Tue Dec 31 14:10:52 UTC 2024","","national systems","",""
"","1","should reject too short phone number","french phone number without region code","Tue Dec 31 14:12:14 UTC 2024","passed","Tue Dec 31 14:12:14 UTC 2024","","","",""
"","0","should return false when detecting change on other field","hasChangesOnStockWithBookings","Tue Dec 31 14:13:24 UTC 2024","passed","Tue Dec 31 14:13:24 UTC 2024","","","",""
"","170","should select template offer","OfferType","Tue Dec 31 14:10:16 UTC 2024","passed","Tue Dec 31 14:10:17 UTC 2024","","","",""
"","159","should have offerer address value when user filters by address","route Offers","Tue Dec 31 14:09:31 UTC 2024","passed","Tue Dec 31 14:09:31 UTC 2024","","With WIP_ENABLE_OFFER_ADDRESS FF","",""
"","56","should not display redirect modal if venue hasNonFreeOffers","Summary","Tue Dec 31 14:09:22 UTC 2024","passed","Tue Dec 31 14:09:22 UTC 2024","","On Creation","",""
"","59","should render stepper in creation","LabelBooking","Tue Dec 31 14:14:35 UTC 2024","passed","Tue Dec 31 14:14:36 UTC 2024","","","",""
"","0","should return true when collective offer with status ""PENDING"" and booking status ""USED"" and after beginningDatetime + 48h","canArchiveCollectiveOffer","Tue Dec 31 14:11:42 UTC 2024","passed","Tue Dec 31 14:11:42 UTC 2024","","","",""
"","388","should display next page when clicking on right arrow","route TemplateCollectiveOffers","Tue Dec 31 14:09:57 UTC 2024","passed","Tue Dec 31 14:09:57 UTC 2024","","page navigation","",""
"","227","should prefill the form with EAN search result","IndividualOfferDetails","Tue Dec 31 14:09:26 UTC 2024","passed","Tue Dec 31 14:09:26 UTC 2024","about EAN search > when a local draft offer is being created","on creation","",""
"","14","should say how many offers are selected when more than 1 offer are selected","ActionsBar","Tue Dec 31 14:10:06 UTC 2024","passed","Tue Dec 31 14:10:06 UTC 2024","","","",""
"","107","should display title, content and links","Callout","Tue Dec 31 14:13:08 UTC 2024","passed","Tue Dec 31 14:13:08 UTC 2024","","","",""
"","181","should select duplicate template offer","OfferType","Tue Dec 31 14:10:17 UTC 2024","passed","Tue Dec 31 14:10:17 UTC 2024","","","",""
"","1423","I should be able to search with a format ""Concert"" and see expected results","Search collective offers","Tue Dec 31 14:17:39 UTC 2024","passed","Tue Dec 31 14:17:41 UTC 2024","","","",""
"","5","should display venueOfferSteps if condition to display it","VenueOfferSteps","Tue Dec 31 14:11:04 UTC 2024","passed","Tue Dec 31 14:11:04 UTC 2024","","","",""
"","9","should not display the dialog when the button modal was not opened or was closed","AdageButtonFilter","Tue Dec 31 14:12:24 UTC 2024","passed","Tue Dec 31 14:12:24 UTC 2024","","","",""
"","72","should change venueType","screens:SignupJourney::ActivityForm","Tue Dec 31 14:10:49 UTC 2024","passed","Tue Dec 31 14:10:49 UTC 2024","","","",""
"","36","should display ""Tarifs"" and ""Dates & Capacités"" steps","IndividualOfferNavigation","Tue Dec 31 14:10:44 UTC 2024","passed","Tue Dec 31 14:10:44 UTC 2024","","when offer is an event","",""
"","58","should log add bank account on click add bank account link","AddBankAccountCallout","Tue Dec 31 14:12:08 UTC 2024","passed","Tue Dec 31 14:12:08 UTC 2024","","","",""
"","73","should render with manual address fields when WIP_ENABLE_OFFER_ADDRESS feature is enabled","VenueSettingsScreen","Tue Dec 31 14:10:40 UTC 2024","passed","Tue Dec 31 14:10:40 UTC 2024","","","",""
"","0","should return the type of coordinates","getCoordsType","Tue Dec 31 14:12:44 UTC 2024","passed","Tue Dec 31 14:12:44 UTC 2024","","","",""
"","133","should deactivate an offer and confirm","StatusToggleButton","Tue Dec 31 14:11:31 UTC 2024","passed","Tue Dec 31 14:11:31 UTC 2024","","","",""
"","0","should set null when quantity field is """"","serializeStockThingList","Tue Dec 31 14:12:40 UTC 2024","passed","Tue Dec 31 14:12:40 UTC 2024","","","",""
"","6","should display venue cancel link when not creating","VenueFormActionBar","Tue Dec 31 14:14:04 UTC 2024","passed","Tue Dec 31 14:14:04 UTC 2024","","","",""
"","0","should return the right offerer id","getCollectiveOffersSwrKeys","Tue Dec 31 14:13:44 UTC 2024","passed","Tue Dec 31 14:13:44 UTC 2024","","","",""
"","118","should close survey satisfaction","SurveySatisfaction","Tue Dec 31 14:13:10 UTC 2024","passed","Tue Dec 31 14:13:10 UTC 2024","","","",""
"","57","should return an error when trying to get offerer image","CollectiveEditionOfferNavigation","Tue Dec 31 14:10:11 UTC 2024","passed","Tue Dec 31 14:10:11 UTC 2024","","","",""
"","1","should return true when collective offer status is ACTIVE in summary page","canArchiveCollectiveOffer","Tue Dec 31 14:11:42 UTC 2024","passed","Tue Dec 31 14:11:42 UTC 2024","","","",""
"","4","should not display beneficiary name part when no first nor last name is given","BeneficiaryCell","Tue Dec 31 14:13:36 UTC 2024","passed","Tue Dec 31 14:13:36 UTC 2024","","","",""
"","0","should not return a date if the start date of the offer does not exist","adageOfferDates","Tue Dec 31 14:12:48 UTC 2024","passed","Tue Dec 31 14:12:48 UTC 2024","","getFormattedDatesForBookableOffer","",""
"","180","should submit onclick modal search button school level","OfferFilters","Tue Dec 31 14:10:34 UTC 2024","passed","Tue Dec 31 14:10:34 UTC 2024","","","",""
"","47","should display show all booking button when default booking id provided","bookings recap table's header","Tue Dec 31 14:13:38 UTC 2024","passed","Tue Dec 31 14:13:38 UTC 2024","","","",""
"","85","should display an unchecked by default checkbox to select all offers when user is not admin","TemplateCollectiveOffersScreen","Tue Dec 31 14:10:09 UTC 2024","passed","Tue Dec 31 14:10:09 UTC 2024","","","",""
"","13","should have an edit link to detail page when offer is draft","IndividualOfferRow","Tue Dec 31 14:10:22 UTC 2024","passed","Tue Dec 31 14:10:22 UTC 2024","","","",""
"","58","should not render the statistics link","Sitemap","Tue Dec 31 14:11:41 UTC 2024","passed","Tue Dec 31 14:11:41 UTC 2024","","when the offerer stats v2 feature is active","",""
"","53","should display geoloc button in localisation filter modal","OfferFilters","Tue Dec 31 14:10:35 UTC 2024","passed","Tue Dec 31 14:10:35 UTC 2024","","","",""
"","37","should activate all offers on click on ""Publier"" button when all offers are selected","ActionsBar","Tue Dec 31 14:10:06 UTC 2024","passed","Tue Dec 31 14:10:06 UTC 2024","","","",""
"","98","should render new offer playlist","AdageDiscovery","Tue Dec 31 14:12:29 UTC 2024","passed","Tue Dec 31 14:12:29 UTC 2024","","","",""
"","65","should show draft offers","route TemplateCollectiveOffers","Tue Dec 31 14:10:03 UTC 2024","passed","Tue Dec 31 14:10:03 UTC 2024","","","",""
"","0","should normalize null values","StockThingForm::utils::buildInitialValues","Tue Dec 31 14:12:34 UTC 2024","passed","Tue Dec 31 14:12:34 UTC 2024","","","",""
