"DESCRIPTION","DURATION IN MS","NAME","PARENT SUITE","START TIME","STATUS","STOP TIME","SUB SUITE","SUITE","TEST CLASS","TEST METHOD"
"","242","should show a success notification if nothing has been touched","screens:StocksEventEdition","Fri Jan 10 13:51:02 UTC 2025","passed","Fri Jan 10 13:51:03 UTC 2025","","","",""
"","2","should return mode ""edition""","useOfferWizardMode","Fri Jan 10 13:55:34 UTC 2025","passed","Fri Jan 10 13:55:34 UTC 2025","","","",""
"","79","should display offerer venues informations","VenueList","Fri Jan 10 13:54:04 UTC 2025","passed","Fri Jan 10 13:54:04 UTC 2025","","","",""
"","31","should render the description as text","Description","Fri Jan 10 13:55:27 UTC 2025","passed","Fri Jan 10 13:55:27 UTC 2025","","","",""
"","1","should return list containing only BookingRecap matching token keywords","filterBookingsRecap","Fri Jan 10 13:51:53 UTC 2025","passed","Fri Jan 10 13:51:53 UTC 2025","","","",""
"","55","should only make one call if the ids all come from the bookable offer","ActionsBar","Fri Jan 10 13:50:55 UTC 2025","passed","Fri Jan 10 13:50:55 UTC 2025","","","",""
"","267","should redirect to right url if requete params exist on submit","screens | OfferEducational : event address step","Fri Jan 10 13:54:06 UTC 2025","passed","Fri Jan 10 13:54:07 UTC 2025","","","",""
"","150","should close confirmation dialog when close button is clicked","UserReviewDialog","Fri Jan 10 13:53:20 UTC 2025","passed","Fri Jan 10 13:53:20 UTC 2025","","","",""
"","0","should map api response errors to form one with changes","serializeApiErrors","Fri Jan 10 13:53:17 UTC 2025","passed","Fri Jan 10 13:53:17 UTC 2025","","","",""
"","154","should display actionsBar when at least one offer is selected","CollectiveOffersScreen","Fri Jan 10 13:51:08 UTC 2025","passed","Fri Jan 10 13:51:08 UTC 2025","","","",""
"","71","should not display duplicate button for pending template offer","CollectiveActionsCells","Fri Jan 10 13:51:12 UTC 2025","passed","Fri Jan 10 13:51:12 UTC 2025","","","",""
"","61","should render adage header with link for discovery","AdageHeader","Fri Jan 10 13:52:38 UTC 2025","passed","Fri Jan 10 13:52:38 UTC 2025","","","",""
"","55","should render the cookie banner","App","Fri Jan 10 13:53:11 UTC 2025","passed","Fri Jan 10 13:53:11 UTC 2025","","","",""
"","63","should disable description, price and places when allowedAction CAN_EDIT_DISCOUNT doesnt exist and FF ENABLE_COLLECTIVE_NEW_STATUSES enable","","Fri Jan 10 13:51:55 UTC 2025","passed","Fri Jan 10 13:51:55 UTC 2025","","","",""
"","18","should display dms timeline if venue has dms application and ff active","CollectiveDataEdition","Fri Jan 10 13:51:07 UTC 2025","passed","Fri Jan 10 13:51:07 UTC 2025","","render","",""
"","7","should render steps for cancelled booking by fraud","collective timeline","Fri Jan 10 13:51:33 UTC 2025","passed","Fri Jan 10 13:51:33 UTC 2025","","","",""
"","471","should go back to the localisation main menu when reopening the localisation multiselect after having submitted it with no values selected","offersSearch component","Fri Jan 10 13:51:41 UTC 2025","passed","Fri Jan 10 13:51:41 UTC 2025","","","",""
"","12","should initialize with current image","useCollectiveOfferImageUpload","Fri Jan 10 13:53:37 UTC 2025","passed","Fri Jan 10 13:53:37 UTC 2025","","","",""
"","1","should return true when collective offer status is DRAFT","canArchiveCollectiveOffer","Fri Jan 10 13:53:04 UTC 2025","passed","Fri Jan 10 13:53:04 UTC 2025","","","",""
"","52","should not disable price, place number, start datetime, end datetime and event time when allowedAction CAN_EDIT_DISCOUNT and CAN_EDIT_DATES exists and ENABLE_COLLECTIVE_NEW_STATUSES is enabled","FormStock","Fri Jan 10 13:52:07 UTC 2025","passed","Fri Jan 10 13:52:07 UTC 2025","","","",""
"","12","should disable next page button on last page","Pagination","Fri Jan 10 13:55:00 UTC 2025","passed","Fri Jan 10 13:55:00 UTC 2025","","","",""
"","230","should allow user to delete stock from a synchronized offer","screens:StocksEventEdition","Fri Jan 10 13:51:00 UTC 2025","passed","Fri Jan 10 13:51:00 UTC 2025","","","",""
"","14","should apply bookingBeneficiary filter when typing keywords for beneficiary name or email","components | FilterByOmniSearch","Fri Jan 10 13:52:36 UTC 2025","passed","Fri Jan 10 13:52:36 UTC 2025","","","",""
"","100","should have a CSV download button","components | BookingsRecap | Pro user","Fri Jan 10 13:50:54 UTC 2025","passed","Fri Jan 10 13:50:54 UTC 2025","","","",""
"","11","should not initialize firebase on the adage iframe","App","Fri Jan 10 13:53:11 UTC 2025","passed","Fri Jan 10 13:53:11 UTC 2025","","","",""
"","11","should not display adage publish button when offer is pending","OfferEducationalActions","Fri Jan 10 13:51:49 UTC 2025","passed","Fri Jan 10 13:51:49 UTC 2025","","","",""
"","281","should close autocomplete panel when escape key pressed","Autocomplete","Fri Jan 10 13:52:04 UTC 2025","passed","Fri Jan 10 13:52:04 UTC 2025","","","",""
"","72","should display Opening hours details message","route VenueEdition","Fri Jan 10 13:51:47 UTC 2025","passed","Fri Jan 10 13:51:47 UTC 2025","","","",""
"","30","should contain a link with the offer name and details link","ollectiveOfferRow","Fri Jan 10 13:51:15 UTC 2025","passed","Fri Jan 10 13:51:15 UTC 2025","","offer title","",""
"","453","should set min value for ending hours","OpeningHoursForm","Fri Jan 10 13:52:13 UTC 2025","passed","Fri Jan 10 13:52:13 UTC 2025","","","",""
"","500","should filter offers given status filter when clicking on ""Appliquer""","route TemplateCollectiveOffers","Fri Jan 10 13:51:16 UTC 2025","passed","Fri Jan 10 13:51:16 UTC 2025","status filters","filters","",""
"","34","should display modify and cancel button on edition","AllocineProviderForm","Fri Jan 10 13:51:49 UTC 2025","passed","Fri Jan 10 13:51:50 UTC 2025","","","",""
"","3","should return the initial values if the venue cant be found","applyVenueDefaultsToFormValues","Fri Jan 10 13:53:42 UTC 2025","passed","Fri Jan 10 13:53:42 UTC 2025","","","",""
"","0","should render 'Votre stock est expiré.'","getStockWarningText","Fri Jan 10 13:55:24 UTC 2025","passed","Fri Jan 10 13:55:24 UTC 2025","","","",""
"","2","should return false if the element is null or undefined","isCollectiveOffer","Fri Jan 10 13:55:22 UTC 2025","passed","Fri Jan 10 13:55:22 UTC 2025","","","",""
"","5","should not display the dialog when the button modal was not opened or was closed","AdageButtonFilter","Fri Jan 10 13:53:45 UTC 2025","passed","Fri Jan 10 13:53:45 UTC 2025","","","",""
"","4","should not display disffuse help if the localstorage is not available","DiffuseHelp","Fri Jan 10 13:55:35 UTC 2025","passed","Fri Jan 10 13:55:35 UTC 2025","","","",""
"","8","should show the offer location for an offer at the offerer venue","AdageOfferInfoSection","Fri Jan 10 13:53:08 UTC 2025","passed","Fri Jan 10 13:53:08 UTC 2025","","","",""
"","36","should not display ""Sélectionner un SIRET"" button for venue that has pricing point","LinkVenueDialog","Fri Jan 10 13:51:52 UTC 2025","passed","Fri Jan 10 13:51:52 UTC 2025","","","",""
"","46","should redirect to previous page on click to Retour","StocksEventCreation","Fri Jan 10 13:52:43 UTC 2025","passed","Fri Jan 10 13:52:43 UTC 2025","","","",""
"","5","should display venueOfferSteps if condition to display it","VenueOfferSteps","Fri Jan 10 13:52:26 UTC 2025","passed","Fri Jan 10 13:52:26 UTC 2025","","","",""
"","0","when offer is not template","computeURLCollectiveOfferId","Fri Jan 10 13:56:02 UTC 2025","passed","Fri Jan 10 13:56:02 UTC 2025","","","",""
"","228","should load offers with selected period beginning date","route CollectiveOffers","Fri Jan 10 13:51:03 UTC 2025","passed","Fri Jan 10 13:51:03 UTC 2025","on click on search button","filters","",""
"","104","should call callback action when clicking the button","ButtonLink","Fri Jan 10 13:54:18 UTC 2025","passed","Fri Jan 10 13:54:18 UTC 2025","","","",""
"","121","should archive an offer bookable","CollectiveEditionOfferNavigation","Fri Jan 10 13:51:33 UTC 2025","passed","Fri Jan 10 13:51:33 UTC 2025","","","",""
"","112","should fill siret field only with numbers","screens:SignupJourney::OffererForm","Fri Jan 10 13:53:01 UTC 2025","passed","Fri Jan 10 13:53:01 UTC 2025","","","",""
"","44","should render stepper in creation","LabelBooking","Fri Jan 10 13:55:57 UTC 2025","passed","Fri Jan 10 13:55:57 UTC 2025","","","",""
"","1","should reject non dom-tom phone number with region code","dom-tom phone number with region code","Fri Jan 10 13:53:35 UTC 2025","passed","Fri Jan 10 13:53:35 UTC 2025","","","",""
"","296","should render collective offer creation form","CollectiveOfferCreation","Fri Jan 10 13:54:16 UTC 2025","passed","Fri Jan 10 13:54:17 UTC 2025","","","",""
"","2","should return the offer institution and teacher names","adageOfferInstitution","Fri Jan 10 13:54:55 UTC 2025","passed","Fri Jan 10 13:54:55 UTC 2025","","getBookableOfferInstitutionAndTeacherName","",""
"","0","should return list containing only BookingRecap matching ISBN keywords","filterBookingsRecap","Fri Jan 10 13:51:53 UTC 2025","passed","Fri Jan 10 13:51:53 UTC 2025","","","",""
"","431","should be able to reset the password when token is ok","ResetPassword","Fri Jan 10 13:55:03 UTC 2025","passed","Fri Jan 10 13:55:04 UTC 2025","","","",""
"","140","should display Declaration information message","Statement of Declaration page","Fri Jan 10 13:56:01 UTC 2025","passed","Fri Jan 10 13:56:01 UTC 2025","","","",""
"","18","should be ""illimité"" when at least one stock of the individual offer is unlimited","IndividualOfferRow","Fri Jan 10 13:51:42 UTC 2025","passed","Fri Jan 10 13:51:42 UTC 2025","","offer remaining quantity or institution","",""
"","10","should not show the dates selection form section when the offer is permanent","FormDates","Fri Jan 10 13:52:49 UTC 2025","passed","Fri Jan 10 13:52:49 UTC 2025","","","",""
"","0","should block in creation when going outside of form","shouldBlockNavigation","Fri Jan 10 13:55:09 UTC 2025","passed","Fri Jan 10 13:55:09 UTC 2025","","","",""
"","102","should be able to submit the form but only close the modal if no changes were made","LinkVenueDialog","Fri Jan 10 13:52:55 UTC 2025","passed","Fri Jan 10 13:52:56 UTC 2025","","","",""
"","57","should display booking details if row is expanded","CollectiveTableRow","Fri Jan 10 13:54:01 UTC 2025","passed","Fri Jan 10 13:54:01 UTC 2025","","","",""
"","1","should return 0 when first row offer name is the same as second row offer name","sortByOfferName","Fri Jan 10 13:52:46 UTC 2025","passed","Fri Jan 10 13:52:46 UTC 2025","","","",""
"","27","should display the isDuo checkbox checked by default on creation","AllocineProviderForm","Fri Jan 10 13:51:49 UTC 2025","passed","Fri Jan 10 13:51:49 UTC 2025","","","",""
"","2","should return true if categoryId=LIVRE and has a musicType as a conditional field","hasMusicType","Fri Jan 10 13:51:39 UTC 2025","passed","Fri Jan 10 13:51:39 UTC 2025","","","",""
"","286","should check content for accessibility","Stepper","Fri Jan 10 13:53:44 UTC 2025","passed","Fri Jan 10 13:53:45 UTC 2025","","","",""
"","28","should display the right wording without the OA FF","components | SiretOrCommentFields","Fri Jan 10 13:51:44 UTC 2025","passed","Fri Jan 10 13:51:44 UTC 2025","","OA feature flag","",""
"","6","should show a generic distance to school if the offer is a preview","AdageOfferPartnerPanel","Fri Jan 10 13:53:14 UTC 2025","passed","Fri Jan 10 13:53:14 UTC 2025","","","",""
"","8","should show the number of dates","OfferNameCell","Fri Jan 10 13:52:36 UTC 2025","passed","Fri Jan 10 13:52:36 UTC 2025","","","",""
"","73","should render collective offer stock form from requested offer","CollectiveOfferStockCreation","Fri Jan 10 13:54:17 UTC 2025","passed","Fri Jan 10 13:54:17 UTC 2025","","","",""
"","104","should call phone validation with country code","PhoneNumberInput","Fri Jan 10 13:53:57 UTC 2025","passed","Fri Jan 10 13:53:57 UTC 2025","","","",""
"","76","should show the normal contact form","FormContact","Fri Jan 10 13:55:19 UTC 2025","passed","Fri Jan 10 13:55:19 UTC 2025","","","",""
"","41","should display the acces libre callout for permanent venues","route VenueEdition","Fri Jan 10 13:51:47 UTC 2025","passed","Fri Jan 10 13:51:47 UTC 2025","","","",""
"","0","should not block when following template creation flow (from recapitulatif to confirmation)","components | RouteLeavingGuardCollectiveOfferCreation","Fri Jan 10 13:52:57 UTC 2025","passed","Fri Jan 10 13:52:57 UTC 2025","","","",""
"","106","should show the discard dialog on cancel click","LinkVenueDialog","Fri Jan 10 13:52:56 UTC 2025","passed","Fri Jan 10 13:52:56 UTC 2025","","","",""
"","9","should render for provider ""leslibraires.fr""","SynchronizedProviderInformation","Fri Jan 10 13:55:15 UTC 2025","passed","Fri Jan 10 13:55:15 UTC 2025","","","",""
"","0","should not block when following creation flow (from stocks to visibilite)","components | RouteLeavingGuardCollectiveOfferCreation","Fri Jan 10 13:52:57 UTC 2025","passed","Fri Jan 10 13:52:57 UTC 2025","","","",""
"","1","should return true when collective offer status is ""EXPIRED"" and booking status ""CANCELLED""","canArchiveCollectiveOffer","Fri Jan 10 13:53:04 UTC 2025","passed","Fri Jan 10 13:53:04 UTC 2025","","","",""
"","147","should render component with informations on edition","Summary","Fri Jan 10 13:50:41 UTC 2025","passed","Fri Jan 10 13:50:41 UTC 2025","","","",""
"","74","should collapse one menu at a time","SideNavLinks","Fri Jan 10 13:52:47 UTC 2025","passed","Fri Jan 10 13:52:47 UTC 2025","","small height devices","",""
"","19","should show an error message when the siret is invalid","OffersInstantSearch","Fri Jan 10 13:53:57 UTC 2025","passed","Fri Jan 10 13:53:57 UTC 2025","","","",""
"","41","should called onConfirm button onclick","DeactivationConfirmDialog","Fri Jan 10 13:54:24 UTC 2025","passed","Fri Jan 10 13:54:24 UTC 2025","","","",""
"","15","should render link when needed","Stepper","Fri Jan 10 13:53:45 UTC 2025","passed","Fri Jan 10 13:53:45 UTC 2025","","","",""
"","0","should parse a list body","getHumanReadableApiError","Fri Jan 10 13:53:17 UTC 2025","passed","Fri Jan 10 13:53:17 UTC 2025","","","",""
"","45","should close the Callout","Callout","Fri Jan 10 13:54:29 UTC 2025","passed","Fri Jan 10 13:54:29 UTC 2025","","","",""
"","0","should return false if last provider is null","isAllocineOffer","Fri Jan 10 13:55:34 UTC 2025","passed","Fri Jan 10 13:55:34 UTC 2025","","","",""
"","57","render component","CollectiveOfferStockSection","Fri Jan 10 13:55:23 UTC 2025","passed","Fri Jan 10 13:55:23 UTC 2025","","","",""
"","0","should not block when leaving confirmation page","components | RouteLeavingGuardCollectiveOfferCreation","Fri Jan 10 13:52:57 UTC 2025","passed","Fri Jan 10 13:52:57 UTC 2025","","","",""
"","32","should pluralize number of stocks sold out when at least two stocks are sold out","IndividualOfferRow","Fri Jan 10 13:51:42 UTC 2025","passed","Fri Jan 10 13:51:42 UTC 2025","","when offer is an event product","",""
"","1","should serialize data for stock thing edition","serializeStockThingList","Fri Jan 10 13:54:01 UTC 2025","passed","Fri Jan 10 13:54:01 UTC 2025","","","",""
"","1","should return false when collective template offer is not archivable","isCollectiveOfferArchivable","Fri Jan 10 13:54:55 UTC 2025","passed","Fri Jan 10 13:54:55 UTC 2025","","","",""
"","21","should display pricing point section when venue has no siret","ReimbursementFields","Fri Jan 10 13:54:15 UTC 2025","passed","Fri Jan 10 13:54:15 UTC 2025","","","",""
"","3","should render { displayedStatus: 'BOOKED', expectedLabel: 'réservée' } status","CollectiveStatusLabel","Fri Jan 10 13:53:28 UTC 2025","passed","Fri Jan 10 13:53:28 UTC 2025","","","",""
"","118","should render App and children components when isMaintenanceActivated is false","App","Fri Jan 10 13:53:11 UTC 2025","passed","Fri Jan 10 13:53:11 UTC 2025","","","",""
"","56","should render contents","ActionsBarSticky","Fri Jan 10 13:55:19 UTC 2025","passed","Fri Jan 10 13:55:19 UTC 2025","","","",""
"","1","should reformat french phone number with region code and invalid prefix","french phone number with region code","Fri Jan 10 13:53:35 UTC 2025","passed","Fri Jan 10 13:53:35 UTC 2025","","","",""
"","99","should change placeholder when user change country code","PhoneNumberInput","Fri Jan 10 13:53:57 UTC 2025","passed","Fri Jan 10 13:53:57 UTC 2025","","","",""
"","124","should display an unchecked by default checkbox to select all offers when user is not admin","CollectiveOffersScreen","Fri Jan 10 13:51:07 UTC 2025","passed","Fri Jan 10 13:51:07 UTC 2025","","","",""
"","4","should convert from my locale to departement timezone and give result in utc","convertFromLocalTimeToVenueTimezoneInUtc","Fri Jan 10 13:53:16 UTC 2025","passed","Fri Jan 10 13:53:16 UTC 2025","","","",""
"","0","should set null when quantity field is """"","serializeStockThingList","Fri Jan 10 13:54:01 UTC 2025","passed","Fri Jan 10 13:54:01 UTC 2025","","","",""
"","12","should apply bookingToken filter when typing keywords for contremarque","components | FilterByOmniSearch","Fri Jan 10 13:52:36 UTC 2025","passed","Fri Jan 10 13:52:36 UTC 2025","","","",""
"","91","should render component with informations","Summary","Fri Jan 10 13:50:41 UTC 2025","passed","Fri Jan 10 13:50:41 UTC 2025","","On Creation","",""
"","281","should load offers with selected venue filter","route TemplateCollectiveOffers","Fri Jan 10 13:51:17 UTC 2025","passed","Fri Jan 10 13:51:18 UTC 2025","on click on search button","filters","",""
"","13","should see activity screen if no activity data is set but an offerer is set","ValidationScreen","Fri Jan 10 13:51:48 UTC 2025","passed","Fri Jan 10 13:51:48 UTC 2025","","","",""
"","2","should generate stocks on a monthly basis every beginning of month","onSubmit","Fri Jan 10 13:51:35 UTC 2025","passed","Fri Jan 10 13:51:35 UTC 2025","","","",""
"","45","should display departments and academies button in localisation filter modal","OfferFilters","Fri Jan 10 13:51:57 UTC 2025","passed","Fri Jan 10 13:51:57 UTC 2025","","","",""
"","14","should display ""Sauvegarder le brouillon"" and ""Publier l’offre"" buttons on summary page","IndividualOffer::ActionBar","Fri Jan 10 13:53:26 UTC 2025","passed","Fri Jan 10 13:53:26 UTC 2025","","on creation","",""
"","58","should not display tab navigation for permanent venues","route VenueEdition","Fri Jan 10 13:51:47 UTC 2025","passed","Fri Jan 10 13:51:47 UTC 2025","","","",""
"","9","should display creation date info","VenueProviderCard","Fri Jan 10 13:52:53 UTC 2025","passed","Fri Jan 10 13:52:53 UTC 2025","","public API provider","",""
"","43","should display the status label","IndividualBookingsStatusCell","Fri Jan 10 13:52:22 UTC 2025","passed","Fri Jan 10 13:52:22 UTC 2025","","","",""
"","1439","should submit the right opening hours hours","OpeningHoursForm","Fri Jan 10 13:52:11 UTC 2025","passed","Fri Jan 10 13:52:12 UTC 2025","","","",""
"","0","should return true when collective offer status is INACTIVE in summary page","canArchiveCollectiveOffer","Fri Jan 10 13:53:04 UTC 2025","passed","Fri Jan 10 13:53:04 UTC 2025","","","",""
"","6","should parse french metropolitan phone number","french phone number without region code","Fri Jan 10 13:53:35 UTC 2025","passed","Fri Jan 10 13:53:35 UTC 2025","","","",""
"","0","should not disable fields when there is no offer and no ean search was performed","setFormReadOnlyFields","Fri Jan 10 13:51:39 UTC 2025","passed","Fri Jan 10 13:51:39 UTC 2025","","","",""
"","39","should limit ending date to beggining date when value","FormDates","Fri Jan 10 13:52:49 UTC 2025","passed","Fri Jan 10 13:52:49 UTC 2025","","","",""
"","94","should display navigation for collective offer in creation","CollectiveCreationOfferNavigation","Fri Jan 10 13:51:52 UTC 2025","passed","Fri Jan 10 13:51:52 UTC 2025","","","",""
"","130","should display actionsBar when at least one offer is selected","TemplateCollectiveOffersScreen","Fri Jan 10 13:51:31 UTC 2025","passed","Fri Jan 10 13:51:31 UTC 2025","","","",""
"","0","should serialize patchBody with empty address label and manual edition false","IndividualOffer:commons:serializers","Fri Jan 10 13:51:57 UTC 2025","passed","Fri Jan 10 13:51:57 UTC 2025","","serializePatchOffer","",""
"","95","should filters venue id on venue filter if provided","offersSearch component","Fri Jan 10 13:51:41 UTC 2025","passed","Fri Jan 10 13:51:41 UTC 2025","","","",""
"","392","should display an error message when there is an api error","CollectiveOfferConfirmation","Fri Jan 10 13:52:30 UTC 2025","passed","Fri Jan 10 13:52:30 UTC 2025","","","",""
"","76","should be able to submit when price field is filled with a decimal on creation","AllocineProviderForm","Fri Jan 10 13:51:49 UTC 2025","passed","Fri Jan 10 13:51:49 UTC 2025","","","",""
"","0","should return not virtual when subCatagory is OFFLINE only","getFilteredVenueList","Fri Jan 10 13:53:41 UTC 2025","passed","Fri Jan 10 13:53:41 UTC 2025","","getFilteredVenueListBySubcategory","",""
"","14","should not display the create offer button if the user isn't Admin","StatisticsDashboard","Fri Jan 10 13:53:23 UTC 2025","passed","Fri Jan 10 13:53:23 UTC 2025","","","",""
"","264","should have the status in the url value when user filters by status","route TemplateCollectiveOffers","Fri Jan 10 13:52:12 UTC 2025","passed","Fri Jan 10 13:52:12 UTC 2025","","url query params","",""
"","157","should display the right wording without the OA FF","App","Fri Jan 10 13:53:49 UTC 2025","passed","Fri Jan 10 13:53:49 UTC 2025","","OA feature flag","",""
"","2","should deduce the offer subtype PHYSICAL_EVENT from the query param","getOfferSubtypeFromParam","Fri Jan 10 13:52:37 UTC 2025","passed","Fri Jan 10 13:52:37 UTC 2025","","","",""
"","0","should return -1 when 1st row beneficiary name strictly comes before 2nd row beneficiary name","sortByBeneficiaryName","Fri Jan 10 13:52:46 UTC 2025","passed","Fri Jan 10 13:52:46 UTC 2025","","","",""
"","122","should display validation screen on click next step button","screens:SignupJourney::Activity","Fri Jan 10 13:52:40 UTC 2025","passed","Fri Jan 10 13:52:40 UTC 2025","","","",""
"","1","should unselect all departments","handleAllFranceDepartmentOptions","Fri Jan 10 13:54:09 UTC 2025","passed","Fri Jan 10 13:54:09 UTC 2025","","","",""
"","11","should call API with given path and formData and credentials by default and correct method","pcapiClient","Fri Jan 10 13:54:37 UTC 2025","passed","Fri Jan 10 13:54:37 UTC 2025","","postWithFormData","",""
"","5","should not show the favorite button if the user is not admin","AdageOfferHeader","Fri Jan 10 13:52:33 UTC 2025","passed","Fri Jan 10 13:52:33 UTC 2025","","","",""
"","74","should display a radio input","BaseRadio","Fri Jan 10 13:55:28 UTC 2025","passed","Fri Jan 10 13:55:28 UTC 2025","","","",""
"","33","should render summary page layout in edition","CollectiveOfferLayout","Fri Jan 10 13:54:33 UTC 2025","passed","Fri Jan 10 13:54:33 UTC 2025","","","",""
"","0","should block when leaving summary creation","components | RouteLeavingGuardCollectiveOfferCreation","Fri Jan 10 13:52:57 UTC 2025","passed","Fri Jan 10 13:52:57 UTC 2025","","","",""
"","0","should not translate user inputs for collective offers","translate","Fri Jan 10 13:53:33 UTC 2025","passed","Fri Jan 10 13:53:33 UTC 2025","","","",""
"","142","should have offer name value be removed when name search value is an empty string","route CollectiveOffers","Fri Jan 10 13:52:18 UTC 2025","passed","Fri Jan 10 13:52:18 UTC 2025","","url query params","",""
"","12","should render steps for validated booking and missing bankInformation","collective timeline","Fri Jan 10 13:51:34 UTC 2025","passed","Fri Jan 10 13:51:34 UTC 2025","","validated booking","",""
"","1","should return the price as free if the offer is bookable and the price is zero","getOfferTags","Fri Jan 10 13:53:03 UTC 2025","passed","Fri Jan 10 13:53:03 UTC 2025","","","",""
"","1","should match only if every word of the pattern were found in the label","searchPatternInOptions","Fri Jan 10 13:54:31 UTC 2025","passed","Fri Jan 10 13:54:31 UTC 2025","","","",""
"","22","should add the currency sign to a price","formatPrice","Fri Jan 10 13:55:52 UTC 2025","passed","Fri Jan 10 13:55:52 UTC 2025","","","",""
"","0","should not block when following creation flow (from recapitulatif to confirmation)","components | RouteLeavingGuardCollectiveOfferCreation","Fri Jan 10 13:52:57 UTC 2025","passed","Fri Jan 10 13:52:57 UTC 2025","","","",""
"","1","should build subcategory options","buildSubcategoryOptions","Fri Jan 10 13:51:39 UTC 2025","passed","Fri Jan 10 13:51:39 UTC 2025","","","",""
"","12","should show the offer title even if it's a preview of the offer","AdageOfferHeader","Fri Jan 10 13:52:32 UTC 2025","passed","Fri Jan 10 13:52:32 UTC 2025","","","",""
"","9","should render with pending bank account if status is WITH_PENDING_CORRECTIONS","ReimbursementBankAccount","Fri Jan 10 13:51:35 UTC 2025","passed","Fri Jan 10 13:51:35 UTC 2025","","","",""
"","15","should display right info when is visible and in venue form","PartnerPageIndividualSection","Fri Jan 10 13:53:43 UTC 2025","passed","Fri Jan 10 13:53:43 UTC 2025","","","",""
"","39","should set initial page title","usePageTitle","Fri Jan 10 13:54:27 UTC 2025","passed","Fri Jan 10 13:54:27 UTC 2025","","","",""
"","226","should add notification mail input when button is clicked","FormNotifications","Fri Jan 10 13:54:03 UTC 2025","passed","Fri Jan 10 13:54:04 UTC 2025","","","",""
"","12","should show the intervention areas","AdageOfferInfoSection","Fri Jan 10 13:53:08 UTC 2025","passed","Fri Jan 10 13:53:08 UTC 2025","","","",""
