"DESCRIPTION","DURATION IN MS","NAME","PARENT SUITE","START TIME","STATUS","STOP TIME","SUB SUITE","SUITE","TEST CLASS","TEST METHOD"
"","518","should require an offer venue selection from the user","screens | OfferEducational : event address step","Mon Feb 03 13:34:37 UTC 2025","passed","Mon Feb 03 13:34:38 UTC 2025","","when there are multiple venues managed by the offerer","",""
"","14","should verify user link is not valid and redirect to connexion even if the error is not an ApiError","src | components | pages | Signup | validation","Mon Feb 03 13:35:55 UTC 2025","passed","Mon Feb 03 13:35:55 UTC 2025","","","",""
"","6","should not render the add link venue banner if the offerer  hasValidBankAccount = true and venuesWithNonFreeOffersWithoutBankAccounts = []","LinkVenueCallout","Mon Feb 03 13:35:01 UTC 2025","passed","Mon Feb 03 13:35:01 UTC 2025","","With FF enabled","",""
"","0","when offer is not template","computeURLCollectiveOfferId","Mon Feb 03 13:38:23 UTC 2025","passed","Mon Feb 03 13:38:23 UTC 2025","","","",""
"","36","should render empty siret field error","screens:SignupJourney::OffererForm","Mon Feb 03 13:35:17 UTC 2025","passed","Mon Feb 03 13:35:17 UTC 2025","","","",""
"","27","should display format when ff is active","CollectiveOfferSummary","Mon Feb 03 13:33:48 UTC 2025","passed","Mon Feb 03 13:33:48 UTC 2025","","","",""
"","71","should hide status filters when clicking outside the modal","IndividualOffersScreen","Mon Feb 03 13:33:03 UTC 2025","passed","Mon Feb 03 13:33:03 UTC 2025","","","",""
"","25","should disabled confirm button","ConfirmDialog","Mon Feb 03 13:37:35 UTC 2025","passed","Mon Feb 03 13:37:35 UTC 2025","","","",""
"","50","should display the EAC section when no adage","PartnerPages","Mon Feb 03 13:35:42 UTC 2025","passed","Mon Feb 03 13:35:42 UTC 2025","","","",""
"","58","should not display column titles when no offers are returned","route TemplateCollectiveOffers","Mon Feb 03 13:33:26 UTC 2025","passed","Mon Feb 03 13:33:26 UTC 2025","status filters","filters","",""
"","0","should return false when booking quantity is 0","hasChangesOnStockWithBookings","Mon Feb 03 13:37:06 UTC 2025","passed","Mon Feb 03 13:37:06 UTC 2025","","","",""
"","7","should render correctly when offer cannot be duo","StockEventSection","Mon Feb 03 13:38:01 UTC 2025","passed","Mon Feb 03 13:38:01 UTC 2025","","","",""
"","223","should display error for virtual offer without url","screens:StocksThing","Mon Feb 03 13:33:12 UTC 2025","passed","Mon Feb 03 13:33:12 UTC 2025","","","",""
"","2","should return error message when the booking cant be validated and not reimbursed yet","getBookingFailure","Mon Feb 03 13:36:37 UTC 2025","passed","Mon Feb 03 13:36:37 UTC 2025","","","",""
"","2","should not delete image if offer initially had one and onImageDelete was not called","useCollectiveOfferImageUpload","Mon Feb 03 13:35:55 UTC 2025","passed","Mon Feb 03 13:35:55 UTC 2025","","","",""
"","13","should not see archive button when offer is not archivable","CollectiveEditionOfferNavigation","Mon Feb 03 13:33:43 UTC 2025","passed","Mon Feb 03 13:33:43 UTC 2025","","","",""
"","49","should not render venues linked to bank account with only one bank account","ReimbursementBankAccount","Mon Feb 03 13:33:45 UTC 2025","passed","Mon Feb 03 13:33:45 UTC 2025","","","",""
"","11","should not render component on getVenueTypes error","screens:SignupJourney::Activity","Mon Feb 03 13:34:57 UTC 2025","passed","Mon Feb 03 13:34:57 UTC 2025","","","",""
"","1","should sort offerer addresses alphabetically","formatAndOrderVenues","Mon Feb 03 13:35:41 UTC 2025","passed","Mon Feb 03 13:35:41 UTC 2025","","formatAndOrderAddresses","",""
"","335","the user should see the home offer steps if they do not have any venues","Homepage","Mon Feb 03 13:34:36 UTC 2025","passed","Mon Feb 03 13:34:37 UTC 2025","","","",""
"","67","should return an error when booking cancellation failed","collectiveActionButton api call","Mon Feb 03 13:34:31 UTC 2025","passed","Mon Feb 03 13:34:31 UTC 2025","","","",""
"","217","should render physical stock thing","screens:StocksThing","Mon Feb 03 13:33:11 UTC 2025","passed","Mon Feb 03 13:33:11 UTC 2025","","","",""
"","20","should show the cultural partner contact button","AdageOfferPartnerPanel","Mon Feb 03 13:35:33 UTC 2025","passed","Mon Feb 03 13:35:33 UTC 2025","","","",""
"","1","refuses image with invalid type","image constraints","Mon Feb 03 13:35:35 UTC 2025","passed","Mon Feb 03 13:35:35 UTC 2025","checks file type","formats","",""
"","40","should render stats when above 0","OfferStats","Mon Feb 03 13:36:05 UTC 2025","passed","Mon Feb 03 13:36:05 UTC 2025","","","",""
"","12","should link the input to its description when defined","TextInput","Mon Feb 03 13:36:20 UTC 2025","passed","Mon Feb 03 13:36:20 UTC 2025","","","",""
"","1","refuse non bitmap file","image constraints","Mon Feb 03 13:35:35 UTC 2025","passed","Mon Feb 03 13:35:35 UTC 2025","checks file binary","formats","",""
"","13","should announce the last link as the current page for assistive technologies","Breadcrumb","Mon Feb 03 13:37:53 UTC 2025","passed","Mon Feb 03 13:37:53 UTC 2025","","","",""
"","56","should not display survey satisfaction","offers","Mon Feb 03 13:32:58 UTC 2025","passed","Mon Feb 03 13:32:58 UTC 2025","","","",""
"","1","should return start datetime in user timezone when booking limit datetime is the same as start datetime","buildBookingLimitDatetimeForStockPayload","Mon Feb 03 13:37:01 UTC 2025","passed","Mon Feb 03 13:37:01 UTC 2025","","","",""
"","31","should enforce absolute links","ButtonLink","Mon Feb 03 13:36:38 UTC 2025","passed","Mon Feb 03 13:36:38 UTC 2025","","","",""
"","93","should display the offer students levels","AdageOfferPublicSection","Mon Feb 03 13:36:38 UTC 2025","passed","Mon Feb 03 13:36:38 UTC 2025","","","",""
"","31","should not show diffuse help","offers","Mon Feb 03 13:32:58 UTC 2025","passed","Mon Feb 03 13:32:58 UTC 2025","","load more button","",""
"","2","should return true if categoryId=LIVRE and has a musicType as a conditional field","hasMusicType","Mon Feb 03 13:33:50 UTC 2025","passed","Mon Feb 03 13:33:50 UTC 2025","","","",""
"","174","should select several options","SelectAutocomplete","Mon Feb 03 13:33:09 UTC 2025","passed","Mon Feb 03 13:33:09 UTC 2025","Multi","Options","",""
"","196","should not display any message when user delete empty stock","screens:StocksEventEdition","Mon Feb 03 13:33:16 UTC 2025","passed","Mon Feb 03 13:33:16 UTC 2025","","","",""
"","1","should prefill the form values with the venue email and phone if the venue has them","applyVenueDefaultsToFormValues","Mon Feb 03 13:36:01 UTC 2025","passed","Mon Feb 03 13:36:01 UTC 2025","","","",""
"","218","should display api errors","screens:StocksThing","Mon Feb 03 13:33:12 UTC 2025","passed","Mon Feb 03 13:33:12 UTC 2025","","","",""
"","290","should display email error message if user is already invited","AttachmentInvitations","Mon Feb 03 13:34:34 UTC 2025","passed","Mon Feb 03 13:34:34 UTC 2025","","","",""
"","60","should allow user to select imported creation mode filter","IndividualOffersScreen","Mon Feb 03 13:33:02 UTC 2025","passed","Mon Feb 03 13:33:03 UTC 2025","","","",""
"","169","should submit the form when clicking the continue button","Offerer","Mon Feb 03 13:33:37 UTC 2025","passed","Mon Feb 03 13:33:37 UTC 2025","","","",""
"","175","should load offers with selected period ending date","route Offers","Mon Feb 03 13:32:57 UTC 2025","passed","Mon Feb 03 13:32:57 UTC 2025","on click on search button","filters","",""
"","194","should open a download modal","IndividualOfferBookingsSummaryScreen","Mon Feb 03 13:35:17 UTC 2025","passed","Mon Feb 03 13:35:17 UTC 2025","","","",""
"","2","should generate stocks on a monthly basis by last day","onSubmit","Mon Feb 03 13:33:46 UTC 2025","passed","Mon Feb 03 13:33:46 UTC 2025","","","",""
"","0","should return category online for virtual cases","getCategoryStatusFromOfferSubtype","Mon Feb 03 13:34:53 UTC 2025","passed","Mon Feb 03 13:34:53 UTC 2025","","","",""
"","80","should display confirmation dialog when user want to be linked to the structure","screens:SignupJourney::Offerers","Mon Feb 03 13:33:59 UTC 2025","passed","Mon Feb 03 13:33:59 UTC 2025","","modal handling","",""
"","57","should display show all booking button when default booking id provided","bookings recap table's header","Mon Feb 03 13:37:22 UTC 2025","passed","Mon Feb 03 13:37:23 UTC 2025","","","",""
"","0","should compute max width for original ""portrait"" target ""landscape""","getCropMaxDimension","Mon Feb 03 13:37:33 UTC 2025","passed","Mon Feb 03 13:37:33 UTC 2025","","","",""
"","64","should not allow edition for a template offer when the ENABLE_COLLECTIVE_NEW_STATUSES FF is enabled and the edition of details is not allowed","CollectiveActionsCells","Mon Feb 03 13:33:21 UTC 2025","passed","Mon Feb 03 13:33:21 UTC 2025","","","",""
"","1","should correctly serialize extra data","serializeExtraData","Mon Feb 03 13:33:50 UTC 2025","passed","Mon Feb 03 13:33:50 UTC 2025","","","",""
"","64","should render correctly","StockEventSection","Mon Feb 03 13:38:01 UTC 2025","passed","Mon Feb 03 13:38:01 UTC 2025","","","",""
"","18","should display mail and phone","RequestFormDialog","Mon Feb 03 13:34:13 UTC 2025","passed","Mon Feb 03 13:34:13 UTC 2025","","","",""
"","55","should called onConfirm button onclick","DeactivationConfirmDialog","Mon Feb 03 13:36:43 UTC 2025","passed","Mon Feb 03 13:36:43 UTC 2025","","","",""
"","113","should log breadcrumbs navigation to authentication","test renderSignupJourneyStepper","Mon Feb 03 13:34:53 UTC 2025","passed","Mon Feb 03 13:34:53 UTC 2025","","","",""
"","100","should display error message when trying to activate collective offers with booking limit date passed","TemplateCollectiveOffersScreen","Mon Feb 03 13:33:41 UTC 2025","passed","Mon Feb 03 13:33:41 UTC 2025","","on click on select all offers checkbox","",""
"","32","should display an import button disabled by default on creation","AllocineProviderForm","Mon Feb 03 13:33:58 UTC 2025","passed","Mon Feb 03 13:33:58 UTC 2025","","","",""
"","6","should render { collectiveDmsApplication: { application: 123, depositDate: '2025-02-03T13:34:28.997Z', lastChangeDate: '2025-02-03T13:34:28.997Z', procedure: 456, state: 'sans_suite', venueId: 1 }, expectedLabel: 'Votre demande de référencement a été classée sans suite' } status","CollectiveDmsTimeline","Mon Feb 03 13:34:29 UTC 2025","passed","Mon Feb 03 13:34:29 UTC 2025","","","",""
"","170","should render an image with url from offer when offer has a thumb url","ollectiveOfferRow","Mon Feb 03 13:33:28 UTC 2025","passed","Mon Feb 03 13:33:28 UTC 2025","","thumb Component","",""
"","338","should require a description with less than 1500 chars (and truncate longer strings)","screens | OfferEducational : creation offer type step","Mon Feb 03 13:34:49 UTC 2025","passed","Mon Feb 03 13:34:49 UTC 2025","","title, description and duration inputs","",""
"","121","should display total number of offers in plural if multiple offers","CollectiveOffersScreen","Mon Feb 03 13:33:17 UTC 2025","passed","Mon Feb 03 13:33:17 UTC 2025","","","",""
"","68","should display title and banner","OffersInstitutionList","Mon Feb 03 13:36:36 UTC 2025","passed","Mon Feb 03 13:36:36 UTC 2025","","","",""
"","91","should show filters with all available statuses","components | FilterByBookingStatus","Mon Feb 03 13:34:59 UTC 2025","passed","Mon Feb 03 13:34:59 UTC 2025","","on focus on the filter icon","",""
"","365","should allow user to delete stock from a synchronized offer","screens:StocksEventEdition","Mon Feb 03 13:33:13 UTC 2025","passed","Mon Feb 03 13:33:13 UTC 2025","","","",""
"","463","should display errors message and focus email input when login failed","SignIn","Mon Feb 03 13:33:38 UTC 2025","passed","Mon Feb 03 13:33:38 UTC 2025","","","",""
"","1","should return virtual venues when subCatagory is ONLINE only","getFilteredVenueList","Mon Feb 03 13:36:00 UTC 2025","passed","Mon Feb 03 13:36:00 UTC 2025","","getFilteredVenueListBySubcategory","",""
"","125","should display errors on api failure","Offerer","Mon Feb 03 13:33:37 UTC 2025","passed","Mon Feb 03 13:33:37 UTC 2025","","","",""
"","160","should warn that there are no results","SelectAutocomplete","Mon Feb 03 13:33:10 UTC 2025","passed","Mon Feb 03 13:33:10 UTC 2025","","filter","",""
"","290","should display the route leaving guard when leaving without saving","VenueFormScreen","Mon Feb 03 13:34:00 UTC 2025","passed","Mon Feb 03 13:34:00 UTC 2025","","","",""
"","85","should display the status label","IndividualBookingsStatusCell","Mon Feb 03 13:34:30 UTC 2025","passed","Mon Feb 03 13:34:30 UTC 2025","","","",""
"","140","should filter according to page query param","route Offers","Mon Feb 03 13:32:55 UTC 2025","passed","Mon Feb 03 13:32:55 UTC 2025","","filters","",""
"","0","should return other uai facet filter","adageFiltersToFacetFilters","Mon Feb 03 13:35:27 UTC 2025","passed","Mon Feb 03 13:35:27 UTC 2025","","","",""
"","11","should see archive button when FF status is enable and archive action is possible for template offer","CollectiveEditionOfferNavigation","Mon Feb 03 13:33:43 UTC 2025","passed","Mon Feb 03 13:33:43 UTC 2025","","","",""
"","0","should return right url","getIndividualOfferUrl","Mon Feb 03 13:35:11 UTC 2025","passed","Mon Feb 03 13:35:11 UTC 2025","","onboarding","",""
"","2","should return nothing if there is only one page","Pagination","Mon Feb 03 13:37:23 UTC 2025","passed","Mon Feb 03 13:37:23 UTC 2025","","","",""
"","12","should show links if confirmation is the active step and the offer is template","CollectiveCreationOfferNavigation","Mon Feb 03 13:34:04 UTC 2025","passed","Mon Feb 03 13:34:04 UTC 2025","","","",""
"","11","should render confirmation page when offer is active and associated to all institutions","CollectiveOfferConfirmation","Mon Feb 03 13:36:31 UTC 2025","passed","Mon Feb 03 13:36:31 UTC 2025","","","",""
"","30","should display the playlist title based on the maximum venue distance","VenuePlaylist","Mon Feb 03 13:36:13 UTC 2025","passed","Mon Feb 03 13:36:13 UTC 2025","","","",""
"","1","should return an empty string","core | Venue | utils | unhumanizeSiret","Mon Feb 03 13:38:11 UTC 2025","passed","Mon Feb 03 13:38:11 UTC 2025","","when siret given is an empty string","",""
"","6","should display each hours and day when the whole day","DayAndHours","Mon Feb 03 13:36:32 UTC 2025","passed","Mon Feb 03 13:36:32 UTC 2025","","","",""
"","3","should display right info when not visible and not title and in venue form","PartnerPageIndividualSection","Mon Feb 03 13:36:01 UTC 2025","passed","Mon Feb 03 13:36:01 UTC 2025","","","",""
"","48","should display public name(if valued) of the venue when addressType is OFFERER_VENUE","OfferVenue","Mon Feb 03 13:37:20 UTC 2025","passed","Mon Feb 03 13:37:20 UTC 2025","","","",""
"","622","should require user to select a domain","screens | OfferEducational : creation offer type step","Mon Feb 03 13:34:42 UTC 2025","passed","Mon Feb 03 13:34:43 UTC 2025","","domains","",""
"","44","should display venue name if publicName is not defined","VenueCard","Mon Feb 03 13:37:10 UTC 2025","passed","Mon Feb 03 13:37:10 UTC 2025","","","",""
"","61","should redirect to preview step on press Retour","CollectiveOfferConfirmation","Mon Feb 03 13:34:45 UTC 2025","passed","Mon Feb 03 13:34:45 UTC 2025","","","",""
"","6","should return false if WIP_ENABLE_PRO_DIDACTIC_ONBOARDING is disabled","useHasAccessToDidacticOnboarding","Mon Feb 03 13:36:49 UTC 2025","passed","Mon Feb 03 13:36:49 UTC 2025","","With AB test enabled","",""
"","49","should not redirect to next step on submit and show notification error when publication fails","CollectiveOfferConfirmation","Mon Feb 03 13:34:45 UTC 2025","passed","Mon Feb 03 13:34:45 UTC 2025","","","",""
"","6","should validate externalTicketOfficeUrl correctly","getValidationSchema","Mon Feb 03 13:35:28 UTC 2025","passed","Mon Feb 03 13:35:28 UTC 2025","","","",""
"","17","should display confirmation","SignIn","Mon Feb 03 13:33:39 UTC 2025","passed","Mon Feb 03 13:33:39 UTC 2025","","should display messages after account validation","",""
"","36","should not display ds application link when the FF is enabled","VenueOfferSteps","Mon Feb 03 13:34:33 UTC 2025","passed","Mon Feb 03 13:34:33 UTC 2025","","","",""
"","11","should show the nearby (< 100km) offers of cultural partners coming to the institution when no results in initial search with no filters","OffersSuggestions","Mon Feb 03 13:34:28 UTC 2025","passed","Mon Feb 03 13:34:28 UTC 2025","","","",""
"","1","should validate the form for case: price above 300","validationSchema","Mon Feb 03 13:36:48 UTC 2025","passed","Mon Feb 03 13:36:48 UTC 2025","","","",""
"","12","should render offerer form with initialValues","screens:SignupJourney::OffererForm","Mon Feb 03 13:35:17 UTC 2025","passed","Mon Feb 03 13:35:17 UTC 2025","","","",""
"","24","should add the currency sign to a price","formatPrice","Mon Feb 03 13:38:12 UTC 2025","passed","Mon Feb 03 13:38:12 UTC 2025","","","",""
"","22","should apply bookingId filter when typing keywords for booking id","components | FilterByOmniSearch","Mon Feb 03 13:34:53 UTC 2025","passed","Mon Feb 03 13:34:53 UTC 2025","","","",""
"","161","should log event when clicking ""Dupliquer"" button","CollectiveEditionOfferNavigation","Mon Feb 03 13:33:43 UTC 2025","passed","Mon Feb 03 13:33:43 UTC 2025","","","",""
"","117","should show banner if generate from publicApi","CollectiveOfferVisibility","Mon Feb 03 13:33:32 UTC 2025","passed","Mon Feb 03 13:33:32 UTC 2025","","","",""
"","1","should not return anything if the institution is not available","adageOfferInstitution","Mon Feb 03 13:37:18 UTC 2025","passed","Mon Feb 03 13:37:18 UTC 2025","","getBookableOfferInstitutionAndTeacherName","",""
"","0","should not be able to archive from summary when the offer is already archived and the offer is reimbursed","canArchiveCollectiveOffer","Mon Feb 03 13:35:23 UTC 2025","passed","Mon Feb 03 13:35:23 UTC 2025","","","",""
"","1","should format browser date as UTC to required format","formatBrowserTimezonedDateAsUTC","Mon Feb 03 13:35:23 UTC 2025","passed","Mon Feb 03 13:35:23 UTC 2025","","","",""
"","29","should not render most viewed offers if there are none","StatisticsDashboard","Mon Feb 03 13:35:40 UTC 2025","passed","Mon Feb 03 13:35:40 UTC 2025","","","",""
"","77","should display the right wording without the OA FF","OA feature flag","Mon Feb 03 13:36:58 UTC 2025","passed","Mon Feb 03 13:36:58 UTC 2025","","","",""
"","110","selects all options when ""Select All"" is clicked","<MultiSelect />","Mon Feb 03 13:35:35 UTC 2025","passed","Mon Feb 03 13:35:35 UTC 2025","","","",""
"","297","should let choose an other partner page","route VenueEdition","Mon Feb 03 13:33:56 UTC 2025","passed","Mon Feb 03 13:33:56 UTC 2025","","","",""
"","116","should filter options based on the search input","<MultiSelectPanel />","Mon Feb 03 13:34:41 UTC 2025","passed","Mon Feb 03 13:34:42 UTC 2025","","","",""
"","6","should render urls with <a> tag","Markdown","Mon Feb 03 13:36:47 UTC 2025","passed","Mon Feb 03 13:36:47 UTC 2025","","","",""
"","28","should allow tabbing from one input of type number to the next","TextInput","Mon Feb 03 13:34:55 UTC 2025","passed","Mon Feb 03 13:34:55 UTC 2025","","","",""
"","0","should return true when collective offer with status ""PENDING"" and booking status ""REIMBURSED""","canArchiveCollectiveOffer","Mon Feb 03 13:35:23 UTC 2025","passed","Mon Feb 03 13:35:23 UTC 2025","","","",""
"","48","should display booking details if row is expanded","CollectiveTableRow","Mon Feb 03 13:36:18 UTC 2025","passed","Mon Feb 03 13:36:18 UTC 2025","","","",""
"","20","should redirect to onboarding if user is not onboarded and tries to go to home page","App","Mon Feb 03 13:34:43 UTC 2025","passed","Mon Feb 03 13:34:43 UTC 2025","","Onboarding status","",""
"","108","should archive an offer template","CollectiveEditionOfferNavigation","Mon Feb 03 13:33:43 UTC 2025","passed","Mon Feb 03 13:33:43 UTC 2025","","","",""
"","298","should render collective offer preview","CollectiveOfferPreviewCreation","Mon Feb 03 13:35:52 UTC 2025","passed","Mon Feb 03 13:35:52 UTC 2025","","","",""
"","3","should render ""en pause"" status when ff is active for INACTIVE displayed status","CollectiveStatusLabel","Mon Feb 03 13:35:48 UTC 2025","passed","Mon Feb 03 13:35:48 UTC 2025","","","",""
"","348","should load offers with written offer name filter","route Offers","Mon Feb 03 13:32:55 UTC 2025","passed","Mon Feb 03 13:32:56 UTC 2025","on click on search button","filters","",""
"","180","should always display a text input and a search button","OffersTableSearch","Mon Feb 03 13:35:21 UTC 2025","passed","Mon Feb 03 13:35:21 UTC 2025","","","",""
"","104","should update venue on submit","AllocineProviderEdit","Mon Feb 03 13:36:45 UTC 2025","passed","Mon Feb 03 13:36:45 UTC 2025","","","",""
"","1","should deduce the offer subtype PHYSICAL_EVENT from the query param","getOfferSubtypeFromParam","Mon Feb 03 13:34:53 UTC 2025","passed","Mon Feb 03 13:34:53 UTC 2025","","","",""
"","6","should not block when following creation flow (from creation to stocks)","components | RouteLeavingGuardCollectiveOfferCreation","Mon Feb 03 13:35:13 UTC 2025","passed","Mon Feb 03 13:35:13 UTC 2025","","","",""
"","1","should not return a date when transforming an invalid date into French text","getDateToFrenchText","Mon Feb 03 13:35:23 UTC 2025","passed","Mon Feb 03 13:35:23 UTC 2025","","","",""
"","23","should render text for one offer","DeactivationConfirmDialog","Mon Feb 03 13:36:43 UTC 2025","passed","Mon Feb 03 13:36:43 UTC 2025","","","",""
"","47","should capture exception with Sentry","ErrorBoundary","Mon Feb 03 13:38:10 UTC 2025","passed","Mon Feb 03 13:38:10 UTC 2025","","","",""
"","101","should remove venue tag on click","FiltersTag","Mon Feb 03 13:34:32 UTC 2025","passed","Mon Feb 03 13:34:33 UTC 2025","","","",""
"","45","should display required message if siret is empty for non virtual venue","components | SiretOrCommentFields","Mon Feb 03 13:33:52 UTC 2025","passed","Mon Feb 03 13:33:52 UTC 2025","","should validate SIRET on submit","",""
"","33","should display stepper with number and label","Stepper","Mon Feb 03 13:36:03 UTC 2025","passed","Mon Feb 03 13:36:03 UTC 2025","","","",""
"","42","should redirect to offerer authentication on add offerer button click","screens:SignupJourney::Offerers","Mon Feb 03 13:33:59 UTC 2025","passed","Mon Feb 03 13:33:59 UTC 2025","","","",""
"","31","should call reinit filters on click reinit button","FiltersTag","Mon Feb 03 13:34:33 UTC 2025","passed","Mon Feb 03 13:34:33 UTC 2025","","","",""
"","10","should render banner at the bottom of the page","CollectiveOfferConfirmation","Mon Feb 03 13:36:31 UTC 2025","passed","Mon Feb 03 13:36:31 UTC 2025","","","",""
"","73","should track cancel all offers on click on ""Annuler"" button","ActionsBar","Mon Feb 03 13:33:40 UTC 2025","passed","Mon Feb 03 13:33:40 UTC 2025","","","",""
"","124","should trigger search when clicking Rechercher while using geoloc","OfferFilters","Mon Feb 03 13:34:12 UTC 2025","passed","Mon Feb 03 13:34:12 UTC 2025","","","",""
"","104","should show the phone form when the contact phone checkbox is checked","FormContactTemplate","Mon Feb 03 13:36:34 UTC 2025","passed","Mon Feb 03 13:36:34 UTC 2025","","","",""
"","59","should call toggleDropdown when the button is clicked","<MultiSelectTrigger />","Mon Feb 03 13:36:21 UTC 2025","passed","Mon Feb 03 13:36:21 UTC 2025","","","",""
"","81","should render with all fields","Signup","Mon Feb 03 13:33:52 UTC 2025","passed","Mon Feb 03 13:33:53 UTC 2025","","render","",""
"","641","should go back to the localisation main menu when reopening the localisation multiselect after having submitted it with no values selected","offersSearch component","Mon Feb 03 13:33:56 UTC 2025","passed","Mon Feb 03 13:33:56 UTC 2025","","","",""
"","336","should redirect to onboarding page if offerer list is empty","SignIn","Mon Feb 03 13:33:38 UTC 2025","passed","Mon Feb 03 13:33:39 UTC 2025","","sign in with new onboarding feature","",""
"","0","should should detect 'FR' country code","getPhoneNumberValues","Mon Feb 03 13:37:32 UTC 2025","passed","Mon Feb 03 13:37:32 UTC 2025","","","",""
"","29","should display mail and phone and custom form","RequestFormDialog","Mon Feb 03 13:34:13 UTC 2025","passed","Mon Feb 03 13:34:13 UTC 2025","","","",""
"","5","should display offer creation link if user has no offer on venue","VenueOfferSteps","Mon Feb 03 13:34:33 UTC 2025","passed","Mon Feb 03 13:34:33 UTC 2025","","","",""
"","11","should not show an image if the offer has no image","AdageOfferHeader","Mon Feb 03 13:34:46 UTC 2025","passed","Mon Feb 03 13:34:46 UTC 2025","","","",""
"","166","should display two offers with their respective stocks when two bookable offers","offers","Mon Feb 03 13:32:57 UTC 2025","passed","Mon Feb 03 13:32:57 UTC 2025","","","",""
"","47","should redirect to offerers page if user is not admin","SignIn","Mon Feb 03 13:33:38 UTC 2025","passed","Mon Feb 03 13:33:38 UTC 2025","","when user is signed in","",""
"","77","should toggle collective section on collective section button click","SideNavLinks","Mon Feb 03 13:35:04 UTC 2025","passed","Mon Feb 03 13:35:04 UTC 2025","","","",""
"","2","should call API without credentials when not required","pcapiClient","Mon Feb 03 13:36:58 UTC 2025","passed","Mon Feb 03 13:36:58 UTC 2025","","postWithFormData","",""
"","70","should show an error message notification when domains could not be fetched","offersSearch component","Mon Feb 03 13:33:56 UTC 2025","passed","Mon Feb 03 13:33:56 UTC 2025","","","",""
