"DESCRIPTION","DURATION IN MS","NAME","PARENT SUITE","START TIME","STATUS","STOP TIME","SUB SUITE","SUITE","TEST CLASS","TEST METHOD"
"","4","should have a count of characters for assistive technologies taht is visually hidden","FieldLayoutCharacterCount","Tue Feb 11 14:31:56 UTC 2025","passed","Tue Feb 11 14:31:56 UTC 2025","","","",""
"","134","should not show pagination when applying filters with no result","components | BookingsRecapTable","Tue Feb 11 14:27:46 UTC 2025","passed","Tue Feb 11 14:27:46 UTC 2025","","","",""
"","32","should display the booking amount when it is not free","IndividualBookingsStatusCell","Tue Feb 11 14:28:43 UTC 2025","passed","Tue Feb 11 14:28:44 UTC 2025","","","",""
"","89","should activate selected offers upon publication","ActionsBar","Tue Feb 11 14:27:53 UTC 2025","passed","Tue Feb 11 14:27:54 UTC 2025","","","",""
"","118","should render when no image is given","test ImageUploaderOffer","Tue Feb 11 14:31:32 UTC 2025","passed","Tue Feb 11 14:31:33 UTC 2025","","","",""
"","29","should render stats when above 0","OfferStats","Tue Feb 11 14:30:21 UTC 2025","passed","Tue Feb 11 14:30:21 UTC 2025","","","",""
"","15","should disabled field for pending offer","PriceCategories","Tue Feb 11 14:31:34 UTC 2025","passed","Tue Feb 11 14:31:34 UTC 2025","","","",""
"","60","Should redirect to homepage if the user can't access the onboarding","<OnboardingOfferIndividual />","Tue Feb 11 14:31:55 UTC 2025","passed","Tue Feb 11 14:31:55 UTC 2025","","","",""
"","120","should render form","OffererAuthenticationForm","Tue Feb 11 14:29:14 UTC 2025","passed","Tue Feb 11 14:29:14 UTC 2025","","","",""
"","59","should display the list of elements in the carousel","Carousel","Tue Feb 11 14:30:35 UTC 2025","passed","Tue Feb 11 14:30:35 UTC 2025","","","",""
"","19","should display booking link for expired offer with booking","ollectiveOfferRow","Tue Feb 11 14:27:41 UTC 2025","passed","Tue Feb 11 14:27:41 UTC 2025","","","",""
"","63","should log an event when the limit date is updated","screens:StocksThing","Tue Feb 11 14:27:27 UTC 2025","passed","Tue Feb 11 14:27:27 UTC 2025","","","",""
"","2","should validate the form for case: valid form without notification email","validationSchema OfferEducational","Tue Feb 11 14:29:40 UTC 2025","passed","Tue Feb 11 14:29:40 UTC 2025","","template offer","",""
"","5","should return the correct patch offer payload for a template offer","createPatchOfferPayload","Tue Feb 11 14:29:54 UTC 2025","passed","Tue Feb 11 14:29:54 UTC 2025","","","",""
"","122","should display with the lateral bar","IndividualOfferWizard","Tue Feb 11 14:32:22 UTC 2025","passed","Tue Feb 11 14:32:22 UTC 2025","","","",""
"","32","should display two edition buttons when the FF ENABLE_COLLECTIVE_NEW_STATUSES is enabled and the offer description and dates are editable","CollectiveOfferSummary","Tue Feb 11 14:28:00 UTC 2025","passed","Tue Feb 11 14:28:00 UTC 2025","","","",""
"","14","should not display a warning when all stocks are sold out","IndividualOfferRow","Tue Feb 11 14:27:05 UTC 2025","passed","Tue Feb 11 14:27:05 UTC 2025","","when offer is an event product","",""
"","7","should never display ""Stock & Prix"" step","IndividualOfferNavigation","Tue Feb 11 14:28:31 UTC 2025","passed","Tue Feb 11 14:28:31 UTC 2025","","when offer is an event","",""
"","2","should return the union of national programs for multiple domains","getNationalProgramsForDomains","Tue Feb 11 14:32:26 UTC 2025","passed","Tue Feb 11 14:32:26 UTC 2025","","","",""
"","45","should display import button","CinemaProviderForm","Tue Feb 11 14:30:12 UTC 2025","passed","Tue Feb 11 14:30:12 UTC 2025","","import form cinema provider for the first time","",""
"","177","should render physical stock thing","screens:StocksThing","Tue Feb 11 14:27:23 UTC 2025","passed","Tue Feb 11 14:27:24 UTC 2025","","","",""
"","40","should render offerer address filter with default option selected and given venues as options","IndividualOffersScreen","Tue Feb 11 14:27:17 UTC 2025","passed","Tue Feb 11 14:27:17 UTC 2025","","","",""
"","1","should trim spaces in all string fields","serializeDetailsPostData","Tue Feb 11 14:28:02 UTC 2025","passed","Tue Feb 11 14:28:02 UTC 2025","","","",""
"","3","should not display permanent venues","VenueList","Tue Feb 11 14:30:38 UTC 2025","passed","Tue Feb 11 14:30:38 UTC 2025","","","",""
"","42","should render adage header with link for discovery","AdageHeader","Tue Feb 11 14:29:08 UTC 2025","passed","Tue Feb 11 14:29:08 UTC 2025","","","",""
"","0","should return both category when subtype is not defined","getCategoryStatusFromOfferSubtype","Tue Feb 11 14:29:07 UTC 2025","passed","Tue Feb 11 14:29:07 UTC 2025","","","",""
"","2","getHumanizeRelativeDistance(undefined) 	= '7 m'","getDistance","Tue Feb 11 14:32:15 UTC 2025","passed","Tue Feb 11 14:32:15 UTC 2025","","","",""
"","63","should show an error message when an error occurs after clicking on ""Supprimer"" button when some offers are selected","ActionsBar","Tue Feb 11 14:27:54 UTC 2025","passed","Tue Feb 11 14:27:54 UTC 2025","","","",""
"","90","should fetch only bookable offers when the WIP_ENABLE_NEW_COLLECTIVE_OFFERS_AND_BOOKINGS_STRUCTURE FF is active","route CollectiveOffers","Tue Feb 11 14:27:32 UTC 2025","passed","Tue Feb 11 14:27:32 UTC 2025","","","",""
"","110","should render footer","Footer","Tue Feb 11 14:32:04 UTC 2025","passed","Tue Feb 11 14:32:04 UTC 2025","","","",""
"","87","should navigate to activity page with the previous step button","ValidationScreen","Tue Feb 11 14:28:04 UTC 2025","passed","Tue Feb 11 14:28:04 UTC 2025","","user actions","",""
"","144","should not display select if only one venue","PartnerPages","Tue Feb 11 14:29:45 UTC 2025","passed","Tue Feb 11 14:29:46 UTC 2025","","","",""
"","49","should display apply accessibility to all offer when its venue edition and accessibility has changed","Accessibility","Tue Feb 11 14:29:08 UTC 2025","passed","Tue Feb 11 14:29:09 UTC 2025","","","",""
"","48","should not render LinkVenueCallout without FF","LinkVenueCallout","Tue Feb 11 14:29:14 UTC 2025","passed","Tue Feb 11 14:29:14 UTC 2025","","","",""
"","217","should display error notification","screens:SignupJourney::Activity","Tue Feb 11 14:29:10 UTC 2025","passed","Tue Feb 11 14:29:10 UTC 2025","","","",""
"","9","should show the whole date","OfferNameCell","Tue Feb 11 14:29:05 UTC 2025","passed","Tue Feb 11 14:29:05 UTC 2025","","","",""
"","8","should render { collectiveDmsApplication: { application: 123, depositDate: '2025-02-11T14:28:41.466Z', lastChangeDate: '2025-02-11T14:28:41.466Z', procedure: 456, state: 'accepte', venueId: 1 }, hasAdageId: true, expectedLabel: 'Votre lieu a été référencé dans ADAGE par les équipes du Ministère de l’Education Nationale' } status","CollectiveDmsTimeline","Tue Feb 11 14:28:41 UTC 2025","passed","Tue Feb 11 14:28:41 UTC 2025","","","",""
"","6","should validate externalTicketOfficeUrl correctly","getValidationSchema","Tue Feb 11 14:29:42 UTC 2025","passed","Tue Feb 11 14:29:42 UTC 2025","","","",""
"","108","renders component successfully","components:UserIdentityForm","Tue Feb 11 14:31:04 UTC 2025","passed","Tue Feb 11 14:31:04 UTC 2025","","","",""
"","89","should notify and submit when clicking on Enregistrer les modifications in edition","PriceCategories","Tue Feb 11 14:28:39 UTC 2025","passed","Tue Feb 11 14:28:39 UTC 2025","","","",""
"","2","should not display the formats section if the offer has no formats","AdageOfferDetailsSection","Tue Feb 11 14:29:38 UTC 2025","passed","Tue Feb 11 14:29:38 UTC 2025","","","",""
"","60","should render LinkVenueCallout","LinkVenueCallout","Tue Feb 11 14:29:14 UTC 2025","passed","Tue Feb 11 14:29:14 UTC 2025","","With FF enabled","",""
"","32","should failed active status value","OfferEducationalActions","Tue Feb 11 14:28:14 UTC 2025","passed","Tue Feb 11 14:28:14 UTC 2025","","","",""
"","131","should not have accessibility violations","<MultiSelectPanel />","Tue Feb 11 14:28:55 UTC 2025","passed","Tue Feb 11 14:28:55 UTC 2025","","","",""
"","2","should add a notification when receiving it","notificationsReducer","Tue Feb 11 14:32:18 UTC 2025","passed","Tue Feb 11 14:32:18 UTC 2025","","","",""
"","41","should remove previous rendered offers on results update","offers","Tue Feb 11 14:27:13 UTC 2025","passed","Tue Feb 11 14:27:13 UTC 2025","","","",""
"","296","should display default error message if error with server","AttachmentInvitations","Tue Feb 11 14:28:47 UTC 2025","passed","Tue Feb 11 14:28:48 UTC 2025","","","",""
"","33","should display the right wording without the OA FF","components | SiretOrCommentFields","Tue Feb 11 14:28:07 UTC 2025","passed","Tue Feb 11 14:28:07 UTC 2025","","OA feature flag","",""
"","152","should show AddBankInformationsDialog on click add bank account button","BankInformations page","Tue Feb 11 14:28:23 UTC 2025","passed","Tue Feb 11 14:28:23 UTC 2025","","","",""
"","1","should sort offerer addresses alphabetically","formatAndOrderVenues","Tue Feb 11 14:29:57 UTC 2025","passed","Tue Feb 11 14:29:57 UTC 2025","","formatAndOrderAddresses","",""
"","1","should throw errors if context is invalid","getNthParentFormValues","Tue Feb 11 14:32:09 UTC 2025","passed","Tue Feb 11 14:32:09 UTC 2025","","","",""
"","28","should remove tag on click","FiltersTag","Tue Feb 11 14:28:46 UTC 2025","passed","Tue Feb 11 14:28:46 UTC 2025","","","",""
"","223","should call the ean search API when the form is submitted","DetailsEanSearch","Tue Feb 11 14:28:16 UTC 2025","passed","Tue Feb 11 14:28:17 UTC 2025","when no EAN search has been performed","when the draft offer has not been created yet (dirty)","",""
"","3","should serialize a venue payload with no openingHours","Venue edition payload serializer","Tue Feb 11 14:31:29 UTC 2025","passed","Tue Feb 11 14:31:29 UTC 2025","","","",""
"","94","should display a success message notification when booking worked","offer item","Tue Feb 11 14:29:29 UTC 2025","passed","Tue Feb 11 14:29:29 UTC 2025","","","",""
"","39","should render without error","Timeline","Tue Feb 11 14:32:20 UTC 2025","passed","Tue Feb 11 14:32:20 UTC 2025","","","",""
"","24","should store the new filters visibility","useStoredFilterConfig","Tue Feb 11 14:30:00 UTC 2025","passed","Tue Feb 11 14:30:00 UTC 2025","","onFiltersToggle","",""
"","299","should have the status in the url value when user filters by multiple statuses","route TemplateCollectiveOffers","Tue Feb 11 14:28:35 UTC 2025","passed","Tue Feb 11 14:28:35 UTC 2025","","url query params","",""
"","452","should select all mainland departments when clicking on ""France métropolitaine""","CollectiveDataEdition","Tue Feb 11 14:27:38 UTC 2025","passed","Tue Feb 11 14:27:39 UTC 2025","","intervention area","",""
"","22","should add the currency sign to a price","formatPrice","Tue Feb 11 14:32:30 UTC 2025","passed","Tue Feb 11 14:32:30 UTC 2025","","","",""
"","121","should indicate that the format is invalid and which characters are valid"," Desk","Tue Feb 11 14:28:43 UTC 2025","passed","Tue Feb 11 14:28:43 UTC 2025","","should validate while user is typing","",""
"","0","should return the end of the booking limit datetime when it is different from the start datetime","buildBookingLimitDatetimeForStockPayload","Tue Feb 11 14:31:18 UTC 2025","passed","Tue Feb 11 14:31:18 UTC 2025","","","",""
"","43","should redirect to the unavailable error page when the API sirene feature is disabled","SignIn","Tue Feb 11 14:27:49 UTC 2025","passed","Tue Feb 11 14:27:49 UTC 2025","","when user clicks on 'Créer un compte'","",""
"","4","should render { displayedStatus: 'PREBOOKED', expectedLabel: 'préréservée' } status","CollectiveStatusLabel","Tue Feb 11 14:30:04 UTC 2025","passed","Tue Feb 11 14:30:04 UTC 2025","","","",""
"","208","should show the dates section if the offer is a template","OfferEducationalForm","Tue Feb 11 14:29:29 UTC 2025","passed","Tue Feb 11 14:29:29 UTC 2025","","","",""
"","16","should display the right wording without the OA FF","CollectiveOfferLocationSection","Tue Feb 11 14:29:18 UTC 2025","passed","Tue Feb 11 14:29:18 UTC 2025","","OA feature flag","",""
"","0","should return category offline for physical cases","getCategoryStatusFromOfferSubtype","Tue Feb 11 14:29:07 UTC 2025","passed","Tue Feb 11 14:29:07 UTC 2025","","","",""
"","15","should display the right wording without the OA FF","CollectiveDataEdition","Tue Feb 11 14:27:42 UTC 2025","passed","Tue Feb 11 14:27:42 UTC 2025","","OA feature flag","",""
"","15","should show the card image if it has one","AdageOfferListCard","Tue Feb 11 14:31:28 UTC 2025","passed","Tue Feb 11 14:31:28 UTC 2025","","","",""
"","329","should store search value","route Offers","Tue Feb 11 14:27:07 UTC 2025","passed","Tue Feb 11 14:27:08 UTC 2025","","url query params","",""
"","81","should render component even if offererNames is empty","Reimbursement page","Tue Feb 11 14:29:59 UTC 2025","passed","Tue Feb 11 14:29:59 UTC 2025","","","",""
"","2","should validate the form for case: price should be at least 0","validationSchema","Tue Feb 11 14:30:07 UTC 2025","passed","Tue Feb 11 14:30:07 UTC 2025","","","",""
"","77","should check the checkbox when the input value changes to 0","PriceInput","Tue Feb 11 14:30:21 UTC 2025","passed","Tue Feb 11 14:30:21 UTC 2025","","when ""Gratuit"" checkbox display is enabled","",""
"","57","should log event when clicking booking link","ollectiveOfferRow","Tue Feb 11 14:27:41 UTC 2025","passed","Tue Feb 11 14:27:41 UTC 2025","","","",""
"","10","should display not display venue select if offerer has no venue","OffererStatsScreen","Tue Feb 11 14:29:33 UTC 2025","passed","Tue Feb 11 14:29:33 UTC 2025","","","",""
"","1","should return other uai facet filter","adageFiltersToFacetFilters","Tue Feb 11 14:29:41 UTC 2025","passed","Tue Feb 11 14:29:41 UTC 2025","","","",""
"","25","should not clear the input on focus","SelectAutocomplete","Tue Feb 11 14:27:22 UTC 2025","passed","Tue Feb 11 14:27:22 UTC 2025","","","",""
"","0","should return false for exact same time","isTimeInTheFuture","Tue Feb 11 14:30:55 UTC 2025","passed","Tue Feb 11 14:30:55 UTC 2025","","","",""
"","0","should compute max width for original ""portrait"" target ""landscape""","getCropMaxDimension","Tue Feb 11 14:31:51 UTC 2025","passed","Tue Feb 11 14:31:51 UTC 2025","","","",""
"","11","should not display the acces libre callout in creation","Accessibility","Tue Feb 11 14:29:09 UTC 2025","passed","Tue Feb 11 14:29:09 UTC 2025","","","",""
"","449","should display only selectable categories on filters","route Offers","Tue Feb 11 14:27:04 UTC 2025","passed","Tue Feb 11 14:27:05 UTC 2025","","filters","",""
"","17","should say how many offers are selected when more than 1 offer are selected","ActionsBar","Tue Feb 11 14:27:53 UTC 2025","passed","Tue Feb 11 14:27:53 UTC 2025","","","",""
"","97","should show an error message notification when domains could not be fetched","offersSearch component","Tue Feb 11 14:28:08 UTC 2025","passed","Tue Feb 11 14:28:09 UTC 2025","","","",""
"","1","should validate the form for case: not valid form without name","validationSchema","Tue Feb 11 14:30:38 UTC 2025","passed","Tue Feb 11 14:30:38 UTC 2025","","","",""
"","71","should render venue playlist","VenuePlaylist","Tue Feb 11 14:30:28 UTC 2025","passed","Tue Feb 11 14:30:28 UTC 2025","","","",""
"","1","should not display the time minutes when the starting date minutes are 00","getRangeToFrenchText","Tue Feb 11 14:29:37 UTC 2025","passed","Tue Feb 11 14:29:37 UTC 2025","","","",""
"","41","should render EAN search for record stores as a venue","IndividualOfferDetails","Tue Feb 11 14:27:09 UTC 2025","passed","Tue Feb 11 14:27:09 UTC 2025","about EAN search","on creation","",""
"","9","should replace conditional fields with a subcategory related error callout","DetailsSubForm","Tue Feb 11 14:29:20 UTC 2025","passed","Tue Feb 11 14:29:20 UTC 2025","when the offer is non-product based > when the offer is a CD","when EAN search is displayed","",""
"","16","should display the offerer name with ""- Offre numérique"" when venue is virtual","IndividualOfferRow","Tue Feb 11 14:27:05 UTC 2025","passed","Tue Feb 11 14:27:05 UTC 2025","","","",""
"","53","should render a main heading when provided","Layout","Tue Feb 11 14:29:54 UTC 2025","passed","Tue Feb 11 14:29:54 UTC 2025","","about main heading & back to nav link","",""
"","2","reports name of the constraints that are not respected","getValidatorErrors","Tue Feb 11 14:29:49 UTC 2025","passed","Tue Feb 11 14:29:49 UTC 2025","","","",""
"","134","should always display ""Détails"" and ""Informations pratiques"" active/enabled steps","IndividualOfferNavigation","Tue Feb 11 14:28:31 UTC 2025","passed","Tue Feb 11 14:28:31 UTC 2025","","","",""
"","74","should render component with new sections and right address data","Summary","Tue Feb 11 14:27:11 UTC 2025","passed","Tue Feb 11 14:27:11 UTC 2025","","On Creation","",""
"","106","should render correctly","<DraftOffers />","Tue Feb 11 14:32:12 UTC 2025","passed","Tue Feb 11 14:32:12 UTC 2025","","","",""
"","110","should reset filters when clicking on reset button","components | NoFilteredBookings","Tue Feb 11 14:32:32 UTC 2025","passed","Tue Feb 11 14:32:32 UTC 2025","","","",""
"","121","should display edition venue link","venues","Tue Feb 11 14:31:34 UTC 2025","passed","Tue Feb 11 14:31:34 UTC 2025","","physical venue section","",""
"","87","should render App and children components when isMaintenanceActivated is false","App","Tue Feb 11 14:28:56 UTC 2025","passed","Tue Feb 11 14:28:56 UTC 2025","","","",""
"","82","should show the phone form when the contact phone checkbox is checked","FormContactTemplate","Tue Feb 11 14:30:51 UTC 2025","passed","Tue Feb 11 14:30:51 UTC 2025","","","",""
"","863","should prefill intervention field with venue intervention field when selecting venue","screens | OfferEducational : event address step","Tue Feb 11 14:28:52 UTC 2025","passed","Tue Feb 11 14:28:53 UTC 2025","","when there are multiple venues managed by the offerer","",""
"","66","should call tracker when clicking on toggle button view","offers","Tue Feb 11 14:27:14 UTC 2025","passed","Tue Feb 11 14:27:14 UTC 2025","","","",""
"","41","should display the acceslibre section under the form if the feature is enabled and data is present","VenueFormScreen","Tue Feb 11 14:28:13 UTC 2025","passed","Tue Feb 11 14:28:13 UTC 2025","","","",""
"","2","should validate the form for case: booking datetime should not be after start datetime","validationSchema","Tue Feb 11 14:30:07 UTC 2025","passed","Tue Feb 11 14:30:07 UTC 2025","","","",""
"","9","should render offerer form with initialValues","screens:SignupJourney::OffererForm","Tue Feb 11 14:29:31 UTC 2025","passed","Tue Feb 11 14:29:31 UTC 2025","","","",""
"","161","should log event when clicking ""Dupliquer"" button","CollectiveEditionOfferNavigation","Tue Feb 11 14:27:56 UTC 2025","passed","Tue Feb 11 14:27:57 UTC 2025","","","",""
"","140","should select an offer","CollectiveOfferConfirmation","Tue Feb 11 14:28:51 UTC 2025","passed","Tue Feb 11 14:28:51 UTC 2025","","","",""
"","1","should return last index when it satisfies the condition","findLastIndex","Tue Feb 11 14:32:12 UTC 2025","passed","Tue Feb 11 14:32:12 UTC 2025","","","",""
"","8","when there are no results","offers","Tue Feb 11 14:27:14 UTC 2025","passed","Tue Feb 11 14:27:14 UTC 2025","","should display no results page","",""
"","18","should initialize with current image","useCollectiveOfferImageUpload","Tue Feb 11 14:30:11 UTC 2025","passed","Tue Feb 11 14:30:11 UTC 2025","","","",""
"","163","should request bookings of default period when user clicks on ""Afficher"" without selecting a period","components | BookingsRecap | Pro user","Tue Feb 11 14:27:19 UTC 2025","passed","Tue Feb 11 14:27:19 UTC 2025","","","",""
"","8","Should display the right wording with the FF enabled","OffererBanners","Tue Feb 11 14:29:56 UTC 2025","passed","Tue Feb 11 14:29:56 UTC 2025","","WIP_ENABLE_OFFER_ADDRESS","",""
"","1","should validate the form for case: labels are duplicated","validationSchema","Tue Feb 11 14:31:05 UTC 2025","passed","Tue Feb 11 14:31:05 UTC 2025","","","",""
"","72","should display an external link with icon","LinkNodes","Tue Feb 11 14:31:39 UTC 2025","passed","Tue Feb 11 14:31:39 UTC 2025","","","",""
"","1","should not return anything if the institution is not available","adageOfferInstitution","Tue Feb 11 14:31:35 UTC 2025","passed","Tue Feb 11 14:31:35 UTC 2025","","getBookableOfferInstitutionAndTeacherName","",""
"","34","should redirect to offerers page if user is not admin","SignIn","Tue Feb 11 14:27:50 UTC 2025","passed","Tue Feb 11 14:27:50 UTC 2025","","when user is signed in","",""
"","24","should display error when file's height and width is too small for portrait","ImageUploadBrowserForm","Tue Feb 11 14:29:43 UTC 2025","passed","Tue Feb 11 14:29:43 UTC 2025","","","",""
"","15","should display specific message when venue is virtual","VenueFormScreen","Tue Feb 11 14:28:13 UTC 2025","passed","Tue Feb 11 14:28:13 UTC 2025","","","",""
"","511","should remove notification after fixed show and transition duration","Notification","Tue Feb 11 14:31:14 UTC 2025","passed","Tue Feb 11 14:31:14 UTC 2025","","","",""
"","0","should return false if last provider name does not contain Allociné","isAllocineOffer","Tue Feb 11 14:32:14 UTC 2025","passed","Tue Feb 11 14:32:14 UTC 2025","","","",""
"","1","should pre-set todays dates for a template offer creation initial values","computeInitialValuesFromOffer","Tue Feb 11 14:30:11 UTC 2025","passed","Tue Feb 11 14:30:11 UTC 2025","","","",""
"","127","should not fill input quantity with negative value","AllocineProviderForm","Tue Feb 11 14:28:11 UTC 2025","passed","Tue Feb 11 14:28:12 UTC 2025","","","",""
"","5","should not display bank account link on second venue if user has no bank account with paid offer","VenueOfferSteps","Tue Feb 11 14:28:46 UTC 2025","passed","Tue Feb 11 14:28:46 UTC 2025","","","",""
"","46","should not display new student level for MeG when ff is not active","FormParticipants","Tue Feb 11 14:28:36 UTC 2025","passed","Tue Feb 11 14:28:36 UTC 2025","","","",""
"","475","should display previous page when clicking on left arrow","route Offers","Tue Feb 11 14:27:09 UTC 2025","passed","Tue Feb 11 14:27:10 UTC 2025","","page navigation","",""
"","123","should display pricing point pop-in when clicking select siret button","LinkVenueDialog","Tue Feb 11 14:28:17 UTC 2025","passed","Tue Feb 11 14:28:17 UTC 2025","","","",""
"","4","should return true if firebase config is true for user","useHasAccessToDidacticOnboarding","Tue Feb 11 14:31:06 UTC 2025","passed","Tue Feb 11 14:31:06 UTC 2025","... and with WIP_ENABLE_PRO_DIDACTIC_ONBOARDING enabled","With AB test enabled","",""
"","69","should display default messages and disable submit button"," Desk","Tue Feb 11 14:28:42 UTC 2025","passed","Tue Feb 11 14:28:42 UTC 2025","","should validate while user is typing","",""
"","171","should send opening hours if the filed was not filled, but the openingHours already existed","VenueFormScreen","Tue Feb 11 14:28:13 UTC 2025","passed","Tue Feb 11 14:28:13 UTC 2025","","","",""
"","59","should show the offer title","AdageOfferHeader","Tue Feb 11 14:28:59 UTC 2025","passed","Tue Feb 11 14:28:59 UTC 2025","","","",""
"","90","should display the offer students levels","AdageOfferPublicSection","Tue Feb 11 14:30:55 UTC 2025","passed","Tue Feb 11 14:30:55 UTC 2025","","","",""
"","151","should call onConfirm on confirm button click","ConfirmDialog","Tue Feb 11 14:31:52 UTC 2025","passed","Tue Feb 11 14:31:52 UTC 2025","","","",""
"","84","should redirect to next step on submit","CollectiveOfferConfirmation","Tue Feb 11 14:28:58 UTC 2025","passed","Tue Feb 11 14:28:58 UTC 2025","","","",""
"","62","should render domains card","OfferCard component","Tue Feb 11 14:32:23 UTC 2025","passed","Tue Feb 11 14:32:23 UTC 2025","","","",""
"","222","should render a list of bookings","IndividualOfferBookingsSummaryScreen","Tue Feb 11 14:29:30 UTC 2025","passed","Tue Feb 11 14:29:30 UTC 2025","","","",""
"","4","renders InputExtension correctly if passed","TextInput","Tue Feb 11 14:29:08 UTC 2025","passed","Tue Feb 11 14:29:08 UTC 2025","","","",""
"","0","should return all fields as read only when offer is rejected","setFormReadOnlyFields","Tue Feb 11 14:28:39 UTC 2025","passed","Tue Feb 11 14:28:39 UTC 2025","","","",""
"","99","should track on import","CinemaProviderForm","Tue Feb 11 14:30:12 UTC 2025","passed","Tue Feb 11 14:30:12 UTC 2025","","import form cinema provider for the first time","",""
"","59","should display the collective title","route VenueEdition","Tue Feb 11 14:28:10 UTC 2025","passed","Tue Feb 11 14:28:11 UTC 2025","","","",""
"","118","should delete headline offer","IndividualOfferRow","Tue Feb 11 14:27:05 UTC 2025","passed","Tue Feb 11 14:27:05 UTC 2025","headline offer actions","action buttons","",""
"","75","should call tracker event when archiving an offer","ActionsBar","Tue Feb 11 14:27:18 UTC 2025","passed","Tue Feb 11 14:27:18 UTC 2025","","","",""
"","198","should submit formats values onclick modal search button","OfferFilters","Tue Feb 11 14:28:21 UTC 2025","passed","Tue Feb 11 14:28:21 UTC 2025","","","",""
"","70","should display booking link for sold out offer with pending booking","CollectiveOfferVisibility","Tue Feb 11 14:27:44 UTC 2025","passed","Tue Feb 11 14:27:44 UTC 2025","","","",""
"","3","should set default initial values from offer correctly","setDefaultInitialValuesFromOffer","Tue Feb 11 14:28:39 UTC 2025","passed","Tue Feb 11 14:28:39 UTC 2025","","","",""
"","73","should display drafts if there is any","<OnboardingOfferIndividual />","Tue Feb 11 14:29:52 UTC 2025","passed","Tue Feb 11 14:29:52 UTC 2025","","","",""
