"DESCRIPTION","DURATION IN MS","NAME","PARENT SUITE","START TIME","STATUS","STOP TIME","SUB SUITE","SUITE","TEST CLASS","TEST METHOD"
"","111","should render the instution panel","AdageOfferPartnerPanel","Tue Dec 31 14:13:39 UTC 2024","passed","Tue Dec 31 14:13:39 UTC 2024","","","",""
"","16","renders the first card with correct title, description, and button","OnboardingOffersChoice Component","Tue Dec 31 14:13:52 UTC 2024","passed","Tue Dec 31 14:13:52 UTC 2024","","","",""
"","0","getHumanizeRelativeDistance(undefined) 	= '75 m'","getDistance","Tue Dec 31 14:14:14 UTC 2024","passed","Tue Dec 31 14:14:14 UTC 2024","","","",""
"","1","should validate the form for case: price should not exceed 60000","validationSchema","Tue Dec 31 14:12:11 UTC 2024","passed","Tue Dec 31 14:12:11 UTC 2024","","","",""
"","4","should render email adress with <a> tag and mailto attribute","Markdown","Tue Dec 31 14:13:16 UTC 2024","passed","Tue Dec 31 14:13:16 UTC 2024","","","",""
"","8","should not display actions when selected offers have the wrong status","ActionsBar","Tue Dec 31 14:10:06 UTC 2024","passed","Tue Dec 31 14:10:06 UTC 2024","","","",""
"","0","should validate the following email address : test@test.co","isValidEmail","Tue Dec 31 14:14:36 UTC 2024","passed","Tue Dec 31 14:14:36 UTC 2024","","","",""
"","19","should redirect to offerers page if the offerer has a venue with the same siret","Offerer","Tue Dec 31 14:10:06 UTC 2024","passed","Tue Dec 31 14:10:06 UTC 2024","","","",""
"","2","should not render the add bank account banner if the offerer has no valid bank account and some unlinked venues but a pending bank account","AddBankAccountCallout","Tue Dec 31 14:12:08 UTC 2024","passed","Tue Dec 31 14:12:08 UTC 2024","","","",""
"","57","should render the component","IndividualOfferDetails","Tue Dec 31 14:09:21 UTC 2024","passed","Tue Dec 31 14:09:21 UTC 2024","","","",""
"","0","should not block when following template creation flow (from creation to recapitulatif)","components | RouteLeavingGuardCollectiveOfferCreation","Tue Dec 31 14:11:36 UTC 2024","passed","Tue Dec 31 14:11:36 UTC 2024","","","",""
"","229","should trigger onSubmit callback when submitting","components:UserPhoneForm","Tue Dec 31 14:13:54 UTC 2024","passed","Tue Dec 31 14:13:54 UTC 2024","","","",""
"","78","should render with pending bank account if status is in draft","ReimbursementBankAccount","Tue Dec 31 14:10:13 UTC 2024","passed","Tue Dec 31 14:10:13 UTC 2024","","","",""
"","47","should close the Callout","Callout","Tue Dec 31 14:13:08 UTC 2024","passed","Tue Dec 31 14:13:08 UTC 2024","","","",""
"","2","should gives the same object but with string blank spaces trimmed","trimStringsInObject","Tue Dec 31 14:13:30 UTC 2024","passed","Tue Dec 31 14:13:30 UTC 2024","","","",""
"","68","should render loader while fetching data","OfferType","Tue Dec 31 14:10:17 UTC 2024","passed","Tue Dec 31 14:10:17 UTC 2024","","","",""
"","128","should display actionsBar when at least one offer is selected","TemplateCollectiveOffersScreen","Tue Dec 31 14:10:10 UTC 2024","passed","Tue Dec 31 14:10:10 UTC 2024","","","",""
"","69","should render correctly","StockEventSection","Tue Dec 31 14:14:16 UTC 2024","passed","Tue Dec 31 14:14:16 UTC 2024","","","",""
"","137","should display a set of year filters with the last year selected by default","Income","Tue Dec 31 14:09:52 UTC 2024","passed","Tue Dec 31 14:09:52 UTC 2024","","when the page first renders","",""
"","12","should display a Warning callout","Callout","Tue Dec 31 14:13:08 UTC 2024","passed","Tue Dec 31 14:13:08 UTC 2024","","","",""
"","47","should render all institution if no institution provided","CollectiveOfferVisibilitySection","Tue Dec 31 14:14:00 UTC 2024","passed","Tue Dec 31 14:14:00 UTC 2024","","","",""
"","5","should not render the add link venue banner if the offerer  hasValidBankAccount = true and venuesWithNonFreeOffersWithoutBankAccounts = []","LinkVenueCallout","Tue Dec 31 14:11:23 UTC 2024","passed","Tue Dec 31 14:11:23 UTC 2024","","With FF enabled","",""
"","71","should display mail and phone and passCulture default form","RequestFormDialog","Tue Dec 31 14:10:39 UTC 2024","passed","Tue Dec 31 14:10:39 UTC 2024","","","",""
"","136","should disable save button, description, price and places when offer is reimbursed or is used since more than 2 days","OfferEducationalStock","Tue Dec 31 14:10:34 UTC 2024","passed","Tue Dec 31 14:10:34 UTC 2024","","","",""
"","29","should display banner if at least one venue has no pricing point","LinkVenueDialog","Tue Dec 31 14:10:31 UTC 2024","passed","Tue Dec 31 14:10:31 UTC 2024","","","",""
"","50","should display Opening hours details message","route VenueEdition","Tue Dec 31 14:10:26 UTC 2024","passed","Tue Dec 31 14:10:26 UTC 2024","","","",""
"","475","should display the right fields and titles","screens | OfferEducational : creation offer type step","Tue Dec 31 14:10:50 UTC 2024","passed","Tue Dec 31 14:10:51 UTC 2024","","","",""
"","530","should show a loader while waiting for response","offers","Tue Dec 31 14:09:30 UTC 2024","passed","Tue Dec 31 14:09:31 UTC 2024","","","",""
"","0","should not be able to archive from summary when the offer is already archived and the offer is reimbursed","canArchiveCollectiveOffer","Tue Dec 31 14:11:42 UTC 2024","passed","Tue Dec 31 14:11:42 UTC 2024","","","",""
"","77","should display the offer title and history title and amount when it is not free","IndividualBookingsStatusCell","Tue Dec 31 14:11:01 UTC 2024","passed","Tue Dec 31 14:11:01 UTC 2024","","","",""
"","5","should not display booking link for cancelled booking","OfferEducationalActions","Tue Dec 31 14:10:26 UTC 2024","passed","Tue Dec 31 14:10:26 UTC 2024","","","",""
"","66","should go back to summary when clicking on ""Annuler et quitter""","screens:StocksThing","Tue Dec 31 14:10:44 UTC 2024","passed","Tue Dec 31 14:10:44 UTC 2024","","","",""
"","113","should log event when clicking on the button","DetailsButtonCell","Tue Dec 31 14:14:07 UTC 2024","passed","Tue Dec 31 14:14:07 UTC 2024","","","",""
"","16","should see archive button when FF status is enable and archive action is possible for template offer","CollectiveEditionOfferNavigation","Tue Dec 31 14:10:11 UTC 2024","passed","Tue Dec 31 14:10:11 UTC 2024","","","",""
"","594","should display the route leaving guard when leaving without saving","VenueSettingsScreen","Tue Dec 31 14:10:39 UTC 2024","passed","Tue Dec 31 14:10:39 UTC 2024","","","",""
"","0","should return list containing only BookingRecap matching ISBN keywords with surrounding space","filterBookingsRecap","Tue Dec 31 14:10:31 UTC 2024","passed","Tue Dec 31 14:10:31 UTC 2024","","","",""
"","8","should not display help download link when user is readonly","AdageHeader","Tue Dec 31 14:11:17 UTC 2024","passed","Tue Dec 31 14:11:17 UTC 2024","","","",""
"","202","should open a download modal","IndividualOfferBookingsSummaryScreen","Tue Dec 31 14:11:39 UTC 2024","passed","Tue Dec 31 14:11:39 UTC 2024","","","",""
"","19","should see the data from the previous forms for validation without public name","ValidationScreen","Tue Dec 31 14:10:28 UTC 2024","passed","Tue Dec 31 14:10:28 UTC 2024","","Data sending tests","",""
"","24","should display error when file's type is refused","ImageUploadBrowserForm","Tue Dec 31 14:12:22 UTC 2024","passed","Tue Dec 31 14:12:22 UTC 2024","","","",""
"","51","should not have ""Tout Sélectionner"" checked when there is no offer to be checked","CollectiveOffersScreen","Tue Dec 31 14:09:47 UTC 2024","passed","Tue Dec 31 14:09:47 UTC 2024","","","",""
"","26","should be able to go to the stocks step if the details are already filled","CollectiveCreationOfferNavigation","Tue Dec 31 14:10:31 UTC 2024","passed","Tue Dec 31 14:10:31 UTC 2024","","","",""
"","102","should render errors","screens:SignupJourney::OffererForm","Tue Dec 31 14:11:39 UTC 2024","passed","Tue Dec 31 14:11:39 UTC 2024","","","",""
"","0","should return the last DMS application for a specific venue","getLastCollectiveDmsApplication","Tue Dec 31 14:11:54 UTC 2024","passed","Tue Dec 31 14:11:54 UTC 2024","","getLastDmsApplicationForOfferer","",""
"","11","should display ""Dates et Capacités"" step as active/enabled when offer has price categories","IndividualOfferNavigation","Tue Dec 31 14:10:44 UTC 2024","passed","Tue Dec 31 14:10:44 UTC 2024","","when offer is an event","",""
"","125","should display a (cumulative) error message that cannot be cleared on new inputs","DetailsEanSearch","Tue Dec 31 14:10:29 UTC 2024","passed","Tue Dec 31 14:10:29 UTC 2024","when no EAN search has been performed > when the subcategory requires an EAN","when the draft offer has not been created yet (dirty)","",""
"","17","should display error","StatusToggleButton","Tue Dec 31 14:11:31 UTC 2024","passed","Tue Dec 31 14:11:31 UTC 2024","","","",""
"","74","should display the add button","AddVenueProviderButton","Tue Dec 31 14:11:58 UTC 2024","passed","Tue Dec 31 14:11:59 UTC 2024","","","",""
"","14","should display provider banner","IndivualOfferLayout","Tue Dec 31 14:11:27 UTC 2024","passed","Tue Dec 31 14:11:27 UTC 2024","","","",""
"","0","should return the students levels without marseille levels","buildStudentLevelsMapWithDefaultValue","Tue Dec 31 14:13:31 UTC 2024","passed","Tue Dec 31 14:13:31 UTC 2024","","","",""
"","75","should go next step with individual target customer","screens:SignupJourney::Activity","Tue Dec 31 14:11:19 UTC 2024","passed","Tue Dec 31 14:11:19 UTC 2024","","","",""
"","0","should validate the following email address : a.test@test.com","isValidEmail","Tue Dec 31 14:14:36 UTC 2024","passed","Tue Dec 31 14:14:36 UTC 2024","","","",""
"","9","should display the image if its present","PartnerPages","Tue Dec 31 14:12:27 UTC 2024","passed","Tue Dec 31 14:12:27 UTC 2024","","","",""
"","67","should call tracker event when archiving an offer","ActionsBar","Tue Dec 31 14:09:34 UTC 2024","passed","Tue Dec 31 14:09:34 UTC 2024","","","",""
"","222","should save the offer without warning on ""Enregistrer les modifications"" button click","screens:StocksEventEdition","Tue Dec 31 14:09:40 UTC 2024","passed","Tue Dec 31 14:09:40 UTC 2024","","","",""
"","0","should return a valid initial form object with offer address fields","setInitialFormValues","Tue Dec 31 14:12:48 UTC 2024","passed","Tue Dec 31 14:12:48 UTC 2024","","","",""
"","6","should not show the dates selection form section when the offer is permanent","FormDates","Tue Dec 31 14:11:28 UTC 2024","passed","Tue Dec 31 14:11:28 UTC 2024","","","",""
"","12","should have right attributes for open in new tab","ButtonLink","Tue Dec 31 14:12:57 UTC 2024","passed","Tue Dec 31 14:12:57 UTC 2024","","","",""
"","12","should display ""Tarifs"" step as active/enabled when offer has price categories","IndividualOfferNavigation","Tue Dec 31 14:10:44 UTC 2024","passed","Tue Dec 31 14:10:44 UTC 2024","","when offer is an event","",""
"","2","should not display the formats section if the offer has no formats","AdageOfferDetailsSection","Tue Dec 31 14:11:44 UTC 2024","passed","Tue Dec 31 14:11:44 UTC 2024","","","",""
"","42","should render when offer is given","IndivualOfferLayout","Tue Dec 31 14:11:27 UTC 2024","passed","Tue Dec 31 14:11:27 UTC 2024","","","",""
"","0","should not sort offers if the column sort is not defined","sortCollectiveOffers","Tue Dec 31 14:12:46 UTC 2024","passed","Tue Dec 31 14:12:46 UTC 2024","","","",""
"","6","should return the list of tags when the offer happens at school","getOfferTags","Tue Dec 31 14:11:40 UTC 2024","passed","Tue Dec 31 14:11:40 UTC 2024","","","",""
"","2","should return an empty array when start date is after end date","getDatesInInterval","Tue Dec 31 14:12:59 UTC 2024","passed","Tue Dec 31 14:12:59 UTC 2024","","","",""
"","1","should return the students level map with all keys enabled","buildStudentLevelsMapWithDefaultValue","Tue Dec 31 14:13:31 UTC 2024","passed","Tue Dec 31 14:13:31 UTC 2024","","","",""
"","28","should return an error when the duplication failed","CollectiveEditionOfferNavigation","Tue Dec 31 14:10:11 UTC 2024","passed","Tue Dec 31 14:10:11 UTC 2024","","","",""
"","21","should be the sum of individual offer stocks remaining quantity","IndividualOfferRow","Tue Dec 31 14:10:22 UTC 2024","passed","Tue Dec 31 14:10:22 UTC 2024","","offer remaining quantity or institution","",""
"","8","should display disabled Adage step","CollectiveDmsTimeline","Tue Dec 31 14:11:00 UTC 2024","passed","Tue Dec 31 14:11:00 UTC 2024","","should replace ""lieu"" by ""structure"" if WIP_ENABLE_OFFER_ADDRESS is enabled","",""
"","0","should give venue name when venue is not virtual and has no public name","computeVenueDisplayName","Tue Dec 31 14:12:02 UTC 2024","passed","Tue Dec 31 14:12:02 UTC 2024","","","",""
"","29","should track ReimbursementPoint","VenueOfferSteps","Tue Dec 31 14:12:26 UTC 2024","passed","Tue Dec 31 14:12:26 UTC 2024","","","",""
"","0","should return stock details from requested offer when requestedDate, totalStudents and totalTeachers are defined","extractInitialVisibilityValues","Tue Dec 31 14:11:29 UTC 2024","passed","Tue Dec 31 14:11:29 UTC 2024","","","",""
"","32","should disable save button when access is read only","OfferEducationalForm","Tue Dec 31 14:11:35 UTC 2024","passed","Tue Dec 31 14:11:35 UTC 2024","","","",""
"","1","should convert from my locale to departement timezone and give result in utc with a different local time","convertFromLocalTimeToVenueTimezoneInUtc","Tue Dec 31 14:11:54 UTC 2024","passed","Tue Dec 31 14:11:54 UTC 2024","","","",""
"","1","should validate the form for case: booking limit date should not be in the past","validationSchema","Tue Dec 31 14:12:11 UTC 2024","passed","Tue Dec 31 14:12:11 UTC 2024","","","",""
"","138","should duplicate a bookable","CollectiveActionsCells","Tue Dec 31 14:09:52 UTC 2024","passed","Tue Dec 31 14:09:52 UTC 2024","","CollectiveActionsCells:Duplicate","",""
"","4","should not display permanent venues","VenueList","Tue Dec 31 14:12:42 UTC 2024","passed","Tue Dec 31 14:12:42 UTC 2024","","","",""
"","29","should send event when offer is remove from favorites","OfferFavoriteButton","Tue Dec 31 14:13:17 UTC 2024","passed","Tue Dec 31 14:13:17 UTC 2024","","","",""
"","351","should call api when selecting new pricing point","PricingPoint","Tue Dec 31 14:11:29 UTC 2024","passed","Tue Dec 31 14:11:29 UTC 2024","","","",""
"","124","should return domains options when the api call was successful","OfferFilters","Tue Dec 31 14:10:35 UTC 2024","passed","Tue Dec 31 14:10:35 UTC 2024","","","",""
"","51","should display the redirection confirmation modal only when the next location is About page","components | RouteLeavingGuardCollectiveOfferCreation | RouteLeavingGuard","Tue Dec 31 14:12:06 UTC 2024","passed","Tue Dec 31 14:12:06 UTC 2024","","","",""
"","51","should disable booking limit datetime when form access is read only","","Tue Dec 31 14:10:34 UTC 2024","passed","Tue Dec 31 14:10:34 UTC 2024","","","",""
"","29","should render the expected table with max given number of hits per page","components | BookingsRecapTable","Tue Dec 31 14:10:03 UTC 2024","passed","Tue Dec 31 14:10:03 UTC 2024","","","",""
"","93","should display creation links when user has a venue created","VenueCrationLinks","Tue Dec 31 14:13:41 UTC 2024","passed","Tue Dec 31 14:13:41 UTC 2024","","","",""
"","42","should display the edition button when the FF ENABLE_COLLECTIVE_NEW_STATUSES is disabled and the offer is template","CollectiveOfferSummary","Tue Dec 31 14:10:16 UTC 2024","passed","Tue Dec 31 14:10:16 UTC 2024","","","",""
"","102","should log breadcrumbs navigation to authentication","test renderSignupJourneyStepper","Tue Dec 31 14:11:15 UTC 2024","passed","Tue Dec 31 14:11:15 UTC 2024","","","",""
"","66","should remove notification mail input when trash icon is clicked","FormNotifications","Tue Dec 31 14:12:42 UTC 2024","passed","Tue Dec 31 14:12:43 UTC 2024","","","",""
"","378","should require an offer venue selection from the user","screens | OfferEducational : event address step","Tue Dec 31 14:11:07 UTC 2024","passed","Tue Dec 31 14:11:08 UTC 2024","","when there are multiple venues managed by the offerer","",""
"","53","should display the status label","IndividualBookingsStatusCell","Tue Dec 31 14:11:01 UTC 2024","passed","Tue Dec 31 14:11:01 UTC 2024","","","",""
"","44","should not show template offers link in collective offer section link when FF is disabled","SideNavLinks","Tue Dec 31 14:11:25 UTC 2024","passed","Tue Dec 31 14:11:25 UTC 2024","","","",""
"","8","should not show the favorite button if the user is not admin","AdageOfferHeader","Tue Dec 31 14:11:13 UTC 2024","passed","Tue Dec 31 14:11:13 UTC 2024","","","",""
"","258","should have venue value be removed when user asks for all venues","route CollectiveOffers","Tue Dec 31 14:10:53 UTC 2024","passed","Tue Dec 31 14:10:53 UTC 2024","","url query params","",""
"","76","should log breadcrumbs navigation","test renderSignupJourneyStepper","Tue Dec 31 14:11:15 UTC 2024","passed","Tue Dec 31 14:11:15 UTC 2024","","","",""
"","8","should render all information when there are only one stock","StockEventSection","Tue Dec 31 14:13:00 UTC 2024","passed","Tue Dec 31 14:13:00 UTC 2024","","","",""
"","13","should display the right wording without the OA FF","CollectiveDataEdition","Tue Dec 31 14:09:52 UTC 2024","passed","Tue Dec 31 14:09:52 UTC 2024","","OA feature flag","",""
"","199","should render selection duplication page","CollectiveOfferConfirmation","Tue Dec 31 14:11:12 UTC 2024","passed","Tue Dec 31 14:11:13 UTC 2024","","","",""
"","1","should handle circular references","trimStringsInObject","Tue Dec 31 14:13:30 UTC 2024","passed","Tue Dec 31 14:13:30 UTC 2024","","","",""
"","15","should render image uploader without file","ImageUploader","Tue Dec 31 14:13:09 UTC 2024","passed","Tue Dec 31 14:13:10 UTC 2024","","","",""
"","128","should have creation mode value when user filters by creation mode","route Offers","Tue Dec 31 14:09:25 UTC 2024","passed","Tue Dec 31 14:09:26 UTC 2024","","url query params","",""
"","0","should return false if the element is null or undefined","isCollectiveOfferTemplate","Tue Dec 31 14:14:03 UTC 2024","passed","Tue Dec 31 14:14:03 UTC 2024","","","",""
"","0","should return only selected days","getDatesInInterval","Tue Dec 31 14:12:59 UTC 2024","passed","Tue Dec 31 14:12:59 UTC 2024","","","",""
"","157","should not inform the user when the selected filter is the same than the actual filter","components | BookingsRecap | Pro user","Tue Dec 31 14:09:31 UTC 2024","passed","Tue Dec 31 14:09:31 UTC 2024","","","",""
"","69","should allow edition for a template offer when the ENABLE_COLLECTIVE_NEW_STATUSES FF is enabled and the edition of details is allowed","CollectiveActionsCells","Tue Dec 31 14:09:52 UTC 2024","passed","Tue Dec 31 14:09:52 UTC 2024","","","",""
"","58","should show the custom contact form when the custom contact checkbox is checked","FormContactTemplate","Tue Dec 31 14:12:55 UTC 2024","passed","Tue Dec 31 14:12:55 UTC 2024","","","",""
"","0","should not return a date if the end date of the offer does not exist","adageOfferDates","Tue Dec 31 14:12:48 UTC 2024","passed","Tue Dec 31 14:12:48 UTC 2024","","getFormattedDatesForBookableOffer","",""
"","41","should render offerer address filter with default option selected and given venues as options","IndividualOffersScreen","Tue Dec 31 14:09:35 UTC 2024","passed","Tue Dec 31 14:09:35 UTC 2024","","","",""
"","123","should trigger search when clicking Rechercher while using geoloc","OfferFilters","Tue Dec 31 14:10:36 UTC 2024","passed","Tue Dec 31 14:10:36 UTC 2024","","","",""
"","1","should set default initial values from offer correctly","setDefaultInitialValuesFromOffer","Tue Dec 31 14:10:59 UTC 2024","passed","Tue Dec 31 14:10:59 UTC 2024","","","",""
"","14","should display a expiration row if the bookable offer is active","ollectiveOfferRow","Tue Dec 31 14:09:56 UTC 2024","passed","Tue Dec 31 14:09:56 UTC 2024","","","",""
"","16","should render link when needed","Stepper","Tue Dec 31 14:12:23 UTC 2024","passed","Tue Dec 31 14:12:23 UTC 2024","","","",""
"","48","should display the number of offers for the user institution","AdageHeader","Tue Dec 31 14:11:16 UTC 2024","passed","Tue Dec 31 14:11:16 UTC 2024","","","",""
"","71","should close the options panel when the Tab key is pressed","SelectAutocomplete","Tue Dec 31 14:09:38 UTC 2024","passed","Tue Dec 31 14:09:38 UTC 2024","","keys","",""
"","12","should validate the form for case: valid form","validationSchema OfferEducational","Tue Dec 31 14:11:46 UTC 2024","passed","Tue Dec 31 14:11:46 UTC 2024","","template offer","",""
"","18","should indicate current page","src | components | Tabs","Tue Dec 31 14:13:05 UTC 2024","passed","Tue Dec 31 14:13:05 UTC 2024","","Accessibility","",""
"","200","should not display all offerer options on render","OffererStatsScreen","Tue Dec 31 14:12:45 UTC 2024","passed","Tue Dec 31 14:12:45 UTC 2024","","","",""
"","2","should return the correct parent","getNthParentFormValues","Tue Dec 31 14:14:08 UTC 2024","passed","Tue Dec 31 14:14:08 UTC 2024","","","",""
"","26","should not render when the offer is not set","IndividualOfferDetails","Tue Dec 31 14:09:27 UTC 2024","passed","Tue Dec 31 14:09:27 UTC 2024","","onboarding","",""
"","12","should show the isbn when the offer has one","OfferNameCell","Tue Dec 31 14:11:11 UTC 2024","passed","Tue Dec 31 14:11:11 UTC 2024","","","",""
"","8","should render ""non conforme"" status when ff is active for REJECTED displayed status","CollectiveStatusLabel","Tue Dec 31 14:12:07 UTC 2024","passed","Tue Dec 31 14:12:07 UTC 2024","","","",""
"","153","should display the venue provider cards & add provider button","VenueSettingsScreen","Tue Dec 31 14:10:39 UTC 2024","passed","Tue Dec 31 14:10:39 UTC 2024","","","",""
"","18","should display status and button in edition","IndivualOfferLayout","Tue Dec 31 14:11:27 UTC 2024","passed","Tue Dec 31 14:11:27 UTC 2024","","","",""
"","8","should render ""en instruction"" status when ff is active for PENDING displayed status","CollectiveStatusLabel","Tue Dec 31 14:12:07 UTC 2024","passed","Tue Dec 31 14:12:07 UTC 2024","","","",""
"","4","should serialize data with event stock","routes::Summary::serializers","Tue Dec 31 14:12:14 UTC 2024","passed","Tue Dec 31 14:12:14 UTC 2024","","","",""
"","82","should activate selected offers upon publication","ActionsBar","Tue Dec 31 14:09:33 UTC 2024","passed","Tue Dec 31 14:09:33 UTC 2024","","","",""
"","3","should return 1 when first row offer name comes after second row offer name","sortByOfferName","Tue Dec 31 14:11:25 UTC 2024","passed","Tue Dec 31 14:11:25 UTC 2024","","","",""
"","0","should compute max width for original ""portrait"" target ""landscape""","getCropMaxDimension","Tue Dec 31 14:13:51 UTC 2024","passed","Tue Dec 31 14:13:51 UTC 2024","","","",""
"","1","should map api response errors to form one without changes","serializeApiErrors","Tue Dec 31 14:11:56 UTC 2024","passed","Tue Dec 31 14:11:56 UTC 2024","","","",""
"","105","should set endingDate when the beginningDate changes","FormDates","Tue Dec 31 14:11:28 UTC 2024","passed","Tue Dec 31 14:11:28 UTC 2024","","","",""
"","220","should require a description with less than 1000 chars (and truncate longer strings)","screens | OfferEducational : creation offer type step","Tue Dec 31 14:10:57 UTC 2024","passed","Tue Dec 31 14:10:57 UTC 2024","","title, description and duration inputs","",""
"","113","should link offerer to user when they confirm","screens:SignupJourney::Offerers","Tue Dec 31 14:10:26 UTC 2024","passed","Tue Dec 31 14:10:26 UTC 2024","","modal handling","",""
"","0","should return an array with one date when start date is equal to end date","getDatesInInterval","Tue Dec 31 14:12:59 UTC 2024","passed","Tue Dec 31 14:12:59 UTC 2024","","","",""
"","1","should display label for variant: green","Tag","Tue Dec 31 14:14:33 UTC 2024","passed","Tue Dec 31 14:14:33 UTC 2024","","render","",""
"","21","should show existing parameters","CinemaProviderForm","Tue Dec 31 14:12:17 UTC 2024","passed","Tue Dec 31 14:12:17 UTC 2024","","edit existing cinema provider","",""
"","32","should failed active status value","OfferEducationalActions","Tue Dec 31 14:10:26 UTC 2024","passed","Tue Dec 31 14:10:26 UTC 2024","","","",""
"","5","should render { collectiveDmsApplication: { application: 123, depositDate: '2024-12-31T14:10:59.843Z', lastChangeDate: '2024-12-31T14:10:59.843Z', procedure: 456, state: 'sans_suite', venueId: 1 }, expectedLabel: 'Votre demande de référencement a été classée sans suite' } status","CollectiveDmsTimeline","Tue Dec 31 14:10:59 UTC 2024","passed","Tue Dec 31 14:10:59 UTC 2024","","","",""
"","7","should not render error and warning messages when all venues are linked","ReimbursementBankAccount","Tue Dec 31 14:10:13 UTC 2024","passed","Tue Dec 31 14:10:13 UTC 2024","","","",""
"","72","should display the contact form when the contact modal is opened","ContactButton","Tue Dec 31 14:13:26 UTC 2024","passed","Tue Dec 31 14:13:26 UTC 2024","","","",""
"","0","should validate the form for case: in edition, quantity below bookings number","validationSchema","Tue Dec 31 14:13:06 UTC 2024","passed","Tue Dec 31 14:13:06 UTC 2024","","","",""
"","147","should toggle venues list","screens:SignupJourney::Offerers","Tue Dec 31 14:10:26 UTC 2024","passed","Tue Dec 31 14:10:26 UTC 2024","","","",""
"","182","should not display any message when user delete empty stock","screens:StocksEventEdition","Tue Dec 31 14:09:41 UTC 2024","passed","Tue Dec 31 14:09:41 UTC 2024","","","",""
"","83","should render loader while fetching data","CollectiveTableRow","Tue Dec 31 14:12:39 UTC 2024","passed","Tue Dec 31 14:12:39 UTC 2024","","","",""
