"DESCRIPTION","DURATION IN MS","NAME","PARENT SUITE","START TIME","STATUS","STOP TIME","SUB SUITE","SUITE","TEST CLASS","TEST METHOD"
"","8","should not display booking link for cancelled booking","OfferEducationalActions","Tue Jan 14 15:55:15 UTC 2025","passed","Tue Jan 14 15:55:15 UTC 2025","","","",""
"","0","should block when leaving offer creation","components | RouteLeavingGuardCollectiveOfferCreation","Tue Jan 14 15:56:25 UTC 2025","passed","Tue Jan 14 15:56:25 UTC 2025","","","",""
"","5","should display bank account link on second venue if user has no bank account and no paid offer","VenueOfferSteps","Tue Jan 14 15:55:50 UTC 2025","passed","Tue Jan 14 15:55:50 UTC 2025","","","",""
"","35","should display the checkbox disabled when the input is disabled","QuantityInput","Tue Jan 14 15:57:08 UTC 2025","passed","Tue Jan 14 15:57:08 UTC 2025","","","",""
"","250","should have venue value when user filters by venue","route TemplateCollectiveOffers","Tue Jan 14 15:55:37 UTC 2025","passed","Tue Jan 14 15:55:38 UTC 2025","","url query params","",""
"","110","should update venue on submit","AllocineProviderEdit","Tue Jan 14 15:57:53 UTC 2025","passed","Tue Jan 14 15:57:53 UTC 2025","","","",""
"","7","should display ""Enregistrer et continuer"" button on other pages","IndividualOffer::ActionBar","Tue Jan 14 15:56:55 UTC 2025","passed","Tue Jan 14 15:56:55 UTC 2025","","on creation","",""
"","463","should display the right fields and titles","screens | OfferEducational : creation offer type step","Tue Jan 14 15:55:34 UTC 2025","passed","Tue Jan 14 15:55:35 UTC 2025","","","",""
"","0","should return true when collective offer status is REJECTED in summary page","canArchiveCollectiveOffer","Tue Jan 14 15:56:32 UTC 2025","passed","Tue Jan 14 15:56:32 UTC 2025","","","",""
"","29","should track ReimbursementPoint","VenueOfferSteps","Tue Jan 14 15:57:17 UTC 2025","passed","Tue Jan 14 15:57:17 UTC 2025","","","",""
"","109","should display a black filter icon","components | FilterByBookingStatus","Tue Jan 14 15:56:09 UTC 2025","passed","Tue Jan 14 15:56:09 UTC 2025","","","",""
"","1","should format a date with the right format for a HTML input","formatShortDateForInput","Tue Jan 14 15:56:32 UTC 2025","passed","Tue Jan 14 15:56:32 UTC 2025","","","",""
"","54","should display 1 date and time when dates are the same","OfferNameCell","Tue Jan 14 15:57:10 UTC 2025","passed","Tue Jan 14 15:57:10 UTC 2025","","","",""
"","3","should not call API when SIRET is empty","getsiretData","Tue Jan 14 15:58:13 UTC 2025","passed","Tue Jan 14 15:58:13 UTC 2025","","","",""
"","39","should display right message on edition","VenueFormActionBar","Tue Jan 14 15:58:56 UTC 2025","passed","Tue Jan 14 15:58:57 UTC 2025","","","",""
"","5","should log an event containing query string and url parameters","useLogNavigation","Tue Jan 14 15:57:21 UTC 2025","passed","Tue Jan 14 15:57:21 UTC 2025","","","",""
"","11","should render duo informations for can be duo things (like ESCAPE_GAME or CARTE_MUSEE)","StockThingSection","Tue Jan 14 15:58:58 UTC 2025","passed","Tue Jan 14 15:58:58 UTC 2025","","","",""
"","248","should save the offer without warning on ""Enregistrer les modifications"" button click","screens:StocksEventEdition","Tue Jan 14 15:54:26 UTC 2025","passed","Tue Jan 14 15:54:26 UTC 2025","","","",""
"","229","should fetch bookings for the filtered venue as many times as the number of pages","components | BookingsRecap | Pro user","Tue Jan 14 15:54:19 UTC 2025","passed","Tue Jan 14 15:54:19 UTC 2025","","","",""
"","1","should compute params with given prefilters","buildBookingsRecapQuery","Tue Jan 14 15:58:30 UTC 2025","passed","Tue Jan 14 15:58:30 UTC 2025","","","",""
"","0","returns 31st August of current year if current date is before September","getMaxEndDate","Tue Jan 14 15:59:27 UTC 2025","passed","Tue Jan 14 15:59:27 UTC 2025","","","",""
"","56","should render edition summary","Summary stock section","Tue Jan 14 15:55:12 UTC 2025","passed","Tue Jan 14 15:55:12 UTC 2025","","for stock event","",""
"","63","should display banner if offerer has no pricing point and venue has no siret","ReimbursementFields","Tue Jan 14 15:57:43 UTC 2025","passed","Tue Jan 14 15:57:43 UTC 2025","","","",""
"","173","should render the sitemap heading","Sitemap","Tue Jan 14 15:56:31 UTC 2025","passed","Tue Jan 14 15:56:31 UTC 2025","","","",""
"","26","should activate offer with booking limit date time in the future","OfferEducationalActions","Tue Jan 14 15:55:15 UTC 2025","passed","Tue Jan 14 15:55:15 UTC 2025","","","",""
"","2","getHumanizeRelativeDistance(undefined) 	= '7 m'","getDistance","Tue Jan 14 15:59:05 UTC 2025","passed","Tue Jan 14 15:59:05 UTC 2025","","","",""
"","50","should check an option when user click on it","AdageMultiselect","Tue Jan 14 15:57:30 UTC 2025","passed","Tue Jan 14 15:57:30 UTC 2025","","","",""
"","1","should return the national program Olympiade culturelle for any domains","getNationalProgramsForDomains","Tue Jan 14 15:59:17 UTC 2025","passed","Tue Jan 14 15:59:17 UTC 2025","","","",""
"","1","refuses image when it's heavier than maximum","image constraints","Tue Jan 14 15:56:45 UTC 2025","passed","Tue Jan 14 15:56:45 UTC 2025","","size","",""
"","75","should display the contact form when the contact modal is opened","ContactButton","Tue Jan 14 15:58:19 UTC 2025","passed","Tue Jan 14 15:58:19 UTC 2025","","","",""
"","45","should prefill form with requested information","CollectiveOfferVisibility","Tue Jan 14 15:54:46 UTC 2025","passed","Tue Jan 14 15:54:46 UTC 2025","","edition","",""
"","113","should not allow user to add a date for a synchronized offer","screens:StocksEventEdition","Tue Jan 14 15:54:25 UTC 2025","passed","Tue Jan 14 15:54:26 UTC 2025","","","",""
"","70","should render steps for pending booking","collective timeline","Tue Jan 14 15:54:59 UTC 2025","passed","Tue Jan 14 15:54:59 UTC 2025","","","",""
"","26","should render tabs as a navigation","src | components | Tabs","Tue Jan 14 15:57:54 UTC 2025","passed","Tue Jan 14 15:57:54 UTC 2025","","Accessibility","",""
"","28","should display authentication signup journey if offerer is set","Offerer","Tue Jan 14 15:54:52 UTC 2025","passed","Tue Jan 14 15:54:52 UTC 2025","","","",""
"","129","should render venue filter with default option selected and given venues as options","TemplateCollectiveOffersScreen","Tue Jan 14 15:54:56 UTC 2025","passed","Tue Jan 14 15:54:56 UTC 2025","","","",""
"","102","should not display date selection table and submit should be clickable if only one date is returned","DownloadBookingModal","Tue Jan 14 15:55:59 UTC 2025","passed","Tue Jan 14 15:55:59 UTC 2025","","","",""
"","64","should display how many dates have been used up when the warning button is clicked.","OfferNameCell","Tue Jan 14 15:56:01 UTC 2025","passed","Tue Jan 14 15:56:01 UTC 2025","","","",""
"","31","should show existing parameters","CinemaProviderForm","Tue Jan 14 15:57:06 UTC 2025","passed","Tue Jan 14 15:57:06 UTC 2025","","edit existing cinema provider","",""
"","30","should render statistics dashboard with statistics coming soon message","StatisticsDashboard","Tue Jan 14 15:56:51 UTC 2025","passed","Tue Jan 14 15:56:51 UTC 2025","","","",""
"","0","should return 0 when first row bookingDate is the same as second row bookingDate","sortByBookingDate","Tue Jan 14 15:56:13 UTC 2025","passed","Tue Jan 14 15:56:13 UTC 2025","","","",""
"","6","should display the ellipsis tag if there are more than 5 selected options","SelectedValuesTags","Tue Jan 14 15:57:39 UTC 2025","passed","Tue Jan 14 15:57:39 UTC 2025","","","",""
"","2","should disabled field for disable statuts ""REJECTED""","StockThingForm::utils::setFormReadOnlyFields","Tue Jan 14 15:58:04 UTC 2025","passed","Tue Jan 14 15:58:04 UTC 2025","","","",""
"","29","should not log breadcrumbs navigation to activity","test renderSignupJourneyStepper","Tue Jan 14 15:56:04 UTC 2025","passed","Tue Jan 14 15:56:04 UTC 2025","","","",""
"","26","should display an import button disabled by default on creation","AllocineProviderForm","Tue Jan 14 15:55:16 UTC 2025","passed","Tue Jan 14 15:55:16 UTC 2025","","","",""
"","42","should display the breadcrumb with a link back to the discovery home","OfferInfos","Tue Jan 14 15:56:07 UTC 2025","passed","Tue Jan 14 15:56:07 UTC 2025","","","",""
"","151","should render correctly","<OnboardingOfferIndividualAutomatic />","Tue Jan 14 15:59:20 UTC 2025","passed","Tue Jan 14 15:59:20 UTC 2025","","","",""
"","95","should change placeholder when user change country code","PhoneNumberInput","Tue Jan 14 15:57:25 UTC 2025","passed","Tue Jan 14 15:57:25 UTC 2025","","","",""
"","3","should return a valid initial form object","setInitialFormValues","Tue Jan 14 15:57:37 UTC 2025","passed","Tue Jan 14 15:57:37 UTC 2025","","","",""
"","466","should display text area + intervention area multiselect when user selects ""other""","screens | OfferEducational : event address step","Tue Jan 14 15:55:53 UTC 2025","passed","Tue Jan 14 15:55:53 UTC 2025","","when there is only one venue managed by the offerer","",""
"","0","should not block when following template creation flow (from recapitulatif to confirmation)","components | RouteLeavingGuardCollectiveOfferCreation","Tue Jan 14 15:56:25 UTC 2025","passed","Tue Jan 14 15:56:25 UTC 2025","","","",""
"","131","should let download several invoices at same time","reimbursementsWithFilters","Tue Jan 14 15:54:43 UTC 2025","passed","Tue Jan 14 15:54:44 UTC 2025","","","",""
"","43","should display warning when limit booking date is in less than 7 days","bookings offer cell","Tue Jan 14 15:56:25 UTC 2025","passed","Tue Jan 14 15:56:25 UTC 2025","","","",""
"","92","should open modal on click on add image button","test ButtonImageEdit","Tue Jan 14 15:57:58 UTC 2025","passed","Tue Jan 14 15:57:58 UTC 2025","","","",""
"","150","should show the email form when the contact email checkbox is checked","FormContactTemplate","Tue Jan 14 15:57:42 UTC 2025","passed","Tue Jan 14 15:57:42 UTC 2025","","","",""
"","28","should display the breadcrumb with a link back to the search page if the user is admin","OfferInfos","Tue Jan 14 15:56:07 UTC 2025","passed","Tue Jan 14 15:56:07 UTC 2025","","","",""
"","39","should display required message if siret is empty for non virtual venue","components | SiretOrCommentFields","Tue Jan 14 15:55:09 UTC 2025","passed","Tue Jan 14 15:55:09 UTC 2025","","should validate SIRET on submit","",""
"","20","should render quantity as ""Illimité"" when quantity is null or undefined","Summary stock section","Tue Jan 14 15:55:11 UTC 2025","passed","Tue Jan 14 15:55:12 UTC 2025","","for stock thing","",""
"","104","should archive an offer template","CollectiveEditionOfferNavigation","Tue Jan 14 15:54:58 UTC 2025","passed","Tue Jan 14 15:54:58 UTC 2025","","","",""
"","22","should display acronym + city when educationalinstitution has no name","ollectiveOfferRow","Tue Jan 14 15:54:41 UTC 2025","passed","Tue Jan 14 15:54:41 UTC 2025","","offer remaining quantity or institution","",""
"","7","should render correctly when offer cannot be duo","StockEventSection","Tue Jan 14 15:59:09 UTC 2025","passed","Tue Jan 14 15:59:09 UTC 2025","","","",""
"","2","should return default values when institution is not defined","extractInitialVisibilityValues","Tue Jan 14 15:57:41 UTC 2025","passed","Tue Jan 14 15:57:41 UTC 2025","","","",""
"","53","should notify of an error if the offer booking limit date is in the past on press ""Publier l’offre""","CollectiveOfferConfirmation","Tue Jan 14 15:55:58 UTC 2025","passed","Tue Jan 14 15:55:59 UTC 2025","","","",""
"","0","should not block when going from visibilite to creation","components | RouteLeavingGuardCollectiveOfferCreation","Tue Jan 14 15:56:25 UTC 2025","passed","Tue Jan 14 15:56:25 UTC 2025","","","",""
"","2","should return true if the object is a collective offer","isCollectiveOffer","Tue Jan 14 15:58:53 UTC 2025","passed","Tue Jan 14 15:58:53 UTC 2025","","","",""
"","49","should not disable price, place number, start datetime, end datetime and event time when allowedAction CAN_EDIT_DISCOUNT and CAN_EDIT_DATES exists and ENABLE_COLLECTIVE_NEW_STATUSES is enabled","FormStock","Tue Jan 14 15:55:34 UTC 2025","passed","Tue Jan 14 15:55:34 UTC 2025","","","",""
"","25","should not display the all participants option when the collective offer is bookable","FormParticipants","Tue Jan 14 15:55:35 UTC 2025","passed","Tue Jan 14 15:55:36 UTC 2025","","","",""
"","7","should not show a list of formats if there is only one element","AdageOfferListCardContent","Tue Jan 14 15:58:33 UTC 2025","passed","Tue Jan 14 15:58:33 UTC 2025","","","",""
"","55","should display duplicate button for draft bookable offer","CollectiveActionsCells","Tue Jan 14 15:54:38 UTC 2025","passed","Tue Jan 14 15:54:38 UTC 2025","","","",""
"","0","should render false","getStockWarningText","Tue Jan 14 15:58:54 UTC 2025","passed","Tue Jan 14 15:58:54 UTC 2025","","","",""
"","120","should change targetCustomer value on click","screens:SignupJourney::ActivityForm","Tue Jan 14 15:55:38 UTC 2025","passed","Tue Jan 14 15:55:38 UTC 2025","","","",""
"","10","should display an error message if POST API ends with an EAN err","DetailsEanSearch","Tue Jan 14 15:55:17 UTC 2025","passed","Tue Jan 14 15:55:17 UTC 2025","when an EAN search is performed succesfully","when the draft offer has not been created yet (dirty)","",""
"","0","should return list containing only BookingRecap matching token keywords with surrounding space","filterBookingsRecap","Tue Jan 14 15:55:19 UTC 2025","passed","Tue Jan 14 15:55:19 UTC 2025","","","",""
"","55","should display public name(if valued) of the venue when addressType is OFFERER_VENUE","OfferVenue","Tue Jan 14 15:58:26 UTC 2025","passed","Tue Jan 14 15:58:26 UTC 2025","","","",""
"","82","should render with template tag","CollectiveOfferCreation","Tue Jan 14 15:57:45 UTC 2025","passed","Tue Jan 14 15:57:45 UTC 2025","","","",""
"","20","should not be displayed when offer is no editable","IndividualOfferRow","Tue Jan 14 15:55:07 UTC 2025","passed","Tue Jan 14 15:55:07 UTC 2025","edit offer link","action buttons","",""
"","0","should return ISO string date without milliseconds","toISOStringWithoutMilliseconds","Tue Jan 14 15:56:32 UTC 2025","passed","Tue Jan 14 15:56:32 UTC 2025","","","",""
"","721","should display the dialog if user updated both withdrawalInformations and address field(s)","screens:IndividualOffer::UsefulInformation","Tue Jan 14 15:54:58 UTC 2025","passed","Tue Jan 14 15:54:58 UTC 2025","","ConfirmDialog","",""
"","0","getHumanizeRelativeDistance(undefined) 	= '2,9 km'","getDistance","Tue Jan 14 15:59:05 UTC 2025","passed","Tue Jan 14 15:59:05 UTC 2025","","","",""
"","1","should create a template from an offer with offer form url","computeInitialValuesFromOffer","Tue Jan 14 15:57:05 UTC 2025","passed","Tue Jan 14 15:57:05 UTC 2025","","","",""
"","1","should return an error when the SIRET is inactive","getsiretData","Tue Jan 14 15:58:13 UTC 2025","passed","Tue Jan 14 15:58:13 UTC 2025","","","",""
"","261","should track event on cancel","screen Offers","Tue Jan 14 15:58:40 UTC 2025","passed","Tue Jan 14 15:58:40 UTC 2025","","","",""
"","1","should return list containing only BookingRecap matching keywords with uppercase letters","filterBookingsRecap","Tue Jan 14 15:55:19 UTC 2025","passed","Tue Jan 14 15:55:19 UTC 2025","","by offer name","",""
"","1","should return all venues when categoryStatus is ONLINE or OFFLINE","getFilteredVenueList","Tue Jan 14 15:57:09 UTC 2025","passed","Tue Jan 14 15:57:09 UTC 2025","","getFilteredVenueListBySubcategory","",""
"","130","should render when no image is given","test ImageUploaderOffer","Tue Jan 14 15:58:22 UTC 2025","passed","Tue Jan 14 15:58:22 UTC 2025","","","",""
"","1","should disabled field synchronized offer","StockThingForm::utils::setFormReadOnlyFields","Tue Jan 14 15:58:04 UTC 2025","passed","Tue Jan 14 15:58:04 UTC 2025","","","",""
"","106","should always display a ""Retour"" button","IndividualOffer::ActionBar","Tue Jan 14 15:56:55 UTC 2025","passed","Tue Jan 14 15:56:55 UTC 2025","","on creation","",""
"","42","should display a DatePicker","components | FilterByEventDate","Tue Jan 14 15:59:08 UTC 2025","passed","Tue Jan 14 15:59:08 UTC 2025","","","",""
"","3","should return nothing if there is only one page","Pagination","Tue Jan 14 15:58:30 UTC 2025","passed","Tue Jan 14 15:58:30 UTC 2025","","","",""
"","54","should display default messages and disable submit button"," Desk","Tue Jan 14 15:55:46 UTC 2025","passed","Tue Jan 14 15:55:46 UTC 2025","","should validate while user is typing","",""
"","0","should add spaces between groups of digits when the price is above 1000","formatPrice","Tue Jan 14 15:59:23 UTC 2025","passed","Tue Jan 14 15:59:23 UTC 2025","","","",""
"","3","should return the union of national programs for multiple domains","getNationalProgramsForDomains","Tue Jan 14 15:59:17 UTC 2025","passed","Tue Jan 14 15:59:17 UTC 2025","","","",""
"","1","should return selectable categories and subCategories for CATEGORY_STATUS.ONLINE_OR_OFFLINE","filterCategories","Tue Jan 14 15:56:04 UTC 2025","passed","Tue Jan 14 15:56:04 UTC 2025","","","",""
"","35","should not display expired offer","offers","Tue Jan 14 15:54:11 UTC 2025","passed","Tue Jan 14 15:54:11 UTC 2025","","","",""
"","3","should return 1 when first row offer name comes after second row offer name","sortByOfferName","Tue Jan 14 15:56:13 UTC 2025","passed","Tue Jan 14 15:56:13 UTC 2025","","","",""
"","28","should display the breadcrumb with a link back to the search page if the url contains 'recherche'","OfferInfos","Tue Jan 14 15:56:07 UTC 2025","passed","Tue Jan 14 15:56:07 UTC 2025","","","",""
"","167","should not show the cancelled status option if the ENABLE_COLLECTIVE_NEW_STATUSES FF is inactive","CollectiveOffersScreen","Tue Jan 14 15:54:35 UTC 2025","passed","Tue Jan 14 15:54:35 UTC 2025","","","",""
"","41","should disable save button when access is read only","OfferEducationalForm","Tue Jan 14 15:56:28 UTC 2025","passed","Tue Jan 14 15:56:28 UTC 2025","","","",""
"","8","should display a Success callout","Callout","Tue Jan 14 15:57:57 UTC 2025","passed","Tue Jan 14 15:57:58 UTC 2025","","","",""
"","4","should not remove dates from an offer to create a template offer","createOfferPayload","Tue Jan 14 15:57:19 UTC 2025","passed","Tue Jan 14 15:57:19 UTC 2025","","","",""
"","51","should display pending offerer banner when rattachement is pending","Homepage","Tue Jan 14 15:55:54 UTC 2025","passed","Tue Jan 14 15:55:54 UTC 2025","","","",""
"","57","user should be able to enter number characters","components | SiretOrCommentFields","Tue Jan 14 15:55:10 UTC 2025","passed","Tue Jan 14 15:55:10 UTC 2025","","should validate SIRET on submit","",""
"","81","should not display error message if offererNames call fails","OffererStatsScreen","Tue Jan 14 15:57:36 UTC 2025","passed","Tue Jan 14 15:57:36 UTC 2025","","","",""
"","75","should render template offer summary creation with one edit link","CollectiveOfferSummaryCreation","Tue Jan 14 15:57:13 UTC 2025","passed","Tue Jan 14 15:57:13 UTC 2025","","","",""
"","1","should validate the form for case: in edition, quantity below 0","validationSchema","Tue Jan 14 15:57:55 UTC 2025","passed","Tue Jan 14 15:57:55 UTC 2025","","","",""
"","42","should not display venueListToggle","screens:SignupJourney::Offerers","Tue Jan 14 15:55:14 UTC 2025","passed","Tue Jan 14 15:55:14 UTC 2025","","","",""
"","281","should allow user to try delete stock from an offer created from charlie api","screens:StocksEventEdition","Tue Jan 14 15:54:24 UTC 2025","passed","Tue Jan 14 15:54:25 UTC 2025","","","",""
"","49","should render correctly","StockEventSection","Tue Jan 14 15:59:09 UTC 2025","passed","Tue Jan 14 15:59:09 UTC 2025","","","",""
"","136","should be able to submit the form","LinkVenueDialog","Tue Jan 14 15:56:23 UTC 2025","passed","Tue Jan 14 15:56:23 UTC 2025","","","",""
"","1","should return teacher details when institution and teacher are defined from requested informations","extractInitialVisibilityValues","Tue Jan 14 15:57:41 UTC 2025","passed","Tue Jan 14 15:57:41 UTC 2025","","","",""
"","54","should allow user to select manual creation mode filter","IndividualOffersScreen","Tue Jan 14 15:54:16 UTC 2025","passed","Tue Jan 14 15:54:16 UTC 2025","","","",""
"","0","should return expected value when there is change on label (not on price)","arePriceCategoriesChanged","Tue Jan 14 15:58:03 UTC 2025","passed","Tue Jan 14 15:58:03 UTC 2025","","","",""
"","241","should update currentPage when clicking on next page button","components | BookingsRecapTable","Tue Jan 14 15:54:50 UTC 2025","passed","Tue Jan 14 15:54:50 UTC 2025","","","",""
"","2","should display no warning when the limit date is in more than 7 days","Utils OfferNameCell","Tue Jan 14 15:59:01 UTC 2025","passed","Tue Jan 14 15:59:01 UTC 2025","","","",""
"","173","should display redirect modal if first offer","Summary","Tue Jan 14 15:54:06 UTC 2025","passed","Tue Jan 14 15:54:07 UTC 2025","","On Creation","",""
"","16","should not display the edition buttons when the FF ENABLE_COLLECTIVE_NEW_STATUSES is enabled the template offer cannot be edited","CollectiveOfferSummary","Tue Jan 14 15:55:03 UTC 2025","passed","Tue Jan 14 15:55:03 UTC 2025","","","",""
"","4","should validate the form for case: missing required fields for unique date","validationSchema","Tue Jan 14 15:56:51 UTC 2025","passed","Tue Jan 14 15:56:51 UTC 2025","","","",""
"","814","should display new stocks notification when creating new stock","screens:StocksEventEdition","Tue Jan 14 15:54:25 UTC 2025","passed","Tue Jan 14 15:54:25 UTC 2025","","","",""
"","27","should display the venue location infos if the offer happens at the offerer place","AdagePreviewLayout","Tue Jan 14 15:57:51 UTC 2025","passed","Tue Jan 14 15:57:51 UTC 2025","","","",""
"","3","should validate the form for case: not valid form without firstName","validationSchema","Tue Jan 14 15:57:33 UTC 2025","passed","Tue Jan 14 15:57:33 UTC 2025","","","",""
"","28","should indicate that user has no offers yet","TemplateCollectiveOffersScreen","Tue Jan 14 15:54:56 UTC 2025","passed","Tue Jan 14 15:54:56 UTC 2025","","","",""
"","104","should display a (cumulative) error message that cannot be cleared on new inputs","DetailsEanSearch","Tue Jan 14 15:55:17 UTC 2025","passed","Tue Jan 14 15:55:17 UTC 2025","when no EAN search has been performed > when the subcategory requires an EAN","when the draft offer has not been created yet (dirty)","",""
"","0","when it is in the school","formatOfferEventAddress","Tue Jan 14 15:58:17 UTC 2025","passed","Tue Jan 14 15:58:17 UTC 2025","","","",""
"","72","should return width and height","useGetImageBitmap","Tue Jan 14 15:59:00 UTC 2025","passed","Tue Jan 14 15:59:00 UTC 2025","","","",""
"","17","should display the custom contact custom url","CollectiveOfferSummary","Tue Jan 14 15:55:03 UTC 2025","passed","Tue Jan 14 15:55:03 UTC 2025","","","",""
"","89","should not be redirected after cancel on dialog","components | RouteLeavingGuardCollectiveOfferCreation | RouteLeavingGuard","Tue Jan 14 15:56:56 UTC 2025","passed","Tue Jan 14 15:56:56 UTC 2025","","","",""
"","143","should show notification with information message when there are more than 5 pages","components | BookingsRecap | Pro user","Tue Jan 14 15:54:20 UTC 2025","passed","Tue Jan 14 15:54:20 UTC 2025","","","",""
"","543","should display offer location if venue is physical and WIP_ENABLE_OFFER_ADDRESS is active","screens:IndividualOffer::UsefulInformation","Tue Jan 14 15:54:56 UTC 2025","passed","Tue Jan 14 15:54:56 UTC 2025","","","",""
"","57","should display the income results","Income","Tue Jan 14 15:54:38 UTC 2025","passed","Tue Jan 14 15:54:38 UTC 2025","","when the page first renders","",""
"","132","should display Declaration information message","Statement of Declaration page","Tue Jan 14 15:59:32 UTC 2025","passed","Tue Jan 14 15:59:32 UTC 2025","","","",""
"","34","should display the text value of the button when is not loading and the button should be enabled","submit button","Tue Jan 14 15:59:18 UTC 2025","passed","Tue Jan 14 15:59:18 UTC 2025","","","",""
"","1","should return a formatted date with Reunion departement code and default format","formatLocalTimeDateString","Tue Jan 14 15:56:44 UTC 2025","passed","Tue Jan 14 15:56:44 UTC 2025","","","",""
"","66","should render activity step","test SignupJourneyStepper","Tue Jan 14 15:56:23 UTC 2025","passed","Tue Jan 14 15:56:23 UTC 2025","","","",""
"","148","should have offer name value be removed when name search value is an empty string","route TemplateCollectiveOffers","Tue Jan 14 15:55:37 UTC 2025","passed","Tue Jan 14 15:55:37 UTC 2025","","url query params","",""
"","131","should toggle individual section on individual section button click","SideNavLinks","Tue Jan 14 15:56:14 UTC 2025","passed","Tue Jan 14 15:56:14 UTC 2025","","","",""
"","5","should convert from my locale to departement timezone and give result in utc","convertFromLocalTimeToVenueTimezoneInUtc","Tue Jan 14 15:56:44 UTC 2025","passed","Tue Jan 14 15:56:44 UTC 2025","","","",""
"","1","should serialize a venue payload with openingHours","Venue edition payload serializer","Tue Jan 14 15:58:19 UTC 2025","passed","Tue Jan 14 15:58:19 UTC 2025","","","",""
"","360","should remove QRcode prefix"," Desk","Tue Jan 14 15:55:46 UTC 2025","passed","Tue Jan 14 15:55:46 UTC 2025","","should validate while user is typing","",""
"","46","should load features when lastLoaded is not defined","useLoadFeatureFlags","Tue Jan 14 15:58:48 UTC 2025","passed","Tue Jan 14 15:58:48 UTC 2025","","","",""
"","0","should return filter subcategories that are not events","filterCategories","Tue Jan 14 15:56:04 UTC 2025","passed","Tue Jan 14 15:56:04 UTC 2025","","","",""
