"DESCRIPTION","DURATION IN MS","NAME","PARENT SUITE","START TIME","STATUS","STOP TIME","SUB SUITE","SUITE","TEST CLASS","TEST METHOD"
"","0","should return false when collective offer status is ""SOLD_OUT""","canArchiveCollectiveOffer","Fri Jan 10 13:53:04 UTC 2025","passed","Fri Jan 10 13:53:04 UTC 2025","","","",""
"","0","should block when leaving stock creation","components | RouteLeavingGuardCollectiveOfferCreation","Fri Jan 10 13:52:57 UTC 2025","passed","Fri Jan 10 13:52:57 UTC 2025","","","",""
"","21","should filter bookings collective on render","components | BookingsRecapTable","Fri Jan 10 13:51:24 UTC 2025","passed","Fri Jan 10 13:51:24 UTC 2025","","","",""
"","130","should render error message when siret doesn't exist","Offerer","Fri Jan 10 13:51:28 UTC 2025","passed","Fri Jan 10 13:51:28 UTC 2025","","","",""
"","1","should check that localstorage is available","localStorageAvailable","Fri Jan 10 13:55:46 UTC 2025","passed","Fri Jan 10 13:55:46 UTC 2025","","","",""
"","3","should build category options","buildCategoryOptions","Fri Jan 10 13:51:39 UTC 2025","passed","Fri Jan 10 13:51:39 UTC 2025","","","",""
"","162","should have status value when user filters by status","route Offers","Fri Jan 10 13:50:46 UTC 2025","passed","Fri Jan 10 13:50:46 UTC 2025","","url query params","",""
"","53","should allow to publish template offer when the ENABLE_COLLECTIVE_NEW_STATUSES FF is enabled","CollectiveActionsCells","Fri Jan 10 13:51:13 UTC 2025","passed","Fri Jan 10 13:51:13 UTC 2025","","","",""
"","41","should display suggestions if there are no search results","offersSearch component","Fri Jan 10 13:51:41 UTC 2025","passed","Fri Jan 10 13:51:41 UTC 2025","","","",""
"","11","should show error page","app","Fri Jan 10 13:52:44 UTC 2025","passed","Fri Jan 10 13:52:44 UTC 2025","","when is not authenticated","",""
"","671","should submit the form with valid payload","VenueSettingsScreen","Fri Jan 10 13:52:02 UTC 2025","passed","Fri Jan 10 13:52:03 UTC 2025","","","",""
"","93","should render subtitle if provided","CollectiveOfferLayout","Fri Jan 10 13:54:33 UTC 2025","passed","Fri Jan 10 13:54:33 UTC 2025","","","",""
"","121","should focus the close button when the button menu is clicked","Layout","Fri Jan 10 13:53:35 UTC 2025","passed","Fri Jan 10 13:53:35 UTC 2025","on smaller screen sizes","side navigation","",""
"","111","should select an offer","CollectiveOfferConfirmation","Fri Jan 10 13:52:30 UTC 2025","passed","Fri Jan 10 13:52:30 UTC 2025","","","",""
"","55","should reload offer to cancel next step when deleting last offer","StocksEventList","Fri Jan 10 13:51:24 UTC 2025","passed","Fri Jan 10 13:51:24 UTC 2025","","","",""
"","147","should display the adresses","Offerers","Fri Jan 10 13:53:54 UTC 2025","passed","Fri Jan 10 13:53:55 UTC 2025","","","",""
"","270","should render collective offer summary","CollectiveOfferSummaryCreation","Fri Jan 10 13:53:44 UTC 2025","passed","Fri Jan 10 13:53:44 UTC 2025","","","",""
"","1","should return a confirmation when all results are retrieved","getEducationalInstitutions","Fri Jan 10 13:54:36 UTC 2025","passed","Fri Jan 10 13:54:36 UTC 2025","","","",""
"","20","should display status and button in edition","IndivualOfferLayout","Fri Jan 10 13:52:48 UTC 2025","passed","Fri Jan 10 13:52:48 UTC 2025","","","",""
"","0","refuses image when it's smaller than minimum","image constraints","Fri Jan 10 13:53:16 UTC 2025","passed","Fri Jan 10 13:53:16 UTC 2025","","height","",""
"","112","should close autocomplete panel when focus outside form","Autocomplete","Fri Jan 10 13:52:04 UTC 2025","passed","Fri Jan 10 13:52:04 UTC 2025","","","",""
"","7","renders component successfully with required message","components:BoxFormLayout","Fri Jan 10 13:55:45 UTC 2025","passed","Fri Jan 10 13:55:45 UTC 2025","","","",""
"","23","should fail close survey satisfaction","SurveySatisfaction","Fri Jan 10 13:54:32 UTC 2025","passed","Fri Jan 10 13:54:32 UTC 2025","","","",""
"","50","should render confirmation page when offer is pending","CollectiveOfferConfirmation","Fri Jan 10 13:54:11 UTC 2025","passed","Fri Jan 10 13:54:11 UTC 2025","","","",""
"","72","should render summary with filled data","DetailsSummaryScreen","Fri Jan 10 13:53:26 UTC 2025","passed","Fri Jan 10 13:53:26 UTC 2025","","","",""
"","1","should build subcategory fields","buildSubcategoryFields","Fri Jan 10 13:51:39 UTC 2025","passed","Fri Jan 10 13:51:39 UTC 2025","","","",""
"","1","should return 1 when 1st row beneficiary firstname comes after 2nd row beneficiary firstname","sortByBeneficiaryName","Fri Jan 10 13:52:46 UTC 2025","passed","Fri Jan 10 13:52:46 UTC 2025","","when both beneficiaries lastname are the same","",""
"","1","should return already reimbursed message when booking is already reimbursed","getBookingFailure","Fri Jan 10 13:54:17 UTC 2025","passed","Fri Jan 10 13:54:17 UTC 2025","","","",""
"","1","should return all venues when categoryStatus is ONLINE or OFFLINE","getFilteredVenueList","Fri Jan 10 13:53:41 UTC 2025","passed","Fri Jan 10 13:53:41 UTC 2025","","getFilteredVenueListBySubcategory","",""
"","18","should display the custom contact custom url","CollectiveOfferSummary","Fri Jan 10 13:51:37 UTC 2025","passed","Fri Jan 10 13:51:37 UTC 2025","","","",""
"","6","should render steps for cancelled booking by backoffice","collective timeline","Fri Jan 10 13:51:33 UTC 2025","passed","Fri Jan 10 13:51:33 UTC 2025","","","",""
"","0","should validate the following email address : a.test@test.com","isValidEmail","Fri Jan 10 13:55:57 UTC 2025","passed","Fri Jan 10 13:55:57 UTC 2025","","","",""
"","105","should apply offerDate filter when choosing an offer date","components | FilterByEventDate","Fri Jan 10 13:55:38 UTC 2025","passed","Fri Jan 10 13:55:38 UTC 2025","","","",""
"","22","should show the action buttons if the offer is template","AdageOfferHeader","Fri Jan 10 13:52:32 UTC 2025","passed","Fri Jan 10 13:52:33 UTC 2025","","","",""
"","225","should select collective offer","OfferType","Fri Jan 10 13:51:38 UTC 2025","passed","Fri Jan 10 13:51:38 UTC 2025","","","",""
"","60","should check the checkbox when the input value changes to 0","PriceInput","Fri Jan 10 13:53:46 UTC 2025","passed","Fri Jan 10 13:53:46 UTC 2025","","when ""Gratuit"" checkbox display is enabled","",""
"","439","should display the right fields and titles","screens | OfferEducational : creation offer type step","Fri Jan 10 13:52:09 UTC 2025","passed","Fri Jan 10 13:52:09 UTC 2025","","","",""
"","13","should show that the offer happens at a specific address","AdageOfferHeader","Fri Jan 10 13:52:33 UTC 2025","passed","Fri Jan 10 13:52:33 UTC 2025","","","",""
"","51","should show diffuse help","offers","Fri Jan 10 13:50:47 UTC 2025","passed","Fri Jan 10 13:50:47 UTC 2025","","load more button","",""
"","0","should not block when going from stocks to creation page with id in url","components | RouteLeavingGuardCollectiveOfferCreation","Fri Jan 10 13:52:57 UTC 2025","passed","Fri Jan 10 13:52:57 UTC 2025","","","",""
"","1","should transform string duration into int minutes","IndividualOffer:commons:serializers","Fri Jan 10 13:51:57 UTC 2025","passed","Fri Jan 10 13:51:57 UTC 2025","","serializeDurationMinutes","",""
"","1","should disable all fields when there offer is rejected or pending","setFormReadOnlyFields","Fri Jan 10 13:51:39 UTC 2025","passed","Fri Jan 10 13:51:39 UTC 2025","","","",""
"","16","should display on going sync info","VenueProviderCard","Fri Jan 10 13:52:53 UTC 2025","passed","Fri Jan 10 13:52:53 UTC 2025","","integration provider with on going sync","",""
"","0","should format the address without the the label if `showAddress` is false","computeAddressDisplayName","Fri Jan 10 13:53:24 UTC 2025","passed","Fri Jan 10 13:53:24 UTC 2025","","","",""
"","60","should display new student level for MeG when ff is active","FormParticipants","Fri Jan 10 13:52:09 UTC 2025","passed","Fri Jan 10 13:52:09 UTC 2025","","","",""
"","3","should show that the offer is not accessible if the offer has no accessibility criteria enabled","AdageOfferPublicSection","Fri Jan 10 13:54:19 UTC 2025","passed","Fri Jan 10 13:54:19 UTC 2025","","","",""
"","35","should not render when the offer is not set","IndividualOfferDetails","Fri Jan 10 13:50:47 UTC 2025","passed","Fri Jan 10 13:50:47 UTC 2025","","onboarding","",""
"","42","should show the offer image if it has one","AdageOfferHeader","Fri Jan 10 13:52:32 UTC 2025","passed","Fri Jan 10 13:52:32 UTC 2025","","","",""
"","57","should display total number of offers in singular if one or no offer","TemplateCollectiveOffersScreen","Fri Jan 10 13:51:30 UTC 2025","passed","Fri Jan 10 13:51:30 UTC 2025","","","",""
"","0","should return true if categoryId!=LIVRE and has a gtl_id as a conditional field","hasMusicType","Fri Jan 10 13:51:39 UTC 2025","passed","Fri Jan 10 13:51:39 UTC 2025","","","",""
"","131","should render when no image is given","test ImageUploaderOffer","Fri Jan 10 13:54:53 UTC 2025","passed","Fri Jan 10 13:54:53 UTC 2025","","","",""
"","166","should update venue selection when selecting pricing point","LinkVenueDialog","Fri Jan 10 13:51:51 UTC 2025","passed","Fri Jan 10 13:51:51 UTC 2025","","","",""
"","1","should return list containing only BookingRecap matching keywords with uppercase letters","filterBookingsRecap","Fri Jan 10 13:51:53 UTC 2025","passed","Fri Jan 10 13:51:53 UTC 2025","","by offer name","",""
"","45","should display warning when limit booking date is in less than 7 days","bookings offer cell","Fri Jan 10 13:52:57 UTC 2025","passed","Fri Jan 10 13:52:57 UTC 2025","","","",""
"","13","should say how many offers are selected when more than 1 offer are selected","ActionsBar","Fri Jan 10 13:51:27 UTC 2025","passed","Fri Jan 10 13:51:27 UTC 2025","","","",""
"","51","should display survey satisfaction","offers","Fri Jan 10 13:50:47 UTC 2025","passed","Fri Jan 10 13:50:47 UTC 2025","","","",""
"","966","should pass callId to the api when suggested subcategories are enabled and used once","IndividualOfferDetails","Fri Jan 10 13:50:46 UTC 2025","passed","Fri Jan 10 13:50:47 UTC 2025","","about categories / subcategories selection","",""
"","49","should not show template offers link in collective offer section link when FF is disabled","SideNavLinks","Fri Jan 10 13:52:47 UTC 2025","passed","Fri Jan 10 13:52:47 UTC 2025","","","",""
"","58","should go next step with individual target customer","screens:SignupJourney::Activity","Fri Jan 10 13:52:40 UTC 2025","passed","Fri Jan 10 13:52:40 UTC 2025","","","",""
"","0","should block when leaving visibility creation","components | RouteLeavingGuardCollectiveOfferCreation","Fri Jan 10 13:52:57 UTC 2025","passed","Fri Jan 10 13:52:57 UTC 2025","","","",""
"","101","should display a set of year filters with the last year selected by default","Income","Fri Jan 10 13:51:12 UTC 2025","passed","Fri Jan 10 13:51:13 UTC 2025","","when the page first renders","",""
"","159","should trigger search when clicking Rechercher while using geoloc","OfferFilters","Fri Jan 10 13:51:58 UTC 2025","passed","Fri Jan 10 13:51:58 UTC 2025","","","",""
"","199","should reload the page if deleting last stock of the page","screens:StocksEventEdition","Fri Jan 10 13:50:59 UTC 2025","passed","Fri Jan 10 13:50:59 UTC 2025","","","",""
"","16","should show the normal contact form if the offer is bookable","FormContact","Fri Jan 10 13:55:19 UTC 2025","passed","Fri Jan 10 13:55:19 UTC 2025","","","",""
"","23","should track updating venue with new venue creation journey","venue create offer link","Fri Jan 10 13:54:51 UTC 2025","passed","Fri Jan 10 13:54:51 UTC 2025","","","",""
"","54","should not display statistics dashboard when selected offerer is active but not validated","Homepage","Fri Jan 10 13:52:29 UTC 2025","passed","Fri Jan 10 13:52:29 UTC 2025","","render statistics dashboard","",""
"","98","should let download several invoices at same time","reimbursementsWithFilters","Fri Jan 10 13:51:19 UTC 2025","passed","Fri Jan 10 13:51:19 UTC 2025","","","",""
"","253","should add and remove a beginning time","RecurrenceForm","Fri Jan 10 13:53:20 UTC 2025","passed","Fri Jan 10 13:53:21 UTC 2025","","","",""
"","1","should return an array with one date when start date is equal to end date","getDatesInInterval","Fri Jan 10 13:54:20 UTC 2025","passed","Fri Jan 10 13:54:20 UTC 2025","","","",""
"","16","should display the acces libre callout in edition","Accessibility","Fri Jan 10 13:52:39 UTC 2025","passed","Fri Jan 10 13:52:39 UTC 2025","","","",""
"","12","should display an invalid radio input","BaseRadio","Fri Jan 10 13:55:28 UTC 2025","passed","Fri Jan 10 13:55:28 UTC 2025","","","",""
"","58","should display the right wording without the OA FF","VenueSettingsScreen","Fri Jan 10 13:52:03 UTC 2025","passed","Fri Jan 10 13:52:03 UTC 2025","","OA feature flag","",""
"","15","should never display ""Réservation"" step","IndividualOfferNavigation","Fri Jan 10 13:52:05 UTC 2025","passed","Fri Jan 10 13:52:05 UTC 2025","","on creation mode","",""
"","103","should handle update failure","LinkVenueDialog","Fri Jan 10 13:52:56 UTC 2025","passed","Fri Jan 10 13:52:56 UTC 2025","","","",""
"","86","should show the offer cards","offers","Fri Jan 10 13:50:47 UTC 2025","passed","Fri Jan 10 13:50:47 UTC 2025","","","",""
"","222","should store search value","route Offers","Fri Jan 10 13:50:45 UTC 2025","passed","Fri Jan 10 13:50:46 UTC 2025","","url query params","",""
"","426","should submit the form with correct payload","screens:IndividualOffer::UsefulInformation","Fri Jan 10 13:51:31 UTC 2025","passed","Fri Jan 10 13:51:31 UTC 2025","","","",""
"","102","should submit valid form","Accessibility","Fri Jan 10 13:52:39 UTC 2025","passed","Fri Jan 10 13:52:39 UTC 2025","","","",""
"","4","should display the EAC section when adage is without following","PartnerPages","Fri Jan 10 13:53:25 UTC 2025","passed","Fri Jan 10 13:53:25 UTC 2025","","","",""
"","12","should display the offer accessibility criteria","AdageOfferPublicSection","Fri Jan 10 13:54:19 UTC 2025","passed","Fri Jan 10 13:54:19 UTC 2025","","","",""
"","94","should track on import  on creation","AllocineProviderForm","Fri Jan 10 13:51:49 UTC 2025","passed","Fri Jan 10 13:51:49 UTC 2025","","","",""
"","151","should have venue value be removed when user asks for all venues","route Offers","Fri Jan 10 13:50:46 UTC 2025","passed","Fri Jan 10 13:50:46 UTC 2025","","url query params","",""
"","94","should display how many dates have been used up when the warning button is clicked.","OfferNameCell","Fri Jan 10 13:52:36 UTC 2025","passed","Fri Jan 10 13:52:36 UTC 2025","","","",""
"","1","should return an error for wrong siret lengths","getsiretData","Fri Jan 10 13:54:45 UTC 2025","passed","Fri Jan 10 13:54:45 UTC 2025","","","",""
"","91","should sort by offer name","components | BookingsRecapTable","Fri Jan 10 13:51:24 UTC 2025","passed","Fri Jan 10 13:51:24 UTC 2025","","","",""
"","10","should filter on the venue specified in the url","OffersInstantSearch","Fri Jan 10 13:53:57 UTC 2025","passed","Fri Jan 10 13:53:57 UTC 2025","","","",""
"","195","should call onCancel when pressing Annuler button","DeactivationConfirmDialog","Fri Jan 10 13:54:19 UTC 2025","passed","Fri Jan 10 13:54:19 UTC 2025","","","",""
"","38","should display unsaved information in the action bar when the value is not the default value","OfferEducationalForm","Fri Jan 10 13:53:01 UTC 2025","passed","Fri Jan 10 13:53:01 UTC 2025","","","",""
"","4","should show the dates of a template offer that has specific dates","adageOfferDates","Fri Jan 10 13:54:10 UTC 2025","passed","Fri Jan 10 13:54:10 UTC 2025","","getFormattedDatesForTemplateOffer","",""
"","1","should return an error when the SIRET is inactive","getsiretData","Fri Jan 10 13:54:45 UTC 2025","passed","Fri Jan 10 13:54:45 UTC 2025","","","",""
"","58","should destroy firebase when consent is taken back","useFirebase","Fri Jan 10 13:53:12 UTC 2025","passed","Fri Jan 10 13:53:12 UTC 2025","","","",""
"","1","should map api response errors to form one without changes","serializeApiErrors","Fri Jan 10 13:53:17 UTC 2025","passed","Fri Jan 10 13:53:17 UTC 2025","","","",""
"","1","should create a template from an offer with offer phone","computeInitialValuesFromOffer","Fri Jan 10 13:53:37 UTC 2025","passed","Fri Jan 10 13:53:37 UTC 2025","","","",""
"","5","should display given information text with icon","Notification","Fri Jan 10 13:54:37 UTC 2025","passed","Fri Jan 10 13:54:37 UTC 2025","","","",""
"","5","should serialize data for stock event creation","serializeStockEventEdition","Fri Jan 10 13:54:02 UTC 2025","passed","Fri Jan 10 13:54:02 UTC 2025","","","",""
"","57","should show the phone form when the contact phone checkbox is checked","FormContactTemplate","Fri Jan 10 13:54:14 UTC 2025","passed","Fri Jan 10 13:54:14 UTC 2025","","","",""
"","2","should use default filters when no filters is passed in argument","buildBookingsRecapQuery","Fri Jan 10 13:55:01 UTC 2025","passed","Fri Jan 10 13:55:01 UTC 2025","","","",""
"","104","should render loader while fetching data","CollectiveTableRow","Fri Jan 10 13:54:01 UTC 2025","passed","Fri Jan 10 13:54:01 UTC 2025","","","",""
"","2","should return last part of url path","useActiveStep","Fri Jan 10 13:55:14 UTC 2025","passed","Fri Jan 10 13:55:14 UTC 2025","","","",""
"","54","should uncheck none option if any other is clicked","useAccessibilityOptions","Fri Jan 10 13:54:32 UTC 2025","passed","Fri Jan 10 13:54:32 UTC 2025","","","",""
"","65","should display the right wording without the OA FF","OA feature flag","Fri Jan 10 13:54:30 UTC 2025","passed","Fri Jan 10 13:54:30 UTC 2025","","","",""
"","67","should display banner if offerer has no pricing point and venue has no siret","ReimbursementFields","Fri Jan 10 13:54:14 UTC 2025","passed","Fri Jan 10 13:54:15 UTC 2025","","","",""
"","271","should display desactive offer option when offer is active and not booked","CollectiveOfferSummary","Fri Jan 10 13:55:06 UTC 2025","passed","Fri Jan 10 13:55:07 UTC 2025","","","",""
"","1","should format a date with the right format for a HTML input","formatShortDateForInput","Fri Jan 10 13:53:04 UTC 2025","passed","Fri Jan 10 13:53:04 UTC 2025","","","",""
"","41","should render tags correctly","SelectedValuesTags","Fri Jan 10 13:54:10 UTC 2025","passed","Fri Jan 10 13:54:10 UTC 2025","","","",""
"","115","should display a message notifying the user they are on a wrong path and add a link to home","src | components | pages | NotFound","Fri Jan 10 13:55:40 UTC 2025","passed","Fri Jan 10 13:55:41 UTC 2025","","","",""
"","23","should display error","SignIn","Fri Jan 10 13:51:30 UTC 2025","passed","Fri Jan 10 13:51:30 UTC 2025","","should display messages after account validation","",""
"","180","should select template offer","OfferType","Fri Jan 10 13:51:38 UTC 2025","passed","Fri Jan 10 13:51:38 UTC 2025","","","",""
"","19","should display the venue name when venue public name is not given","IndividualOfferRow","Fri Jan 10 13:51:42 UTC 2025","passed","Fri Jan 10 13:51:42 UTC 2025","","","",""
"","9","should render { collectiveDmsApplication: { application: 123, depositDate: '2025-01-10T13:52:21.663Z', lastChangeDate: '2025-01-10T13:52:21.663Z', procedure: 456, state: 'accepte', venueId: 1 }, expectedLabel: 'Votre demande de référencement a été acceptée' } status","CollectiveDmsTimeline","Fri Jan 10 13:52:21 UTC 2025","passed","Fri Jan 10 13:52:21 UTC 2025","","","",""
"","95","should display previsionnal income only for current year","Income","Fri Jan 10 13:51:14 UTC 2025","passed","Fri Jan 10 13:51:14 UTC 2025","","when the user changes year selection","",""
"","105","should not link offerer to user when they cancel","screens:SignupJourney::Offerers","Fri Jan 10 13:51:46 UTC 2025","passed","Fri Jan 10 13:51:46 UTC 2025","","modal handling","",""
"","76","should display notification on api error","Summary","Fri Jan 10 13:50:42 UTC 2025","passed","Fri Jan 10 13:50:42 UTC 2025","","On Creation","",""
"","33","should render the component for stock page","IndividualOffer::ActionBar","Fri Jan 10 13:53:27 UTC 2025","passed","Fri Jan 10 13:53:27 UTC 2025","","on edition","",""
"","6","should not render when the offer is not set","PriceCategories","Fri Jan 10 13:55:19 UTC 2025","passed","Fri Jan 10 13:55:19 UTC 2025","","","",""
"","185","should not display error fields when fields are empty","CollectiveDataEdition","Fri Jan 10 13:51:10 UTC 2025","passed","Fri Jan 10 13:51:10 UTC 2025","","error fields","",""
"","4","should return the correct patch offer payload for a template offer","createPatchOfferPayload","Fri Jan 10 13:53:21 UTC 2025","passed","Fri Jan 10 13:53:21 UTC 2025","","","",""
"","3","should validate the form for case: not valid form without firstName","validationSchema","Fri Jan 10 13:54:05 UTC 2025","passed","Fri Jan 10 13:54:05 UTC 2025","","","",""
"","9","should display the right wording with the OA FF","OffersSynchronization","Fri Jan 10 13:55:20 UTC 2025","passed","Fri Jan 10 13:55:20 UTC 2025","","OA feature flag","",""
"","5","should display offer creation link if user has no offer on venue","VenueOfferSteps","Fri Jan 10 13:52:26 UTC 2025","passed","Fri Jan 10 13:52:26 UTC 2025","","","",""
"","114","should track failing of form submit","venue form trackers","Fri Jan 10 13:53:16 UTC 2025","passed","Fri Jan 10 13:53:17 UTC 2025","","","",""
"","169","should check that token is valid and display booking details"," Desk","Fri Jan 10 13:52:21 UTC 2025","passed","Fri Jan 10 13:52:21 UTC 2025","","should validate while user is typing","",""
"","48","should render venue filter with given venue selected","TemplateCollectiveOffersScreen","Fri Jan 10 13:51:31 UTC 2025","passed","Fri Jan 10 13:51:31 UTC 2025","","","",""
"","3","should render { displayedStatus: 'EXPIRED', expectedLabel: 'expirée' } status","CollectiveStatusLabel","Fri Jan 10 13:53:28 UTC 2025","passed","Fri Jan 10 13:53:28 UTC 2025","","","",""
"","42","should allow edition for a bookable offer when the ENABLE_COLLECTIVE_NEW_STATUSES FF is enabled and the edition of 'dates' is allowed","CollectiveActionsCells","Fri Jan 10 13:51:13 UTC 2025","passed","Fri Jan 10 13:51:13 UTC 2025","","","",""
"","64","should not render price details if offer is not template","OfferEducationalForm","Fri Jan 10 13:53:00 UTC 2025","passed","Fri Jan 10 13:53:00 UTC 2025","","","",""
"","70","should display invoice banner","reimbursementsWithFilters","Fri Jan 10 13:51:18 UTC 2025","passed","Fri Jan 10 13:51:18 UTC 2025","","","",""
"","46","should display ""Tarifs"" and ""Dates & Capacités"" steps","IndividualOfferNavigation","Fri Jan 10 13:52:05 UTC 2025","passed","Fri Jan 10 13:52:05 UTC 2025","","when offer is an event","",""
"","42","should not display expired offer","offers","Fri Jan 10 13:50:47 UTC 2025","passed","Fri Jan 10 13:50:47 UTC 2025","","","",""
"","15","should display a expiration row if the bookable offer is active","ollectiveOfferRow","Fri Jan 10 13:51:16 UTC 2025","passed","Fri Jan 10 13:51:16 UTC 2025","","","",""
"","4","should display label for variant: light-purple","Tag","Fri Jan 10 13:55:55 UTC 2025","passed","Fri Jan 10 13:55:55 UTC 2025","","render","",""
"","66","should be able to unlink a venue already attached to the same bank account","LinkVenueDialog","Fri Jan 10 13:51:52 UTC 2025","passed","Fri Jan 10 13:51:52 UTC 2025","","","",""
"","80","should track closing the not link offerer modal","Offerers trackers","Fri Jan 10 13:53:46 UTC 2025","passed","Fri Jan 10 13:53:46 UTC 2025","","","",""
"","253","should display the page","route TemplateCollectiveOffers","Fri Jan 10 13:51:16 UTC 2025","passed","Fri Jan 10 13:51:16 UTC 2025","","","",""
"","136","should display error message when api call fail","PricingPoint","Fri Jan 10 13:52:51 UTC 2025","passed","Fri Jan 10 13:52:51 UTC 2025","","","",""
"","1","should return true for today and future hours","isTimeInTheFuture","Fri Jan 10 13:54:20 UTC 2025","passed","Fri Jan 10 13:54:20 UTC 2025","","","",""
"","2","should return true for a valid time","isValidTime","Fri Jan 10 13:53:16 UTC 2025","passed","Fri Jan 10 13:53:16 UTC 2025","","","",""
"","0","should disable all fields for provided offers","setFormReadOnlyFields","Fri Jan 10 13:51:39 UTC 2025","passed","Fri Jan 10 13:51:39 UTC 2025","","","",""
"","15","should use callback function onclick","Toggle button","Fri Jan 10 13:54:25 UTC 2025","passed","Fri Jan 10 13:54:25 UTC 2025","","","",""
"","165","should redirect on submit button and offer selected","CollectiveOfferConfirmation","Fri Jan 10 13:52:30 UTC 2025","passed","Fri Jan 10 13:52:30 UTC 2025","","","",""
"","7","should render duo informations for can be duo things (like ESCAPE_GAME or CARTE_MUSEE)","StockThingSection","Fri Jan 10 13:55:27 UTC 2025","passed","Fri Jan 10 13:55:27 UTC 2025","","","",""
"","250","should display a trash icon with a confirm dialog to delete draft offer","IndividualOfferRow","Fri Jan 10 13:51:42 UTC 2025","passed","Fri Jan 10 13:51:42 UTC 2025","draft delete button","action buttons","",""
"","37","should remove a tag when the user closes the tag","SelectAutocomplete","Fri Jan 10 13:50:58 UTC 2025","passed","Fri Jan 10 13:50:58 UTC 2025","","tags","",""
"","10","should not render on venue types api error","ValidationScreen","Fri Jan 10 13:51:48 UTC 2025","passed","Fri Jan 10 13:51:48 UTC 2025","","errors","",""
"","2","when offer is template","computeURLCollectiveOfferId","Fri Jan 10 13:56:02 UTC 2025","passed","Fri Jan 10 13:56:02 UTC 2025","","","",""
"","9","should render with default offerer select","BankInformations page","Fri Jan 10 13:51:57 UTC 2025","passed","Fri Jan 10 13:51:57 UTC 2025","","","",""
"","70","should render 1 bookings","IndividualOfferBookingsSummaryScreen","Fri Jan 10 13:53:00 UTC 2025","passed","Fri Jan 10 13:53:00 UTC 2025","","","",""
