"DESCRIPTION","DURATION IN MS","NAME","PARENT SUITE","START TIME","STATUS","STOP TIME","SUB SUITE","SUITE","TEST CLASS","TEST METHOD"
"","35","should focus on top of the page as a fallback","useFocus","Mon Feb 03 13:36:46 UTC 2025","passed","Mon Feb 03 13:36:46 UTC 2025","","","",""
"","127","should link offerer to user when they confirm","screens:SignupJourney::Offerers","Mon Feb 03 13:34:00 UTC 2025","passed","Mon Feb 03 13:34:00 UTC 2025","","modal handling","",""
"","11","should not show the dates range on template offers if the dates are not defined","offer summary","Mon Feb 03 13:37:08 UTC 2025","passed","Mon Feb 03 13:37:08 UTC 2025","","","",""
"","120","should call tracker when clicking on template button","FormOfferType","Mon Feb 03 13:36:29 UTC 2025","passed","Mon Feb 03 13:36:29 UTC 2025","","","",""
"","83","should display the saved information in the action bar","CollectiveOfferSummaryCreation","Mon Feb 03 13:36:03 UTC 2025","passed","Mon Feb 03 13:36:04 UTC 2025","","","",""
"","308","when clicking on ""Réinitialiser les filtres""","route CollectiveOffers","Mon Feb 03 13:33:21 UTC 2025","passed","Mon Feb 03 13:33:21 UTC 2025","","should reset filters","",""
"","8","should not display bank any wording or button under bank account card if offerer has no venue","ReimbursementBankAccount","Mon Feb 03 13:33:46 UTC 2025","passed","Mon Feb 03 13:33:46 UTC 2025","","","",""
"","27","should not render EAN search when the draft offer is non product-based","IndividualOfferDetails","Mon Feb 03 13:32:58 UTC 2025","passed","Mon Feb 03 13:32:58 UTC 2025","about EAN search > when the draft offer being created is no longer local but posted","on creation","",""
"","1","should convert from my locale to departement timezone and give result in utc with a different local time","convertFromLocalTimeToVenueTimezoneInUtc","Mon Feb 03 13:35:34 UTC 2025","passed","Mon Feb 03 13:35:34 UTC 2025","","","",""
"","0","should return false if last provider is undefined","isAllocineOffer","Mon Feb 03 13:37:56 UTC 2025","passed","Mon Feb 03 13:37:56 UTC 2025","","","",""
"","1","should return 1 when 1st row beneficiary name strictly comes after 2nd row beneficiary name","sortByBeneficiaryName","Mon Feb 03 13:35:03 UTC 2025","passed","Mon Feb 03 13:35:03 UTC 2025","","","",""
"","300","should trigger onSubmit callback when submitting","components:UserEmailForm","Mon Feb 03 13:37:34 UTC 2025","passed","Mon Feb 03 13:37:35 UTC 2025","","","",""
"","226","should be able to submit when price field is filled on creation","AllocineProviderForm","Mon Feb 03 13:33:58 UTC 2025","passed","Mon Feb 03 13:33:58 UTC 2025","","","",""
"","4","should display the EAC section when adage refused","PartnerPages","Mon Feb 03 13:35:42 UTC 2025","passed","Mon Feb 03 13:35:42 UTC 2025","","","",""
"","205","should render the venue settings form with venue data","VenueSettingsScreen","Mon Feb 03 13:34:13 UTC 2025","passed","Mon Feb 03 13:34:14 UTC 2025","","","",""
"","176","should show the cancelled status option if the ENABLE_COLLECTIVE_NEW_STATUSES FF is active","CollectiveOffersScreen","Mon Feb 03 13:33:19 UTC 2025","passed","Mon Feb 03 13:33:20 UTC 2025","","","",""
"","25","should display provider banner","IndivualOfferLayout","Mon Feb 03 13:34:19 UTC 2025","passed","Mon Feb 03 13:34:19 UTC 2025","","","",""
"","42","should render the component for details page","IndividualOffer::ActionBar","Mon Feb 03 13:35:45 UTC 2025","passed","Mon Feb 03 13:35:45 UTC 2025","","on edition","",""
"","40","should navigate to activite page when clicking the second update button","ValidationScreen","Mon Feb 03 13:34:01 UTC 2025","passed","Mon Feb 03 13:34:01 UTC 2025","","user actions","",""
"","130","should render validation step and navigate through steps","test SignupJourneyStepper","Mon Feb 03 13:35:12 UTC 2025","passed","Mon Feb 03 13:35:12 UTC 2025","","","",""
"","96","should render ButtonImageDelete","ButtonImageDelete","Mon Feb 03 13:37:34 UTC 2025","passed","Mon Feb 03 13:37:34 UTC 2025","","","",""
"","57","should display total number of offers in singular if one or no offer","TemplateCollectiveOffersScreen","Mon Feb 03 13:33:41 UTC 2025","passed","Mon Feb 03 13:33:41 UTC 2025","","","",""
"","19","should display sync info","VenueProviderCard","Mon Feb 03 13:35:10 UTC 2025","passed","Mon Feb 03 13:35:10 UTC 2025","","synched integration provider","",""
"","375","should filter stocks","StocksEventList","Mon Feb 03 13:33:37 UTC 2025","passed","Mon Feb 03 13:33:37 UTC 2025","","","",""
"","260","should have creation mode value be removed when user ask for all creation modes","route Offers","Mon Feb 03 13:32:58 UTC 2025","passed","Mon Feb 03 13:32:59 UTC 2025","","url query params","",""
"","63","should render digital stock thing","screens:StocksThing","Mon Feb 03 13:33:11 UTC 2025","passed","Mon Feb 03 13:33:11 UTC 2025","","","",""
"","12","should render duo informations for can be duo things (like ESCAPE_GAME or CARTE_MUSEE)","StockThingSection","Mon Feb 03 13:37:49 UTC 2025","passed","Mon Feb 03 13:37:49 UTC 2025","","","",""
"","217","should have venue value be removed when user asks for all venues","route CollectiveOffers","Mon Feb 03 13:34:26 UTC 2025","passed","Mon Feb 03 13:34:26 UTC 2025","","url query params","",""
"","63","should return an error on offer archiving when the offer id is not valid","CollectiveEditionOfferNavigation","Mon Feb 03 13:33:43 UTC 2025","passed","Mon Feb 03 13:33:43 UTC 2025","","","",""
"","48","should log add bank account on click add bank account link","AddBankAccountCallout","Mon Feb 03 13:35:49 UTC 2025","passed","Mon Feb 03 13:35:49 UTC 2025","","","",""
"","47","should render the new offer info page sections","OfferInfos","Mon Feb 03 13:34:57 UTC 2025","passed","Mon Feb 03 13:34:57 UTC 2025","","","",""
"","142","The email suggestion should not be displayed when the field is invalid","EmailSpellCheckInput","Mon Feb 03 13:36:16 UTC 2025","passed","Mon Feb 03 13:36:16 UTC 2025","","","",""
"","85","should redirect to venue settings if user chooses ""automatiquement""","<OnboardingOfferIndividual />","Mon Feb 03 13:35:37 UTC 2025","passed","Mon Feb 03 13:35:37 UTC 2025","","","",""
"","56","should display the collective title","route VenueEdition","Mon Feb 03 13:33:56 UTC 2025","passed","Mon Feb 03 13:33:56 UTC 2025","","","",""
"","2","should validate the form for case: booking limit date can be in the past if the form is read only","validationSchema","Mon Feb 03 13:35:51 UTC 2025","passed","Mon Feb 03 13:35:51 UTC 2025","","","",""
"","3","should render ""en instruction"" status when ff is active for PENDING displayed status","CollectiveStatusLabel","Mon Feb 03 13:35:48 UTC 2025","passed","Mon Feb 03 13:35:48 UTC 2025","","","",""
"","10","should never display ""Stock & Prix"" step","IndividualOfferNavigation","Mon Feb 03 13:34:17 UTC 2025","passed","Mon Feb 03 13:34:17 UTC 2025","","when offer is an event","",""
"","37","should validate the form for case: start and end date should be on same school year","validationSchema","Mon Feb 03 13:35:51 UTC 2025","passed","Mon Feb 03 13:35:51 UTC 2025","","","",""
"","28","should redirect to page 404 when api has not found","App","Mon Feb 03 13:34:43 UTC 2025","passed","Mon Feb 03 13:34:43 UTC 2025","","","",""
"","97","should display the right wording with the OA FF","PricingPoint","Mon Feb 03 13:35:08 UTC 2025","passed","Mon Feb 03 13:35:08 UTC 2025","","OA feature flag","",""
"","2","getHumanizeRelativeDistance(undefined) 	= '7 m'","getDistance","Mon Feb 03 13:37:57 UTC 2025","passed","Mon Feb 03 13:37:57 UTC 2025","","","",""
"","36","should display the edition button when the FF ENABLE_COLLECTIVE_NEW_STATUSES is disabled and the offer is template","CollectiveOfferSummary","Mon Feb 03 13:33:48 UTC 2025","passed","Mon Feb 03 13:33:48 UTC 2025","","","",""
"","3","should disabled field for disable statuts ""REJECTED""","StockThingForm::utils::setFormReadOnlyFields","Mon Feb 03 13:36:56 UTC 2025","passed","Mon Feb 03 13:36:56 UTC 2025","","","",""
"","238","should submit formats values onclick modal search button","OfferFilters","Mon Feb 03 13:34:07 UTC 2025","passed","Mon Feb 03 13:34:08 UTC 2025","","","",""
"","35","should not allow edition for a bookable offer when the ENABLE_COLLECTIVE_NEW_STATUSES FF is enabled and no edition action is allowed","CollectiveActionsCells","Mon Feb 03 13:33:21 UTC 2025","passed","Mon Feb 03 13:33:21 UTC 2025","","","",""
"","1","should invalidate the following email address : test@","isValidEmail","Mon Feb 03 13:38:18 UTC 2025","passed","Mon Feb 03 13:38:18 UTC 2025","","","",""
"","5","should display venueOfferSteps if condition to display it","VenueOfferSteps","Mon Feb 03 13:34:33 UTC 2025","passed","Mon Feb 03 13:34:33 UTC 2025","","","",""
"","1","should check that localstorage is not available on Firefox","storageAvailable","Mon Feb 03 13:38:06 UTC 2025","passed","Mon Feb 03 13:38:06 UTC 2025","","","",""
"","277","should load offers with selected offer type if the WIP_ENABLE_NEW_COLLECTIVE_OFFERS_AND_BOOKINGS_STRUCTURE FF is not active","route CollectiveOffers","Mon Feb 03 13:33:18 UTC 2025","passed","Mon Feb 03 13:33:18 UTC 2025","on click on search button","filters","",""
"","451","should display academies filter with departments options if user has selected academy filter","offersSearch component","Mon Feb 03 13:33:54 UTC 2025","passed","Mon Feb 03 13:33:55 UTC 2025","","","",""
"","33","should track ReimbursementPoint","VenueOfferSteps","Mon Feb 03 13:36:07 UTC 2025","passed","Mon Feb 03 13:36:07 UTC 2025","","","",""
"","374","should display add the email on success and trigger buttons event","AttachmentInvitations","Mon Feb 03 13:34:33 UTC 2025","passed","Mon Feb 03 13:34:34 UTC 2025","","","",""
"","17","should display the image if its present","PartnerPages","Mon Feb 03 13:36:10 UTC 2025","passed","Mon Feb 03 13:36:10 UTC 2025","","","",""
"","297","should display the page","route TemplateCollectiveOffers","Mon Feb 03 13:33:24 UTC 2025","passed","Mon Feb 03 13:33:24 UTC 2025","","","",""
"","250","should render collective offer preview edition","CollectiveOfferPreviewCreation","Mon Feb 03 13:37:09 UTC 2025","passed","Mon Feb 03 13:37:10 UTC 2025","","","",""
"","309","should render collective offer summary","CollectiveOfferSummaryCreation","Mon Feb 03 13:36:03 UTC 2025","passed","Mon Feb 03 13:36:03 UTC 2025","","","",""
"","22","should show a generic count when more than 500 offers are selected","ActionsBar","Mon Feb 03 13:33:06 UTC 2025","passed","Mon Feb 03 13:33:06 UTC 2025","","","",""
"","293","should indicate that no offers match selected filters","route TemplateCollectiveOffers","Mon Feb 03 13:33:25 UTC 2025","passed","Mon Feb 03 13:33:26 UTC 2025","status filters","filters","",""
"","581","should display previous page when clicking on left arrow","route CollectiveOffers","Mon Feb 03 13:33:18 UTC 2025","passed","Mon Feb 03 13:33:19 UTC 2025","","page navigation","",""
"","76","should return width and height","useGetImageBitmap","Mon Feb 03 13:37:51 UTC 2025","passed","Mon Feb 03 13:37:52 UTC 2025","","","",""
"","131","should not display MaybeAppUserDialog component if siret is incorrect","Offerer","Mon Feb 03 13:33:38 UTC 2025","passed","Mon Feb 03 13:33:38 UTC 2025","","","",""
"","71","should instanciate the observer and observe the watched element","useIsElementVisible","Mon Feb 03 13:37:48 UTC 2025","passed","Mon Feb 03 13:37:48 UTC 2025","","","",""
"","43","should not display survey satisfaction if only 1 offer","offers","Mon Feb 03 13:32:58 UTC 2025","passed","Mon Feb 03 13:32:58 UTC 2025","","","",""
"","87","should duplicate a bookable","CollectiveActionsCells","Mon Feb 03 13:33:21 UTC 2025","passed","Mon Feb 03 13:33:21 UTC 2025","","CollectiveActionsCells:Duplicate","",""
"","1","should transform the api response errors of an array field into an error structure compatible with formik","serializeApiErrors","Mon Feb 03 13:35:36 UTC 2025","passed","Mon Feb 03 13:35:36 UTC 2025","","","",""
"","128","should have creation mode value when user filters by creation mode","route Offers","Mon Feb 03 13:32:58 UTC 2025","passed","Mon Feb 03 13:32:58 UTC 2025","","url query params","",""
"","117","should keep previously selected subcategory as radio button even if it is not in the suggested subcategories","SuggestedSubcategories","Mon Feb 03 13:34:40 UTC 2025","passed","Mon Feb 03 13:34:40 UTC 2025","","","",""
"","118","should render tabs","src | components | Tabs","Mon Feb 03 13:36:46 UTC 2025","passed","Mon Feb 03 13:36:46 UTC 2025","","","",""
"","78","should not display redirect modal if hasPendingBankAccount is true","Summary","Mon Feb 03 13:32:53 UTC 2025","passed","Mon Feb 03 13:32:53 UTC 2025","","On Creation","",""
"","2","should build default initial values","test ImageUploader:utils:buildInitialValues","Mon Feb 03 13:37:47 UTC 2025","passed","Mon Feb 03 13:37:47 UTC 2025","","","",""
"","90","should filter options with the default filter function when the user types in the field","SelectAutocomplete","Mon Feb 03 13:33:10 UTC 2025","passed","Mon Feb 03 13:33:10 UTC 2025","","filter","",""
"","2","should validate the form for case: need price","validationSchema","Mon Feb 03 13:36:48 UTC 2025","passed","Mon Feb 03 13:36:48 UTC 2025","","","",""
"","2","should display label for variant: light-purple","Tag","Mon Feb 03 13:38:15 UTC 2025","passed","Mon Feb 03 13:38:15 UTC 2025","","render","",""
"","7","should return expected value when there is change on label (not on price)","arePriceCategoriesChanged","Mon Feb 03 13:36:55 UTC 2025","passed","Mon Feb 03 13:36:55 UTC 2025","","","",""
"","66","should display the right wording without the OA FF","OffersSynchronization","Mon Feb 03 13:37:42 UTC 2025","passed","Mon Feb 03 13:37:42 UTC 2025","","OA feature flag","",""
"","849","should disable all fields when mode is READONLY","screens | OfferEducational","Mon Feb 03 13:36:44 UTC 2025","passed","Mon Feb 03 13:36:45 UTC 2025","","","",""
"","1","accepts image when it's higher than minimum","image constraints","Mon Feb 03 13:35:35 UTC 2025","passed","Mon Feb 03 13:35:35 UTC 2025","","height","",""
"","0","should return true when collective offer status is REJECTED","canArchiveCollectiveOffer","Mon Feb 03 13:35:23 UTC 2025","passed","Mon Feb 03 13:35:23 UTC 2025","","","",""
"","5","should convert from my locale to departement timezone and give result in utc","convertFromLocalTimeToVenueTimezoneInUtc","Mon Feb 03 13:35:34 UTC 2025","passed","Mon Feb 03 13:35:34 UTC 2025","","","",""
"","21","should not display the all participants option when the collective offer is bookable","FormParticipants","Mon Feb 03 13:34:22 UTC 2025","passed","Mon Feb 03 13:34:22 UTC 2025","","","",""
"","49","should disable save button when access is read only","OfferEducationalForm","Mon Feb 03 13:35:17 UTC 2025","passed","Mon Feb 03 13:35:17 UTC 2025","","","",""
"","153","should show AddBankInformationsDialog on click add bank account button","BankInformations page","Mon Feb 03 13:34:10 UTC 2025","passed","Mon Feb 03 13:34:10 UTC 2025","","","",""
"","114","should render adage discovery","AdageDiscovery","Mon Feb 03 13:35:12 UTC 2025","passed","Mon Feb 03 13:35:12 UTC 2025","","","",""
"","0","should return all fields as read only when offer is pending","setFormReadOnlyFields","Mon Feb 03 13:34:26 UTC 2025","passed","Mon Feb 03 13:34:26 UTC 2025","","","",""
"","31","should always display a reset button","OffersTableSearch","Mon Feb 03 13:35:21 UTC 2025","passed","Mon Feb 03 13:35:21 UTC 2025","","","",""
"","223","should show confirmation dialog when submitting data","UserReviewDialog","Mon Feb 03 13:35:44 UTC 2025","passed","Mon Feb 03 13:35:45 UTC 2025","","","",""
"","4","should not display the description section if the offer has no description","AdageOfferDetailsSection","Mon Feb 03 13:35:25 UTC 2025","passed","Mon Feb 03 13:35:25 UTC 2025","","","",""
"","16","should display a proper tag when offer is an headline offer and feature is active","IndivualOfferLayout","Mon Feb 03 13:34:19 UTC 2025","passed","Mon Feb 03 13:34:19 UTC 2025","","","",""
"","18","should load saved venue in localStorage if no get parameter","PartnerPages","Mon Feb 03 13:35:32 UTC 2025","passed","Mon Feb 03 13:35:32 UTC 2025","","","",""
"","59","renders options with checkboxes","<MultiSelectPanel />","Mon Feb 03 13:34:41 UTC 2025","passed","Mon Feb 03 13:34:41 UTC 2025","","","",""
"","16","should not display a expiration row if the FF ENABLE_COLLECTIVE_OFFERS_EXPIRATION is disabled","ollectiveOfferRow","Mon Feb 03 13:33:29 UTC 2025","passed","Mon Feb 03 13:33:29 UTC 2025","","","",""
"","3","should build category options","buildCategoryOptions","Mon Feb 03 13:33:50 UTC 2025","passed","Mon Feb 03 13:33:50 UTC 2025","","","",""
"","8","should create nothing when creation limit is reach","onSubmit","Mon Feb 03 13:33:46 UTC 2025","passed","Mon Feb 03 13:33:46 UTC 2025","","","",""
"","79","should render a category select","SuggestedSubcategories","Mon Feb 03 13:34:40 UTC 2025","passed","Mon Feb 03 13:34:40 UTC 2025","","when the ""Autre"" radio button is selected","",""
"","0","should not block when following template creation flow (from creation to recapitulatif)","components | RouteLeavingGuardCollectiveOfferCreation","Mon Feb 03 13:35:13 UTC 2025","passed","Mon Feb 03 13:35:13 UTC 2025","","","",""
"","2","should sort collective offers in a descending order","sortCollectiveOffers","Mon Feb 03 13:36:27 UTC 2025","passed","Mon Feb 03 13:36:27 UTC 2025","","","",""
"","58","should display tab navigation for not permanent venues","route VenueEdition","Mon Feb 03 13:33:57 UTC 2025","passed","Mon Feb 03 13:33:57 UTC 2025","","","",""
"","133","should trigger onSubmit callback when submitting","components:UserIdentityForm","Mon Feb 03 13:36:48 UTC 2025","passed","Mon Feb 03 13:36:48 UTC 2025","","","",""
"","38","should display categories and subcategories as disabled","IndividualOfferDetails","Mon Feb 03 13:32:58 UTC 2025","passed","Mon Feb 03 13:32:58 UTC 2025","","on edition","",""
"","53","should display the breadcrumb with a link back to the discovery home","OfferInfos","Mon Feb 03 13:34:57 UTC 2025","passed","Mon Feb 03 13:34:57 UTC 2025","","","",""
"","3","should not display the national program section if the offer has no national program","AdageOfferDetailsSection","Mon Feb 03 13:35:25 UTC 2025","passed","Mon Feb 03 13:35:25 UTC 2025","","","",""
"","6","should not show a list of formats if there is only one element","AdageOfferListCardContent","Mon Feb 03 13:37:27 UTC 2025","passed","Mon Feb 03 13:37:27 UTC 2025","","","",""
"","0","should be able to parse Greenwich Meridian coordinates correctly","parseDms","Mon Feb 03 13:36:24 UTC 2025","passed","Mon Feb 03 13:36:24 UTC 2025","","","",""
"","26","should display error message when trying to activate offer with booking limit date time in the past","OfferEducationalActions","Mon Feb 03 13:34:02 UTC 2025","passed","Mon Feb 03 13:34:02 UTC 2025","","","",""
"","39","should render all institution if no institution provided","CollectiveOfferVisibilitySection","Mon Feb 03 13:37:43 UTC 2025","passed","Mon Feb 03 13:37:43 UTC 2025","","","",""
"","11","should hide filters passed as children and the reset button by default","OffersTableSearch","Mon Feb 03 13:35:21 UTC 2025","passed","Mon Feb 03 13:35:21 UTC 2025","","when filters toggling and storing is enabled","",""
"","28","should render a default message provider is not from known list","SynchronizedProviderInformation","Mon Feb 03 13:37:37 UTC 2025","passed","Mon Feb 03 13:37:37 UTC 2025","","","",""
"","337","should reset bookings recap list when applying filters","components | BookingsRecap | Pro user","Mon Feb 03 13:33:06 UTC 2025","passed","Mon Feb 03 13:33:07 UTC 2025","","","",""
"","29","should display a favorites tab in the header","AdageHeader","Mon Feb 03 13:34:55 UTC 2025","passed","Mon Feb 03 13:34:55 UTC 2025","","","",""
"","133","should display readonly info","VenueFormScreen","Mon Feb 03 13:33:59 UTC 2025","passed","Mon Feb 03 13:33:59 UTC 2025","","","",""
"","5","should not display bank account link on second venue if user has no bank account with paid offer","VenueOfferSteps","Mon Feb 03 13:34:33 UTC 2025","passed","Mon Feb 03 13:34:33 UTC 2025","","","",""
"","1","should match diacritics characters with regular characters","searchPatternInOptions","Mon Feb 03 13:36:51 UTC 2025","passed","Mon Feb 03 13:36:51 UTC 2025","","","",""
"","0","should return already reimbursed message when booking is already reimbursed","getBookingFailure","Mon Feb 03 13:36:37 UTC 2025","passed","Mon Feb 03 13:36:37 UTC 2025","","","",""
"","28","should display a checkbox","PriceInput","Mon Feb 03 13:36:05 UTC 2025","passed","Mon Feb 03 13:36:05 UTC 2025","","when ""Gratuit"" checkbox display is enabled","",""
"","0","should not block when going from stocks to creation page with id in url","components | RouteLeavingGuardCollectiveOfferCreation","Mon Feb 03 13:35:13 UTC 2025","passed","Mon Feb 03 13:35:13 UTC 2025","","","",""
"","16","should show a generic count when more than 500 offers are selected","ActionsBar","Mon Feb 03 13:33:40 UTC 2025","passed","Mon Feb 03 13:33:40 UTC 2025","","","",""
"","214","should display delete banner when stock is linked and delete right line","PriceCategories","Mon Feb 03 13:34:08 UTC 2025","passed","Mon Feb 03 13:34:09 UTC 2025","","","",""
"","170","should show student levels without Marseille options when WIP_ENABLE_MARSEILLE is off","CollectiveDataForm","Mon Feb 03 13:36:58 UTC 2025","passed","Mon Feb 03 13:36:58 UTC 2025","","","",""
"","152","should select ""all"" when user selects all participants","FormParticipants","Mon Feb 03 13:34:22 UTC 2025","passed","Mon Feb 03 13:34:22 UTC 2025","","useParticipantUpdates","",""
"","84","should display venue header without the FF","route Offers","Mon Feb 03 13:33:01 UTC 2025","passed","Mon Feb 03 13:33:01 UTC 2025","","With WIP_ENABLE_OFFER_ADDRESS FF","",""
"","228","should submit stock form when click on ""Enregistrer et continuer""","screens:StocksThing","Mon Feb 03 13:33:11 UTC 2025","passed","Mon Feb 03 13:33:12 UTC 2025","","","",""
"","155","should unselect ""all"" when user deselects one participant","FormParticipants","Mon Feb 03 13:34:22 UTC 2025","passed","Mon Feb 03 13:34:22 UTC 2025","","useParticipantUpdates","",""
"","104","renders component successfully","components:UserIdentityForm","Mon Feb 03 13:36:48 UTC 2025","passed","Mon Feb 03 13:36:48 UTC 2025","","","",""
"","17","Should redirect to homepage if the user can't access it and is on onboarding url","IndivualOfferLayout","Mon Feb 03 13:34:19 UTC 2025","passed","Mon Feb 03 13:34:19 UTC 2025","","onboarding","",""
"","149","should be able to quit without submitting from RouteLeavingGuard","screens:StocksThing","Mon Feb 03 13:33:14 UTC 2025","passed","Mon Feb 03 13:33:14 UTC 2025","","","",""
"","182","should reset modal state when closing academies filter modal","OfferFilters","Mon Feb 03 13:34:12 UTC 2025","passed","Mon Feb 03 13:34:12 UTC 2025","","","",""
"","124","should render image uploader for existing file","ImageUploader","Mon Feb 03 13:36:51 UTC 2025","passed","Mon Feb 03 13:36:52 UTC 2025","","","",""
"","55","should display offerer stats when selecting all venues","OffererStatsScreen","Mon Feb 03 13:35:19 UTC 2025","passed","Mon Feb 03 13:35:20 UTC 2025","","","",""
"","32","should display a filter toggle button","OffersTableSearch","Mon Feb 03 13:35:21 UTC 2025","passed","Mon Feb 03 13:35:21 UTC 2025","","when filters toggling and storing is enabled","",""
"","67","should render awesome headline offer banner when ff is activated and actor is elligible","route Offers","Mon Feb 03 13:33:02 UTC 2025","passed","Mon Feb 03 13:33:02 UTC 2025","","with FF WIP_HEADLINE_OFFER","",""
"","33","should display modify and cancel button","CinemaProviderForm","Mon Feb 03 13:35:57 UTC 2025","passed","Mon Feb 03 13:35:57 UTC 2025","","edit existing cinema provider","",""
"","2","should generate stocks on a daily basis","onSubmit","Mon Feb 03 13:33:46 UTC 2025","passed","Mon Feb 03 13:33:46 UTC 2025","","","",""
"","279","should allow user to edit quantity for a cinema synchronized offer","screens:StocksEventEdition","Mon Feb 03 13:33:15 UTC 2025","passed","Mon Feb 03 13:33:15 UTC 2025","","","",""
"","3","should return mode ""read only""","useOfferWizardMode","Mon Feb 03 13:37:57 UTC 2025","passed","Mon Feb 03 13:37:57 UTC 2025","","","",""
"","7","should display the element passed as input extension when defined","TextInput","Mon Feb 03 13:34:55 UTC 2025","passed","Mon Feb 03 13:34:55 UTC 2025","","","",""
"","26","should not deactivate offers on click on ""Masquer"" when at least one offer expired but with booking finished","ActionsBar","Mon Feb 03 13:33:07 UTC 2025","passed","Mon Feb 03 13:33:07 UTC 2025","","","",""
"","101","should display edition venue link","venues","Mon Feb 03 13:37:17 UTC 2025","passed","Mon Feb 03 13:37:17 UTC 2025","","physical venue section","",""
"","1","should validate the form for case: price too high","validationSchema","Mon Feb 03 13:36:48 UTC 2025","passed","Mon Feb 03 13:36:48 UTC 2025","","","",""
"","171","should warn user that his prefilters returned no booking when no bookings where returned by selected pre-filters","components | BookingsRecap | Pro user","Mon Feb 03 13:33:04 UTC 2025","passed","Mon Feb 03 13:33:04 UTC 2025","","","",""
"","38","shoud prefill form with initial values","CollectiveOfferVisibility","Mon Feb 03 13:33:33 UTC 2025","passed","Mon Feb 03 13:33:33 UTC 2025","","edition","",""
"","15","should render steps for reimbursed booking","collective timeline","Mon Feb 03 13:33:44 UTC 2025","passed","Mon Feb 03 13:33:44 UTC 2025","","","",""
"","3","does not display error when no error prop is passed","TextInput","Mon Feb 03 13:34:55 UTC 2025","passed","Mon Feb 03 13:34:55 UTC 2025","","","",""
