"DESCRIPTION","DURATION IN MS","NAME","PARENT SUITE","START TIME","STATUS","STOP TIME","SUB SUITE","SUITE","TEST CLASS","TEST METHOD"
"","25","should display specific banner instead of place and referencing banner","screens | OfferEducational : creation offerer step","Mon Feb 03 13:34:51 UTC 2025","passed","Mon Feb 03 13:34:51 UTC 2025","","when the offerer is not validated","",""
"","279","when clicking on ""Réinitialiser les filtres""","route Offers","Mon Feb 03 13:33:01 UTC 2025","passed","Mon Feb 03 13:33:01 UTC 2025","","should reset filters","",""
"","3","should translate between query params to api params for collective offers","translate","Mon Feb 03 13:35:52 UTC 2025","passed","Mon Feb 03 13:35:52 UTC 2025","","","",""
"","95","render","ImageUploadBrowserForm","Mon Feb 03 13:35:30 UTC 2025","passed","Mon Feb 03 13:35:30 UTC 2025","","","",""
"","4","should validate bookingContact correctly","getValidationSchema","Mon Feb 03 13:35:28 UTC 2025","passed","Mon Feb 03 13:35:28 UTC 2025","","","",""
"","25","should display creation title","CollectiveOfferLayout","Mon Feb 03 13:36:54 UTC 2025","passed","Mon Feb 03 13:36:54 UTC 2025","","","",""
"","7","should render cancel button if isCancellable is true","collectiveActionButton api call","Mon Feb 03 13:34:31 UTC 2025","passed","Mon Feb 03 13:34:31 UTC 2025","","","",""
"","4","should render badge with correct count when options are selected","<MultiSelectTrigger />","Mon Feb 03 13:36:21 UTC 2025","passed","Mon Feb 03 13:36:21 UTC 2025","","","",""
"","135","should display button to show all members","AttachmentInvitations","Mon Feb 03 13:34:34 UTC 2025","passed","Mon Feb 03 13:34:34 UTC 2025","","","",""
"","0","should not sort offers if the column sort is not defined","sortCollectiveOffers","Mon Feb 03 13:36:27 UTC 2025","passed","Mon Feb 03 13:36:27 UTC 2025","","","",""
"","241","should display offer dates table","DownloadBookingModal","Mon Feb 03 13:34:48 UTC 2025","passed","Mon Feb 03 13:34:48 UTC 2025","","","",""
"","6","Should display the right wording without the FF enabled","OffererBanners","Mon Feb 03 13:35:39 UTC 2025","passed","Mon Feb 03 13:35:39 UTC 2025","user offerer not validated","WIP_ENABLE_OFFER_ADDRESS","",""
"","21","should init input with provided value and pad it if needed if it is valid","BaseTimePicker","Mon Feb 03 13:36:12 UTC 2025","passed","Mon Feb 03 13:36:12 UTC 2025","","","",""
"","20","should disable institution input when allowedAction CAN_EDIT_INSTITUTION  doesnt exist and FF ENABLE_COLLECTIVE_NEW_STATUSES enable","CollectiveOfferVisibility","Mon Feb 03 13:33:34 UTC 2025","passed","Mon Feb 03 13:33:34 UTC 2025","","","",""
"","22","should pluralize word if many offers","pluralize","Mon Feb 03 13:37:32 UTC 2025","passed","Mon Feb 03 13:37:32 UTC 2025","","standard words","",""
"","283","should have the status in the url value when user filters by status","route CollectiveOffers","Mon Feb 03 13:34:26 UTC 2025","passed","Mon Feb 03 13:34:26 UTC 2025","","url query params","",""
"","7","should render with several venues not linked to bank account","ReimbursementBankAccount","Mon Feb 03 13:33:45 UTC 2025","passed","Mon Feb 03 13:33:45 UTC 2025","","","",""
"","40","should display the acces libre callout for permanent venues","route VenueEdition","Mon Feb 03 13:33:57 UTC 2025","passed","Mon Feb 03 13:33:57 UTC 2025","","","",""
"","87","should have no accessibility violations","<MultiSelectTrigger />","Mon Feb 03 13:36:21 UTC 2025","passed","Mon Feb 03 13:36:21 UTC 2025","","","",""
"","260","should redirect with offer type when no venue and type selected","screens:IndividualOffer::OfferType","Mon Feb 03 13:35:50 UTC 2025","passed","Mon Feb 03 13:35:51 UTC 2025","","","",""
"","25","should display delete and pause buttons","VenueProviderCard","Mon Feb 03 13:35:10 UTC 2025","passed","Mon Feb 03 13:35:10 UTC 2025","","integration provider with on going sync","",""
"","1","should remove ""Toute la France"" from selected values","handleAllFranceDepartmentOptions","Mon Feb 03 13:36:29 UTC 2025","passed","Mon Feb 03 13:36:29 UTC 2025","","","",""
"","280","should display invalidating message when waiting for invalidation and display invalidation confirmation"," Desk","Mon Feb 03 13:34:30 UTC 2025","passed","Mon Feb 03 13:34:30 UTC 2025","","should invalidate contremarque when the user submits the form","",""
"","125","should not display confirm dialog when clicking on duplicate button when user did see the modal","ollectiveOfferRow","Mon Feb 03 13:33:29 UTC 2025","passed","Mon Feb 03 13:33:29 UTC 2025","","","",""
"","11","should not render when the offer is not set","IndividualOfferWizard","Mon Feb 03 13:38:04 UTC 2025","passed","Mon Feb 03 13:38:04 UTC 2025","","","",""
"","31","should not call educational partner if venue has no siret and no collective data","CollectiveDataEdition","Mon Feb 03 13:33:29 UTC 2025","passed","Mon Feb 03 13:33:29 UTC 2025","","prefill","",""
"","169","should return an error when there are no bookings for this offer","ollectiveOfferRow","Mon Feb 03 13:33:29 UTC 2025","passed","Mon Feb 03 13:33:29 UTC 2025","","","",""
"","81","should render loader while fetching data","CollectiveTableRow","Mon Feb 03 13:36:18 UTC 2025","passed","Mon Feb 03 13:36:18 UTC 2025","","","",""
"","27","should show an error message when an error occurs after clicking on ""Publier"" button when some offers are selected","ActionsBar","Mon Feb 03 13:33:40 UTC 2025","passed","Mon Feb 03 13:33:40 UTC 2025","","","",""
"","934","should display new stocks banner for several stocks","StocksEventCreation","Mon Feb 03 13:34:58 UTC 2025","passed","Mon Feb 03 13:34:59 UTC 2025","","","",""
"","190","should prefill the form with EAN search result","IndividualOfferDetails","Mon Feb 03 13:32:58 UTC 2025","passed","Mon Feb 03 13:32:58 UTC 2025","about EAN search > when a local draft offer is being created","on creation","",""
"","85","should display creation links when user has a venue created","VenueCrationLinks","Mon Feb 03 13:37:25 UTC 2025","passed","Mon Feb 03 13:37:25 UTC 2025","","","",""
"","9","should display right info when is visible and in homepage","PartnerPageIndividualSection","Mon Feb 03 13:36:01 UTC 2025","passed","Mon Feb 03 13:36:01 UTC 2025","","","",""
"","1","shoudl transform an object to query string","handling of URL","Mon Feb 03 13:38:10 UTC 2025","passed","Mon Feb 03 13:38:10 UTC 2025","","","",""
"","67","should deactivate all offers on click on ""Désactiver"" button when all offers are selected","ActionsBar","Mon Feb 03 13:33:40 UTC 2025","passed","Mon Feb 03 13:33:40 UTC 2025","","","",""
"","1","should return the right offerer id","getCollectiveOffersSwrKeys","Mon Feb 03 13:37:28 UTC 2025","passed","Mon Feb 03 13:37:28 UTC 2025","","","",""
"","128","should open/close ModalAppPreview on click","ButtonAppPreview","Mon Feb 03 13:37:28 UTC 2025","passed","Mon Feb 03 13:37:28 UTC 2025","","","",""
"","167","should have venue value when user filters by venue","route Offers","Mon Feb 03 13:32:57 UTC 2025","passed","Mon Feb 03 13:32:58 UTC 2025","","url query params","",""
"","55","should attempt to fetch income data with all venues and display a loading spinner meanwhile","Income","Mon Feb 03 13:33:24 UTC 2025","passed","Mon Feb 03 13:33:24 UTC 2025","","when the page first renders","",""
"","5","should render multiple strong tags when multiple words are surrounded with double asterisks","Markdown","Mon Feb 03 13:36:47 UTC 2025","passed","Mon Feb 03 13:36:47 UTC 2025","","","",""
"","0","should return true when detecting change on beginningTime","hasChangesOnStockWithBookings","Mon Feb 03 13:37:06 UTC 2025","passed","Mon Feb 03 13:37:06 UTC 2025","","","",""
"","110","should notify when adding headline offer fails","IndividualOfferRow","Mon Feb 03 13:33:05 UTC 2025","passed","Mon Feb 03 13:33:05 UTC 2025","headline offer actions","action buttons","",""
"","7","should display draft unsaved information message","ActionsBarSticky","Mon Feb 03 13:37:41 UTC 2025","passed","Mon Feb 03 13:37:41 UTC 2025","","","",""
"","84","should display the invoice table","reimbursementsWithFilters","Mon Feb 03 13:33:32 UTC 2025","passed","Mon Feb 03 13:33:32 UTC 2025","","","",""
"","25","calls onOptionSelect when Enter key is pressed on an option","<MultiSelectPanel />","Mon Feb 03 13:34:42 UTC 2025","passed","Mon Feb 03 13:34:42 UTC 2025","","","",""
"","63","should show the e-mail address","AdageOfferPartnerSection","Mon Feb 03 13:37:32 UTC 2025","passed","Mon Feb 03 13:37:32 UTC 2025","","","",""
"","17","should refresh the template offers list when the offer status is modified and the FF WIP_ENABLE_NEW_COLLECTIVE_OFFERS_AND_BOOKINGS_STRUCTURE is enabled","ActionsBar","Mon Feb 03 13:33:07 UTC 2025","passed","Mon Feb 03 13:33:07 UTC 2025","","","",""
"","12","should render offer venue tag when offer will happens in pro venue","OfferCard component","Mon Feb 03 13:35:09 UTC 2025","passed","Mon Feb 03 13:35:09 UTC 2025","","","",""
"","156","should open modal on invalidate button click","ButtonInvalidateToken","Mon Feb 03 13:37:44 UTC 2025","passed","Mon Feb 03 13:37:44 UTC 2025","","","",""
"","1","should serialize patchBody","IndividualOffer:commons:serializers","Mon Feb 03 13:34:11 UTC 2025","passed","Mon Feb 03 13:34:11 UTC 2025","","serializePatchOffer","",""
"","43","should render tags correctly","SelectedValuesTags","Mon Feb 03 13:36:30 UTC 2025","passed","Mon Feb 03 13:36:30 UTC 2025","","","",""
"","116","should display a set of year filters with the last year selected by default","Income","Mon Feb 03 13:33:24 UTC 2025","passed","Mon Feb 03 13:33:24 UTC 2025","","when the page first renders","",""
"","0","should return null if there are no DMS applications","getLastCollectiveDmsApplication","Mon Feb 03 13:35:34 UTC 2025","passed","Mon Feb 03 13:35:34 UTC 2025","","getLastDmsApplicationForOfferer","",""
"","52","should render school tag when offer will happens in school","OfferCard component","Mon Feb 03 13:35:09 UTC 2025","passed","Mon Feb 03 13:35:09 UTC 2025","","","",""
"","6","should display no opening hours !","OpeningHoursReadOnly","Mon Feb 03 13:36:32 UTC 2025","passed","Mon Feb 03 13:36:32 UTC 2025","","","",""
"","105","should notify an error when submit fail","PriceCategories","Mon Feb 03 13:34:25 UTC 2025","passed","Mon Feb 03 13:34:25 UTC 2025","","","",""
"","1","should disabled field for disable statuts ""PENDING""","StockThingForm::utils::setFormReadOnlyFields","Mon Feb 03 13:36:56 UTC 2025","passed","Mon Feb 03 13:36:56 UTC 2025","","","",""
"","111","should deactivate selected offers","ActionsBar","Mon Feb 03 13:33:06 UTC 2025","passed","Mon Feb 03 13:33:06 UTC 2025","","","",""
"","22","should show the card image if it has one","AdageOfferListCard","Mon Feb 03 13:37:12 UTC 2025","passed","Mon Feb 03 13:37:12 UTC 2025","","","",""
"","0","should return true when collective offer status is INACTIVE in summary page","canArchiveCollectiveOffer","Mon Feb 03 13:35:23 UTC 2025","passed","Mon Feb 03 13:35:23 UTC 2025","","","",""
"","14","should render message when the user has a valid bank account and no pending one","BankInformations page","Mon Feb 03 13:34:10 UTC 2025","passed","Mon Feb 03 13:34:10 UTC 2025","","","",""
"","167","should redirect to the search page if the user is in Marseille en Grand and if the FF is active","AppLayout","Mon Feb 03 13:35:49 UTC 2025","passed","Mon Feb 03 13:35:49 UTC 2025","","","",""
"","180","when clicking on ""afficher toutes les offres"" when no offers are displayed","route Offers","Mon Feb 03 13:33:01 UTC 2025","passed","Mon Feb 03 13:33:01 UTC 2025","","should reset filters","",""
"","60","should redirect to list offer with success notification on press ""Sauvegarder le brouillon et quitter""","CollectiveOfferConfirmation","Mon Feb 03 13:34:45 UTC 2025","passed","Mon Feb 03 13:34:45 UTC 2025","","","",""
"","0","should return 1 when 1st row beneficiary firstname comes after 2nd row beneficiary firstname","sortByBeneficiaryName","Mon Feb 03 13:35:03 UTC 2025","passed","Mon Feb 03 13:35:03 UTC 2025","","when both beneficiaries lastname are the same","",""
"","103","should show a success notification if nothing has been touched","screens:StocksThing","Mon Feb 03 13:34:16 UTC 2025","passed","Mon Feb 03 13:34:16 UTC 2025","","","",""
"","27","should render no stock warning","Summary stock section","Mon Feb 03 13:33:57 UTC 2025","passed","Mon Feb 03 13:33:57 UTC 2025","","for general case","",""
"","3","should display proper infos for validated status","bookings status history cell","Mon Feb 03 13:36:18 UTC 2025","passed","Mon Feb 03 13:36:18 UTC 2025","","","",""
"","250","should pass axe accessibility tests","OnboardingOffersChoice Component","Mon Feb 03 13:37:33 UTC 2025","passed","Mon Feb 03 13:37:34 UTC 2025","","","",""
"","81","should only uncheck none option when unchecking it","useAccessibilityOptions","Mon Feb 03 13:36:53 UTC 2025","passed","Mon Feb 03 13:36:53 UTC 2025","","","",""
"","10","should display link for eac informations if has adage id and already created offer","VenueOfferSteps","Mon Feb 03 13:34:33 UTC 2025","passed","Mon Feb 03 13:34:33 UTC 2025","","","",""
"","370","should track logout","SignupJourneyRoutes::trackers","Mon Feb 03 13:37:09 UTC 2025","passed","Mon Feb 03 13:37:09 UTC 2025","","","",""
"","78","should render template offer summary creation with one edit link","CollectiveOfferSummaryCreation","Mon Feb 03 13:36:04 UTC 2025","passed","Mon Feb 03 13:36:04 UTC 2025","","","",""
"","2","should return an empty string","core | Venue | utils | humanizeSiret","Mon Feb 03 13:38:11 UTC 2025","passed","Mon Feb 03 13:38:11 UTC 2025","","when siret given is an empty string","",""
"","32","should display the checkbox disabled when the input is disabled","QuantityInput","Mon Feb 03 13:35:58 UTC 2025","passed","Mon Feb 03 13:35:58 UTC 2025","","","",""
"","9","should show the partner distance to school","AdageOfferPartnerPanel","Mon Feb 03 13:35:33 UTC 2025","passed","Mon Feb 03 13:35:33 UTC 2025","","","",""
"","64","should render new collective offer visibility form if ff active","CollectiveOfferVisibility","Mon Feb 03 13:37:05 UTC 2025","passed","Mon Feb 03 13:37:05 UTC 2025","","","",""
"","34","should display an user firstname, lastname and email address","BeneficiaryCell","Mon Feb 03 13:37:19 UTC 2025","passed","Mon Feb 03 13:37:19 UTC 2025","","","",""
"","27","should render expired warning","Summary stock section","Mon Feb 03 13:33:57 UTC 2025","passed","Mon Feb 03 13:33:57 UTC 2025","","for general case","",""
"","169","should display the spinner while waiting for server response","StocksProviderForm","Mon Feb 03 13:36:09 UTC 2025","passed","Mon Feb 03 13:36:09 UTC 2025","","on form submit","",""
"","28","should append script tag on first render","initReCaptchaScript","Mon Feb 03 13:38:12 UTC 2025","passed","Mon Feb 03 13:38:12 UTC 2025","","","",""
"","127","should call tracker when clicking save draft and exit","CollectiveOfferPreviewCreation","Mon Feb 03 13:35:52 UTC 2025","passed","Mon Feb 03 13:35:52 UTC 2025","","","",""
"","133","should ask user to select a pre-filter before clicking on ""Afficher""","components | BookingsRecap | Pro user","Mon Feb 03 13:33:03 UTC 2025","passed","Mon Feb 03 13:33:03 UTC 2025","","","",""
"","67","should make two calls if the ids come from template offer and bookable offer","ActionsBar","Mon Feb 03 13:33:07 UTC 2025","passed","Mon Feb 03 13:33:07 UTC 2025","","","",""
"","340","should load offers with written offer name filter","route CollectiveOffers","Mon Feb 03 13:33:16 UTC 2025","passed","Mon Feb 03 13:33:17 UTC 2025","on click on search button","filters","",""
"","51","should clear the input on focus","SelectAutocomplete","Mon Feb 03 13:33:11 UTC 2025","passed","Mon Feb 03 13:33:11 UTC 2025","","","",""
"","60","should render component with new sections","Summary","Mon Feb 03 13:32:52 UTC 2025","passed","Mon Feb 03 13:32:52 UTC 2025","","On Creation","",""
"","7","should display right info when is visible and in venue form","PartnerPageIndividualSection","Mon Feb 03 13:36:01 UTC 2025","passed","Mon Feb 03 13:36:01 UTC 2025","","","",""
"","1","should return list containing only BookingRecap matching partial beneficiary lastname keywords","filterBookingsRecap","Mon Feb 03 13:34:05 UTC 2025","passed","Mon Feb 03 13:34:05 UTC 2025","","","",""
"","4","should display in school message when addressType is IN_SCHOOL","OfferVenue","Mon Feb 03 13:37:20 UTC 2025","passed","Mon Feb 03 13:37:20 UTC 2025","","","",""
"","3","should render { displayedStatus: 'BOOKED', expectedLabel: 'réservée' } status","CollectiveStatusLabel","Mon Feb 03 13:35:47 UTC 2025","passed","Mon Feb 03 13:35:47 UTC 2025","","","",""
"","85","should not disable description, price and places when allowedAction CAN_EDIT_DISCOUNT exist and FF ENABLE_COLLECTIVE_NEW_STATUSES enable","","Mon Feb 03 13:34:07 UTC 2025","passed","Mon Feb 03 13:34:07 UTC 2025","","","",""
"","0","should deduce the offer subtype VIRTUAL_EVENT from the query param","getOfferSubtypeFromParam","Mon Feb 03 13:34:53 UTC 2025","passed","Mon Feb 03 13:34:53 UTC 2025","","","",""
"","22","should remove student tag on click","FiltersTag","Mon Feb 03 13:34:33 UTC 2025","passed","Mon Feb 03 13:34:33 UTC 2025","","","",""
"","398","should remove QRcode prefix"," Desk","Mon Feb 03 13:34:28 UTC 2025","passed","Mon Feb 03 13:34:28 UTC 2025","","should validate while user is typing","",""
"","51","should notify of an error if the offer beginning date is in the past on press ""Publier l’offre""","CollectiveOfferConfirmation","Mon Feb 03 13:34:45 UTC 2025","passed","Mon Feb 03 13:34:45 UTC 2025","","","",""
"","661","should display venue selects as disabled (not editable) fields","screens | OfferEducational : edition offerer step","Mon Feb 03 13:35:57 UTC 2025","passed","Mon Feb 03 13:35:58 UTC 2025","","","",""
"","134","should display venue when venueId is provided in url","app","Mon Feb 03 13:35:01 UTC 2025","passed","Mon Feb 03 13:35:01 UTC 2025","","when is authenticated","",""
"","83","should test eligibility and display an error message with a link if the offerer is not eligible","screens | OfferEducational : creation offerer step","Mon Feb 03 13:34:51 UTC 2025","passed","Mon Feb 03 13:34:51 UTC 2025","","when there is only one offerer associated with the account","",""
"","119","should select and redirect fine case : %s","OfferType","Mon Feb 03 13:33:49 UTC 2025","passed","Mon Feb 03 13:33:49 UTC 2025","","","",""
"","32","should render the component","Section","Mon Feb 03 13:38:22 UTC 2025","passed","Mon Feb 03 13:38:22 UTC 2025","","","",""
"","201","should display bad token informations","ResetPassword","Mon Feb 03 13:37:27 UTC 2025","passed","Mon Feb 03 13:37:27 UTC 2025","","","",""
"","144","renders component successfully","components:UserEmailForm","Mon Feb 03 13:37:34 UTC 2025","passed","Mon Feb 03 13:37:34 UTC 2025","","","",""
"","61","should display institution type, name and city in select options","CollectiveOfferVisibility","Mon Feb 03 13:33:33 UTC 2025","passed","Mon Feb 03 13:33:33 UTC 2025","","","",""
"","5","should display domain label in tag","FiltersTag","Mon Feb 03 13:34:33 UTC 2025","passed","Mon Feb 03 13:34:33 UTC 2025","","","",""
"","25","should render without error","Tooltip","Mon Feb 03 13:38:23 UTC 2025","passed","Mon Feb 03 13:38:23 UTC 2025","","","",""
"","31","should not display the confirmation modal before redirection when it's not activated","components | RouteLeavingGuardCollectiveOfferCreation | RouteLeavingGuard","Mon Feb 03 13:35:46 UTC 2025","passed","Mon Feb 03 13:35:46 UTC 2025","","","",""
"","15","should say how many offers are selected when only 1 offer is selected","ActionsBar","Mon Feb 03 13:33:40 UTC 2025","passed","Mon Feb 03 13:33:40 UTC 2025","","","",""
"","155","should display initial component","Accessibility","Mon Feb 03 13:34:55 UTC 2025","passed","Mon Feb 03 13:34:55 UTC 2025","","","",""
"","264","should display 100+ for total number of offers if more than 500 offers are fetched","CollectiveOffersScreen","Mon Feb 03 13:33:17 UTC 2025","passed","Mon Feb 03 13:33:18 UTC 2025","","","",""
"","5","should not render if there are no stocks","StockThingSection","Mon Feb 03 13:37:49 UTC 2025","passed","Mon Feb 03 13:37:49 UTC 2025","","","",""
"","177","should render a subcategory select when a category is selected","SuggestedSubcategories","Mon Feb 03 13:34:40 UTC 2025","passed","Mon Feb 03 13:34:40 UTC 2025","","when the ""Autre"" radio button is selected","",""
"","23","should filter bookings on render","components | BookingsRecapTable","Mon Feb 03 13:33:33 UTC 2025","passed","Mon Feb 03 13:33:33 UTC 2025","","","",""
"","34","should display the offer that is passed through the router when the user navigates within the app","OfferInfos","Mon Feb 03 13:34:57 UTC 2025","passed","Mon Feb 03 13:34:57 UTC 2025","","","",""
"","218","should display confirm dialog when clicking on duplicate button when user did not see the modal","ollectiveOfferRow","Mon Feb 03 13:33:29 UTC 2025","passed","Mon Feb 03 13:33:29 UTC 2025","","","",""
"","52","should display error message if comment empty","components | SiretOrCommentFields","Mon Feb 03 13:33:52 UTC 2025","passed","Mon Feb 03 13:33:52 UTC 2025","","should validate comment on submit","",""
"","79","should not display statistics dashboard when selected offerer is validated but not active","Homepage","Mon Feb 03 13:34:37 UTC 2025","passed","Mon Feb 03 13:34:37 UTC 2025","","render statistics dashboard","",""
"","0","should compute max width for original ""landscape"" target ""portrait""","getCropMaxDimension","Mon Feb 03 13:37:33 UTC 2025","passed","Mon Feb 03 13:37:33 UTC 2025","","","",""
"","26","should unselect offers and hide action bar on click on ""Annuler"" button","ActionsBar","Mon Feb 03 13:33:06 UTC 2025","passed","Mon Feb 03 13:33:06 UTC 2025","","","",""
"","58","should handle decimal input correctly with hasDecimal=true","TextInput","Mon Feb 03 13:34:55 UTC 2025","passed","Mon Feb 03 13:34:55 UTC 2025","","","",""
"","119","should render summary with filled data","DetailsSummaryScreen","Mon Feb 03 13:35:43 UTC 2025","passed","Mon Feb 03 13:35:43 UTC 2025","","","",""
"","40","should log info when opening sastisfaction survey","SurveySatisfaction","Mon Feb 03 13:36:52 UTC 2025","passed","Mon Feb 03 13:36:52 UTC 2025","","","",""
"","13","should only call callback function once","useFunctionOnce()","Mon Feb 03 13:38:19 UTC 2025","passed","Mon Feb 03 13:38:19 UTC 2025","","","",""
"","68","should not render booking details if row is not expanded","CollectiveTableRow","Mon Feb 03 13:36:18 UTC 2025","passed","Mon Feb 03 13:36:18 UTC 2025","","","",""
"","100","should display error when offer not selected","CollectiveOfferConfirmation","Mon Feb 03 13:34:39 UTC 2025","passed","Mon Feb 03 13:34:39 UTC 2025","","","",""
"","9","offer name and event beginning datetime in venue timezone when stock is an event","bookings offer cell","Mon Feb 03 13:35:29 UTC 2025","passed","Mon Feb 03 13:35:29 UTC 2025","","","",""
"","99","should not show help section if there are stocks already and show table","StocksEventCreation","Mon Feb 03 13:34:58 UTC 2025","passed","Mon Feb 03 13:34:58 UTC 2025","","","",""
"","1","should return true for 'allowed action CAN_DUPLICATE on booka…'","isActionAllowedOnCollectiveOffer","Mon Feb 03 13:37:07 UTC 2025","passed","Mon Feb 03 13:37:07 UTC 2025","","","",""
"","137","should render error message when siret is not visible","Offerer","Mon Feb 03 13:33:38 UTC 2025","passed","Mon Feb 03 13:33:38 UTC 2025","","","",""
"","204","should display error message and empty field when contremarque could not be validated"," Desk","Mon Feb 03 13:34:29 UTC 2025","passed","Mon Feb 03 13:34:30 UTC 2025","","should validate contremarque when the user submits the form","",""
"","21","should display actions button and status tag by default","OfferEducationalActions","Mon Feb 03 13:34:02 UTC 2025","passed","Mon Feb 03 13:34:02 UTC 2025","","","",""
"","3","should not render the add bank account banner if the offerer has no valid bank account and some unlinked venues but a pending bank account","AddBankAccountCallout","Mon Feb 03 13:35:49 UTC 2025","passed","Mon Feb 03 13:35:49 UTC 2025","","","",""
"","6","should show the institution and the price if the offer is bookable","AdageOfferHeader","Mon Feb 03 13:34:46 UTC 2025","passed","Mon Feb 03 13:34:46 UTC 2025","","","",""
"","161","should display error notification","screens:SignupJourney::Activity","Mon Feb 03 13:34:57 UTC 2025","passed","Mon Feb 03 13:34:57 UTC 2025","","","",""
"","82","should go next step with individual target customer","screens:SignupJourney::Activity","Mon Feb 03 13:34:57 UTC 2025","passed","Mon Feb 03 13:34:57 UTC 2025","","","",""
"","28","should display venue creation link","Offerers","Mon Feb 03 13:36:12 UTC 2025","passed","Mon Feb 03 13:36:12 UTC 2025","","","",""
"","9","should display the offer accessibility criteria","AdageOfferPublicSection","Mon Feb 03 13:36:38 UTC 2025","passed","Mon Feb 03 13:36:38 UTC 2025","","","",""
"","23","should only display mail","RequestFormDialog","Mon Feb 03 13:34:13 UTC 2025","passed","Mon Feb 03 13:34:13 UTC 2025","","","",""
"","22","should disabled field for provider","PriceCategories","Mon Feb 03 13:37:17 UTC 2025","passed","Mon Feb 03 13:37:17 UTC 2025","","","",""
"","17","should apply bookingBeneficiary filter when typing keywords for beneficiary name or email","components | FilterByOmniSearch","Mon Feb 03 13:34:53 UTC 2025","passed","Mon Feb 03 13:34:53 UTC 2025","","","",""
"","7","should display the national program of the offer","AdageOfferDetailsSection","Mon Feb 03 13:35:25 UTC 2025","passed","Mon Feb 03 13:35:25 UTC 2025","","","",""
"","28","should display adage publish button if action is allowed","OfferEducationalActions","Mon Feb 03 13:34:02 UTC 2025","passed","Mon Feb 03 13:34:02 UTC 2025","","","",""
